title,link,score
"DC required daycare workers to get degrees. News only talked to those who stayed","https://abio.substack.com/p/dc-required-daycare-workers-to-get",11
"Ask HN: Is offshoring a bigger issue than AI and H1B for US workers?","https://old.reddit.com/r/cscareerquestions/comments/1r2urma/anyone_feel_like_offshoring_is_a_bigger_issue/o4zqqgf/",11
"TikTok is tracking you, even if you don't use the app","https://www.bbc.com/future/article/20260210-tiktok-is-tracking-you-even-if-you-dont-use-the-app-heres-how-to-stop-it",11
"Moderna Won't Run Any Phase III Vaccine Trials as Skepticism Grows in US","https://www.biospace.com/business/moderna-wont-run-phase-iii-vaccine-trials-as-skepticism-grows-in-us-bloomberg",11
"Bryan Johnson's Immortals program costs $1M. How to DIY it <1% of the price","https://www.empirical.health/blog/bryan-johnson-immortals-program-diy/",11
"Show HN: Solving Sudoku reasoning via Energy Geometric models","https://www.davisgeometric.com/index.html",10
"Ask HN: Ranking sliders on a personal blog?","item?id=47027650",10
"Actual-Size Eniac Replica Is the Coolest Thing You'll See Today","https://www.pcmag.com/news/this-actual-size-eniac-replica-is-the-coolest-thing-youll-see-today?test_uuid=04IpBmWGZleS0I0J3epvMrC&test_variant=A",10
"The great computer science exodus (and where students are going instead)","https://techcrunch.com/2026/02/15/the-great-computer-science-exodus-and-where-students-are-going-instead/",10
"Show HN: Bubble sort on a Turing machine","https://github.com/purplejacket/bubble_sort_on_tm",10
"Shipping Htmx in Production (A Post-Mortem)","https://enriquebruzual.substack.com/p/speeding-up-a-lead-qualifying-saas",10
"Sex toys maker Tenga says hacker stole customer information","https://techcrunch.com/2026/02/13/sex-toys-maker-tenga-says-hacker-stole-customer-information/",10
"Ask HN: Want to move to use a "dumb" phone. How to make the switch?","item?id=47019122",10
"Arianespace launches 32 Amazon Leo satellites with the first Ariane 64","https://newsroom.arianespace.com/arianespace-successfully-launches-32-amazon-leo-satellites-with-the-first-ariane-64",10
"The Battle of the Beams","https://en.wikipedia.org/wiki/Battle_of_the_Beams",10
"Offering Scott Alexander a Wager About AI's Effects over the Next Three Years","https://freddiedeboer.substack.com/p/im-offering-scott-alexander-a-wager",10
"AI Agents Enable Human Communication at Unprecedented Scale","https://venturebeat.com/orchestration/ai-agents-turned-super-bowl-viewers-into-one-high-iq-team-now-imagine-this",10
"Ask HN: Has anyone achieved recursive self-improvement with agentic tools?","item?id=46984452",10
"Show HN: Building My Own Google Analytics for $0","https://www.adwait.me/writings/building-my-own-google-analytics",10
"OK, so Anthropic's AI built a C compiler. That don't impress me much","https://www.theregister.com/2026/02/13/anthropic_c_compiler/",10
"Private equity's big bet on software was derailed by AI","https://www.ft.com/content/954ed03b-4119-4412-be9f-59f68b537a95",10
"Ideas for an Agent-Oriented Programming Language","https://davi.sh/blog/2026/02/markov-ideas/",9
"Soviet Tektronix 7000-series oscilloscope copies","https://martin-jones.com/2017/02/19/soviet-tektronix-7000-series-oscilloscope-copies/",9
"Pangaea Proxima","https://en.wikipedia.org/wiki/Pangaea_Proxima",9
"The Bastard Operator from Hell","https://bofh.bjash.com/",9
"The Desperate Race to Escape AI's Permanent Underclass","https://www.telegraph.co.uk/business/2026/02/15/the-desperate-race-to-escape-ais-permanent-underclass/",9
"Windows: Prefer the Native API over Win32","https://codeberg.org/ziglang/zig/issues/31131",9
"Show HN: MicroGPT in 243 Lines – Demystifying the LLM Black Box","item?id=46998295",9
"Logic for Programmers","https://leanpub.com/logic/",9
"Show HN: I built managed OpenClaw hosting with 60s provisioning in 6 days","https://clawhosters.com/blog/posts/how-i-built-60-second-vps-provisioning",9
"French railway operator tests solar on train tracks","https://www.pv-magazine.com/2026/02/05/french-railway-operator-tests-pv-on-train-tracks/",9
"What Is Claude? Anthropic Doesn't Know, Either","https://www.newyorker.com/magazine/2026/02/16/what-is-claude-anthropic-doesnt-know-either",9
"A great wee place: the small Scottish factory crafting Olympic curling stones","https://www.theguardian.com/sport/2026/feb/13/a-great-wee-place-the-small-scottish-factory-crafting-olympic-curling-stones",9
""Windows 11 26H1" is a special version of Windows exclusively for new Arm PCs","https://arstechnica.com/gadgets/2026/02/windows-11-26h1-is-a-special-version-of-windows-exclusively-for-new-arm-pcs/",9
"AI Fails at 96% of Jobs (New Study)","https://www.youtube.com/watch?v=z3kaLM8Oj4o",9
"I Was a Director at Amex When They Started Replacing Us with $30K Workers [video]","https://www.youtube.com/watch?v=t5fXrPMGM5E",8
"Tinder Hasn't Worked, So I'm Putting Myself on Zillow","https://www.mcsweeneys.net/articles/tinder-hasnt-worked-so-im-putting-myself-on-zillow",8
"Show HN: A playable toy model of frontier AI lab capex decisions","https://darios-dilemma.up.railway.app/",8
"Rendering the Visible Spectrum","https://brandonli.net/spectra/doc/",8
"Why Amazon is full of crap [video]","https://www.youtube.com/watch?v=BGuOpzDqWhw",8
"A Deep Dive into Apple's .car File Format","https://dbg.re/posts/car-file-format/",8
"Four new astronauts arrive via SpaceX rocket at International Space Station","https://www.theguardian.com/science/2026/feb/14/international-space-station-full-crew",8
"Interop 2026","https://webkit.org/blog/17818/announcing-interop-2026/",8
"Can the shingles vaccine slow ageing?","https://www.economist.com/science-and-technology/2026/02/13/can-the-shingles-vaccine-slow-ageing",8
"A Stanford Experiment to Pair 5k Singles Has Taken over Campus","https://www.wsj.com/lifestyle/relationships/stanford-students-experiment-dating-date-drop-92a4aea8",8
"Token Anxiety","https://writing.nikunjk.com/p/token-anxiety",8
"Our security auditor is an idiot. How do I give him the information he wants? (2011)","https://serverfault.com/questions/293217/our-security-auditor-is-an-idiot-how-do-i-give-him-the-information-he-wants",8
"Ask HN: Stripe is asking for bank statements to check financial health","item?id=47013256",8
"Terence Tao makes –$700k at UCLA","https://twitter.com/pitdesi/status/2020365826671669438",8
"Show HN: Rawkit – Free, no-ads developer tools that run in the browser","https://rawkit.dev/",8
"microgpt.py","https://gist.github.com/karpathy/8627fe009c40f57531cb18360106ce95",8
"Ask HN: Tools to code using voice?","item?id=46989357",8
"Are the Mysteries of Quantum Mechanics Beginning to Dissolve?","https://www.quantamagazine.org/are-the-mysteries-of-quantum-mechanics-beginning-to-dissolve-20260213/",8
"AI Docs Sent by Exec to Attys Not Privileged, Judge Says","https://www.law360.com/bankruptcy-authority/articles/2440082/ai-docs-sent-by-exec-to-attys-not-privileged-judge-says",8
"New experiments suggest Earth's core contains up to 45 oceans' worth of hydrogen","https://phys.org/news/2026-02-earth-core-oceans-worth-hydrogen.html",8
"Top non-ad google result for "polymarket" in Australia is a crypto scam","item?id=47030691",7
"Show HN: GPU Perpetual Futures Prototype","https://github.com/zacharyfrederick/compex",7
"A Defector Explains the Remote-Work Scam Helping North Korea Pay for Nukes","https://www.wsj.com/world/asia/a-defector-explains-the-remote-work-scam-helping-north-korea-pay-for-nukes-277fc94f",7
"OpenClaw creator Peter Steinberger joins OpenAI","https://techcrunch.com/2026/02/15/openclaw-creator-peter-steinberger-joins-openai/",7
"Making a font with ligatures to display thirteenth-century monk numerals","https://digitalseams.com/blog/making-a-font-with-9999-ligatures-to-display-thirteenth-century-monk-numerals",7
"Reverse Engineering Sid Meier's Railroad Tycoon for DOS from 1990","https://www.vogons.org/viewtopic.php?t=105451",7
"How Investigators Find the Source of a Fire [video]","https://www.youtube.com/watch?v=1pPoB8be1G0",7
"A Deep Dive into Apple's .car File Format","https://dbg.re/posts/car-file-format/",7
"Delphi is 31 years old – innovation timeline","https://blogs.embarcadero.com/delphi-innovation-timeline-31st-anniversary-edition-published-get-your-free-pdf/",7
"FreeBSD: Home NAS, part 10 – monitoring with VictoriaMetrics and Grafana","https://rtfm.co.ua/en/freebsd-home-nas-part-10-monitoring-with-victoriametrics-and-grafana/",7
"Ghidra by NSA","https://github.com/NationalSecurityAgency/ghidra",7
"Show HN: MicroVibe – minimal JSX web starter","https://github.com/melendezgg/microvibe",7
"Minimum Wages and the Rise of the Robots","https://papers.ssrn.com/sol3/papers.cfm?abstract_id=6184798",7
"6.2M names, birthdays and passport details leaked from Odido","https://nos.nl/artikel/2602080-hack-bij-odido-gegevens-miljoenen-klanten-in-handen-van-criminelen",7
"Show HN: Insider Trading Alerts – Open-Market Buys&Sells from SEC Form 4 Filings","https://stockalert.pro/alerts/insider-transactions",7
"$10M factory in a 600 square foot room [Video]","https://www.youtube.com/watch?v=hqGFcwyXYI0",7
"Moss-kernel: Rust Linux-compatible kernel","https://github.com/hexagonal-sun/moss-kernel",7
"AI safety staff departures raise worries about pursuit of profit at all costs","https://www.theguardian.com/commentisfree/2026/feb/15/the-guardian-view-on-ai-safety-staff-departures-raise-worries-about-industry-pursuing-profit-at-all-costs",7
"India doubles down on state-backed venture capital, approving $1.1B fund","https://techcrunch.com/2026/02/14/india-doubles-down-on-state-backed-venture-capital-approving-1-1b-fund/",7
"VE Motion electric trailer axles cut truckers' diesel fuel bills in HALF","https://electrek.co/2026/02/13/ve-motion-electric-trailer-axles-cut-truckers-diesel-fuel-bills-in-half/",7
"Rules to Be a Better Thinker in 2026","https://ryanholiday.net/26-rules-to-be-a-better-thinker/",7
"Why are people disconnecting or destroying their Ring cameras?","https://www.usatoday.com/story/news/nation/2026/02/10/ring-super-bowl-ad-dog-camera-privacy/88606738007/",7
"A Brief History of Sega Enterprises","https://www.abortretry.fail/p/a-brief-history-of-sega-enterprises",6
"Hyper-Scalers Are Using CXL to Lower the Impact of DDR5 Supply Constraints","https://www.servethehome.com/hyper-scalers-are-using-cxl-to-lower-the-impact-of-ddr5-supply-constraints-marvell-arm/",6
"Encyclopedia of people, places, and events from the Epstein","https://jmail.world/wiki",6
"A Framework for Time-Updating Probabilistic Forecasts","https://arxiv.org/abs/2602.09982",6
"Chiplets Get Physical: The Days of Mix-and-Match Silicon Draw Nigh","https://www.eejournal.com/article/chiplets-get-physical-the-days-of-mix-and-match-silicon-draw-nigh/",6
"Show HN: Auto-Layouting ASCII Diagrams","https://github.com/switz/box-of-rain",6
"I broke my rule and built on Spotify's API. Then they pulled the plug on indies","https://blog.ailon.org/full-me-twice-when-an-api-isnt-the-business-d9aef4f1ce4d",6
"PascalABC.net","https://pascalabc.net:443/en",6
"Ask HN: Info on the 1982 Apple 2 text game Abuse?","item?id=47015165",6
"Survival Analysis of the Supreme Court","https://entropicthoughts.com/survival-analysis-of-the-supreme-court",6
"Show HN: ClawDeploy – OpenClaw deployment for non-technical users","https://clawdeploy.com",6
"Complex swimming creature animations via simple maths and p5.js","https://twitter.com/yuruyurau/status/2022526453779435912",6
"CPUs are getting so small they're starting to hallucinate","https://twitter.com/lauriewired/status/2022387879390122049",6
"The Debacle That Led to the Closure of El Paso's Airspace","https://www.nytimes.com/2026/02/14/us/politics/el-paso-airspace-closure-faa-pentagon.html",6
"Automatic Differentiation from Scratch (2023)","https://blog.esciencecenter.nl/automatic-differentiation-from-scratch-23d50c699555",6
"Jikipedia turns Epstein's emails into an encyclopedia of his powerful friends","https://www.theverge.com/policy/879508/jikipedia-epstein-email-encyclopedia",6
"Ask HN: Do sociotechnical pressures select for beneficial or harmful AI systems?","item?id=46995522",6
"OpenAI retired its most seductive chatbot – leaving users angry and grieving","https://www.theguardian.com/lifeandstyle/ng-interactive/2026/feb/13/openai-chatbot-gpt4o-valentines-day",6
"The allegations against a San Francisco social climber accused of sex crimes","https://sfstandard.com/2026/02/12/mickey-gerold-sex-crimes-investigation/",6
"Designing a 36-key custom keyboard layout (2021)","https://peterxjang.medium.com/designing-a-36-key-custom-keyboard-layout-24498a0eecd4",5
"Experiments with CodeMirror: Building a code review tool","https://aziis98.com/blog/codemirror-review-tool/",5
"When Germany Seized the Future: Lessons from CAD for the AI Era","https://andrulis.de",5
"Can the shingles vaccine slow ageing? The evidence is surprisingly strong","https://www.economist.com/science-and-technology/2026/02/13/can-the-shingles-vaccine-slow-ageing",5
"Use Microsoft Office Shortcuts in Libre Office","https://github.com/Zaki101Aslam/MS-office-shortcuts-for-Libre-Office",5
"The Vibe Coding Slot Machine","https://alexanderweichart.de/5_Archive/4_Projects/ai-slot-machine/The-Vibe-Coding-Slot-Machine",5
"What the hell is Forth? (2019)","https://blog.information-superhighway.net/what-the-hell-is-forth",5
"Apple Rankings by the Appleist Brian Frange","https://applerankings.com/",5
"Delivery van 'stuck on deadliest mudflat footpath'","https://www.bbc.co.uk/news/articles/cn9e32yv9g5o",5
"Cherry, A firewall against AI-generated PRs","https://cherry.gethopp.app/",5
"Show HN: Open-source CI for coding with AI","https://github.com/sburl/CrossCheck",5
"AgentRE-Bench: Can LLM Agents Reverse Engineer Malware?","https://www.agentre-bench.ai/",5
"Project Oberon: A Late Appraisal (2025)","https://www.youtube.com/watch?v=hZyNFaojbew",5
"Fake job recruiters hide malware in developer coding challenges","https://www.bleepingcomputer.com/news/security/fake-job-recruiters-hide-malware-in-developer-coding-challenges/",5
"Physicists Make Electrons Flow Like Water","https://www.quantamagazine.org/physicists-make-electrons-flow-like-water-20260211/",5
"Idax – A beautiful, idiomatic and less frustrating IDA C++ SDK","https://github.com/19h/idax",5
"Astronomers discover unique 'inside out' planetary system","https://news.st-andrews.ac.uk/archive/astronomers-discover-unique-inside-out-planetary-system/",5
"Rare Mithraic altars found in Scotland go on display for the first time","https://www.thehistoryblog.com/archives/75352",5
"Short guide to 3D file formats: STL, OBJ, 3MF, STEP and the rest","https://modelrift.com/blog/3d-file-formats-explained/",5
"HySparse: A Hybrid Sparse Attention Architecture","https://arxiv.org/abs/2602.03560",5
"Ask HN: Exceptionally well-written research papers in CS/ML/AI?","item?id=47011353",5
"She didn't expect to fall in love with a chatbot – and then have to say goodbye","https://www.bbc.co.uk/news/articles/crl43dxwwy9o",5
"Ask HN: Better hardware means OpenAI, Anthropic, etc. are doomed in the future?","item?id=46998801",5
"Sheet Metal Instruments","https://barthopkin.com/metal-sheet-instruments/",5
"Ask HN: We're building a saving app for European savers and need GTM advice","item?id=46994985",5
"The motherhood penalty isn't as large as we think","https://plausiblyexogenous.substack.com/p/the-motherhood-penalty-isnt-as-large",5
"Show HN: Visualizing How Books Reference Each Other Across 3k Years","https://thiagolira.github.io/bookgraph-revisited/",5
"Why haven't humans been back to the moon in over 50 years?","https://www.cnn.com/2026/02/13/science/why-humans-have-not-been-back-to-moon",5
"Olympic athletes push their bodies to the limit. Should we?","https://text.npr.org/nx-s1-5707478",5
"OpenAI attempts "First Proof" challenge","https://twitter.com/merettm/status/2022517085193277874",5
"Is there a true alternative to Discord?","https://medium.com/@mycahp/is-there-a-true-alternative-to-discord-7faf052ef28e",4
"Intermittent fasting no better than typical weight loss diets, study finds","https://www.theguardian.com/science/2026/feb/16/intermittent-fasting-no-better-than-typical-weight-loss-diet-study-finds",4
"How to Choose Between Hindley-Milner and Bidirectional Typing","https://thunderseethe.dev/posts/how-to-choose-between-hm-and-bidir/",4
"Show HN: WCAG 2.2 AAA Toolkit – AI Skill for Accessible Web Apps","https://github.com/simonplmak-cloud/wcag-aaa-web-design",4
"Following Discord's suit, OpenAI will scan your usage and ask to confirm your ID","https://www.pcgamer.com/software/ai/following-discords-suit-openai-will-also-predict-your-age-based-on-your-usage-to-know-if-it-should-id-you-at-the-digital-door/",4
"Disney Blasts ByteDance with Cease and Desist Letter over Seedance 2.0 AI Model","https://deadline.com/2026/02/disney-bytedance-cease-and-desist-letter-seedance-ai-video-1236719549/",4
"An AI agent harassed a Matplotlib maintainer. We're asking the wrong question","https://chaosguru.substack.com/p/who-opened-the-door",4
"I made an interactive fiction x personality quiz dating SIM for valentine's day","https://my.trove.is/",4
"Elephant trunk whiskers exhibit material intelligence","https://www.mpg.de/26113474/elephant-trunk-whiskers-exhibit-material-intelligence",4
"HHS // Open Data Platform","https://opendata.hhs.gov/",4
"What every compiler writer should know about programmers (Anton Ertl, 2015) [pdf]","https://www.complang.tuwien.ac.at/kps2015/proceedings/KPS_2015_submission_29.pdf",4
"Show HN: I generated a "stress test" of 200 rare defects from 7 real photos","item?id=46994542",4
"The Godless Students of London University","https://www.historytoday.com/archive/feature/godless-students-london-university",4
"Portable 1MV X-ray system combines Cockcroft–Walton with Van de Graaff dome","https://www.lanl.gov/media/publications/1663/0624-x-rays-light",4
"Show HN: Busca – the fuzzy ripgrep fast code explorer","https://github.com/rokyed/busca",4
"Show HN: Ngn – a new back end programming language","https://ngnlang.com",4
"The curious case of binfmt for x86 emulation for ARM Docker","https://gergely.imreh.net/blog/2025/04/the-curious-case-of-binfmt-for-x86-emulation-for-arm-docker/",4
"Echo – iOS/iPad Terminal","https://replay.software/echo",4
"The cataclysmic flood that wasn't","https://knowablemagazine.org/content/article/physical-world/2026/case-against-zanclean-megaflood-filling-mediterranean",4
"Coursera prompt injection on copy and paste","https://twitter.com/iangcarroll/status/2022212829441667482",4
"Old School Telecine, circa 1980s (2017)","https://www.liftgammagain.com/forum/index.php?threads/old-school-telecine-circa-1980s.9984/",3
"How to get an AI to check your schematic","item?id=47028176",3
"Four Column ASCII (2017)","https://garbagecollected.org/2017/01/31/four-column-ascii/",3
"Generalized on-policy distillation with reward extrapolation","https://arxiv.org/abs/2602.12125",3
"From PDF to .LBR: Using Deep Think to Write Custom CAD Parts","https://blog.adafruit.com/2026/02/14/from-pdf-to-lbr-using-deep-think-to-write-custom-cad-parts/",3
"Showcasing my Git repositories on the web","https://cybrkyd.com/post/showcasing-my-git-repositories-on-the-web/",3
"How DSQL makes sure sequences scale","https://blog.benjscho.dev/technical/2026/02/13/dsql-sequences.html",3
"Richard Carrington's first portrait has been found","https://www.cnn.com/2026/02/12/science/solar-storm-richard-carrington-photo",3
"SoftMatcha 2: A Fast and Soft Pattern Matcher for Trillion-Scale Corpora","https://arxiv.org/abs/2602.10908",3
"From 3 Minutes to 7.8 Seconds: Improving on RocksDB performance","https://blog.serenedb.com/building-faster-ingestion",3
"Rolling your own serverless OCR in 40 lines of code","https://christopherkrapu.com/blog/2026/ocr-textbooks-modal-deepseek/",3
"Raising an Agent","https://www.ashishselvaraj.com/writing/raising-an-agent",3
"Victorian Engineering Connections Diagram from the Brunel Museum","https://thebrunelmuseum.com/engineering-connections/",3
"PXL2000","https://en.wikipedia.org/wiki/PXL2000",3
"Supercomputer simulations test turbulence theories at 35T grid points","https://phys.org/news/2026-02-supercomputer-simulations-turbulence-theories-trillion.html",3
"macOS Tahoe no longer supports Time Capsules","https://eclecticlight.co/2026/02/11/macos-tahoe-no-longer-fully-supports-time-capsules/",3
"Cogram (YC W22) – Hiring former technical founders","https://www.ycombinator.com/companies/cogram/jobs/LDTrViN-ex-technical-founder-product-engineer",0
