title,link,score
"Programming in D: Tutorial and Reference","https://ddili.org/ders/d.en/",147
"Daily driving a Linux phone, but why?","https://thefoggiest.dev/2025/04/24/daily-driving-a-linux-phone-but-why",147
"Llasa: Llama-Based Speech Synthesis","https://llasatts.github.io/llasatts/",145
"Reading RSS content is a skilled activity","https://www.doliver.org/articles/rss-as-a-skill",145
"Show HN: Colanode, open-source and local-first Slack and Notion alternative","https://github.com/colanode/colanode",145
"Pixel is a unit of length and area","https://www.nayuki.io/page/pixel-is-a-unit-of-length-and-area",145
"Tumor-derived erythropoietin acts as immunosuppressive switch in cancer immunity","https://www.science.org/doi/10.1126/science.adr3026",145
"The missteps that led to a fatal plane crash at Reagan National Airport","https://www.nytimes.com/2025/04/27/business/dc-plane-crash-reagan-airport.html",138
"The hospital where staff treat fear of death as well as physical pain","https://www.theguardian.com/society/2025/apr/22/palliative-care-denmark-hospital-death-dying",138
"We need more optimistic science fiction","https://craig-russell.co.uk/blog/2024-10-24-optimistic-sci-fi/",136
"WorldGen: Open-source 3D scene generator for Game/VR/XR","https://worldgen.github.io/",136
"An illustrated guide to automatic sparse differentiation","https://iclr-blogposts.github.io/2025/blog/sparse-autodiff/",136
"Pyrefly - A faster Python type checker written in Rust","https://pyrefly.org/",136
"Mesmerizing Interlocking Geometric Patterns Produced with Japanese Woodworking","https://www.smithsonianmag.com/smithsonian-institution/see-the-mesmerizing-interlocking-geometric-patterns-produced-with-this-ancient-japanese-woodworking-technique-180986494/",135
"Some __nonstring__ Turbulence","https://lwn.net/SubscriberLink/1018486/1dcd29863655cb25/",135
"Tilt: dev environment as code","https://github.com/tilt-dev/tilt",134
"Trust Me, I'm Local: Chrome Extensions, MCP, and the Sandbox Escape","https://blog.extensiontotal.com/trust-me-im-local-chrome-extensions-mcp-and-the-sandbox-escape-1875a0ee4823",131
"Show HN: Create your own finetuned AI model using Google Sheets","https://promptrepo.com/finetune/",130
"Show HN: Daily Jailbreak – Prompt Engineer's Wordle","https://www.vaultbreak.ai/daily-jailbreak",130
"After 53 years, a failed Soviet Venus spacecraft is crashing back to Earth","https://gizmodo.com/after-53-years-a-failed-soviet-venus-spacecraft-is-crashing-back-to-earth-2000595234",130
"Is outbound going to die?","https://rnikhil.com/2025/04/25/sales-outbound-ai-dead",129
"Bill Gates's Personal Easter Eggs in 8 Bit BASIC (2008)","https://www.pagetable.com/?p=43",129
"Company built its own rail terminal in NYC to avoid relying on trucks","https://www.fastcompany.com/91324241/this-company-built-an-entire-rail-terminal-in-queens-to-avoid-relying-on-trucks",128
"Phi-4 Reasoning Models","https://azure.microsoft.com/en-us/blog/one-year-of-phi-small-language-models-making-big-leaps-in-ai/",128
"Home washing machines fail to remove important pathogens from textiles","https://medicalxpress.com/news/2025-04-home-machines-important-pathogens-textiles.html",126
"Show HN: Bhvr, a Bun and Hono and Vite and React Starter","https://bhvr.dev",125
"AirBorne: Wormable zero-click remote code execution (RCE) in AirPlay protocol","https://www.oligo.security/blog/airborne",124
"The many ways tarrifs will hit electronics","https://spectrum.ieee.org/tariffs-electronics-prices",124
"xAI dev leaks API key for private SpaceX, Tesla LLMs","https://krebsonsecurity.com/2025/05/xai-dev-leaks-api-key-for-private-spacex-tesla-llms/",123
"The suburban office park that launched Silicon Valley","https://thehustle.co/originals/the-suburban-office-park-that-launched-silicon-valley",123
"Show HN: I created snapDOM to capture DOM nodes as images with exceptional speed","https://github.com/zumerlab/snapdom",119
"Spain is about to face the challenge of a "black start"","https://arstechnica.com/science/2025/04/why-restarting-a-power-grid-is-so-hard/",119
"Show HN: AgenticSeek – Self-hosted alternative to cloud-based AI tools","https://github.com/Fosowl/agenticSeek",118
"The term "vegetative electron microscopy" keeps showing up in scientific papers","https://www.sciencealert.com/a-strange-phrase-keeps-turning-up-in-scientific-papers-but-why",117
"MCP on AWS Lambda with MCPEngine","https://www.featureform.com/post/deploy-mcp-on-aws-lambda-with-mcpengine",117
"Show HN: I486SX_soft_FPU – Software FPU Emulator for NetBSD 10 on 486SX","https://github.com/mezantrop/i486SX_soft_FPU",116
"Show HN: An MCP server for understanding AWS costs","item?id=43794120",115
"How much math is knowable? [video]","https://www.youtube.com/watch?v=VplMHWSZf5c",115
"My takeaways from DjangoCon EU 2025","https://www.zachbellay.com/posts/djangocon-eu-2025/",113
"Show HN: ART – a new open-source RL framework for training agents","https://github.com/OpenPipe/ART",112
"Show HN: GS-Calc – A modern spreadsheet with Python integration","https://citadel5.com/gs-calc.htm",112
"New atomic fountain clock joins group that keeps the world on time","https://www.nist.gov/news-events/news/2025/04/new-atomic-fountain-clock-joins-elite-group-keeps-world-time",111
"Path Isn't Real on Linux","https://blog.danielh.cc/blog/path",111
"Dad and the Egg Controller (2018)","https://www.pentadact.com/2018-12-18-dad-and-the-egg-controller/",109
"Why Momentum Works (2017)","https://distill.pub/2017/momentum/",108
"Why Does My eBPF Program Work on One Kernel but Fail on Another?","https://ebpfchirp.substack.com/p/why-does-my-ebpf-program-work-on",108
"Show HN: An interactive demo of QR codes' error correction","https://qris.cool",107
"Watching o3 model sweat over a Paul Morphy mate-in-2","https://alexop.dev/posts/how-03-model-tries-chess-puzzle/",107
"How NASA Is Using Graph Technology and LLMs to Build a People Knowledge Graph","https://memgraph.com/blog/nasa-memgraph-people-knowledge-graph",107
"Mac app launches slowed by malware scan (2024)","https://lapcatsoftware.com/articles/2024/2/3.html",105
"OCaml's Wings for Machine Learning","https://github.com/raven-ml/raven",105
"Naur's "Programming as Theory Building" and LLMs replacing human programmers","https://ratfactor.com/cards/naur-vs-llms",104
"Finland is painting deer antlers with reflective paint (2014)","https://www.smithsonianmag.com/smart-news/avoid-deer-strikes-finland-painting-deer-antlers-reflective-paint-180949792/",101
"Still standing","https://blog.4chan.org/post/781845918774394880/still-standing",101
"Collatz's Ant","https://gbragafibra.github.io/2025/01/08/collatz_ant2.html",101
"Echo – Open Hardware Music Player","https://github.com/amachronic/echoplayer",100
"AI code review: Should the author be the reviewer?","https://www.greptile.com/blog/ai-code-reviews-conflict",99
"Show HN: Heart Rate Zones Plus – The first iOS app I developed","https://apps.apple.com/us/app/heart-rate-zones-plus/id6744743232",99
"Manuscript of Ismail al-Jazarī's Ingenious Mechanical Devices (ca. 17th century)","https://publicdomainreview.org/collection/arabic-machine-manuscript/",99
"Chris Krebs Support Letter","https://www.eff.org/document/chris-krebs-support-letter-april-28-2025",97
"Meta AI App built with Llama 4","https://about.fb.com/news/2025/04/introducing-meta-ai-app-new-way-access-ai-assistant/",97
"Exploiting Undefined Behavior in C/C++ Programs: The Performance Impact [pdf]","https://web.ist.utl.pt/nuno.lopes/pubs/ub-pldi25.pdf",97
"Show HN: Index – New Open Source browser agent","https://github.com/lmnr-ai/index",97
"Google Wallet launches new age and identity verification features (ZK proofs)","https://blog.google/products/google-pay/google-wallet-age-identity-verifications/",95
"Show HN: A Common Lisp implementation in development, supports ASDF","https://savannah.nongnu.org/p/alisp",95
"Vision Transformers Need Registers","https://arxiv.org/abs/2309.16588",94
"Show HN: Infat – Declaritive application assocation manager for macOS","https://github.com/philocalyst/infat",94
"Show HN: Faasta – A self-hosted Serverless platform for WASM-wasi-HTTP in Rust","https://github.com/fourlexboehm/faasta",94
"Windows RDP lets you log-in using revoked passwords. Microsoft is ok with that","https://arstechnica.com/security/2025/04/windows-rdp-lets-you-log-in-using-revoked-passwords-microsoft-is-ok-with-that/",93
"Milwaukee police considering trading mugshots for facial recognition tech","https://www.jsonline.com/story/news/crime/2025/04/25/milwaukee-police-considering-trading-mugshots-for-facial-recognition-tech/83084223007/",93
"A Principled Approach to Querying Data – A Type-Safe Search DSL","https://www.claudiu-ivan.com/writing/search-dsl",93
"NYC home prices rise 10% in early 2025","https://qns.com/2025/04/home-prices-rise-early-2025-malba-highest-queens/",92
"Oklahoma City family traumatized after ICE mistakenly raids their home","https://kfor.com/news/local/were-citizens-oklahoma-city-family-traumatized-after-ice-raids-home-but-they-werent-suspects/",92
"To 'Reclaim Future-Making', Amazon Workers Published Collection of SciFi Stories","https://afteramazon.world/",91
"One-sixth of the planet's cropland has toxic levels of one or more metals","https://english.elpais.com/science-tech/2025-04-17/one-sixth-of-the-planets-cropland-has-toxic-levels-of-one-or-more-metals.html",91
"The Mira Pro Color is Boox's first color E Ink monitor","https://www.theverge.com/news/658705/boox-mira-pro-color-e-ink-desktop-monitor",89
"Spring 83: a draft protocol intended to suggest new ways of relating online","https://github.com/robinsloan/spring-83",89
"Show HN: Kubetail – Real-time log search for Kubernetes","https://github.com/kubetail-org/kubetail",88
"Computer Architects Can't Find the Average","https://dgsq.net/2025-04-27-averages/",88
"Why can't Ivies cope with losing a few hundred million?","https://www.economist.com/briefing/2025/04/10/why-cant-stinking-rich-ivies-cope-with-losing-a-few-hundred-million",87
"A senior Apple exec could be jailed in Epic case","https://9to5mac.com/2025/05/01/a-senior-apple-exec-could-be-jailed-in-epic-case-its-time-to-end-this-disaster/",87
"Show HN: Zev – Remember (or discover) terminal commands","https://github.com/dtnewman/zev",86
"Show HN: I made my own TRMNL e-ink device","https://www.stavros.io/posts/making-a-trmnl-device/",85
"Show HN: Web-eval-agent – Let the coding agent debug itself","https://github.com/Operative-Sh/web-eval-agent",84
"Reversing the fossilization of computer science conferences","https://cacm.acm.org/blogcacm/reversing-the-fossilization-of-computer-science-conferences/",84
"The VTech Socratic Method","https://www.leadedsolder.com/2025/04/22/vtech-socrates-pickup.html",84
"PyGraph: Robust Compiler Support for CUDA Graphs in PyTorch","https://arxiv.org/abs/2503.19779",84
"Millihertz 5 Mechanical Computer (2022)","https://www.srimech.com/MHZ5.html",83
"How a Pipe Organ Works (2020)","https://www.pipedreams.org/page/how-a-pipe-organ-works",83
"NSF stops awarding new grants and funding existing ones","https://www.nature.com/articles/d41586-025-01396-2",80
"Wikipedia says it will use AI, but not to replace human volunteers","https://wikimediafoundation.org/news/2025/04/30/our-new-ai-strategy-puts-wikipedias-humans-first/",79
"Show HN: Kexa.io – Open-Source IT Security and Compliance Verification","item?id=43844665",78
"Unlocking Ractors: Object_id","https://byroot.github.io/ruby/performance/2025/04/26/unlocking-ractors-object-id.html",78
"Liverpool's title win has completed a mysterious Fibonacci sequence","https://www.bbc.com/future/article/20250425-the-fibonacci-sequence-hidden-in-liverpool-fcs-premier-league-football-title",76
"DECtalk Archive","https://dectalk.nu/",76
"Unauthorized Experiment on CMV Involving AI-Generated Comments","https://simonwillison.net/2025/Apr/26/unauthorized-experiment-on-cmv/",76
"OpenAI adds shopping to ChatGPT","https://www.wired.com/story/openai-adds-shopping-to-chatgpt/",76
"Fivetran to acquire Census","https://www.fivetran.com/blog/why-fivetran-and-census-are-joining-forces",75
"Are you the same person you used to be? (2022)","https://www.newyorker.com/magazine/2022/10/10/are-you-the-same-person-you-used-to-be-life-is-hard-the-origins-of-you",75
"Ask HN: Who wants to be hired? (May 2025)","item?id=43858552",74
"Two publishers and three authors fail to understand what "vibe coding" means","https://simonwillison.net/2025/May/1/not-vibe-coding/",74
"Packed Data Support in Haskell","https://arthi-chaud.github.io/posts/packed/",74
"Palantir's Justification for Building ICE's Master Database","https://www.404media.co/this-is-palantirs-justification-for-building-ices-master-database/",74
"Chrome Origin Trial: Device Bound Session Credentials","https://developer.chrome.com/blog/dbsc-origin-trial",73
"A competing theory to 'dark energy' suggests universe has different time zones","https://www.cbc.ca/radio/quirks/dark-energy-time-zones-1.7465116",72
"Requirements change until they don't","https://buttondown.com/hillelwayne/archive/requirements-change-until-they-dont/",72
"Doge Put a College Student in Charge of Using AI to Rewrite Regulations","https://www.wired.com/story/doge-college-student-ai-rewrite-regulations-deregulation/",72
"Differential Coverage for Debugging","https://research.swtch.com/diffcover",72
"Finding paths of least action with gradient descent (2023)","https://greydanus.github.io/2023/03/05/ncf-tutorial/",71
"HTTP Feeds: a minimal specification for polling events over HTTP","https://www.http-feeds.org/",71
"Robot Dexterity Still Seems Hard","https://www.construction-physics.com/p/robot-dexterity-still-seems-hard",71
"A new sign that AI is competing with college grads?","https://www.theatlantic.com/economy/archive/2025/04/job-market-youth/682641/",70
"Mission Impossible: Managing AI Agents in the Real World","https://medium.com/gitconnected/mission-impossible-managing-ai-agents-in-the-real-world-f8e7834833af",70
"What happens at the end of 'Trading Places'? (2013)","https://www.npr.org/sections/money/2013/07/19/201430727/what-actually-happens-at-the-end-of-trading-places",70
"CONL: "Markdown" for your config files","https://cirw.in/blog/conl",70
"Felix86: Run x86-64 programs on RISC-V Linux","https://felix86.com/",69
"Inference-Aware Fine-Tuning for Best-of-N Sampling in Large Language Models","https://arxiv.org/abs/2412.15287",69
"Colossal Cave Adventure (1976)","https://github.com/wh0am1-dev/adventure",69
"Legal art forgery, for the sake of movies (2014)","https://www.vanityfair.com/hollywood/2014/04/art-in-movies",68
"CosAE: Learnable Fourier Series for Image Restoration","https://sifeiliu.net/CosAE-page/",68
"Quebec refuses to reinvest in Lion Electric","https://www.thecanadianpressnews.ca/politics/quebec-raises-doubts-about-electrification-as-it-refuses-to-reinvest-in-lion-electric/article_db74eea8-2ec8-5d06-b965-7ea97dd99751.html",66
"Study finds that budget cuts to public R&D would significantly hurt the economy","https://impa.american.edu/costs-of-cutting-scientific-research/",66
"The Passing of Ucbvax (1994)","http://ucbvax.berkeley.edu/passing-of-ucbvax.txt",66
"LLMs for Engineering: Teaching Models to Design High Powered Rockets","https://arxiv.org/abs/2504.19394",64
"If you're in the market for a $1,900 color E Ink monitor, one of them exists now","https://arstechnica.com/gadgets/2025/04/e-ink-android-tablet-maker-onyx-boox-is-making-a-1900-color-e-ink-monitor/",64
"Get your Minitel back, the COMPUTEL videotex BBS is back","https://cq94.medium.com/get-your-minitels-back-the-computel-videotex-bbs-is-back-1d8c42f1ea17",64
"Researchers are studying how to minimize human impact on public lands","https://undark.org/2025/04/28/keep-wild-places-wild/",63
"C++26: more constexpr in the standard library","https://www.sandordargo.com/blog/2025/04/30/cpp26-constexpr-library-changes",61
"Greek Particles (1990)","https://specgram.com/Babel.I.2/07.sriyatha.greek.html",60
"Can LLMs do randomness?","https://rnikhil.com/2025/04/26/llm-coin-toss-odd-even",60
"Gaussian Splatting Meets ROS2","https://github.com/shadygm/ROSplat",59
"Show HN: Hyperparam: OSS tools for exploring datasets locally in the browser","https://hyperparam.app/about/opensource",58
"The last masters of Afro-Colombian machete fencing","https://globalvoices.org/2025/04/19/the-last-masters-of-afro-colombian-machete-fencing-fight-to-save-their-tradition/",57
"Beating the Crowd","https://www.withentropy.com/blog/2025-04-21-beating_the_crowd/",57
"Elon Musk Just Doesn't Understand the Sci-Fi Visions of Iain M. Banks","https://lithub.com/elon-musk-just-doesnt-understand-the-sci-fi-visions-of-iain-m-banks/",57
"Is Chrome Even a Sellable Asset?","https://daringfireball.net/2025/04/is_chrome_even_a_sellable_asset",56
"ACM's flagship magazine seeks submissions by/for practitioners","https://cacm.acm.org/practice/call-for-papers-cacm-practice-section/",55
"Restoring a Sinclair C5","https://woof.tech/@crashtestdev/114411537491626882",54
"Owen Le Blanc: creator of the first Linux distribution","https://lwn.net/Articles/1017846/",53
"Creating beautiful charts with JRuby and JFreeChart","https://blog.headius.com/2025/04/beautiful-charts-with-jruby-and-jfreechart.html",53
"Don't watermark your legal PDFs with purple dragons in suits","https://arstechnica.com/tech-policy/2025/05/dont-watermark-your-legal-pdfs-with-purple-dragons-in-suits/",53
"Maybe Zelenskiy Should Be Writing the Art of the Deal","https://www.bloomberg.com/opinion/articles/2025-05-01/maybe-zelenskiy-should-be-writing-the-art-of-the-deal",53
"What the heck is AEAD again?","https://ochagavia.nl/blog/what-the-heck-is-aead-again/",52
"Ask HN: Memory-safe low level languages?","item?id=43811487",52
"The lost secrets of Palm webOS (2014)","https://www.theverge.com/2014/1/2/5264580/the-lost-secrets-of-webos",49
"The best – but not good – way to limit string length","https://adam-p.ca/blog/2025/04/string-length/",49
"How the Water System Works","https://www.thenewatlantis.com/publications/how-water-system-works",48
"Satya Nadella says as much as 30% of Microsoft code is written by software","https://www.cnbc.com/2025/04/29/satya-nadella-says-as-much-as-30percent-of-microsoft-code-is-written-by-ai.html",48
"Show HN: Empty Enter Expander – Type less in the terminal with this tool","https://github.com/waszabi/empty-enter-expander",48
"OpenAlternative – open-source Alternatives to Popular Software","https://github.com/piotrkulpinski/openalternative",48
"All roses were once yellow","https://phys.org/news/2025-04-red-pink-white-roses-yellow.html",46
"Slinky-Coil Dipole (2021)","https://nonstopsystems.com/radio/frank_radio_antenna.htm",46
"Offline-First with CouchDB and PouchDB in 2025","https://neighbourhood.ie/blog/2025/03/26/offline-first-with-couchdb-and-pouchdb-in-2025",44
"AI suggestions make writing more generic, Western","https://news.cornell.edu/stories/2025/04/ai-suggestions-make-writing-more-generic-western",44
"Why 'Margin Call' remains Wall Street's favorite movie","https://www.semafor.com/article/04/28/2025/jc-chandor-on-writing-margin-call-and-jeremy-irons",43
"BYD Keeps Delivering on Tesla's Unkept Promises","https://cleantechnica.com/2025/04/23/byd-keeps-delivering-on-teslas-unkept-promises/",43
"The Art of Managing Skunks","https://maheshba.bitbucket.io/blog/2025/02/09/2025-skunks.html",42
"Statewide fluoride ban for tap water passes in Florida","https://www.miamiherald.com/news/local/community/miami-dade/article305335416.html",42
"Calibrations Have a Context-Collapse Problem","https://www.oldschoolburke.com/011-calibrations-have-a-context-collapse-problem/",42
"Show HN: Autarkie – Instant grammar fuzzing using Rust macros","https://github.com/R9295/autarkie",41
"Show HN: Rad Type - Can we make gamepad typing fast?","https://www.tyleo.com/projects/rad-type",41
"'ProtectEU' security strategy: a step further towards a digital dystopian future","https://edri.org/our-work/protecteu-security-strategy-a-step-further-towards-a-digital-dystopian-future/",40
"How the Internet Left 4chan Behind","https://www.newyorker.com/culture/infinite-scroll/how-the-internet-left-4chan-behind",40
"Show HN: Logchef – Schema-agnostic log viewer for ClickHouse","https://github.com/mr-karan/logchef",40
"Show HN: Convert Large CSV/XLSX to JSON or XML in Browser","https://csvforge.com",39
"Dataframely: A polars-native data frame validation library","https://tech.quantco.com/blog/dataframely",39
"Switzerland suspends Deutsche Bahn trains due to chronic delays","https://www.thelocal.de/20250430/switzerland-suspends-deutsche-bahn-trains-due-to-chronic-delays",39
"Do Large Language Models know who did what to whom?","https://arxiv.org/abs/2504.16884",39
"Cut: Chattanooga Civic User Testing","https://cut.chattanooga.gov/",39
"People who don't ask me questions drive me crazy. Why are they like that?","https://www.theguardian.com/wellness/2025/may/01/why-dont-people-ask-questions-in-conversation",38
"Compiler Reminders","https://jfmengels.net/compiler-reminders/",38
"Blood droplets on inclined surfaces reveal new cracking patterns","https://phys.org/news/2025-04-blood-droplets-inclined-surfaces-reveal.html",36
"Stockhausen: Sounds in Space","https://stockhausenspace.blogspot.com/",36
"McDonald's posts biggest US sales drop since 2020","https://www.bbc.com/news/articles/cy4vzpggkjno",36
"Ask HN: 3rd Week at FAANG and feeling imposter syndrome","item?id=43852440",36
"In the US, not even $11,000 a month can buy you dignity at the end of your life","https://www.theguardian.com/society/ng-interactive/2025/may/01/nursing-home-assisted-living-costs-care",36
"Doom GPU Flame Graphs","https://www.brendangregg.com/blog//2025-05-01/doom-gpu-flame-graphs.html",35
"Lessons from the Lebanese Space Program – Kasurian","https://kasurian.com/p/lebanese-space-program",35
"Implement Flash Attention Back End in SGLang – Basics and KV Cache","https://hebiao064.github.io/fa3-attn-backend-basic",35
"Reflecting on a Year of Gamedev in Zig","https://bgthompson.codeberg.page/blog/one-year-zig-gamedev-reflections/",34
"USPS law enforcement assists 'mass deportation' effort, sources and records show","https://www.washingtonpost.com/business/2025/04/29/usps-immigration-trump-deportations/",34
"Reanimation of the original Logic Theorist, the first AI, in IPL-V [video]","https://www.youtube.com/watch?v=qmE5o2ezqBg",34
"Zoho halts $700M semiconductor plan","https://semiconductorsinsight.com/zoho-halts-700-million-semiconductor-plan/",33
"Show HN: Robot Unlock – an open-ended programming game/zachlike","https://store.steampowered.com/app/3318050/Robot_Unlock/",32
"AGI Is Not a Milestone","https://www.aisnakeoil.com/p/agi-is-not-a-milestone",32
"The complicated circuitry for the 386 processor's registers","https://www.righto.com/2025/05/intel-386-register-circuitry.html",32
"RFK Jr. to require placebo-controlled studies for new vaccines","https://www.npr.org/sections/shots-health-news/2025/05/01/nx-s1-5383172/rfk-jr-placebo-vaccine-testing-studies",31
"NASA's Psyche spacecraft hits a speed bump on the way to a metal asteroid","https://arstechnica.com/space/2025/04/engineers-probe-pressure-drop-in-psyche-spacecrafts-propulsion-system/",31
"Strings Just Got Faster","https://inside.java/2025/05/01/strings-just-got-faster/",31
"SecuROM Unraveled","https://thecybersecguru.com/backtrack/securom-encyclopedia-history-technology-controversies-rootkit-impact-2025/",31
"Bloom Filters","https://eli.thegreenplace.net/2025/bloom-filters/",30
"TLA+ Video Course (2021)","https://lamport.azurewebsites.net/video/videos.html",30
"84% of the coral reefs hit by worst bleaching event on record","https://apnews.com/article/coral-reef-bleaching-climate-change-fdbeddf7ae3ccc9d7cf85d1c3267e581",30
"Why I'm getting off US tech","https://www.disconnect.blog/p/why-im-getting-off-us-tech",29
"Microsoft Confirms $1.50 Windows Security Update Hotpatch Fee Starts July 1","https://www.forbes.com/sites/daveywinder/2025/04/30/microsoft-confirms-150-windows-security-update-fee-starts-july-1/",29
"GPT Image prompted to "create the exact replica of this image" 74 times","https://old.reddit.com/r/ChatGPT/comments/1k9yow9/chatgpt_omni_prompted_to_create_the_exact_replica/",29
"An Ode to the Thigh (2024)","https://ponnekanti.net/posts/an-ode-to-the-thigh/",27
"Hybrid AC/DC distribution system with a shared neutral (2020)","https://electrical-engineering-portal.com/download-center/books-and-guides/electricity-generation-t-d/hybrid-ac-dc-distribution",26
"The Secret Services' involvement in the making of The Line of Fire (1993) [pdf]","https://www.governmentattic.org/58docs/USSSmovieInTheLineOfFireNoDate.pdf",26
"Princeton Engineering Anomalies Research (2010)","https://pearlab.icrl.org/theory.html",26
"Show HN: Neurox – GPU Observability for AI Infra","https://github.com/neuroxhq/helm-chart-neurox-control",25
"It feels at the beginning of the end of the world","https://www.fastcompany.com/91326177/this-is-how-it-feels-at-the-beginning-of-the-end-of-the-world",24
"The Signal Chat Leak and the NSA","https://www.schneier.com/blog/archives/2025/03/the-signal-chat-leak-and-the-nsa.html",24
"Ancient DNA Unveils the Cosmopolitan Heart of the Phoenician-Punic Civilization","https://allthathistory.com/archaeology-discoveries/phoenician-punic-civilization/2622/",23
"AI models routinely lie when honesty conflicts with their goals","https://www.theregister.com/2025/05/01/ai_models_lie_research/",23
"Pebble Core 2 Duo Smartwatch Demo and Q&A [video]","https://www.youtube.com/watch?v=UCI7N70tNRE",23
"Hunting for dark nights and wishing on stars","https://www.hcn.org/articles/hunting-for-dark-nights-and-wishing-on-stars/",23
"The cat that wouldn't die","https://aeon.co/essays/no-schrodingers-cat-is-not-alive-and-dead-at-the-same-time",22
