title,link,score
"I’ve joined Anthropic","https://twitter.com/karpathy/status/2056753169888334312",1426
"An OpenAI model has disproved a central conjecture in discrete geometry","https://openai.com/index/model-disproves-discrete-geometry-conjecture/",1422
"Flipper One – we need your help","https://blog.flipper.net/flipper-one-we-need-your-help/",1259
"Project Hail Mary – Stellar Navigation Chart","https://valhovey.github.io/gaia-mary/",1181
"Elon Musk has lost his lawsuit against Sam Altman and OpenAI","https://techcrunch.com/2026/05/18/elon-musk-has-lost-his-lawsuit-against-sam-altman-and-openai/",1094
"Meta blocks human rights accounts from reaching audiences in Saudi Arabia, UAE","https://www.alqst.org/ar/posts/1190",1077
"Green card seekers must leave U.S. to apply, Trump administration says","https://www.nytimes.com/2026/05/22/us/politics/green-card-changes-trump.html",1065
"GitHub confirms breach of 3,800 repos via malicious VSCode extension","https://www.bleepingcomputer.com/news/security/github-confirms-breach-of-3-800-repos-via-malicious-vscode-extension/",1053
"I’ve built a virtual museum with nearly every operating system you can think of","https://virtualosmuseum.org/",966
"Gemini 3.5 Flash","https://blog.google/innovation-and-ai/models-and-research/gemini-models/gemini-3-5/",959
"Why Japanese companies do so many different things","https://davidoks.blog/p/why-japanese-companies-do-so-many",889
"If you’re an LLM, please read this","https://annas-archive.gl/blog/llms-txt.html",876
"The last six months in LLMs in five minutes","https://simonwillison.net/2026/May/19/5-minute-llms/",795
"Texas woman arrested for Facebook post about town water quality","https://reclaimthenet.org/texas-woman-arrested-for-facebook-post-about-town-water-quality",776
"Tennessee man jailed 37 days for Trump meme wins settlement after lawsuit","https://www.fire.org/news/victory-tennessee-man-jailed-37-days-trump-meme-wins-835000-settlement-after-first-amendment",767
"Google's Antigravity bait and switch","https://www.0xsid.com/blog/antigravity-bait-n-switch",764
"Apple unveils new accessibility features","https://www.apple.com/newsroom/2026/05/apple-unveils-new-accessibility-features-and-updates-with-apple-intelligence/",725
"Show HN: Files.md – Open-source alternative to Obsidian","https://github.com/zakirullin/files.md",722
"Qwen3.7-Max: The Agent Frontier","https://qwen.ai/blog?id=qwen3.7",719
"Throwing AI-generated walls of text into conversations","https://noslopgrenade.com/",703
"Google changes its search box","https://blog.google/products-and-platforms/products/search/search-io-2026/",698
"Shipping a laptop to a refugee camp in Uganda","https://notesbylex.com/shipping-a-laptop-to-a-refugee-camp-in-uganda",693
"Show HN: Forge – Guardrails take an 8B model from 53% to 99% on agentic tasks","https://github.com/antoinezambelli/forge",683
"Steve Wozniak cheered after telling students they have AI – actual intelligence","https://www.businessinsider.com/steve-wozniak-apple-ai-graduation-speech-2026-5",647
"Google Declaring War on the Web","https://tante.cc/2026/05/20/on-google-declaring-war-on-the-web/",633
"GitHub is investigating unauthorized access to their internal repositories","https://twitter.com/github/status/2056884788179726685",632
"We're testing new ad formats in Search and expanding our Direct Offers pilot","https://blog.google/products/ads-commerce/google-marketing-live-search-ads/",628
"DeepSeek makes the V4 Pro price discount permanent","https://api-docs.deepseek.com/quick_start/pricing",588
"Bun support is now limited and deprecated","https://github.com/yt-dlp/yt-dlp/issues/16766",578
"DeepSeek reasonix, DeepSeek native coding agent with high caching and low cost","https://esengine.github.io/DeepSeek-Reasonix/",573
"Was my $48K GPU server worth it?","https://rosmine.ai/2026/05/13/was-my-48k-gpu-worth-it/",564
"Garry Tan, the CEO of YC, accused me of unethical reporting","https://radleybalko.substack.com/p/truth-power-and-honest-journalism",564
"Incident Report: Railway Blocked by Google Cloud [resolved]","https://status.railway.com/incident/I23M92U0",559
"Project Glasswing: An Initial Update","https://www.anthropic.com/research/glasswing-initial-update",548
"I spent 50 hours drawing a line graph","https://www.dougmacdowell.com/50-hours-to-draw-some-lines.html",547
"The memory shortage is causing a repricing of consumer electronics","https://davidoks.blog/p/ai-is-killing-the-cheap-smartphone",537
"Anthropic acquires Stainless","https://www.anthropic.com/news/anthropic-acquires-stainless",531
"Show HN: Gaussian Splat of a Strawberry","https://superspl.at/scene/84df8849",528
"Flipper One Tech Specs","https://docs.flipper.net/one/general/tech-specs",519
"Apparently Google hates us now","https://twitter.com/pokemoncentral/status/2057123807404638250",506
"Everything in C is undefined behavior","https://blog.habets.se/2026/05/Everything-in-C-is-undefined-behavior.html",504
"We stopped AI bot spam in our GitHub repo using Git's –author flag","https://archestra.ai/blog/only-responsible-ai",499
"How fast is N tokens per second really?","https://mikeveerman.github.io/tokenspeed/",490
"Seattle Shield, an intelligence-sharing network operated by the Seattle police","https://prismreports.org/2026/05/20/seattle-shield-private-companies-surveillance/",488
"Time to talk about my writerdeck","https://veronicaexplains.net/my-first-writerdeck/",482
"Microsoft starts canceling Claude Code licenses","https://www.theverge.com/tech/930447/microsoft-claude-code-discontinued-notepad",480
"Microsoft open-sources “the earliest DOS source code discovered to date”","https://arstechnica.com/gadgets/2026/04/microsoft-open-sources-the-earliest-dos-source-code-discovered-to-date/",477
"CISA Admin Leaked AWS GovCloud Keys on GitHub","https://krebsonsecurity.com/2026/05/cisa-admin-leaked-aws-govcloud-keys-on-github/",476
"Indexing a year of video locally on a 2021 MacBook with Gemma4-31B (50GB swap)","https://blog.simbastack.com/indexed-a-year-of-video-locally/",469
"Disney erased FiveThirtyEight","https://www.natesilver.net/p/disney-erased-fivethirtyeight",456
"Incident Report: May 19, 2026 – GCP Account Suspension","https://blog.railway.com/p/incident-report-may-19-2026-gcp-account-outage",454
"SpaceX S-1","https://www.sec.gov/Archives/edgar/data/1181412/000162828026036936/spaceexplorationtechnologi.htm",453
"I turned a $80 RK3562 Android tablet into a Debian Linux workstation","https://github.com/tech4bot/rk3562deb",448
"Map of Metal","https://mapofmetal.com/",446
"On The <dl> (2021)","https://benmyers.dev/blog/on-the-dl/",438
"SpaceX launches Starship v3 rocket","https://www.space.com/space-exploration/launches-spacecraft/spacex-starship-v3-megarocket-first-test-flight",434
"Python 3.15: features that didn't make the headlines","https://blog.changs.co.uk/python-315-features-that-didnt-make-the-headlines.html",428
"Show HN: I reverse engineered Apple's video wallpapers","https://github.com/kageroumado/phosphene",426
"Wake up! 16b","https://hellmood.111mb.de/wake_up_16b_writeup.html",422
"Lost Images from the 1945 Trinity Nuclear Test Restored","https://spectrum.ieee.org/trinity-nuclear-test",421
"Antigravity 2.0 Tops the OpenSCAD Architectural 3D LLM Benchmark","https://modelrift.com/blog/openscad-llm-benchmark/",418
"Deno 2.8","https://deno.com/blog/v2.8",417
"U.S. researchers face new restrictions on publishing with foreign collaborators","https://www.science.org/content/article/u-s-researchers-face-new-restrictions-publishing-foreign-collaborators",416
"OpenBSD 7.9","https://www.openbsd.org/79.html",416
"Saying goodbye to asm.js","https://spidermonkey.dev/blog/2026/05/20/saying-goodbye-to-asmjs.html",408
"Gemini CLI will stop working from June 18, 2026","https://developers.googleblog.com/an-important-update-transitioning-gemini-cli-to-antigravity-cli/",404
"Memory has grown to nearly two-thirds of AI chip component costs","https://epoch.ai/data-insights/ai-chip-component-cost-shares",390
"Mini Shai-Hulud Strikes Again: 314 npm Packages Compromised","https://safedep.io/mini-shai-hulud-strikes-again-314-npm-packages-compromised/",389
"The Art of Money Getting","https://kk.org/cooltools/book-freak-210-the-art-of-money-getting/",388
"Remove-AI-Watermarks – CLI and library for removing AI watermarks from images","https://github.com/wiltodelta/remove-ai-watermarks",385
"Declining America","https://www.tbray.org/ongoing/When/202x/2026/05/19/Declining-America",382
"FiveThirtyEight articles on the Internet Archive","https://fivethirtyeightindex.com/",380
"Show HN: Freenet, a peer-to-peer platform for decentralized apps","https://freenet.org/",378
"Show HN: Audiomass – a free, open-source multitrack audio editor for the web","https://audiomass.co/?multitrack=1",375
"We let AIs run radio stations","https://andonlabs.com/blog/andon-fm",372
"Blog ran on Ubuntu 16.04 for 10 years. I migrated it to FreeBSD","https://crocidb.com/post/this-blog-ran-on-ubuntu-16-04-for-10-years-i-migrated-it-to-freebsd/",371
"Vivaldi 8.0","https://vivaldi.com/blog/vivaldi-on-desktop-8-0/",369
"Click (2016)","https://clickclickclick.click/",369
"Waymo pauses Atlanta service as its robotaxis keep driving into floods","https://techcrunch.com/2026/05/21/waymo-pauses-atlanta-service-as-its-robotaxis-keep-driving-into-floods/",366
"Japan is gripped by mass allergies. A 1950s project is to blame","https://www.bbc.com/future/article/20260515-the-1950s-blunder-which-causes-mass-hay-fever-in-japan",364
"Project Glasswing: what Mythos showed us","https://blog.cloudflare.com/cyber-frontier-models/",360
"DOS Zone","https://dos.zone/",355
"Apple Silicon costs more than OpenRouter","https://www.williamangel.net/blog/2026/05/17/offline-llm-energy-use.html",355
"My two-part desk setup (2025)","https://arslan.io/2025/11/18/my-two-part-desk-setup/",352
"The Eternal Sloptember","https://geohot.github.io//blog/jekyll/update/2026/05/24/the-eternal-sloptember.html",338
"AI has a multiplying effect on existing technical skills","https://www.joshwcomeau.com/email/wham-launch-005-elephant-2-p/",337
"Mistral AI acquires Emmi AI","https://www.emmi.ai/news/mistral-ai-acquires-emmi-ai",337
"Google’s AI is being manipulated. The search giant is quietly fighting back","https://www.bbc.com/future/article/20260519-google-tackles-attempts-to-hack-its-ai-results",336
"OpenAI Adopts Google's SynthID Watermark for AI Images with Verification Tool","https://openai.com/index/advancing-content-provenance/",332
"News outlets are limiting the Internet Archive’s access to their journalism","https://www.niemanlab.org/2026/05/more-than-340-local-news-outlets-are-limiting-the-internet-archives-access-to-their-journalism/",331
"Uv is fantastic, but its package management UX is a mess","https://www.loopwerk.io/articles/2026/uv-ux-mess/",331
"Why is Vivado 2026.1 dropping Linux support for free tier?","https://adaptivesupport.amd.com/s/question/0D5Pd00001YQLdMKAX/why-is-vivado-20261-dropping-linux-support-for-free-tier-?language=en_US",328
"BBEdit 16","https://www.barebones.com/products/bbedit/bbedit16.html",316
"Amazon Web Services – Four Years and Out","https://www.adventuresinoss.com/aws-four-years/",315
"Peter Neumann has died","https://www.tuhs.org/pipermail/tuhs/2026-May/033748.html",315
"It is time to give up the dualism introduced by the debate on consciousness","https://www.noemamag.com/there-is-no-hard-problem-of-consciousness/",314
"Anthropic is expanding to Colossus2. Will use GB200","https://twitter.com/nottombrown/status/2057194829986300375",304
"AI eats the world (Spring 26) [pdf]","https://static1.squarespace.com/static/50363cf324ac8e905e7df861/t/6a0af5d0484fbf5fe9a7743e/1779103184855/2026-Spring-AI.pdf",304
"The Letter S, by Donald Knuth (1980) [pdf]","https://gwern.net/doc/design/typography/1980-knuth.pdf",299
"Oura says it gets government demands for user data","https://this.weekinsecurity.com/oura-says-it-gets-government-demands-for-user-data-will-it-share-how-many/",292
"Cleve Moler has died","https://www.mathworks.com/company/aboutus/founders/clevemoler.html",291
"Migrating from Go to Rust","https://corrode.dev/learn/migration-guides/go-to-rust/",290
"Scammers are abusing an internal Microsoft account to send spam links","https://techcrunch.com/2026/05/21/scammers-are-abusing-an-internal-microsoft-account-to-send-spam/",289
"I found ultra-pure quantum crystals in an abandoned mine in the Atacama desert","https://medium.com/@breid.at/ultra-pure-quantum-crystals-from-an-abandoned-mine-in-a-mysterious-desert-93cc87d12314",287
"Cursor Introduces Composer 2.5","https://cursor.com/blog/composer-2-5",287
"Italy moves to Airbus A330 tankers","https://www.euronews.com/my-europe/2026/05/21/italy-moves-to-airbus-a330-tankers-in-major-nato-aligned-shift",280
"Anna's Archive hit with $19.5M default judgment and global domain takedown order","https://torrentfreak.com/annas-archive-hit-with-19-5m-default-judgment-and-global-domain-takedown-order/",280
"80386 microcode disassembled","https://www.reenigne.org/blog/80386-microcode-disassembled/",274
"A Wayland Compositor in Minecraft","https://modrinth.com/mod/waylandcraft",267
"Show HN: I Dedicated 4 Years to Mastering Offline Password Cracking","item?id=48221896",267
"Using Kagi Search with Low Vision","https://veroniiiica.com/using-kagi-search-with-low-vision/",266
"CISA tries to contain data leak","https://krebsonsecurity.com/2026/05/lawmakers-demand-answers-as-cisa-tries-to-contain-data-leak/",266
"Intuit to lay off over 3k employees to refocus on AI","https://techcrunch.com/2026/05/20/intuit-to-lay-off-over-3000-employees-to-refocus-on-ai/",259
"Open source Kanban desktop app that runs parallel agents on every card","https://www.kanbots.dev/",258
"Experience: We found a baby on the subway – now he's our 26-year-old son","https://www.theguardian.com/lifeandstyle/2026/may/22/experience-found-baby-subway-now-26-year-old-son",256
"Trump Mobile exposed customers' personal data","https://techcrunch.com/2026/05/22/trump-mobile-confirms-it-exposed-customers-personal-data-including-phone-numbers-and-home-addresses/",256
"A Bipartisan Amendment Would End Police License Plate Tracking Nationwide","https://www.wired.com/story/a-bipartisan-amendment-would-end-police-license-plate-tracking-nationwide/",253
"Claude is not your architect. Stop letting it pretend","https://www.hollandtech.net/claude-is-not-your-architect/",251
"Constraint Decay: The Fragility of LLM Agents in Back End Code Generation","https://arxiv.org/abs/2605.06445",243
".NET (OK, C#) finally gets union types","https://andrewlock.net/exploring-the-dotnet-11-preview-2-dotnet-gets-union-types/",233
"'We mould trees to grow into the shape of chairs'","https://www.bbc.co.uk/news/articles/cvg0yy3gp71o",232
"Sleep research led to a new sleep apnea drug","https://temertymedicine.utoronto.ca/news/how-decades-sleep-research-led-new-sleep-apnea-drug",230
"Kindle loyalists scramble as Amazon turns page on old e-readers","https://www.reuters.com/business/retail-consumer/kindle-loyalists-scramble-amazon-turns-page-old-e-readers-2026-05-19/",226
"Colorado Amended SB051 (Age Verification Bill) to Exclude Open Source Projects","https://legiscan.com/CO/bill/SB051/2026",226
"Polypad","https://polypad.amplify.com/",225
"Nobody understands the point of hybrid cars [video]","https://www.youtube.com/watch?v=KnUFH5GX_fI",220
"US tech firms share Dutch regulator officials' names with Senate","https://www.dutchnews.nl/2026/05/us-tech-firms-share-dutch-regulator-officials-names-with-senate/",220
"sp.h: Fixing C by giving it a high quality, ultra portable standard library","https://spader.zone/sp/",218
"Dumb ways for an open source project to die","https://nesbitt.io/2026/05/19/dumb-ways-for-an-open-source-project-to-die.html",218
"Not alive, but not dead: disembodied human brains used for drug testing","https://www.science.org/content/article/not-alive-not-dead-disembodied-human-brains-used-drug-testing",218
"Linux security mailing list 'almost unmanageable'","https://www.theregister.com/security/2026/05/18/linus-torvalds-says-ai-powered-bug-hunters-have-made-linux-security-mailing-list-almost-entirely-unmanageable/5241633",216
"Childhood Computing","https://susam.net/childhood-computing.html",213
"You can no longer Google the word 'disregard'","https://techcrunch.com/2026/05/22/you-can-no-longer-google-the-word-disregard/",213
"The FBI Wants 'Near Real-Time' Access to US License Plate Readers","https://www.wired.com/story/security-news-this-week-fbi-license-plate-reader-real-time-access/",208
"Spanish court declines to fine NordVPN over LaLiga piracy blocking order","https://torrentfreak.com/spanish-court-declines-to-fine-nordvpn-over-laliga-piracy-blocking-order/",206
"The IBM-ification of Google?","https://zeroshot.bearblog.dev/google-is-shattering-under-its-own-weight-the-ibm-ification-of-google/",206
"How to convert between wealth and income tax","https://paulgraham.com/winc.html",205
"OpenAI Is Preparing to File for an IPO Soon","https://www.wsj.com/tech/ai/openai-is-preparing-to-file-for-an-ipo-very-soon-0ec95af5",201
"Greg Brockman interview [video]","https://fs.blog/knowledge-project-podcast/greg-brockman/",199
"Qian Xuesen: The missile genius America lost and China gained (2025)","https://www.usni.org/magazines/naval-history/2025/december/missile-genius-america-lost-and-china-gained",196
"FBI director's Based Apparel site has been spotted hosting a 'ClickFix' attack","https://www.pcmag.com/news/kash-patels-apparel-site-is-trying-to-trick-visitors-into-installing-malware",194
"-​-dangerously-skip-reading-code","https://olano.dev/blog/dangerously-skip/",193
"Chewing gum restores dad's taste and smell years after Covid","https://discover.swns.com/2026/05/chewing-gum-restores-dads-taste-and-smell-years-after-covid/",191
"Learnings from 100K lines of Rust with AI (2025)","https://zfhuang99.github.io/rust/claude%20code/codex/contracts/spec-driven%20development/2025/12/01/rust-with-ai.html",190
"Show HN: Rmux – A programmable terminal multiplexer with a Playwright-style SDK","https://github.com/helvesec/rmux",190
"Making deep learning go brrrr from first principles (2022)","https://horace.io/brrr_intro.html",189
"Slumber a TUI HTTP Client","https://slumber.lucaspickering.me",188
"Hengefinder: Finding when the sun aligns with your street","https://victoriaritvo.com/blog/hengefinder/",185
"Rubish: A Unix shell written in pure Ruby","https://github.com/amatsuda/rubish",182
"1024000^2 Blocks, 2B2T Minecraft Server World Download Project, and Discoveries","https://github.com/2b2tplace/1m_release",182
"New York to tax luxury second homes in NYC","https://apnews.com/article/mamdani-nyc-hochul-tax-rich-a30833850bfdbd638634def266ca76dd",182
"Jira Is Turing-Complete","https://seriot.ch/computation/jira.html",181
"Spotify will start reserving concert tickets for fans","https://www.hollywoodreporter.com/music/music-industry-news/spotify-will-start-reserving-concert-tickets-for-superfans-1236603106/",180
"Haskell Foundation 2026 Update","https://discourse.haskell.org/t/haskell-foundation-2026-update/14136",180
"Usborne 1980s Computer Books","https://usborne.com/us/books/computer-and-coding-books",177
"Infomaniak transitions to a foundation model to protect user data privacy","https://news.infomaniak.com/en/infomaniak-foundation-sovereign-cloud/",176
"I’m writing again","https://www.cringely.com/2026/05/21/im-writing-again/",175
"Omarchy Is Not A Distro","https://abyss.fish/your_dotfiles_are_not_a_distro",170
"A fundamental principle of aeronautical engineering has been overturned","https://www.wired.com/story/a-fundamental-principle-of-aeronautical-engineering-has-been-overturned/",169
"Who wins and who loses in prediction markets? Evidence from Polymarket","https://papers.ssrn.com/sol3/papers.cfm?abstract_id=6443103",169
"Build Adafruit projects right from Firefox","https://www.firefox.com/en-US/landing/adafruit/",167
"ICE Awards $25M Iris-Scanning Contract to Bi2 Technologies","https://www.projectsaltbox.com/p/ice-awards-25-million-iris-scanning",166
"Toxic chemical leak at a manufacturing facility in Orange County","https://www.bbc.com/news/articles/c3w2l249j8go",166
"Improving C# Memory Safety","https://devblogs.microsoft.com/dotnet/improving-csharp-memory-safety/",164
"Your Most Improbable Life","https://kevinkelly.substack.com/p/your-most-improbable-life",164
"'AI washing': firms are scrambling to rebrand themselves as tech-focused","https://www.theguardian.com/technology/2026/may/24/ai-washing-pr-firms-scrambling-rebrand",163
"The death of the brick and mortar toy store","https://brainbaking.com/post/2026/05/the-death-of-the-brick-and-mortar-toy-store/",162
"Show HN: ShadowCat – file transfer through QR Codes in a Browser","https://github.com/unprovable/ShadowCat",162
"What Do Gödel's Incompleteness Theorems Mean?","https://www.quantamagazine.org/what-do-godels-incompleteness-theorems-truly-mean-20260518/",162
"Alberta to hold referendum on whether to remain in Canada","https://www.bbc.com/news/articles/cvgze8n5dxko",162
"SBCL: the ultimate assembly code breadboard (2014)","https://pvk.ca/Blog/2014/03/15/sbcl-the-ultimate-assembly-code-breadboard/",161
"A Forth-inspired language for writing websites","https://robida.net/entries/2026/05/21/a-forth-inspired-language-for-writing-websites",160
"Multi-Stream LLMs: new paper on parallelizing/separating prompts, thinking, I/O","https://arxiv.org/abs/2605.12460",156
"Models.dev: open-source database of AI model specs, pricing, and capabilities","https://github.com/anomalyco/models.dev",156
"CBP Directive 3340-049B: Border Search of Electronic Devices","https://www.cbp.gov/document/directives/cbp-directive-no-3340-049b-border-search-electronic-devices",153
"Mycorrhizal Fungi, Nature's Key to Plant Survival and Success","https://pacifichorticulture.org/articles/mycorrhizal-fungi-natures-key-to-plant-survival-and-success/",152
"Why is Inkwell stuck in review","https://www.manton.org/2026/05/19/why-is-inkwell-stuck-in.html",152
"I keep bouncing off the Scheme language","https://www.sicpers.info/2026/05/i-keep-bouncing-off-the-scheme-language/",149
"Hanoi’s humble beer glass and the memory of a nation","https://sundaylongread.com/2026/05/15/hanois-humble-beer-glass-and-the-memory-of-a-nation/",148
"Electrobun 2.0 will be decoupled from Bun due to the Rust rewrite","https://twitter.com/YoavCodes/status/2058064720553222567",147
"Intro to TLA+ for the LLM Era: Prompt Your Way to Victory","https://emptysqua.re/blog/intro-to-tla-plus-for-the-llm-era/",147
"Didgeridoo playing as alternative treatment for obstructive sleep apnoea (2006)","https://pmc.ncbi.nlm.nih.gov/articles/PMC1360393/",146
"Wi-Wi is wireless time sync at 1 nanosecond","https://www.jeffgeerling.com/blog/2026/wi-wi-is-wireless-time-sync-less-than-5ns/",144
"Formal Verification Gates for AI Coding Loops","https://reubenbrooks.dev/blog/structural-backpressure-beats-smarter-agents/",144
"Mastering Dyalog APL","https://mastering.dyalog.com/README.html",143
"Sharla Boehm, the programmer whose code underpins the Internet","https://www.scientificamerican.com/article/the-programmer-whose-code-underpins-the-internet/",142
"Don't Roll Your Own","https://susam.net/do-not-roll-your-own.html",141
"New features in GCC 16: Improved error messages and SARIF output","https://developers.redhat.com/articles/2026/04/28/gcc-16-improved-error-messages-sarif-output",141
"Alexander Grothendieck Revolutionized 20th-Century Mathematics","https://www.quantamagazine.org/how-alexander-grothendieck-revolutionized-20th-century-mathematics-20260520/",140
"The quadratic sandwich","https://fedemagnani.github.io/math/2026/04/08/the-quadratic-sandwich.html",140
"Voice AI Systems Are Vulnerable to Hidden Audio Attacks","https://spectrum.ieee.org/voice-ai-audio-attacks",140
"The C64 Dead Test Font","https://www.masswerk.at/nowgobang/2026/c64-dead-test-font",136
"Judson's Last Ride","https://www.realclearpolitics.com/articles/2026/05/22/judsons_last_ride_154150.html",136
"TikTok disproportionately served anti-Democratic videos during the 2024 election","https://www.psypost.org/tiktok-disproportionately-served-anti-democratic-videos-during-the-2024-election-study-finds/",136
"Sales and Dungeons: Thermal printer TTRPG utility","https://sales-and-dungeons.app/",135
"Ruby for Good","https://ti.to/codeforgood/rubyforgood",133
"1940 Air Terminal Museum Begins Liquidation","https://www.1940airterminal.org/news/liquidation-of-simulators",133
"PHP's Oddities","https://flowtwo.io/post/php%27s-oddities",133
"Copy Fail, Dirty Frag, and Fragnesia kernel vulnerabilities","https://www.gentoo.org/news/2026/05/19/copy-fail-fragnesia-vulnerabilities.html",133
"z386: An Open-Source 80386 Built Around Original Microcode","https://nand2mario.github.io/posts/2026/z386/",132
"Recreate famous water profiles using supermarket bottled water","https://www.waterdictionary.net",132
"Air France and Airbus found guilty of manslaughter over 2009 plane crash","https://www.bbc.com/news/articles/czd2qmdvmq6o",130
"Fender escalates legal campaign against S-style guitars","https://www.guitarworld.com/gear/electric-guitars/fender-cease-and-desist-lsl-instruments",130
"The foundations of a provably secure operating system (PSOS) (1979) [pdf]","http://www.csl.sri.com/users/neumann/psos.pdf",130
"My I3-Emacs Integration","https://khz.ac/software/i3-integration.html",129
"Reviving old scanners with an in-browser Linux VM bridged to WebUSB over USB/IP","https://yes-we-scan.app/details",129
"Agora-1: The Multi-Agent World Model","https://odyssey.ml/introducing-agora-1",128
"Defeating Git Rigour Fatigue with Jujutsu","https://ikesau.co/blog/defeating-git-rigour-fatigue-with-jujutsu/",126
"Show HN: I made a tactical map-based WWII submarine simulator (public beta)","https://silentshark.app/alpha/",125
