title,link,score
"Widespread power outage in Spain and Portugal","https://www.bbc.com/news/live/c9wpq8xrvd9t",1536
"Redis is open source again","https://antirez.com/news/151",1472
"A $20k American-made electric pickup with no paint, no stereo, no screen","https://www.theverge.com/electric-cars/655527/slate-electric-truck-price-paint-radio-bezos",1439
"You wouldn't steal a font","https://fedi.rib.gay/notes/a6xqityngfubsz0f",1399
"Someone at YouTube needs glasses","https://jayd.ml/2025/04/30/someone-at-youtube-needs-glasses.html",1359
"Apple violated antitrust ruling, judge finds","https://www.wsj.com/tech/apple-violated-antitrust-ruling-federal-judge-finds-66b85957",1117
"Careless People","https://pluralistic.net/2025/04/23/zuckerstreisand/#zdgaf",1068
"I use zip bombs to protect my server","https://idiallo.com/blog/zipbomb-protection",1016
"Watching o3 guess a photo's location is surreal, dystopian and entertaining","https://simonwillison.net/2025/Apr/26/o3-photo-locations/",976
"Show HN: I built a hardware processor that runs Python","https://www.runpyxl.com/gpio",973
"Show HN: I built an AI that turns GitHub codebases into easy tutorials","https://github.com/The-Pocket/Tutorial-Codebase-Knowledge",920
"Wikipedia’s nonprofit status questioned by D.C. U.S. attorney","https://www.washingtonpost.com/technology/2025/04/25/wikipedia-nonprofit-ed-martin-letter/",919
"Judge rules Apple executive lied under oath, makes criminal contempt referral","https://www.thebignewsletter.com/p/judge-rules-apple-executive-lied",907
"Internet in a Box","https://internet-in-a-box.org/",886
"AI Horseless Carriages","https://koomen.dev/essays/horseless-carriages/",861
"Qwen3: Think deeper, act faster","https://qwenlm.github.io/blog/qwen3/",853
"I wrote to the address in the GPLv2 license notice (2022)","https://code.mendhak.com/gpl-v2-address-letter/",794
"An end to all this prostate trouble?","https://yarchive.net/blog/prostate/",787
"LibreLingo – FOSS Alternative to Duolingo","https://librelingo.app",785
"Firefox tab groups are here","https://blog.mozilla.org/en/firefox/tab-groups-community/",778
"Finland Bans Smartphones in Schools","https://yle.fi/a/74-20158886",763
"Office is too slow, so Microsoft is making it load at Windows startup","https://www.pcworld.com/article/2651749/office-is-too-slow-so-microsoft-is-making-it-load-at-windows-startup.html",749
"Migrating away from Rust","https://deadmoney.gg/news/articles/migrating-away-from-rust",713
"Port of Los Angeles says shipping volume will plummet 35% next week","https://www.cnbc.com/2025/04/29/port-of-los-angeles-sees-shipping-volume-down-35percent-next-week-as-tariffs-bite.html",710
"Try Switching to Kagi","https://daringfireball.net/2025/04/try_switching_to_kagi",698
"I created Perfect Wiki and reached $250k in annual revenue without investors","https://habr.com/en/articles/905812/",693
"Raspberry Pi Lidar Scanner","https://github.com/PiLiDAR/PiLiDAR",686
"Show HN: Dia, an open-weights TTS model for generating realistic dialogue","https://github.com/nari-labs/dia",651
"Writing "/etc/hosts" breaks the Substack editor","https://scalewithlee.substack.com/p/when-etchsts-breaks-your-substack",641
"Only Teslas exempt from new auto tariffs thanks to 85% domestic content rule","https://fuelarc.com/cars/only-tesla-exempt-from-new-auto-tariffs-thanks-to-85-domestic-content-rule/",627
"Blog hosted on a Nintendo Wii","https://blog.infected.systems/posts/2025-04-21-this-blog-is-hosted-on-a-nintendo-wii/",621
"Python’s new t-strings","https://davepeck.org/2025/04/11/pythons-new-t-strings/",619
"All four major web browsers are about to lose 80% of their funding","https://danfabulich.medium.com/all-four-major-web-browsers-are-about-to-lose-80-of-their-funding-0e42ceb358f1",599
"Jepsen: Amazon RDS for PostgreSQL 17.4","https://jepsen.io/analyses/amazon-rds-for-postgresql-17.4",591
"Atuin Desktop: Runbooks That Run","https://blog.atuin.sh/atuin-desktop-runbooks-that-run/",572
"Show HN: My self-written hobby OS is finally running on my vintage IBM ThinkPad","https://github.com/joexbayer/RetrOS-32",569
"Evertop: E-ink IBM XT clone with 100+ hours of battery life","https://github.com/ericjenott/Evertop",563
"Claude Integrations","https://www.anthropic.com/news/integrations",547
"Sycophancy in GPT-4o","https://openai.com/index/sycophancy-in-gpt-4o/",544
"Chain of Recursive Thoughts: Make AI think harder by making it argue with itself","https://github.com/PhialsBasement/Chain-of-Recursive-Thoughts",532
"Mark Zuckerberg says social media is over","https://www.newyorker.com/culture/infinite-scroll/mark-zuckerberg-says-social-media-is-over",531
"The Friendship Recession: The lost art of connecting","https://www.happiness.hks.harvard.edu/february-2025-issue/the-friendship-recession-the-lost-art-of-connecting",530
"Retailers will soon have only about 7 weeks of full inventories left","https://fortune.com/article/retailers-weeks-of-inventory-left-trump-china-trade-war/",517
"Starting July 1, academic publishers can't paywall NIH-funded research","https://www.nih.gov/about-nih/who-we-are/nih-director/statements/accelerating-access-research-results-new-implementation-date-2024-nih-public-access-policy",515
"Cloth","https://www.cloudofoz.com/verlet-test/",514
"The effect of deactivating Facebook and Instagram on users' emotional state","https://www.nber.org/papers/w33697",505
"Why did Windows 7 log on slower for months if you had a solid color background?","https://devblogs.microsoft.com/oldnewthing/20250428-00/?p=111121",501
"How a single line of code could brick your iPhone","https://rambo.codes/posts/2025-04-24-how-a-single-line-of-code-could-brick-your-iphone",501
"Xiaomi MiMo Reasoning Model","https://github.com/XiaomiMiMo/MiMo",471
"A faster way to copy SQLite databases between computers","https://alexwlchan.net/2025/copying-sqlite-databases/",461
"108B Pixel Scan of Johannes Vermeer's Girl with a Pearl Earring","https://www.hirox-europe.com/gigapixel/girl-with-a-pearl-earring/",457
"Show HN: I made a web-based, free alternative to Screen Studio","https://www.screenrecorder.me",457
"U.S. Economy Contracts at 0.3% Rate in First Quarter","https://www.wsj.com/economy/us-gdp-q1-2025-1f82f689",451
"You Wouldn't Download a Hacker News","https://www.jasonthorsness.com/25",448
"Apple and Meta fined millions for breaching EU law","https://ca.finance.yahoo.com/news/apple-fined-570-million-meta-094701712.html",447
"O3 beats a master-level GeoGuessr player, even with fake EXIF data","https://sampatt.com/blog/2025-04-28-can-o3-beat-a-geoguessr-master",442
"Ask HN: Share your AI prompt that stumps every model","item?id=43782299",439
"Shortest-possible walking tour to 81,998 bars in South Korea","https://www.math.uwaterloo.ca/tsp/korea/index.html",435
"Show HN: Beatsync – perfect audio sync across multiple devices","https://github.com/freeman-jiang/beatsync",430
"How the US defense secretary circumvents official DoD communications equipment","https://www.electrospaces.net/2025/04/how-us-defense-secretary-hegseth.html",425
"Indian court orders blocking of Proton Mail","https://techcrunch.com/2025/04/29/indian-court-orders-blocking-of-proton-mail/",415
"Lossless LLM compression for efficient GPU inference via dynamic-length float","https://arxiv.org/abs/2504.11651",411
"Ask HN: What are you working on? (April 2025)","item?id=43815523",396
"A Love Letter to People Who Believe in People","https://www.swiss-miss.com/2025/04/a-love-letter-to-people-who-believe-in-people.html",395
"The One-Person Framework in Practice","https://link.mail.beehiiv.com/ss/c/u001.5SRwDQ9qxPQW8vmD5Do73b3R4eTCi2vXqPyztEk6wMFC9_fqEAcDVx6xEJ96T4BSMXrPS7z5exEBSTF4pF48z8SqJkJnkAwMUW9LtYdd8lWmvkDinT92nsk5HmXOHdWgLsysm9FMGrqmu7dnG57cXpga8ZOe8X0IV8pyeC3AswdRMaitfT307y7naP-_6W5CiolKhXCKrEndMGCW2PftFUu9ieYOxpVJ_fhu82gAh-4/4g1/wA_MG-I5SVCyR3KY66oEaQ/h30/h001.kLDFZMgisudi21zmTPbd_O8U7X98d4UxYqZjQTb_D7o",393
"I wrote a book called “Crap Towns”. It seemed funny at the time","https://samj.substack.com/p/that-joke-isnt-funny-any-more",393
"Waymo and Toyota outline partnership to advance autonomous driving deployment","https://waymo.com/blog/2025/04/waymo-and-toyota-outline-strategic-partnership",388
"Attacking My Landlord's Boiler","https://blog.videah.net/attacking-my-landlords-boiler/",388
"DeepSeek-Prover-V2","https://github.com/deepseek-ai/DeepSeek-Prover-V2",387
"International Workers' Day","https://en.wikipedia.org/wiki/International_Workers%27_Day",383
"Mercury: Commercial-scale diffusion language model","https://www.inceptionlabs.ai/introducing-mercury",379
"Instant SQL for results as you type in DuckDB UI","https://motherduck.com/blog/introducing-instant-sql/",378
"Avoiding skill atrophy in the age of AI","https://addyo.substack.com/p/avoiding-skill-atrophy-in-the-age",371
"We identified a North Korean hacker who tried to get a job","https://blog.kraken.com/news/how-we-identified-a-north-korean-hacker",369
"Your phone isn't secretly listening to you, but the truth is more disturbing","https://newatlas.com/computers/smartphone-listening-conversations-ads-facebook/",368
"Knowledge-based society, my ass","https://mihaiolteanu.me/knowledge-based-society-my-ass",368
"The Gruen Transfer is consuming the internet","https://sebs.website/blog/the%20gruen-transfer-is-consuming-the-internet",360
"Google Play sees 47% decline in apps since start of last year","https://techcrunch.com/2025/04/29/google-play-sees-47-decline-in-apps-since-start-of-last-year/",351
"The side hustle from hell","https://blog.jacobstechtavern.com/p/the-side-hustle-from-hell",345
"Supabase raises $200M Series D at $2B valuation","https://finance.yahoo.com/news/exclusive-supabase-raises-200-million-112154867.html",342
"Generative AI is not replacing jobs or hurting wages at all, say economists","https://www.theregister.com/2025/04/29/generative_ai_no_effect_jobs_wages/",341
"The hidden cost of AI coding","https://terriblesoftware.org/2025/04/23/the-hidden-cost-of-ai-coding/",341
"Business co-founders in tech startups are less valuable than they think","https://verdikapuku.com/posts/business-founders-are-less-valuable-than-they-think/",340
"How I blog with Obsidian, Hugo, GitHub, and Cloudflare","https://ingau.me/blog/how-i-write-my-blogs-in-obsidian-and-publish-instantly/",336
"One Million Chessboards","https://onemillionchessboards.com/#199,276",334
"Australian who ordered radioactive materials walks away from court","https://www.chemistryworld.com/news/australian-who-ordered-radioactive-materials-over-the-internet-walks-away-from-court/4021306.article",333
""AI-first" is the new Return To Office","https://www.anildash.com//2025/04/19/ai-first-is-the-new-return-to-office/",331
"CSS Zen Garden","https://csszengarden.com/",327
"YAGRI: You are gonna read it","https://www.scottantipa.com/yagri",327
"The 12-bit rainbow palette","https://iamkate.com/data/12-bit-rainbow/",322
"Eurorack Knob Idea","https://mitxela.com/projects/euroknob",322
"AI helps unravel a cause of Alzheimer’s and identify a therapeutic candidate","https://today.ucsd.edu/story/ai-helps-unravel-a-cause-of-alzheimers-disease-and-identify-a-therapeutic-candidate",319
"Notation as a Tool of Thought (1979)","https://www.jsoftware.com/papers/tot.htm",319
"Show HN: My from-scratch OS kernel that runs DOOM","https://github.com/UnmappedStack/TacOS",319
"Pwning the Ladybird Browser","https://jessie.cafe/posts/pwning-ladybirds-libjs/",316
"NotebookLM Audio Overviews are now available in over 50 languages","https://blog.google/technology/google-labs/notebooklm-audio-overviews-50-languages/",315
"Show HN: I used OpenAI's new image API for a personalized coloring book service","https://clevercoloringbook.com/",315
"The Policy Puppetry Attack: Novel bypass for major LLMs","https://hiddenlayer.com/innovation-hub/novel-universal-bypass-for-all-major-llms/",313
"A single line of code cost $8000","https://pietrasiak.com/one-line-of-code-that-did-cost-dollar8000",302
"Icônes","https://icones.js.org/",299
"Performance optimization is hard because it's fundamentally a brute-force task","https://purplesyringa.moe/blog/why-performance-optimization-is-hard-work/",296
"Tiny-LLM – a course of serving LLM on Apple Silicon for systems engineers","https://github.com/skyzh/tiny-llm",291
"Show HN: A Chrome extension that will auto-reject non-essential cookies","https://blog.bymitch.com/posts/reject-cookies/",290
"Show HN: Remote-Controlled IKEA Deathstar Lamp","https://gitlab.com/sephalon/deathstar_lamp",290
"Scientists Develop Artificial Leaf, Uses Sunlight to Produce Valuable Chemicals","https://newscenter.lbl.gov/2025/04/24/scientists-develop-artificial-leaf-that-uses-sunlight-to-produce-valuable-chemicals/",290
"Virginia passes law to enforce maximum vehicle speeds for repeat speeders","https://www.fastcompany.com/91323835/virginia-will-use-technology-to-slow-chronic-speeders-cars-and-other-states-are-rushing-to-join-in",288
"I just want to code (2023)","https://www.zachbellay.com/daily/i-just-want-to-code/",287
"The True Size Of","https://thetruesize.com/",284
"MinC Is Not Cygwin","https://minc.commandlinerevolution.nl/english/home.html",284
"Third party cookies must be removed","https://w3ctag.github.io/web-without-3p-cookies/",282
"Boxie – an always offline audio player for my 3 year old","https://mariozechner.at/posts/2025-04-20-boxie/",282
"Programming languages should have a tree traversal primitive","https://blog.tylerglaiel.com/p/programming-languages-should-have",281
"Berkeley Humanoid Lite – Open-source robot","https://lite.berkeley-humanoid.org/",280
"GCC 15.1","https://gcc.gnu.org/gcc-15/",280
"Read the Obits","https://thereader.mitpress.mit.edu/the-creativity-hack-no-one-told-you-about-read-the-obits/",277
"Future of OSU Open Source Lab in Jeopardy","https://osuosl.org/blog/osl-future/",274
"Reverse geocoding is hard","https://shkspr.mobi/blog/2025/04/reverse-geocoding-is-hard/",273
"I should have loved biology too","https://nehalslearnings.substack.com/p/i-should-have-loved-biology-too",271
"Mike Waltz Accidentally Reveals App Govt Uses to Archive Signal Messages","https://www.404media.co/mike-waltz-accidentally-reveals-obscure-app-the-government-is-using-to-archive-signal-messages/",269
"Presentation Slides with Markdown","https://sli.dev",268
"Did 5G kill the IMSI catcher?","https://zetier.com/5g-imsi-catcher/",267
"Reproducibility project fails to validate dozens of biomedical studies","https://www.nature.com/articles/d41586-025-01266-x",267
"Running Qwen3 on your macbook, using MLX, to vibe code for free","https://localforge.dev/blog/running-qwen3-macbook-mlx",265
"Jagged AGI: o3, Gemini 2.5, and everything after","https://www.oneusefulthing.org/p/on-jagged-agi-o3-gemini-25-and-everything",265
"Linkwarden: FOSS self-hostable bookmarking with AI-tagging and page archival","https://linkwarden.app/",264
"Uncovering the mechanics of The Games: Winter Challenge","https://mrwint.github.io/winter/writeup/writeup.html",261
"How to program a text adventure in C","https://helderman.github.io/htpataic/htpataic01.html",261
"The Gang Has a Mid-Life Crisis","https://chris-martin.org/2025/the-gang-has-a-mid-life-crisis",259
"The coming knowledge-work supply-chain crisis","https://worksonmymachine.substack.com/p/the-coming-knowledge-work-supply",258
"Show HN: Node.js video tutorials where you can edit and run the code","item?id=43771365",258
"Open-source interactive C tutorial in the browser","https://www.learn-c.org/",256
"Google contract prevented Motorola from setting Perplexity as default assistant","https://www.bloomberg.com/news/articles/2025-04-23/perplexity-executive-says-google-blocked-motorola-s-use-of-ai-assistant",255
"Heart disease deaths worldwide linked to chemical widely used in plastics","https://medicalxpress.com/news/2025-04-heart-disease-deaths-worldwide-linked.html",254
"Shardines: SQLite3 Database-per-Tenant with ActiveRecord","https://blog.julik.nl/2025/04/a-can-of-shardines",253
"U.S. autism data project sparks uproar over ethics, privacy and intent","https://www.washingtonpost.com/health/2025/04/25/autism-registry-privacy-rfk-research/",253
"New Study: Waymo is reducing serious crashes and making streets safer","https://waymo.com/blog/2025/05/waymo-making-streets-safer-for-vru",252
"What If We Could Rebuild Kafka from Scratch?","https://www.morling.dev/blog/what-if-we-could-rebuild-kafka-from-scratch/",252
"World Emulation via Neural Network","https://madebyoll.in/posts/world_emulation_via_dnn/",250
"Mobygratis – Free Moby music to empower your creative projects","https://mobygratis.com/",249
"An interview question that will protect you from North Korean fake workers","https://www.theregister.com/2025/04/29/north_korea_worker_interview_questions/",246
"Congress passes Take It Down act despite major flaws","https://www.eff.org/deeplinks/2025/04/congress-passes-take-it-down-act-despite-major-flaws",246
"Found a simple tool for database modeling: dbdiagram.io","https://dbdiagram.io",244
"Show HN: A pure WebGL image editor with filters, crop and perspective correction","https://github.com/xdadda/mini-photo-editor",241
"Espressif's ESP32-C5 Is Now in Mass Production","https://www.espressif.com/en/news/ESP32-C5_Mass_Production",239
"Secret Deals, Foreign Investments: The Rise of Trump’s Crypto Firm","https://www.nytimes.com/2025/04/29/us/politics/trump-crypto-world-liberty-financial.html",239
"Astronomers confirm the existence of a lone black hole","https://phys.org/news/2025-04-astronomers-lone-black-hole.html",239
"Anubis saved our websites from a DDoS attack","https://fabulous.systems/posts/2025/05/anubis-saved-our-websites-from-a-ddos-attack/",237
"Chongqing, the Largest City – In Pictures","https://www.theguardian.com/world/gallery/2025/apr/27/chongqing-the-worlds-largest-city-in-pictures",234
"Assignment 5: Cars and Key Fobs (2021)","https://web.stanford.edu/class/ee26n/Assignments/Assignment5.html",233
"How encryption for Cinema Movies works","https://serverless.industries/2024/05/31/digital-cinema.en.html",230
"Bare metal printf – C standard library without OS","https://popovicu.com/posts/bare-metal-printf/",228
"Linux Kernel Exploitation: Attack of the Vsock","https://hoefler.dev/articles/vsock.html",227
"When ChatGPT broke the field of NLP: An oral history","https://www.quantamagazine.org/when-chatgpt-broke-an-entire-field-an-oral-history-20250430/",226
"Oxide’s compensation model: how is it going?","https://oxide.computer/blog/oxides-compensation-model-how-is-it-going",223
"JetBrains defends removal of negative reviews for unpopular AI Assistant","https://devclass.com/2025/04/30/jetbrains-defends-removal-of-negative-reviews-for-unpopular-ai-assistant/",223
"The Brief Origins of May Day","https://archive.iww.org/history/library/misc/origins_of_mayday/",222
"I Tried to Buy an Actual Barrel of Crude Oil (2015)","https://www.bloomberg.com/news/articles/2015-11-03/that-time-i-tried-to-buy-some-crude-oil",220
"Parallel ./configure","https://tavianator.com/2025/configure.html",219
"Reports of the death of California High-Speed Rail have been greatly exaggerated","https://asteriskmag.com/issues/10/reports-of-the-death-of-california-high-speed-rail-have-been-greatly-exaggerated",218
"My sourdough starter has twins","https://brainbaking.com/post/2025/04/my-sourdough-starter-has-twins/",212
"Everything we announced at our first LlamaCon","https://ai.meta.com/blog/llamacon-llama-news/?_fb_noscript=1",211
"LLMs can see and hear without any training","https://github.com/facebookresearch/MILS",210
"Bamba: An open-source LLM that crosses a transformer with an SSM","https://research.ibm.com/blog/bamba-ssm-transformer-model",206
"ZFS: Apple's new filesystem that wasn't (2016)","https://ahl.dtrace.org/2016/06/15/apple_and_zfs/",204
"Running Clojure in WASM with GraalVM","https://romanliutikov.com/blog/running-clojure-in-wasm",200
"Show HN: Morphik – Open-source RAG that understands PDF images, runs locally","https://github.com/morphik-org/morphik-core",200
"Abusing DuckDB-WASM by making SQL draw 3D graphics (Sort Of)","https://www.hey.earth/posts/duckdb-doom",200
"101 BASIC Computer Games","https://github.com/maurymarkowitz/101-BASIC-Computer-Games",195
"TmuxAI: AI-Powered, Non-Intrusive Terminal Assistant","https://tmuxai.dev/",194
"Find the Odd Disk","https://colors2.alessandroroussel.com/",192
"The Joy of Linux Theming in the Age of Bootable Containers","https://blues.win/posts/joy-of-linux-theming/",192
"Show HN: Sim Studio – Open-Source Agent Workflow GUI","https://github.com/simstudioai/sim",191
"Joining Sun Microsystems – 40 years ago (2022)","https://akapugs.blog/2022/05/03/674/",188
"Show HN: Formalizing Principia Mathematica using Lean","https://github.com/ndrwnaguib/principia",188
"Are polynomial features the root of all evil? (2024)","https://alexshtf.github.io/2024/01/21/Bernstein.html",188
"Zhaoxin's KX-7000","https://chipsandcheese.com/p/zhaoxins-kx-7000",186
"Cheating the Reaper in Go","https://mcyoung.xyz/2025/04/21/go-arenas/",186
"The raccoons who made computer magazine ads great","https://technologizer.com/home/2025/04/22/pc-connection-ads-raccoons/",185
"Linux in Excel","https://github.com/NSG650/LinuxInExcel",184
"Launch HN: Magic Patterns (YC W23) – AI Design and Prototyping for Product Teams","item?id=43752176",184
"Ping, You've Got Whale: AI detection system alerts ships of whales in their path","https://www.biographic.com/ping-youve-got-whale/",179
"How to build Intrinsic Motivation: a review of the science","https://erringtowardsanswers.substack.com/p/intrinsic-motivation",178
"π0.5: A VLA with open-world generalization","https://pi.website/blog/pi05",177
"Show HN: Magnitude – open-source, AI-native test framework for web apps","https://github.com/magnitudedev/magnitude",177
"The Leaderboard Illusion","https://arxiv.org/abs/2504.20879",176
"Show HN: I open-sourced my AI toy company that runs on ESP32 and OpenAI realtime","https://github.com/akdeb/ElatoAI",176
"New material gives copper superalloy-like strength","https://news.lehigh.edu/new-material-gives-copper-superalloy-like-strength-0",175
"Hyperwood – Open-Source Furniture","https://hyperwood.org/",175
"A M.2 HDMI capture card","https://interfacinglinux.com/2025/04/18/magewell-eco-m-2-hdmi-capture-card/",175
"Sigbovik Conference Proceedings 2025 [pdf]","https://sigbovik.org/2025/proceedings.pdf",174
"What It Takes to Defend a Cybersecurity Company from Today's Adversaries","https://www.sentinelone.com/labs/top-tier-target-what-it-takes-to-defend-a-cybersecurity-company-from-todays-adversaries/",172
"Show HN: Flowcode – Turing-complete visual programming platform","https://app.getflowcode.io/playground/example1",172
"Launch HN: Cua (YC X25) – Open-Source Docker Container for Computer-Use Agents","https://github.com/trycua/cua",172
"Dear "Security Researchers"","https://ftp.bit.nl/pub/debian/",172
"Curry: A functional logic programming language","https://curry-lang.org/",172
"Duolingo will replace contract workers with AI","https://www.theverge.com/news/657594/duolingo-ai-first-replace-contract-workers",171
"Show HN: Roons – Mechanical Computer Kit","https://whomtech.com/show-hn/",170
"It's School time: Adventures in hacking an old Kindle","https://samkhawase.com/blog/hacking-kindle/",170
"Amazon Japan ordered to pay 35M. yen for allowing listing of fakes","https://mainichi.jp/english/articles/20250425/p2g/00m/0bu/047000c",170
"I Found Malware in a BeamNG Mod","https://lemonyte.com/blog/beamng-malware",169
"Wyze pays $255k of tariffs on $167k of floodlights","https://twitter.com/WyzeCam/status/1917662183036706849",168
"Anatomy of a SQL Engine","https://www.dolthub.com/blog/2025-04-25-sql-engine-anatomy/",167
"Prolog Adventure Game","https://github.com/stefanrodrigues2/Prolog-Adventure-game",166
"What Is "Induced Atmospheric Vibration"?","https://physics.stackexchange.com/questions/848666/what-is-induced-atmospheric-vibration",165
"Julia Parsons, U.S. Navy Code Breaker During World War II, Dies at 104","https://www.nytimes.com/2025/04/30/world/julia-parsons-dead.html",165
"Tiny Emulators","https://floooh.github.io/tiny8bit/",165
"Arizona laptop farmer pleads guilty for funneling $17M to Kim Jong Un","https://www.theregister.com/2025/02/12/arizona_woman_laptop_farm_guilty/",164
"ArkFlow: High-performance Rust stream processing engine","https://github.com/arkflow-rs/arkflow",164
"Vanguard 50-year anniversary CEO letter","https://corporate.vanguard.com/content/corporatesite/us/en/corp/articles/of-investor-by-investor-for-investor-since-1975.html",162
"Ask HN: Who is hiring? (May 2025)","item?id=43858554",161
"Reversible computing with mechanical links and pivots","https://tennysontbardwell.com/blog/2025/04/30/mechanical-computing/index.html",161
"Show HN: Rowboat – Open-source IDE for multi-agent systems","https://github.com/rowboatlabs/rowboat",161
"Deno's Decline","https://dbushell.com/2025/04/28/denos-decline/",158
"China's Clinical Trial Boom","https://www.asimov.press/p/china-trials",158
"Verus: Verified Rust for low-level systems code","https://github.com/secure-foundations/verus",158
"More Everything Forever","https://www.nytimes.com/2025/04/23/books/review/more-everything-forever-adam-becker.html",157
"Stuffed-Na(a)N: stuff your NaNs","https://github.com/si14/stuffed-naan-js",154
"Fundamental flaws of SIMD ISAs (2021)","https://www.bitsnbites.eu/three-fundamental-flaws-of-simd/",153
"A Visual Journey Through Async Rust","https://github.com/alexpusch/rust-magic-patterns/blob/master/visual-journey-through-async-rust/Readme.md",151
"BART's Anime Mascots","https://www.bart.gov/news/fun/anime",150
"Dopamine signals when a fear can be forgotten","https://picower.mit.edu/news/dopamine-signals-when-fear-can-be-forgotten",148
"The group chats that changed America","https://www.semafor.com/article/04/27/2025/the-group-chats-that-changed-america",148
