title,link,score
"An AI agent published a hit piece on me","https://theshamblog.com/an-ai-agent-published-a-hit-piece-on-me/",2323
"Fix the iOS keyboard before the timer hits zero or I'm switching back to Android","https://ios-countdown.win/",1606
"uBlock filter list to hide all YouTube Shorts","https://github.com/i5heu/ublock-hide-yt-shorts/",1131
"Claude Code is being dumbed down?","https://symmetrybreak.ing/blog/claude-code-is-being-dumbed-down/",1077
"Gemini 3 Deep Think","https://blog.google/innovation-and-ai/models-and-research/gemini-models/gemini-3-deep-think/",1073
"Warcraft III Peon Voice Notifications for Claude Code","https://github.com/tonyyont/peon-ping",1002
"I’m joining OpenAI","https://steipete.me/posts/2026/openclaw",984
"EU bans the destruction of unsold apparel, clothing, accessories and footwear","https://environment.ec.europa.eu/news/new-eu-rules-stop-destruction-unsold-clothes-and-shoes-2026-02-09_en",958
"Discord/Twitch/Snapchat age verification bypass","https://age-verifier.kibty.town/",950
"AI agent opens a PR write a blogpost to shames the maintainer who closes it","https://github.com/matplotlib/matplotlib/pull/31132",945
"I love the work of the ArchWiki maintainers","https://k7r.eu/i-love-the-work-of-the-archwiki-maintainers/",898
"GPT‑5.3‑Codex‑Spark","https://openai.com/index/introducing-gpt-5-3-codex-spark/",887
"Resizing windows on macOS Tahoe – the saga continues","https://noheger.at/blog/2026/02/12/resizing-windows-on-macos-tahoe-the-saga-continues/",871
"Monosketch","https://monosketch.io/",860
"Amazon's Ring and Google's Nest reveal the severity of U.S. surveillance state","https://greenwald.substack.com/p/amazons-ring-and-googles-nest-unwittingly",823
"Improving 15 LLMs at Coding in One Afternoon. Only the Harness Changed","http://blog.can.ac/2026/02/12/the-harness-problem/",819
"Windows Notepad App Remote Code Execution Vulnerability","https://www.cve.org/CVERecord?id=CVE-2026-20841",803
"The EU moves to kill infinite scrolling","https://www.politico.eu/article/tiktok-meta-facebook-instagram-brussels-kill-infinite-scrolling/",773
"An AI agent published a hit piece on me – more things have happened","https://theshamblog.com/an-ai-agent-published-a-hit-piece-on-me-part-2/",741
"I fixed Windows native development","https://marler8997.github.io/blog/fixed-windows/",728
"ai;dr","https://www.0xsid.com/blog/aidr",713
"Amazon Ring's lost dog ad sparks backlash amid fears of mass surveillance","https://www.theverge.com/tech/876866/ring-search-party-super-bowl-ad-online-backlash",676
"Babylon 5 is now free to watch on YouTube","https://cordcuttersnews.com/babylon-5-is-now-free-to-watch-on-youtube/",635
"Major European payment processor can't send email to Google Workspace users","https://atha.io/blog/2026-02-12-viva",606
"My smart sleep mask broadcasts users' brainwaves to an open MQTT broker","https://aimilios.bearblog.dev/reverse-engineering-sleep-mask/",599
"OpenAI has deleted the word 'safely' from its mission","https://theconversation.com/openai-has-deleted-the-word-safely-from-its-mission-and-its-new-structure-is-a-test-for-whether-ai-serves-society-or-shareholders-274467",599
"Ooh.directory: a place to find good blogs that interest you","https://ooh.directory/",587
"Ring cancels its partnership with Flock Safety after surveillance backlash","https://www.theverge.com/news/878447/ring-flock-partnership-canceled",584
"GPT-5.2 derives a new result in theoretical physics","https://openai.com/index/new-result-theoretical-physics/",571
"News publishers limit Internet Archive access due to AI scraping concerns","https://www.niemanlab.org/2026/01/news-publishers-limit-internet-archive-access-due-to-ai-scraping-concerns/",556
"Fluorite – A console-grade game engine fully integrated with Flutter","https://fluorite.game/",535
"Tell HN: Ralph Giles has died (Xiph.org| Rust@Mozilla | Ghostscript)","item?id=46996490",511
"Ireland rolls out basic income scheme for artists","https://www.reuters.com/world/ireland-rolls-out-pioneering-basic-income-scheme-artists-2026-02-10/",504
"MinIO repository is no longer maintained","https://github.com/minio/minio/commit/7aac2a2c5b7c882e68c1ce017d8256be2feea27f",495
"Oat – Ultra-lightweight, zero dependency, semantic HTML, CSS, JS UI library","https://oat.ink/",494
"Skip the Tips: A game to select "No Tip" but dark patterns try to stop you","https://skipthe.tips/",487
"GLM-5: Targeting complex systems engineering and long-horizon agentic tasks","https://z.ai/blog/glm-5",481
"Chrome extensions spying on users' browsing data","https://qcontinuum.substack.com/p/spying-chrome-extensions-287-extensions-495",471
"Modern CSS Code Snippets: Stop writing CSS like it's 2015","https://modern-css.com",447
"Anthropic raises $30B in Series G funding at $380B post-money valuation","https://www.anthropic.com/news/anthropic-raises-30-billion-series-g-funding-380-billion-post-money-valuation",439
"Vim 9.2","https://www.vim.org/vim-9.2-released.php",418
"Ring owners are returning their cameras","https://www.msn.com/en-us/lifestyle/shopping/ring-owners-are-returning-their-cameras-here-s-how-much-you-can-get/ar-AA1W8Qa3",415
"Breaking the spell of vibe coding","https://www.fast.ai/posts/2026-01-28-dark-flow/",410
"Hideki Sato, designer of all Sega's consoles, has died","https://www.videogameschronicle.com/news/hideki-sato-designer-of-segas-consoles-dies-age-75/",397
"I want to wash my car. The car wash is 50 meters away. Should I walk or drive?","https://mastodon.world/@knowmadd/116072773118828295",393
"US businesses and consumers pay 90% of tariff costs, New York Fed says","https://www.ft.com/content/c4f886a1-1633-418c-b6b5-16f700f8bb0d",369
"IBM tripling entry-level jobs after finding the limits of AI adoption","https://fortune.com/2026/02/13/tech-giant-ibm-tripling-gen-z-entry-level-hiring-according-to-chro-rewriting-jobs-ai-era/",366
"Zig – io_uring and Grand Central Dispatch std.Io implementations landed","https://ziglang.org/devlog/2026/#2026-02-13",365
"Officials Claim Drone Incursion Led to Shutdown of El Paso Airport","https://www.nytimes.com/2026/02/11/us/faa-el-paso-flight-restrictions.html",365
"Homeland Security Wants Social Media Sites to Expose Anti-ICE Accounts","https://www.nytimes.com/2026/02/13/technology/dhs-anti-ice-social-media.html",355
"LT6502: A 6502-based homebrew laptop","https://github.com/TechPaula/LT6502",351
"I'm not worried about AI job loss","https://davidoks.blog/p/why-im-not-worried-about-ai-job-loss",347
"The risk of a hothouse Earth trajectory","https://www.cell.com/one-earth/fulltext/S2590-3322%2825%2900391-4",344
"Polis: Open-source platform for large-scale civic deliberation","https://pol.is/home2",340
"Lena by qntm (2021)","https://qntm.org/mmacevedo",337
"NetNewsWire Turns 23","https://netnewswire.blog/2026/02/11/netnewswire-turns.html",336
"Flashpoint Archive – Over 200k web games and animations preserved","https://flashpointarchive.org",334
"NewPipe: YouTube client without vertical videos and algorithmic feed","https://newpipe.net/",331
"Zed editor switching graphics lib from blade to wgpu","https://github.com/zed-industries/zed/pull/46758",315
"Welcoming Discord users amidst the challenge of Age Verification","https://matrix.org/blog/2026/02/welcome-discord/",312
"GPT-5 outperforms federal judges in legal reasoning experiment","https://papers.ssrn.com/sol3/papers.cfm?abstract_id=6155012",310
"Descent, ported to the web","https://mrdoob.github.io/three-descent/",306
"Instagram's URL Blackhole","https://medium.com/@shredlife/instagrams-url-blackhole-c1733e081664",304
"Building a TUI is easy now","https://hatchet.run/blog/tuis-are-easy-now",300
"AWS Adds support for nested virtualization","https://github.com/aws/aws-sdk-go-v2/commit/3dca5e45d5ad05460b93410087833cbaa624754e",300
"Beginning fully autonomous operations with the 6th-generation Waymo driver","https://waymo.com/blog/2026/02/ro-on-6th-gen-waymo-driver",296
"Platforms bend over backward to help DHS censor ICE critics, advocates say","https://arstechnica.com/tech-policy/2026/02/platforms-bend-over-backward-to-help-dhs-censor-ice-critics-advocates-say/",293
"Palantir Gets Millions of Dollars from New York City's Public Hospitals","https://theintercept.com/2026/02/15/palantir-contract-new-york-city-health-hospitals/",281
"CBP signs Clearview AI deal to use face recognition for 'tactical targeting'","https://www.wired.com/story/cbp-signs-clearview-ai-deal-to-use-face-recognition-for-tactical-targeting/",274
"Magnus Carlsen Wins the Freestyle (Chess960) World Championship","https://www.fide.com/magnus-carlsen-wins-2026-fide-freestyle-world-championship/",270
"How to make a living as an artist","https://essays.fnnch.com/make-a-living",269
"Apple patches decade-old iOS zero-day, possibly exploited by commercial spyware","https://www.theregister.com/2026/02/12/apple_ios_263/",263
"Carl Sagan's Baloney Detection Kit: Tools for Thinking Critically (2025)","https://www.openculture.com/2025/09/the-carl-sagan-baloney-detection-kit.html",260
"Apache Arrow is 10 years old","https://arrow.apache.org/blog/2026/02/12/arrow-anniversary/",258
"Show HN: Data Engineering Book – An open source, community-driven guide","https://github.com/datascale-ai/data_engineering_book/blob/main/README_en.md",246
"Communities are not fungible","https://www.joanwestenberg.com/communities-are-not-fungible/",245
"OpenAI should build Slack","https://www.latent.space/p/ainews-why-openai-should-build-slack",244
"The "AI agent hit piece" situation clarifies how dumb we are acting","https://ardentperf.com/2026/02/13/the-scott-shambaugh-situation-clarifies-how-dumb-we-are-acting/",244
"Oh, good: Discord's age verification rollout has ties to Palantir co-founder","https://www.pcgamer.com/software/platforms/oh-good-discords-age-verification-rollout-has-ties-to-palantir-co-founder-and-panopticon-architect-peter-thiel/",241
"Editor's Note: Retraction of article containing fabricated quotations","https://arstechnica.com/staff/2026/02/editors-note-retraction-of-article-containing-fabricated-quotations/",234
"ICE, CBP Knew Facial Recognition App Couldn't Do What DHS Says It Could","https://www.techdirt.com/2026/02/12/ice-cbp-knew-facial-recognition-app-couldnt-do-what-dhs-says-it-could-deployed-it-anyway/",230
"Show HN: SQL-tap – Real-time SQL traffic viewer for PostgreSQL and MySQL","https://github.com/mickamy/sql-tap",228
"Do not apologize for replying late to my email","https://ploum.net/2026-02-11-do_not_apologize_for_replying_to_my_email.html",228
"Show HN: Sameshi – a ~1200 Elo chess engine that fits within 2KB","https://github.com/datavorous/sameshi",227
"Gwtar: A static efficient single-file HTML format","https://gwern.net/gwtar",226
"Palantir vs. the "Republik": US analytics firm takes magazine to court","https://www.heise.de/en/news/Palantir-vs-the-Republik-US-analytics-firm-takes-magazine-to-court-11176508.html",226
"You can't trust the internet anymore","https://nicole.express/2026/not-my-casual-hobby.html",226
"Open source is not about you (2018)","https://gist.github.com/richhickey/1563cddea1002958f96e7ba9519972d9",225
"Zvec: A lightweight, fast, in-process vector database","https://github.com/alibaba/zvec",216
"Discord distances from age verification firm after ties to Peter Thiel surface","https://kotaku.com/discord-palantir-peter-thiel-persona-age-verification-2000668951",215
"D Programming Language","https://dlang.org/",214
"YouTube as Storage","https://github.com/PulseBeat02/yt-media-storage",213
"U.S. had almost no job growth in 2025","https://www.nbcnews.com/business/economy/january-jobs-revisions-trump-rcna258398",206
"MiniMax M2.5 released: 80.2% in SWE-bench Verified","https://www.minimax.io/news/minimax-m25",204
"CSS-Doodle","https://css-doodle.com/",200
"Paragon accidentally uploaded a photo of its spyware control panel","https://twitter.com/DrWhax/status/2021608609595945442",198
"Audio is the one area small labs are winning","https://www.amplifypartners.com/blog-posts/arming-the-rebels-with-gpus-gradium-kyutai-and-audio-ai",192
"A party balloon shut down El Paso International Airport; estimated cost –$573k","https://log.jasongodfrey.info/questions/The-Most-Expensive-Party-Balloon-in-History",192
"So many trees planted in Taklamakan Desert that it's turned into a carbon sink","https://www.livescience.com/planet-earth/plants/china-has-planted-so-many-trees-around-the-taklamakan-desert-that-its-turned-this-biological-void-into-a-carbon-sink",188
"Two different tricks for fast LLM inference","https://www.seangoedecke.com/fast-llm-inference/",185
"7zip.com Is Serving Malware","https://www.malwarebytes.com/blog/threat-intel/2026/02/fake-7-zip-downloads-are-turning-home-pcs-into-proxy-nodes",183
"Show HN: Microgpt is a GPT you can visualize in the browser","https://microgpt.boratto.ca",177
"I gave Claude access to my pen plotter","https://harmonique.one/posts/i-gave-claude-access-to-my-pen-plotter",173
"America's Cyber Defense Agency Is Burning Down and Nobody's Coming to Put It Out","https://www.threathunter.ai/blog/americas-cyber-defense-agency-burning-down/",170
"Discord just killed anonymity","https://michael-dev-tech.github.io/Website/matrix.html",167
"Reports of Telnet's death have been greatly exaggerated","https://www.terracenetworks.com/blog/2026-02-11-telnet-routing",165
"Backblaze Drive Stats for 2025","https://www.backblaze.com/blog/backblaze-drive-stats-for-2025/",164
"A brief history of barbed wire fence telephone networks (2024)","https://loriemerson.net/2024/08/31/a-brief-history-of-barbed-wire-fence-telephone-networks/",163
"US repeals EPA endangerment finding for greenhouse gases","https://www.cnn.com/2026/02/12/climate/trump-repeals-epa-endangerment-finding",163
"Common Lisp Screenshots: today's CL applications in action","http://www.lisp-screenshots.org",161
"TikTok is tracking you, even if you don't use the app","https://www.bbc.com/future/article/20260210-tiktok-is-tracking-you-even-if-you-dont-use-the-app-heres-how-to-stop-it",161
"Age of Empires: 25 years of pathfinding problems with C++ [video]","https://www.youtube.com/watch?v=lEBQveBCtKY",160
"Amsterdam Compiler Kit","https://github.com/davidgiven/ack",158
"How did the Maya survive?","https://www.theguardian.com/news/2026/feb/12/apocalypse-no-how-almost-everything-we-thought-we-knew-about-the-maya-is-wrong",158
"Real-time PathTracing with global illumination in WebGL","https://erichlof.github.io/THREE.js-PathTracing-Renderer/",155
"Audiophiles can't distinguish audio sent through copper, banana or mud","https://www.tomshardware.com/speakers/in-a-blind-test-audiophiles-couldnt-tell-the-difference-between-audio-signals-sent-through-copper-wire-a-banana-or-wet-mud-the-mud-should-sound-perfectly-awful-but-it-doesnt-notes-the-experiment-creator",155
"Run Pebble OS in Browser via WASM","https://ericmigi.github.io/pebble-qemu-wasm/",153
"How often do full-body MRIs find cancer?","https://www.usatoday.com/story/life/health-wellness/2026/02/11/full-body-mris-cancer-aneurysm/88396037007/",152
"NPMX – a fast, modern browser for the NPM registry","https://npmx.dev",151
"The "Crown of Nobles" Noble Gas Tube Display (2024)","https://theshamblog.com/the-crown-of-nobles-noble-gas-tube-display/",151
"The wonder of modern drywall","https://www.worksinprogress.news/p/the-wonder-of-modern-drywall",150
"iOS 26.3 and macOS 26.3 Fix Dozens of Vulnerabilities, Including Zero-Day","https://www.macrumors.com/2026/02/11/ios-26-3-security-vulnerabilities/",150
"US labels SpaceX a common carrier by air, will regulate firm under railway law","https://arstechnica.com/tech-policy/2026/02/victory-for-elon-musk-us-labor-board-abandons-authority-over-spacex/",149
"Culture Is the Mass-Synchronization of Framings","https://aethermug.com/posts/culture-is-the-mass-synchronization-of-framings",148
"Launch HN: Omnara (YC S25) – Run Claude Code and Codex from anywhere","item?id=46991591",147
"Launch HN: Omnara (YC S25) – Run Claude Code and Codex from anywhere","item?id=46991591",147
"Show HN: Geo Racers – Race from London to Tokyo on a single bus pass","https://geo-racers.com/",147
"Radio host David Greene says Google's NotebookLM tool stole his voice","https://www.washingtonpost.com/technology/2026/02/15/david-greene-google-ai-podcast/",146
"Peter Thiel: 2,436 emails with Epstein from 2014 to 2019","https://jmail.world/wiki/peter-thiel",146
"WolfSSL sucks too, so now what?","https://blog.feld.me/posts/2026/02/wolfssl-sucks-too/",145
"The Future for Tyr, a Rust GPU Driver for Arm Mali Hardware","https://lwn.net/Articles/1055590/",139
"Exposure Simulator","http://www.andersenimages.com/tutorials/exposure-simulator/",139
"Byte magazine artist Robert Tinney, who illustrated the birth of PCs, dies at 78","https://arstechnica.com/gadgets/2026/02/byte-magazine-artist-robert-tinney-who-illustrated-the-birth-of-pcs-dies-at-78/",139
"Show HN: Knock-Knock.net – Visualizing the bots knocking on my server's door","https://knock-knock.net",137
"Apple's latest attempt to launch the new Siri runs into snags","https://www.bloomberg.com/news/articles/2026-02-11/apple-s-ios-26-4-siri-update-runs-into-snags-in-internal-testing-ios-26-5-27",136
"Show HN: Skill that lets Claude Code/Codex spin up VMs and GPUs","https://cloudrouter.dev/",135
"Gemini 3 Deep Think drew me a good SVG of a pelican riding a bicycle","https://simonwillison.net/2026/Feb/12/gemini-3-deep-think/",132
"Rari – Rust-powered React framework","https://rari.build/",132
"AI-First Company Memos","https://the-ai-native.company/",132
"I spent two days gigging at RentAHuman and didn't make a single cent","https://www.wired.com/story/i-tried-rentahuman-ai-agents-hired-me-to-hype-their-ai-startups/",130
"State Attorneys General Want to Tie Online Access to ID","https://reclaimthenet.org/40-attorneys-general-back-ids-online-safety-act",129
"Inside Epstein’s network: what 1.4M emails reveal","https://www.economist.com/interactive/international/2026/02/12/inside-epsteins-network",128
"Microwave Oven Failure: Spontaneously turned on by its LED display (2024)","https://blog.stuffedcow.net/2024/06/microwave-failure-spontaneously-turns-on/",127
"Covering electricity price increases from our data centers","https://www.anthropic.com/news/covering-electricity-price-increases",127
"The consequences of task switching in supervisory programming","https://martinfowler.com/fragments/2026-02-13.html",125
"Lines of Code Are Back (and It's Worse Than Before)","https://www.thepragmaticcto.com/p/lines-of-code-are-back-and-its-worse",125
"How Did the FBI Get Nancy Guthrie's Nest Doorbell Footage?","https://lifehacker.com/tech/how-did-the-fbi-get-nancy-guthries-doorbell-footage",125
"Show HN: Moltis – AI assistant with memory, tools, and self-extending skills","https://www.moltis.org",123
"Show HN: Off Grid – Run AI text, image gen, vision offline on your phone","https://github.com/alichherawalla/off-grid-mobile",119
"AI is going to kill app subscriptions","https://nichehunt.app/blog/ai-going-to-kill-app-subscriptions",116
"A practical guide to observing the night sky for real skies and real equipment","https://stargazingbuddy.com/",116
"Fixing retail with land value capture","https://worksinprogress.co/issue/fixing-retail-with-land-value-capture/",115
"How to Have a Bad Career – David Patterson (2016) [video]","https://www.youtube.com/watch?v=Rn1w4MRHIhc",114
"Trump revokes landmark ruling that greenhouse gases endanger public health","https://www.bbc.com/news/articles/cn0zdd7yl4vo",114
"Something Big Is Happening","https://shumer.dev/something-big-is-happening",113
"Dario Amodei – "We are near the end of the exponential" [video]","https://www.dwarkesh.com/p/dario-amodei-2",113
"Reversed engineered game Starflight (1986)","https://github.com/s-macke/starflight-reverse",110
"How many registers does an x86-64 CPU have? (2020)","https://blog.yossarian.net/2020/11/30/How-many-registers-does-an-x86-64-cpu-have",110
"Shut Up: Comment Blocker","https://rickyromero.com/shutup/",108
"Hologram v0.7.0: Milestone release for Elixir-to-JavaScript porting initiative","https://hologram.page/blog/porting-initiative-delivers-hologram-v0-7-0",107
"A Cosmic Miracle: A Remarkably Luminous Galaxy at z=14.44 Confirmed with JWST","https://astro.theoj.org/article/156033-a-cosmic-miracle-a-remarkably-luminous-galaxy-at-_z_-sub-spec-sub-14-44-confirmed-with-jwst",107
"The missing digit of Stela C","https://johncarlosbaez.wordpress.com/2026/02/12/stela-c/",105
"What dating apps are optimizing","https://phys.org/news/2026-02-dating-apps-optimizing-hint-isnt.html",105
"A review of M Disc archival capability with long term testing results (2016)","http://www.microscopy-uk.org.uk/mag/artsep16/mol-mdisc-review.html",104
"Pocketblue – Fedora Atomic for mobile devices","https://github.com/pocketblue/pocketblue",99
"Flood Fill vs. The Magic Circle","https://www.robinsloan.com/winter-garden/magic-circle/",98
"Towards Autonomous Mathematics Research","https://arxiv.org/abs/2602.10177",96
"Recoverable and Irrecoverable Decisions","https://herbertlui.net/recoverable-and-irrecoverable-decisions/",95
"Interference Pattern Formed in a Finger Gap Is Not Single Slit Diffraction","https://note.com/hydraenids/n/nbe89030deaba",92
"Guitars of the USSR and the Jolana Special in Azerbaijani Music (2012)","https://caucascapades.wordpress.com/2012/06/14/guitars-of-the-ussr-and-the-jolana-special-in-azerbaijani-music/",90
"65 Lines of Markdown, a Claude Code Sensation","https://tildeweb.nl/~michiel/65-lines-of-markdown-a-claude-code-sensation.html",90
"Pink noise reduces REM sleep and may harm sleep quality","https://www.pennmedicine.org/news/pink-noise-reduces-rem-sleep-and-may-harm-sleep-quality",89
"Russia killed opposition leader Alexei Navalny using dart frog toxin, UK says","https://www.bbc.com/news/articles/cwyk4lz4e3eo",89
"Show HN: Arcmark – macOS bookmark manager that attaches to browser as sidebar","https://github.com/Geek-1001/arcmark",88
"1940s Irish sci-fi novel features early mecha and gravity assists","https://github.com/cavedave/Manannan",87
"A header-only C vector database library","https://github.com/abdimoallim/vdb",87
"Railway (PaaS) global outage","https://status.railway.com",86
"Q&A: New UK onshore wind and solar is '50% cheaper' than new gas","https://www.carbonbrief.org/qa-new-uk-onshore-wind-and-solar-is-50-cheaper-than-new-gas/",84
"GNU Pies – Program Invocation and Execution Supervisor","https://www.gnu.org.ua/software/pies/",83
"Show HN: VOOG – Moog-style polyphonic synthesizer in Python with tkinter GUI","https://github.com/gpasquero/voog",83
"New Nick Bostrom Paper: Optimal Timing for Superintelligence [pdf]","https://nickbostrom.com/optimal.pdf",83
"Realfood.gov includes a Grok search box","https://realfood.gov/#answers",83
"Kimi Claw","https://www.kimi.com/bot",82
"SCM as a database for the code","https://gist.github.com/gritzko/6e81b5391eacb585ae207f5e634db07e",81
"DjVu and its connection to Deep Learning (2023)","https://scottlocklin.wordpress.com/2023/05/31/djvu-and-its-connection-to-deep-learning/",80
"Why I don't think AGI is imminent","https://dlants.me/agi-not-imminent.html",79
"Show HN: CodeRLM – Tree-sitter-backed code indexing for LLM agents","https://github.com/JaredStewart/coderlm/blob/main/server/REPL_to_API.md",79
"Evolving Git for the Next Decade","https://lwn.net/SubscriberLink/1057561/bddc1e61152fadf6/",77
"Should your developer company go open source?","https://extremefoundership.substack.com/p/should-your-developer-company-go",75
"Discord Voluntarily Pushes Mandatory Age Verification Despite Recent Data Breach","https://www.eff.org/deeplinks/2026/02/discord-voluntarily-pushes-mandatory-age-verification-despite-recent-data-breach",75
"Mamdani Hires Lisa Gelobter as Chief Tech Officer","https://www.nytimes.com/2026/02/10/nyregion/mamdani-lisa-gelobter-gif.html",75
"Discord: A case study in performance optimization","https://newsletter.fullstack.zip/p/discord-a-case-study-in-performance",74
"Ask HN: Why are electronics still so unrecyclable?","item?id=46975933",74
"JavaScript-heavy approaches are not compatible with long-term performance goals","https://sgom.es/posts/2026-02-13-js-heavy-approaches-are-not-compatible-with-long-term-performance-goals/",73
"Arm wants a bigger slice of the chip business","https://www.economist.com/business/2026/02/12/arm-wants-a-bigger-slice-of-the-chip-business",70
"Error payloads in Zig","https://srcreigh.ca/posts/error-payloads-in-zig/",70
"Dune II written in HTML5/JS","https://github.com/oklemenz/Dune2JS",70
"An Enslaved Gardener Transformed the Pecan into a Cash Crop","https://lithub.com/how-an-enslaved-gardener-transformed-the-pecan-into-a-cash-crop/",69
"Unicorn Jelly","https://unicornjelly.com/",66
"Show HN: Pangolin: Open-source identity-based VPN (Twingate/Zscaler alternative)","https://github.com/fosrl/pangolin",65
"Court orders Acer and Asus to stop selling PCs in Germany over H.265 patents","https://videocardz.com/newz/acer-and-asus-are-now-banned-from-selling-pcs-and-laptops-in-germany-following-nokia-hevc-patent-ruling",65
"Launching Interop 2026","https://hacks.mozilla.org/2026/02/launching-interop-2026/",65
"Show HN: Triclock – A Triangular Clock","https://triclock.franzai.com/",65
"Show HN: Agent Alcove – Claude, GPT, and Gemini debate across forums","https://agentalcove.ai",64
"Most Americans don’t pay for news and don’t think they need to","https://www.niemanlab.org/2026/02/most-americans-dont-pay-for-news-and-dont-think-they-need-to/",64
"Components will kill pages","https://bitsandbytes.dev/posts/components-will-kill-pages",63
"Shingles Vaccine Linked to Slower Biological Aging in Older Adults","https://gero.usc.edu/2026/01/19/shingles-vaccine-slower-biological-aging/",62
"Show HN: Copy-and-patch compiler for hard real-time Python","https://github.com/Nonannet/copapy",62
