title,link,score
"The length of file names in early Unix","https://utcc.utoronto.ca/~cks/space/blog/unix/UnixEarlyFilenameLenghts",13
"Show HN: Embedo – Word Equation Puzzle Game","item?id=44061028",13
"Gamers Are Making EA, Take-Two and CDPR Scared to Use AI","https://www.forbes.com/sites/paultassi/2025/05/24/gamers-are-making-ea-take-two-and-cdpr-scared-to-use-ai/",13
"Initial support for calling Mojo from Python","https://forum.modular.com/t/initial-support-for-calling-mojo-from-python/1514",13
"Why Silicon Valley's Most Powerful People Are So Obsessed with Hobbits","https://www.nytimes.com/2025/05/23/books/tolkien-musk-thiel-silicon-valley.html",13
"AI system resorts to blackmail if told it will be removed","https://www.bbc.com/news/articles/cpqeng9d20go",13
"Compressed-Air Car","https://en.wikipedia.org/wiki/Compressed-air_car",13
"Show HN: 8-Bit Spelling Game I Built for My Daughter Using Claude AI","https://kbr.sh/post/2025/May/21/8-bit-spelling-game-built-with-claude/",13
"Can Directories Rise Again?","https://thehistoryoftheweb.com/can-directories-rise-again/",13
"Linux Cgroup from First Principles","https://fzakaria.com/2025/05/26/linux-cgroup-from-first-principles",12
"FizzBuzz Through Monoids","https://entropicthoughts.com/fizzbuzz-through-monoids",12
"The latest image to text and OCR technology","https://vheer.com/image-to-text",12
"TCP/IP on Windows for Workgroups 3.11 in 2025 under QEMU","https://www.uninformativ.de/blog/postings/2025-05-25/0/POSTING-en.html",12
"Where Have All My Deep Male Friendships Gone?","https://www.nytimes.com/2025/05/25/magazine/male-friendships.html",12
"Sublime Text Build 4200 and Future Plugin Changes","https://www.sublimetext.com/blog/articles/sublime-text-4200",12
"Prime Path Coverage in the GNU Compiler Collection","https://arxiv.org/abs/2505.14694",12
"The End of Sierra as We Knew It, Part 4: Chainsaw Monday","https://www.filfre.net/2025/05/the-end-of-sierra-as-we-knew-it-part-4-chainsaw-monday/",12
"New Bacteria Have Been Discovered on a Chinese Space Station","https://www.wired.com/story/bacteria-unknown-on-earth-appears-on-chinese-space-station/",12
"Duolingo deletes TikTok videos after AI backlash, returns with a message","https://www.fastcompany.com/91338068/duolingo-deletes-tiktok-ai-backlash-returns-with-strange-message",12
"Show HN: send2kindle – CLI utility to send documents to your Kindle","https://github.com/carlos-menezes/send2kindle",12
"Like a hot dog, the Wienermobile is made from a variety of ingredients (2022)","https://www.roadandtrack.com/car-culture/a38734853/wienermobile-has-corvette-g-wagen-and-nsx-parts/",11
"Show HN: I made a running app that turns your runs to a virtual garden","https://www.runandgrow.com/",11
"Show HN: CodeNow – CoderPad over WebRTC and WASM","https://codenow-mu.vercel.app/problems/0001-fizzbuzz",11
"One Writing Class, 35 Years, 113 Deals, 95 Books","https://www.nytimes.com/2025/05/25/books/review/sam-freedman-columbia-journalism-school.html",11
"The Source of "Water" (2020)","https://jamesgill.net/waterword/",11
"Scaling the Let's Encrypt rate limits to prepare for a billion active TLS cert","https://letsencrypt.org/2025/01/30/scaling-rate-limits/",11
"Show HN: Generate SVGs with AI","https://vectorart.ai",11
"Linux 6.15 Released with Continued Rust Integration, Bcachefs Stabilizing","https://www.phoronix.com/news/Linux-6.15-Released",11
"zeptoforth: A not-so-small Forth for ARM Cortex-M","https://github.com/tabemann/zeptoforth/wiki",11
"The Transwedge Product","https://terathon.com/blog/transwedge-product.html",11
"A Run of CRDT Posts","https://jhellerstein.github.io/blog/crdt-intro/",11
"I Made a Font","https://blog.chay.dev/i-made-a-font/",10
"OpenToonz: Open-Source Animation Production Software","https://opentoonz.github.io/e/",10
"ReactOS, an Open Source Take on Windows","https://thenewstack.io/reactos-an-open-source-take-on-windows/",10
"The CIA Ran a Star Wars Fan Site","https://www.404media.co/the-cia-secretly-ran-a-star-wars-fan-site/",10
"Ask HN: What's the best decision you made early in your career","item?id=44099983",10
"Work requirements penalize workers in volatile occupations","https://www.brookings.edu/articles/work-requirements-penalize-workers-in-volatile-occupations/",10
"They Were Every Student's Worst Nightmare. Now Blue Books Are Back","https://www.wsj.com/business/chatgpt-ai-cheating-college-blue-books-5e3014a6",10
"Dividing an array into fair sized chunks","https://lemire.me/blog/2025/05/22/dividing-an-array-into-fair-sized-chunks/",10
"Community Notes on X Appear to Have Been Down the Past Three Days","https://leadstories.com/analysis/2025/05/fact-check-community-notes-x-down-for-three-days.html",9
"Electric Vehicles Died a Century Ago. Could That Happen Again?","https://www.nytimes.com/2025/05/26/business/electric-vehicles-history.html",9
"C# 14: Exploring extension members","https://devblogs.microsoft.com/dotnet/csharp-exploring-extension-members/",9
"Show HN: Crymaps – A map of the best places to cry","https://crymaps.netlify.app/",9
"Mr. Bates vs. the Post Office [TV Series] (Horizon IT Scandal)","https://www.arte.tv/en/videos/RC-026307/mr-bates-vs-the-post-office/",9
"Our docs are now built with Starlight instead of Docusaurus","https://glasskube.dev/blog/distr-docs/",9
"Sam and Jony and Skepticism","https://sixcolors.com/post/2025/05/sam-and-jony-and-skepticism/",9
"Btrfs to See More Performance Improvements with Linux 6.16","https://www.phoronix.com/news/Linux-6.16-Btrfs-Performance",9
"Show HN: I built a directory for side hustles to help people exit the rat race","https://esidehustles.com/",9
"'It was so unreal': Norwegian man wakes to cargo ship in his garden","https://www.theguardian.com/world/2025/may/22/it-was-so-unreal-norwegian-man-wakes-to-cargo-ship-in-his-garden",9
"Google Researcher Lowers Quantum Bar to Crack RSA Encryption","https://thequantuminsider.com/2025/05/24/google-researcher-lowers-quantum-bar-to-crack-rsa-encryption/",9
"Bank transactions cleared by FTP-ing files","https://twitter.com/alexpotato/status/1809579426687983657",8
"DeepMind's Veo3 AI – The New King Is Here [video]","https://www.youtube.com/watch?v=Pqx-gSiogjM",8
"The Windows Registry Adventure #7: Attack surface analysis","https://googleprojectzero.blogspot.com/2025/05/the-windows-registry-adventure-7-attack-surface.html",8
"20 years of NetBSD code bloat","http://kristerw.blogspot.com/2016/05/20-years-of-netbsd-code-bloat.html",8
"Highlights from the Claude 4 system prompt","https://simonwillison.net/2025/May/25/claude-4-system-prompt/",8
"The Miraculous Guru with an h-index of 62","https://neurocritic.blogspot.com/2024/07/the-miraculous-guru-with-h-index-of-62.html",8
"Microsoft will stop accepting new third-party print drivers in Windows (2023)","https://arstechnica.com/gadgets/2023/09/microsoft-will-stop-accepting-new-third-party-print-drivers-in-windows/",8
"rqlite turns 10: Lessons from a decade building Distributed Systems","https://philipotoole.com/rqlite-turns-10-lessons-from-a-decade-of-building-distributed-systems/",8
"A Tale of Running Modern Linux on Hardware from 1997","https://sahajsarup.com/a-tale-of-running-modern-linux-on-hardware-from-1997/",8
"Noam Chomsky: The False Promise of ChatGPT (2023)","https://www.nytimes.com/2023/03/08/opinion/noam-chomsky-chatgpt-ai.html",8
"The Network State","https://thenetworkstate.com/",7
"Emulating PS1 on a DS fitting a computer inside the cartridge [video]","https://www.youtube.com/watch?v=uq0pJmd7GAA",7
"Please don't ship heavy, fragile vintage computers. They will be destroyed","https://www.downtowndougbrown.com/2025/05/please-dont-ship-heavy-fragile-vintage-computers-they-will-be-destroyed/",7
"What If We Had Bigger Brains? Imagining Minds Beyond Ours","https://writings.stephenwolfram.com/2025/05/what-if-we-had-bigger-brains-imagining-minds-beyond-ours/",7
"Tim Cook's Bad Year Keeps Getting Worse","https://www.wsj.com/tech/ai/apple-ceo-tim-cook-tariffs-ai-48049d0c",7
"Extending Minds with Generative AI","https://www.nature.com/articles/s41467-025-59906-9",7
"ChezScheme v10.2.0","https://github.com/cisco/ChezScheme/releases/tag/v10.2.0",7
"This article won’t change your mind","https://www.theguardian.com/commentisfree/2025/may/18/change-mind-evidence-arguing-social-relationships",7
"Scientists discover class of crystals with properties that may be revolutionary","https://www.nanotechnologyworld.org/post/scientists-discover-class-of-crystals-with-properties-that-may-prove-revolutionary",7
"Big Problems From Big IN lists with Ruby on Rails and PostgreSQL","https://andyatkinson.com/big-problems-big-in-clauses-postgresql-ruby-on-rails",7
"The Monster-Slaying Game You Can Play Almost Anywhere","https://www.nytimes.com/2025/05/21/arts/play-doom-ports.html",7
"MMaDA – Open-Sourced Multimodal Large Diffusion Language Models","https://github.com/Gen-Verse/MMaDA",7
"Show HN: Lazy Tetris","https://lazytetris.com/",6
"Non-Pointless Software Projects for New Devs in the LLM Age","https://cprimozic.net/blog/non-pointless-software-projects-for-new-devs-in-the-llm-age/",6
"Ordinary life improvements 2018-2025","https://smagin.fyi/posts/ordinary-life-improvements/",6
"Designing Tools for Scientific Thought","https://www.forester-notes.org/tfmt-0001/index.xml",6
"Builder.ai coded itself into a corner – now it's bankrupt","https://www.theregister.com/2025/05/21/builderai_insolvency/",6
"Neural Thermodynamic Laws for Large Language Model Training","https://arxiv.org/abs/2505.10559",6
"SpaceX to launch Starship in critical test of Elon Musk's 2026 Mars plan","https://www.independent.co.uk/space/starship-launch-latest-spacex-mars-b2757919.html",6
"Germany: No more range restrictions on the weapons supplied to Ukraine","https://apnews.com/article/ukraine-germany-merz-weapons-range-4702908e5d98e6c43d9865ea0a8a4130",6
"What's been your biggest technical bottleneck as a small startup lately?","item?id=44092511",6
"Firewalls and BIOS's and Coreboot","https://hagensieker.com/2020/11/08/firewalls-and-bioss-and-coreboot/",6
"Show HN: I made a OSS alternative to Weights and Biases","https://github.com/mlop-ai/mlop",6
"What would a Microsoft engineer do to Ubuntu?","https://www.theregister.com/2025/05/23/anduinos/",6
"Worlds first petahertz transistor at ambient conditions","https://news.arizona.edu/news/u-researchers-developing-worlds-first-petahertz-speed-phototransistor-ambient-conditions",6
"Laser Breakthrough can read text from a mile away","https://www.sciencealert.com/this-laser-breakthrough-can-read-text-on-a-page-from-a-mile-away",6
"I No Longer Recommend RAG for Autonomous Coding Agents","https://pashpashpash.substack.com/p/why-i-no-longer-recommend-rag-for",6
"An update on improving passkey support in Linux","https://www.iinuwa.xyz/blog/linux-passkeys-update/",6
"A tool for easy download of Spanish geospatial and address data","https://github.com/ernestofgonzalez/trece",6
"Those Stealthy Botnets","https://jan.wildeboer.net/2025/02/Blocking-Stealthy-Botnets/",6
"Moments of Awakening","https://www.astralcodexten.com/p/moments-of-awakening",6
"Ask HN: Can you give tips on writing a README for project?","item?id=44081489",6
"Understanding Memory Management, Part 6: Basic Garbage Collection","https://educatedguesswork.org/posts/memory-management-6/",5
"Scaling RNNs to Billions of Parameters with Zero Order","https://arxiv.org/abs/2505.17852",5
"A simple explanation of a/(b+c) + b/(c+a) + c/(a+b) = 4","https://vitalik.eth.limo/general/2025/05/11/abc4.html",5
"Pragmatic Dave Thomas: Testing might not mean what you think it means","https://articles.pragdave.me/p/testing",5
"SEO Is Dead, According to Google","https://www.inc.com/joe-procopio/seo-is-dead-according-to-google/91193051",5
"HD-64 – An HDMI RF-modulator replacement for the Commodore 64","https://github.com/sideprojectslab/HD-64",5
"Meet the Press: Lost and Lonely: America's Mental Health Crisis","https://www.nbcnews.com/meet-the-press/video/may-25-lost-lonely-america-s-mental-health-crisis-240279621876",5
"Anti-Proverbs","https://en.wikipedia.org/wiki/Anti-proverb",5
"ARM PAN","https://blog.siguza.net/PAN/",5
"Why ChatGPT is unlikely to solve climate change","https://www.sfexaminer.com/news/technology/why-chatgpt-generative-ai-unlikely-to-solve-climate-change/article_3af9df0f-0cb6-41d0-93bd-417c5ead8c99.html",5
"Supplemental Feeding as a Driver of Morphological Change in Anna's Hummingbirds","https://onlinelibrary.wiley.com/doi/abs/10.1111/gcb.70237",5
"SHENZEN I/O","https://www.zachtronics.com/shenzhen-io/",5
"Restoring Vangelis's Performance Sequencers","https://zyklus-mps.com/about",5
"The Hobby Computer Culture","https://technicshistory.com/2025/05/24/the-hobby-computer-culture/",5
"Nearly Half of the Buildings in Manhattan Could Not Be Built Today (2016)","https://www.nytimes.com/interactive/2016/05/19/upshot/forty-percent-of-manhattans-buildings-could-not-be-built-today.html",5
"The satellite that will 'weigh' 1.5T trees","https://www.bbc.com/news/articles/crldwjj6d6no",5
"Cognitive independence and interactions between cerebral hemispheres","https://www.sciencedirect.com/science/article/abs/pii/S0028393225000880",5
"Enzyme Automatic Differentiation Framework","https://enzyme.mit.edu",5
"Demonstrating end-to-end scientific discovery with Robin: a multi-agent system","https://www.futurehouse.org/research-announcements/demonstrating-end-to-end-scientific-discovery-with-robin-a-multi-agent-system",4
"Boring Iceberg Catalog – 1 JSON file. 0 Setup","https://juhache.substack.com/p/boring-iceberg-catalog",4
"Grass Rendering Series","https://hexaquo.at/pages/grass-rendering-series-part-1-theory/",4
"Bash Style Guide","https://style.ysap.sh/",4
"AI Eats Software Testing","https://www.sabrina.dev/p/ai-eats-software-testing",4
"Can LLMs Aid in Deciphering the Voynich Manuscript?","https://viao.co.uk/blog/can-large-language-models-aid",4
"OpenPOWER Foundation – Open-Source / Open Hardware PowerPC CPU ISA","https://openpowerfoundation.org/",4
"Historic England Launches Local Heritage Hub to Unlock Hidden Histories","https://historicengland.org.uk/whats-new/news/local-heritage-hub-launches/",4
"Direct Preference Optimization vs. RLHF","https://www.together.ai/blog/direct-preference-optimization",4
"Word Tour: 1d word embeddings","https://data-processing.club/1dim/",4
"There Is No Diffie-Hellman but Elliptic Curve Diffie-Hellman","https://keymaterial.net/2025/05/23/there-is-no-diffie-hellman-but-elliptic-curve-diffie-hellman/",4
"Cows get GPS collars to stop them falling in river","https://www.bbc.co.uk/news/articles/cj4229k744lo",4
"Satellite Spots Large-Scale River Waves for First Time","https://www.jpl.nasa.gov/news/nasa-french-satellite-spots-large-scale-river-waves-for-first-time/",4
"I Bought a Robot Cat for My Rabbit","https://nautil.us/i-bought-a-robot-cat-for-my-rabbit-1213169/",4
"NES Zapper Becomes Telephone","https://hackaday.com/2025/05/25/nes-zapper-becomes-telephone/",4
"Semicolons bring the drama; that's why I love them","https://www.ft.com/content/80c39c74-8753-44bf-aeb0-cf6701a64f02",4
"Does employee happiness create value for firm performance?","https://www.nature.com/articles/s41599-025-05024-2",4
"Rock, Paper, Scissors that learns how you play using markov chains","https://luduxia.com/showdown/",3
"High strength bio-concrete for the production of building components","https://www.nature.com/articles/s44296-023-00004-6",3
"Camera reviews are not only pointless, but are also kind of rigged","https://om.co/2025/05/23/fujix-half-camera-is-dumb/",3
"European Space Agency will beam the famous 'Blue Danube' waltz into space","https://www.npr.org/2025/05/26/nx-s1-5411771/blue-danube-strauss-music-space-esa",3
"Google's Chief Scientist Is Vibe Coding? [video]","https://www.youtube.com/shorts/PuOJEkD7RwI",3
"Bitmap Images in 1965 – Mariner 4","https://oliverkwebb.github.io/articles/bmp-1965/",3
"Programming Basics with Tiki","https://tiki.li/",3
"Visualize and debug Rust programs with a new lens","https://firedbg.sea-ql.org/",3
"Venta AI (YC S23) is hiring a full stack engineer in Amsterdam","https://www.ycombinator.com/companies/venta-ai/jobs/K8m4p6z-founding-full-stack-engineer",0
