title,link,score
"Redis is open source again","https://antirez.com/news/151",1870
"Widespread power outage in Spain and Portugal","https://www.bbc.com/news/live/c9wpq8xrvd9t",1552
"Someone at YouTube needs glasses","https://jayd.ml/2025/04/30/someone-at-youtube-needs-glasses.html",1397
"Apple violated antitrust ruling, judge finds","https://www.wsj.com/tech/apple-violated-antitrust-ruling-federal-judge-finds-66b85957",1153
"I use zip bombs to protect my server","https://idiallo.com/blog/zipbomb-protection",1063
"Judge rules Apple executive lied under oath, makes criminal contempt referral","https://www.thebignewsletter.com/p/judge-rules-apple-executive-lied",1013
"Watching o3 guess a photo's location is surreal, dystopian and entertaining","https://simonwillison.net/2025/Apr/26/o3-photo-locations/",985
"Show HN: I built a hardware processor that runs Python","https://www.runpyxl.com/gpio",981
"Internet in a Box","https://internet-in-a-box.org/",893
"Qwen3: Think deeper, act faster","https://qwenlm.github.io/blog/qwen3/",862
"I'd rather read the prompt","https://claytonwramsey.com/blog/prompt/",845
"LibreLingo – FOSS Alternative to Duolingo","https://librelingo.app",797
"Firefox tab groups are here","https://blog.mozilla.org/en/firefox/tab-groups-community/",795
"Office is too slow, so Microsoft is making it load at Windows startup","https://www.pcworld.com/article/2651749/office-is-too-slow-so-microsoft-is-making-it-load-at-windows-startup.html",794
"An end to all this prostate trouble?","https://yarchive.net/blog/prostate/",790
"Finland Bans Smartphones in Schools","https://yle.fi/a/74-20158886",778
"Show HN: Free, in-browser PDF editor","https://breezepdf.com",731
"Migrating away from Rust","https://deadmoney.gg/news/articles/migrating-away-from-rust",730
"Claude Integrations","https://www.anthropic.com/news/integrations",718
"Port of Los Angeles says shipping volume will plummet 35% next week","https://www.cnbc.com/2025/04/29/port-of-los-angeles-sees-shipping-volume-down-35percent-next-week-as-tariffs-bite.html",716
"Try Switching to Kagi","https://daringfireball.net/2025/04/try_switching_to_kagi",711
"I created Perfect Wiki and reached $250k in annual revenue without investors","https://habr.com/en/articles/905812/",710
"Only Teslas exempt from new auto tariffs thanks to 85% domestic content rule","https://fuelarc.com/cars/only-tesla-exempt-from-new-auto-tariffs-thanks-to-85-domestic-content-rule/",635
"All four major web browsers are about to lose 80% of their funding","https://danfabulich.medium.com/all-four-major-web-browsers-are-about-to-lose-80-of-their-funding-0e42ceb358f1",630
"Starting July 1, academic publishers can't paywall NIH-funded research","https://www.nih.gov/about-nih/who-we-are/nih-director/statements/accelerating-access-research-results-new-implementation-date-2024-nih-public-access-policy",626
"Jepsen: Amazon RDS for PostgreSQL 17.4","https://jepsen.io/analyses/amazon-rds-for-postgresql-17.4",601
"Accountability Sinks","https://250bpm.substack.com/p/accountability-sinks",588
"Show HN: My self-written hobby OS is finally running on my vintage IBM ThinkPad","https://github.com/joexbayer/RetrOS-32",573
"How to live an intellectually rich life","https://utsavmamoria.substack.com/p/how-to-live-an-intellectually-rich",568
"Sycophancy in GPT-4o","https://openai.com/index/sycophancy-in-gpt-4o/",553
"Chain of Recursive Thoughts: Make AI think harder by making it argue with itself","https://github.com/PhialsBasement/Chain-of-Recursive-Thoughts",535
"Design for 3D-Printing","https://blog.rahix.de/design-for-3d-printing/",530
"Retailers will soon have only about 7 weeks of full inventories left","https://fortune.com/article/retailers-weeks-of-inventory-left-trump-china-trade-war/",525
"Cloth","https://www.cloudofoz.com/verlet-test/",517
"Why did Windows 7 log on slower for months if you had a solid color background?","https://devblogs.microsoft.com/oldnewthing/20250428-00/?p=111121",504
"How a single line of code could brick your iPhone","https://rambo.codes/posts/2025-04-24-how-a-single-line-of-code-could-brick-your-iphone",501
"A faster way to copy SQLite databases between computers","https://alexwlchan.net/2025/copying-sqlite-databases/",498
"Show HN: I built a synthesizer based on 3D physics","https://anukari.com",490
"We fell out of love with Next.js and back in love with Ruby on Rails","https://hardcover.app/blog/part-1-how-we-fell-out-of-love-with-next-js-and-back-in-love-with-ruby-on-rails-inertia-js",479
"Xiaomi MiMo Reasoning Model","https://github.com/XiaomiMiMo/MiMo",479
"108B Pixel Scan of Johannes Vermeer's Girl with a Pearl Earring","https://www.hirox-europe.com/gigapixel/girl-with-a-pearl-earring/",473
"How the US defense secretary circumvents official DoD communications equipment","https://www.electrospaces.net/2025/04/how-us-defense-secretary-hegseth.html",468
"Show HN: I made a web-based, free alternative to Screen Studio","https://www.screenrecorder.me",462
"DuckDB is probably the most important geospatial software of the last decade","https://www.dbreunig.com/2025/05/03/duckdb-is-the-most-impactful-geospatial-software-in-a-decade.html",460
"You Wouldn't Download a Hacker News","https://www.jasonthorsness.com/25",456
"Apple App Store guidelines remove ban on encouraging external payments in US","https://developer.apple.com/app-store/review/guidelines/",454
"Third party cookies must be removed","https://w3ctag.github.io/web-without-3p-cookies/",448
"O3 beats a master-level GeoGuessr player, even with fake EXIF data","https://sampatt.com/blog/2025-04-28-can-o3-beat-a-geoguessr-master",448
"Show HN: Beatsync – perfect audio sync across multiple devices","https://github.com/freeman-jiang/beatsync",437
"Buffett to step down following six-decade run atop Berkshire","https://www.bloomberg.com/news/articles/2025-05-03/warren-buffett-to-step-down-from-berkshire-hathaway-at-year-end",433
"Gorgeous-GRUB: collection of decent community-made GRUB themes","https://github.com/Jacksaur/Gorgeous-GRUB",426
"Time saved by AI offset by new work created, study suggests","https://arstechnica.com/ai/2025/05/time-saved-by-ai-offset-by-new-work-created-study-suggests/",424
"Indian court orders blocking of Proton Mail","https://techcrunch.com/2025/04/29/indian-court-orders-blocking-of-proton-mail/",420
"The language brain matters more for programming than the math brain? (2020)","https://massivesci.com/articles/programming-math-language-python-women-in-science/",409
"Ask HN: What are you working on? (April 2025)","item?id=43815523",406
"International Workers' Day","https://en.wikipedia.org/wiki/International_Workers%27_Day",400
"Old Soviet Venus descent craft nearing Earth reentry","https://www.leonarddavid.com/old-soviet-venus-descent-craft-nearing-earth-reentry/",399
"The One-Person Framework in Practice","https://link.mail.beehiiv.com/ss/c/u001.5SRwDQ9qxPQW8vmD5Do73b3R4eTCi2vXqPyztEk6wMFC9_fqEAcDVx6xEJ96T4BSMXrPS7z5exEBSTF4pF48z8SqJkJnkAwMUW9LtYdd8lWmvkDinT92nsk5HmXOHdWgLsysm9FMGrqmu7dnG57cXpga8ZOe8X0IV8pyeC3AswdRMaitfT307y7naP-_6W5CiolKhXCKrEndMGCW2PftFUu9ieYOxpVJ_fhu82gAh-4/4g1/wA_MG-I5SVCyR3KY66oEaQ/h30/h001.kLDFZMgisudi21zmTPbd_O8U7X98d4UxYqZjQTb_D7o",396
"DeepSeek-Prover-V2","https://github.com/deepseek-ai/DeepSeek-Prover-V2",394
"“Fewer Users” Warning Hurting Specialized and New Apps","https://support.google.com/googleplay/android-developer/thread/330114530/fewer-users-warning-hurting-specialized-and-new-apps-need-answers?hl=en",393
"Suno v4.5","https://suno.com/explore/",385
"Mercury: Commercial-scale diffusion language model","https://www.inceptionlabs.ai/introducing-mercury",385
"When flat rate movers won't answer your calls","https://aphyr.com/posts/381-when-flat-rate-movers-wont-answer-your-calls",380
"Why can't HTML alone do includes?","https://frontendmasters.com/blog/seeking-an-answer-why-cant-html-alone-do-includes/",378
"New Study: Waymo is reducing serious crashes and making streets safer","https://waymo.com/blog/2025/05/waymo-making-streets-safer-for-vru",377
"Irish privacy watchdog hits TikTok with €530M fine over data transfers to China","https://apnews.com/article/tiktok-ireland-european-union-data-privacy-regulation-d386ec74becc716905d7f686d6a448e2",357
"Minimum Viable Blog","https://ostwilkens.se/blog/setting-up-blog",353
"Google Play sees 47% decline in apps since start of last year","https://techcrunch.com/2025/04/29/google-play-sees-47-decline-in-apps-since-start-of-last-year/",353
"The side hustle from hell","https://blog.jacobstechtavern.com/p/the-side-hustle-from-hell",348
"Anubis saved our websites from a DDoS attack","https://fabulous.systems/posts/2025/05/anubis-saved-our-websites-from-a-ddos-attack/",347
"Business co-founders in tech startups are less valuable than they think","https://verdikapuku.com/posts/business-founders-are-less-valuable-than-they-think/",345
"Generative AI is not replacing jobs or hurting wages at all, say economists","https://www.theregister.com/2025/04/29/generative_ai_no_effect_jobs_wages/",342
"One Million Chessboards","https://onemillionchessboards.com/#199,276",336
""AI-first" is the new Return To Office","https://www.anildash.com//2025/04/19/ai-first-is-the-new-return-to-office/",335
"Pwning the Ladybird Browser","https://jessie.cafe/posts/pwning-ladybirds-libjs/",329
"CSS Zen Garden","https://csszengarden.com/",329
"NotebookLM Audio Overviews are now available in over 50 languages","https://blog.google/technology/google-labs/notebooklm-audio-overviews-50-languages/",326
"The 12-bit rainbow palette","https://iamkate.com/data/12-bit-rainbow/",325
"AI helps unravel a cause of Alzheimer’s and identify a therapeutic candidate","https://today.ucsd.edu/story/ai-helps-unravel-a-cause-of-alzheimers-disease-and-identify-a-therapeutic-candidate",319
"What went wrong with wireless USB","http://oldvcr.blogspot.com/2025/05/what-went-wrong-with-wireless-usb.html",318
"Mike Waltz Accidentally Reveals App Govt Uses to Archive Signal Messages","https://www.404media.co/mike-waltz-accidentally-reveals-obscure-app-the-government-is-using-to-archive-signal-messages/",308
"Icônes","https://icones.js.org/",304
"A single line of code cost $8000","https://pietrasiak.com/one-line-of-code-that-did-cost-dollar8000",303
"Linkwarden: FOSS self-hostable bookmarking with AI-tagging and page archival","https://linkwarden.app/",301
"Performance optimization is hard because it's fundamentally a brute-force task","https://purplesyringa.moe/blog/why-performance-optimization-is-hard-work/",301
"Tiny-LLM – a course of serving LLM on Apple Silicon for systems engineers","https://github.com/skyzh/tiny-llm",296
"An interview question that will protect you from North Korean fake workers","https://www.theregister.com/2025/04/29/north_korea_worker_interview_questions/",295
"Show HN: A Chrome extension that will auto-reject non-essential cookies","https://blog.bymitch.com/posts/reject-cookies/",294
"The True Size Of","https://thetruesize.com/",293
"Show HN: Remote-Controlled IKEA Deathstar Lamp","https://gitlab.com/sephalon/deathstar_lamp",290
"Virginia passes law to enforce maximum vehicle speeds for repeat speeders","https://www.fastcompany.com/91323835/virginia-will-use-technology-to-slow-chronic-speeders-cars-and-other-states-are-rushing-to-join-in",289
"An Alabama landline that keeps ringing","https://oxfordamerican.org/oa-now/the-alabama-landline-that-keeps-ringing",285
"Boxie – an always offline audio player for my 3 year old","https://mariozechner.at/posts/2025-04-20-boxie/",285
"Programming languages should have a tree traversal primitive","https://blog.tylerglaiel.com/p/programming-languages-should-have",285
"Future of OSU Open Source Lab in Jeopardy","https://osuosl.org/blog/osl-future/",283
"Running Qwen3 on your macbook, using MLX, to vibe code for free","https://localforge.dev/blog/running-qwen3-macbook-mlx",283
"Don't watermark your legal PDFs with purple dragons in suits","https://arstechnica.com/tech-policy/2025/05/dont-watermark-your-legal-pdfs-with-purple-dragons-in-suits/",277
"Read the Obits","https://thereader.mitpress.mit.edu/the-creativity-hack-no-one-told-you-about-read-the-obits/",277
"Run LLMs on Apple Neural Engine (ANE)","https://github.com/Anemll/Anemll",275
"Reverse geocoding is hard","https://shkspr.mobi/blog/2025/04/reverse-geocoding-is-hard/",275
"When ChatGPT broke the field of NLP: An oral history","https://www.quantamagazine.org/when-chatgpt-broke-an-entire-field-an-oral-history-20250430/",274
"Presentation Slides with Markdown","https://sli.dev",272
"Just redesigned my personal site with a TTY-style interface","https://www.abdisa.me/",270
"Did 5G kill the IMSI catcher?","https://zetier.com/5g-imsi-catcher/",267
"Why Archers Didn't Volley Fire","https://acoup.blog/2025/05/02/collections-why-archers-didnt-volley-fire/",266
"Uncovering the mechanics of The Games: Winter Challenge","https://mrwint.github.io/winter/writeup/writeup.html",265
"Legendary Bose Magic Carpet Suspension Is Finally Going Global","https://www.thedrive.com/news/legendary-bose-magic-carpet-suspension-is-finally-going-global",264
"How to program a text adventure in C","https://helderman.github.io/htpataic/htpataic01.html",262
"Oxide’s compensation model: how is it going?","https://oxide.computer/blog/oxides-compensation-model-how-is-it-going",259
"The coming knowledge-work supply-chain crisis","https://worksonmymachine.substack.com/p/the-coming-knowledge-work-supply",258
"Open-source interactive C tutorial in the browser","https://www.learn-c.org/",256
"Heart disease deaths worldwide linked to chemical widely used in plastics","https://medicalxpress.com/news/2025-04-heart-disease-deaths-worldwide-linked.html",255
"Ask HN: Who is hiring? (May 2025)","item?id=43858554",254
"Shardines: SQLite3 Database-per-Tenant with ActiveRecord","https://blog.julik.nl/2025/04/a-can-of-shardines",254
"Why I stopped angel investing after 15 years, and what I'm doing instead","https://halletecco.substack.com/p/why-i-stopped-angel-investing-after",250
"Expanding on what we missed with sycophancy","https://openai.com/index/expanding-on-sycophancy/",248
"Creating Bluey: Tales from the Art Director","https://substack.com/home/post/p-160039885",246
"Espressif's ESP32-C5 Is Now in Mass Production","https://www.espressif.com/en/news/ESP32-C5_Mass_Production",246
"Strings Just Got Faster","https://inside.java/2025/05/01/strings-just-got-faster/",244
"xAI dev leaks API key for private SpaceX, Tesla LLMs","https://krebsonsecurity.com/2025/05/xai-dev-leaks-api-key-for-private-spacex-tesla-llms/",242
"Show HN: A pure WebGL image editor with filters, crop and perspective correction","https://github.com/xdadda/mini-photo-editor",242
"Linux Kernel Exploitation: Attack of the Vsock","https://hoefler.dev/articles/vsock.html",234
"Bloom Filters","https://eli.thegreenplace.net/2025/bloom-filters/",233
"The Brief Origins of May Day","https://archive.iww.org/history/library/misc/origins_of_mayday/",227
"Show HN: GPT-2 implemented using graphics shaders","https://github.com/nathan-barry/gpt2-webgl",225
"JetBrains defends removal of negative reviews for unpopular AI Assistant","https://devclass.com/2025/04/30/jetbrains-defends-removal-of-negative-reviews-for-unpopular-ai-assistant/",225
"Reports of the death of California High-Speed Rail have been greatly exaggerated","https://asteriskmag.com/issues/10/reports-of-the-death-of-california-high-speed-rail-have-been-greatly-exaggerated",219
"My sourdough starter has twins","https://brainbaking.com/post/2025/04/my-sourdough-starter-has-twins/",217
"Everything we announced at our first LlamaCon","https://ai.meta.com/blog/llamacon-llama-news/?_fb_noscript=1",214
"Dopamine signals when a fear can be forgotten","https://picower.mit.edu/news/dopamine-signals-when-fear-can-be-forgotten",211
"What I've learned from jj","https://zerowidth.com/2025/what-ive-learned-from-jj/",209
"QModem 4.51 Source Code","https://github.com/AaronFriel/qmodem-4.51",208
"Bamba: An open-source LLM that crosses a transformer with an SSM","https://research.ibm.com/blog/bamba-ssm-transformer-model",207
"ZFS: Apple's new filesystem that wasn't (2016)","https://ahl.dtrace.org/2016/06/15/apple_and_zfs/",205
"Running Clojure in WASM with GraalVM","https://romanliutikov.com/blog/running-clojure-in-wasm",203
"Deno's Decline","https://dbushell.com/2025/04/28/denos-decline/",201
"Evidence of controversial Planet 9 uncovered in sky surveys taken 23 years apart","https://www.space.com/astronomy/solar-system/evidence-of-controversial-planet-9-uncovered-in-sky-surveys-taken-23-years-apart",199
"Show HN: Roons – Mechanical Computer Kit","https://whomtech.com/show-hn/",199
"Connomore64: Cycle exact emulation of the C64 using parallel microcontrollers","https://github.com/c1570/Connomore64",198
"Metagenomics test saves woman's sight after mystery infection","https://www.bbc.co.uk/news/articles/czx45vze0vyo",197
"Technical analysis of TM SGNL, the unofficial Signal app Trump officials used","https://micahflee.com/tm-sgnl-the-obscure-unofficial-signal-app-mike-waltz-uses-to-text-with-trump-officials/",195
"Joining Sun Microsystems – 40 years ago (2022)","https://akapugs.blog/2022/05/03/674/",194
"Show HN: Sim Studio – Open-Source Agent Workflow GUI","https://github.com/simstudioai/sim",193
"Zhaoxin's KX-7000","https://chipsandcheese.com/p/zhaoxins-kx-7000",193
"Show HN: I taught AI to commentate Pong in real time","https://github.com/pncnmnp/xpong",192
"I put sheet music into smart glasses [video]","https://www.youtube.com/watch?v=j36u2i7PKKE",192
"Dummy's Guide to Modern LLM Sampling","https://rentry.co/samplers",191
"Google Gemini has the worst LLM API","https://venki.dev/notes/google-gemini-is-bad",188
"N8n – Flexible AI workflow automation for technical teams","https://n8n.io/",188
"Linux in Excel","https://github.com/NSG650/LinuxInExcel",185
"Arizona laptop farmer pleads guilty for funneling $17M to Kim Jong Un","https://www.theregister.com/2025/02/12/arizona_woman_laptop_farm_guilty/",184
"How to build Intrinsic Motivation: a review of the science","https://erringtowardsanswers.substack.com/p/intrinsic-motivation",183
"Why I Am Not Going to Buy a Computer (1987) [pdf]","https://classes.matthewjbrown.net/teaching-files/philtech/berry-computer.pdf",180
"The Leaderboard Illusion","https://arxiv.org/abs/2504.20879",180
"Oberon Pi","http://pascal.hansotten.com/niklaus-wirth/project-oberon/oberon-pi/",179
"Duolingo will replace contract workers with AI","https://www.theverge.com/news/657594/duolingo-ai-first-replace-contract-workers",177
"It's School time: Adventures in hacking an old Kindle","https://samkhawase.com/blog/hacking-kindle/",176
"I Found Malware in a BeamNG Mod","https://lemonyte.com/blog/beamng-malware",175
"What It Takes to Defend a Cybersecurity Company from Today's Adversaries","https://www.sentinelone.com/labs/top-tier-target-what-it-takes-to-defend-a-cybersecurity-company-from-todays-adversaries/",175
"Show HN: Flowcode – Turing-complete visual programming platform","https://app.getflowcode.io/playground/example1",174
"ArkFlow: High-performance Rust stream processing engine","https://github.com/arkflow-rs/arkflow",169
"Julia Parsons, U.S. Navy Code Breaker During World War II, Dies at 104","https://www.nytimes.com/2025/04/30/world/julia-parsons-dead.html",169
"Llasa: Llama-Based Speech Synthesis","https://llasatts.github.io/llasatts/",168
"Tiny Emulators","https://floooh.github.io/tiny8bit/",167
"What Is "Induced Atmospheric Vibration"?","https://physics.stackexchange.com/questions/848666/what-is-induced-atmospheric-vibration",166
"Brian Eno's Theory of Democracy","https://www.programmablemutter.com/p/brian-enos-theory-of-democracy",163
"Reversible computing with mechanical links and pivots","https://tennysontbardwell.com/blog/2025/04/30/mechanical-computing/index.html",163
"The Cannae Problem","https://www.joanwestenberg.com/the-cannae-problem/",161
"China's Clinical Trial Boom","https://www.asimov.press/p/china-trials",160
"Show HN: OSle – A 510 bytes OS in x86 assembly","https://github.com/shikaan/osle",158
"Owen Le Blanc: creator of the first Linux distribution","https://lwn.net/Articles/1017846/",157
"Stuffed-Na(a)N: stuff your NaNs","https://github.com/si14/stuffed-naan-js",155
"Ask HN: Hackathons feel fake now","item?id=43889502",154
"A Common Lisp jq replacement","https://world-playground-deceit.net/blog/2025/03/a-common-lisp-jq-replacement.html",154
"AI code is legacy code?","https://text-incubation.com/AI+code+is+legacy+code+from+day+one",152
"The group chats that changed America","https://www.semafor.com/article/04/27/2025/the-group-chats-that-changed-america",152
"BART's Anime Mascots","https://www.bart.gov/news/fun/anime",150
"Graceful Shutdown in Go: Practical Patterns","https://victoriametrics.com/blog/go-graceful-shutdown/index.html",146
"The future of solar doesn't track the sun","https://terraformindustries.wordpress.com/2025/04/29/the-future-of-solar-doesnt-track-the-sun/",146
"Trust Me, I'm Local: Chrome Extensions, MCP, and the Sandbox Escape","https://blog.extensiontotal.com/trust-me-im-local-chrome-extensions-mcp-and-the-sandbox-escape-1875a0ee4823",146
"Show HN: Blast – Fast, multi-threaded serving engine for web browsing AI agents","https://github.com/stanford-mast/blast",143
"You could just choose optimism","https://quarter--mile.com/You-Could-Just-Choose-Optimism",143
"RustAssistant: Using LLMs to Fix Compilation Errors in Rust Code","https://www.microsoft.com/en-us/research/publication/rustassistant-using-llms-to-fix-compilation-errors-in-rust-code/",142
"'I found your dad': The mystery of a missing climber","https://www.espn.com/olympics/story/_/id/44690603/bill-stampfl-missing-climber-peru-huascaran",140
"The missteps that led to a fatal plane crash at Reagan National Airport","https://www.nytimes.com/2025/04/27/business/dc-plane-crash-reagan-airport.html",140
"We need more optimistic science fiction","https://craig-russell.co.uk/blog/2024-10-24-optimistic-sci-fi/",139
"The hospital where staff treat fear of death as well as physical pain","https://www.theguardian.com/society/2025/apr/22/palliative-care-denmark-hospital-death-dying",139
"Numerical Linear Algebra Class in Julia TUM","https://venkovic.github.io/NLA-for-CS-and-IE.html",138
"On Not Carrying a Camera – Cultivating memories instead of snapshots","https://hedgehogreview.com/issues/after-neoliberalism/articles/on-not-carrying-a-camera",137
"Show HN: Create your own finetuned AI model using Google Sheets","https://promptrepo.com/finetune/",137
"WorldGen: Open-source 3D scene generator for Game/VR/XR","https://worldgen.github.io/",137
"An illustrated guide to automatic sparse differentiation","https://iclr-blogposts.github.io/2025/blog/sparse-autodiff/",136
"Mesmerizing Interlocking Geometric Patterns Produced with Japanese Woodworking","https://www.smithsonianmag.com/smithsonian-institution/see-the-mesmerizing-interlocking-geometric-patterns-produced-with-this-ancient-japanese-woodworking-technique-180986494/",135
"Webflow makes GSAP 100% free – plus more updates","https://webflow.com/blog/gsap-becomes-free",134
"AI code review: Should the author be the reviewer?","https://www.greptile.com/blog/ai-code-reviews-conflict",133
"People are losing loved ones to AI-fueled spiritual fantasies","https://www.rollingstone.com/culture/culture-features/ai-spiritual-delusions-destroying-human-relationships-1235330175/",131
"GitDroid: A third party Android app manager for apps uploaded to GitHub releases","https://github.com/TechnicJelle/GitDroid",131
"Home washing machines fail to remove important pathogens from textiles","https://medicalxpress.com/news/2025-04-home-machines-important-pathogens-textiles.html",131
"How LWN is faring in 2025","https://lwn.net/Articles/1019217/",131
"Company built its own rail terminal in NYC to avoid relying on trucks","https://www.fastcompany.com/91324241/this-company-built-an-entire-rail-terminal-in-queens-to-avoid-relying-on-trucks",130
"Show HN: Daily Jailbreak – Prompt Engineer's Wordle","https://www.vaultbreak.ai/daily-jailbreak",130
"Phi-4 Reasoning Models","https://azure.microsoft.com/en-us/blog/one-year-of-phi-small-language-models-making-big-leaps-in-ai/",130
"Building Burstables: CPU slicing with cgroups","https://www.ubicloud.com/blog/building-burstables-cpu-slicing-with-cgroups",129
"AirBorne: Wormable zero-click remote code execution (RCE) in AirPlay protocol","https://www.oligo.security/blog/airborne",129
"Is outbound going to die?","https://rnikhil.com/2025/04/25/sales-outbound-ai-dead",129
"In kids, EEG monitoring of consciousness safely reduces anesthetic use","https://news.mit.edu/2025/kids-eeg-monitoring-consciousness-safely-reduces-anesthetic-use-0429",128
"The US has approved CRISPR pigs for food","https://www.technologyreview.com/2025/05/02/1116059/the-us-approves-crispr-pigs-for-food/",128
"Ask HN: Who wants to be hired? (May 2025)","item?id=43858552",128
"Deadly Screwworm Parasite's Comeback Threatens Texas Cattle, US Beef Supply","http://www.bloomberg.com/news/features/2025-05-02/deadly-screwworm-parasite-s-comeback-threatens-texas-cattle-us-beef-supply",125
"Vatican Observatory","https://www.vaticanobservatory.org/telescopes/va/",125
"Felix86: Run x86-64 programs on RISC-V Linux","https://felix86.com/",125
"TScale – Distributed training on consumer GPUs","https://github.com/Foreseerr/TScale",124
"Show HN: Kubetail – Real-time log search for Kubernetes","https://github.com/kubetail-org/kubetail",124
"LLMs for Engineering: Teaching Models to Design High Powered Rockets","https://arxiv.org/abs/2504.19394",123
"Show HN: AgenticSeek – Self-hosted alternative to cloud-based AI tools","https://github.com/Fosowl/agenticSeek",121
"The term "vegetative electron microscopy" keeps showing up in scientific papers","https://www.sciencealert.com/a-strange-phrase-keeps-turning-up-in-scientific-papers-but-why",120
