title,link,score
"FreeBSD fans rally round zVault upstart","https://www.theregister.com/2025/05/12/second_preview_zvault/",14
"Samsung launches the first 500Hz OLED gaming monitor for $1,300","https://www.tomshardware.com/monitors/gaming-monitors/samsung-launches-the-worlds-first-500hz-oled-gaming-monitor-for-usd1-300-with-its-burn-in-fighting-heat-pipes-in-tow",14
"You can now export your deep research reports as well-formatted PDFs","https://twitter.com/OpenAI/status/1921998278628901322",14
"Offline vs. online ML pipelines","https://decodingml.substack.com/p/offline-vs-online-ml-pipelines",13
"Lego Island's lost source code has been rediscovered","https://www.gamesradar.com/games/28-years-later-lego-islands-lost-source-code-has-been-rediscovered-but-the-fans-who-spent-nearly-two-years-painstakingly-decompiling-it-by-hand-cant-have-it/",13
"Google just changed its 'G' logo","https://www.theverge.com/news/664958/google-g-logo-gradient-design-change",13
"VPN firm says it didn't know customers had lifetime subscriptions, cancels them","https://arstechnica.com/gadgets/2025/05/vpn-firm-says-it-didnt-know-customers-had-lifetime-subscriptions-cancels-them/",13
"GM's LMR battery breakthrough means more range at a lower cost","https://arstechnica.com/features/2025/05/gms-new-ev-battery-will-offer-30-percent-more-range-for-less-money/",13
"Bippy: A toolkit to hack into react internals","https://www.bippy.dev/",13
"A whippet waypoint / Nofl: A Precise Immix","https://wingolog.org/archives/2025/05/09/a-whippet-waypoint",13
"Reconstructing illusory camouflage patterns on moth wings using computer vision","https://royalsocietypublishing.org/doi/10.1098/rsif.2024.0757",13
"Show HN: Printstack – I'll print and post your Substacks to you","https://printstack.net/for-readers",13
"Bento gets a makeover","https://warpstreamlabs.github.io/bento/",13
"How a "We Buy Ugly Houses" Franchise Left a Trail of Financial Wreckage in Texas","https://www.propublica.org/article/homevestors-fraud-charles-carrier-texas",12
"The Myth of the Poverty Trap","https://www.theatlantic.com/podcasts/archive/2025/05/the-myth-of-the-poverty-trap/682786/",12
"One Alien's Trash Is Another Alien's Treasure","https://thebsdetector.substack.com/p/one-aliens-trash-is-another-aliens",12
"Chime S-1","https://www.sec.gov/Archives/edgar/data/1795586/000162828025025059/chimefinancialinc-sx1wq1da.htm",12
"A formatter for your kdl files","https://github.com/hougesen/kdlfmt",12
"Amazon warns it'll terminate your account for screenshotting Prime Video","https://www.neowin.net/news/amazon-allegedly-warns-itll-terminate-your-account-for-screenshotting-prime-video/",12
"Google Docs: "Copy as Markdown"","https://twitter.com/googledocs/status/1921966599185068525",12
"Political attacks could crush the mRNA vaccine revolution","https://www.nature.com/articles/d41586-025-01462-9",12
"Microsoft boots 3% of staff in latest cull","https://www.theregister.com/2025/05/13/microsoft_layoff/",12
"The Situation: A Used Plane That Needs Work","https://www.lawfaremedia.org/article/the-situation--a-used-plane-that-needs-work",12
"Sam Altman's eye-scanning orbs have arrived, sparking curiosity and fear","https://www.latimes.com/business/story/2025-05-12/dystopian-aesthetic-in-california-sam-altmans-eye-scanning-orbs-spark-curiosity-and-resistance",12
"Pope Leo XIV's PhD Dissertation","https://kathleenmccook.substack.com/p/pope-leo-xiv-dissertation",12
"Don't buy a new computer when Support for Windows 10 ends on Oct 14","https://endof10.org/",12
"Unending ransomware attacks are a symptom, not the sickness","https://www.theregister.com/2025/05/12/opinion_column_ransomware/",12
"Why do NYC drivers waste two hundred million hours a year circling the block?","https://www.newyorker.com/magazine/2025/05/12/no-parking-zone-the-perils-of-finding-a-spot-in-nyc",11
"EventQL: A Query Language for Events","https://docs.eventsourcingdb.io/reference/eventql/",11
"Google Facing at Least €12B in Civil Claims Across Europe","https://www.bloomberg.com/news/articles/2025-05-13/google-facing-at-least-12-billion-in-civil-claims-across-europe",11
"Farewell to Lee Gold's Alarums and Excursions","https://www.chaosium.com/blogout-of-the-suitcase-54-farewell-to-lee-golds-alarums-excursions/",11
"Google accidentally leaks Material 3 Expressive UI ahead of Android 16","https://timesofindia.indiatimes.com/technology/tech-news/google-accidentally-reveals-new-android-design-language-material-3-expressive-heres-what-changes-it-may-bring-to-android-16/articleshow/120919076.cms",11
"This is Water by David Foster Wallace","https://fs.blog/david-foster-wallace-this-is-water/",11
"Noncoders using AI to prompt their ideas into reality. It's called 'vibe coding'","https://www.nbcnews.com/tech/tech-news/noncoders-ai-prompt-ideas-vibe-coding-rcna205661",10
"System lets robots identify an object's properties through handling","https://news.mit.edu/2025/system-lets-robots-identify-objects-properties-through-handling-0508",10
"Zinc Microcapacitors Are the Best of Both Worlds","https://spectrum.ieee.org/zinc-microcapacitor",10
"Bios Boot to D","https://theartofmachinery.com/2017/01/24/boot_to_d.html",10
"Apple Wants People to Control Devices with Their Thoughts","https://www.wsj.com/tech/apple-brain-computer-interface-9ec69919",10
"Apple unveils powerful accessibility features coming later this year","https://www.apple.com/newsroom/2025/05/apple-unveils-powerful-accessibility-features-coming-later-this-year/",10
"Why do Saturation and Luminance go all the way to 240, but Hue goes only to 239","https://devblogs.microsoft.com/oldnewthing/20151013-00/?p=91371",10
"Coupling furfural oxidation for H2 production using silicon photoelectrodes","https://www.nature.com/articles/s41467-025-58000-4",10
"Multiple Security Issues in Screen","https://security.opensuse.org/2025/05/12/screen-security-issues.html",10
"Perplexity AI's Valuation Surges to $14B in $500M Funding Round","https://www.wsj.com/tech/ai-startup-perplexitys-valuation-surges-to-14-billion-in-fresh-funding-round-26124482",10
"Kung Fury 2 trailer [video]","https://www.youtube.com/watch?v=JQRuka2aJy4",10
"Ask HN: Did GitHub UI become unbearably slow?","item?id=43961329",10
"D Slices","https://dlang.org/articles/d-array-article.html",9
"Working in IT made me a nervous traveller","https://rubenerd.com/working-in-it-made-me-a-nervous-flyer/",9
"C is not a low-level language (2018)","https://queue.acm.org/detail.cfm?id=3212479",9
"Next.js to Htmx – A Real World Example","https://htmx.org/essays/a-real-world-nextjs-to-htmx-port/",9
"Low-intensity transcranial focused ultrasound amygdala neuromodulation","https://www.nature.com/articles/s41380-025-03033-w",9
"In defense of self-signed certificates (2013)","https://michael.orlitzky.com/articles/in_defense_of_self-signed_certificates.xhtml",9
"Trump Appointees Blocked from Entering US Copyright Office","https://www.wired.com/story/us-copyright-office-trump-takeover/",9
"Show HN: Vibemail – Chrome extension for vibe emailing","https://chromewebstore.google.com/detail/vibemail/dijcjhhnpgoenmkmahigmdgpkajhhhbg",9
"Show HN: TheorIA – An Open Curated Physics Dataset (Equations,Explanations,JSON)","https://theoria-dataset.github.io/theoria-dataset/",9
"China's EUV breakthrough: Huawei, SMIC reportedly advancing LDP lithography","https://globalsmtasia.com/chinas-euv-breakthrough-huawei-smic-reportedly-advancing-ldp-lithography-eye-3q25-trial-2026-rollout/",9
"AI Hallucination in Filings, 14th-Largest US Law Firm: $31K in Sanctions","https://reason.com/volokh/2025/05/13/ai-hallucination-in-filings-involving-14th-largest-u-s-law-firm-lead-to-31k-in-sanctions/",8
"Dusk OS C Compiler","https://git.sr.ht/~vdupras/duskos/tree/master/item/fs/doc/comp/c.txt?__goaway_challenge=js-refresh&__goaway_id=09245079d4cf1efcea00bf4a44558faf&__goaway_referer=https%3A%2F%2Fduskos.org%2F",8
"Pgwatch: PostgreSQL Monitoring Solution","https://github.com/cybertec-postgresql/pgwatch",8
"CISA changes vulnerabilities updates, shifts to X and emails","https://www.theregister.com/2025/05/12/cisa_vulnerabilities_updates_x/",8
"On Pope Leo's Desk: Fixing Vatican Finances","https://www.pillarcatholic.com/p/on-pope-leos-desk-fixing-vatican",8
"Just Say No – Jeff Geerling","https://www.jeffgeerling.com/blog/2022/just-say-no",8
"There Is a Monster in the Forest","https://bsky.app/profile/joles.bsky.social/post/3logjuqggkk2q",8
"Memories: Edinburgh ML to Standard ML","https://lawrencecpaulson.github.io/2022/10/05/Standard_ML.html",8
"The Ecstatic Swoon","https://aeon.co/essays/what-stendhal-says-about-the-purpose-and-promise-of-art",8
"Ask HN: I burnt out, quit my job – any advice on moving to freelance/consulting?","item?id=43968224",8
"A Rust API Inspired by Python, Powered by Serde","https://ohadravid.github.io/posts/2025-05-serde-reflect/",8
"The AUCTUS A6: the chip enabling inexpensive DMR Radio (2021)","https://jhart99.com/auctus-a6/",8
"Show HN: Put macros.menu/ in front of any restaurant menu URL","https://macros.menu",7
"Republicans Try to Cram Ban on AI Regulation into Budget Reconciliation Bill","https://www.404media.co/republicans-try-to-cram-ban-on-ai-regulation-into-budget-reconciliation-bill/",7
"Mason: A declarative build tool on top of Dagger","https://whtwnd.com/vbehar.dev/3lp2uqrwpbo2i",7
"Cory Arcangel Recovered a Late Artist's Digital Legacy","https://www.newyorker.com/culture/infinite-scroll/how-cory-arcangel-recovered-a-late-artists-digital-legacy",7
"Alcohol use is declining. THC is swooping in","https://www.cnn.com/2025/05/10/business/thc-drinks-legal-farm-bill",7
"Brewhaha: Turns out machines can't replace people, Starbucks finds","https://www.theregister.com/2025/04/30/starbucks_finds_machines_cant_replace/",7
"Apple to Block Mac Apps from Accessing Your Clipboard","https://www.macrumors.com/2025/05/12/apple-mac-apps-clipboard-change/",7
"Nvidia CEO's net worth nears $120B as shares surge on Saudi chip deal","https://www.reuters.com/technology/nvidia-ceos-net-worth-nears-120-billion-shares-surge-saudi-chip-deal-2025-05-13/",7
"Better Air Purifiers","https://www.jefftk.com/p/better-air-purifiers",7
"AI is a test of our intelligence","https://www.psychologytoday.com/us/blog/the-digital-self/202505/ai-isnt-just-a-tool-its-a-test",6
"Mousemaster: Efficiently control your mouse with keyboard inputs","https://github.com/petoncle/mousemaster",6
""Google wanted that": Nextcloud decries Android permissions as "gatekeeping"","https://arstechnica.com/gadgets/2025/05/nextcloud-accuses-google-of-big-tech-gatekeeping-over-android-app-permissions/",6
"GM's new turbo engine rewrites the rules of torque control-and locks out tuners","https://www.carsandhorsepower.com/featured/gm-s-new-turbo-engine-patent-could-rewrite-the-rules-of-torque-control-and-lock-out-tuners-for-good",6
"Linux kernel to drop 486 and early 586 support","https://www.theregister.com/2025/05/07/linux_kernel_drops_486/",6
"Man jailed for 1986 murder acquitted after 38 years","https://www.bbc.co.uk/news/articles/ce809e3gd1xo",6
"Cracking the Dave and Buster's Anomaly","https://rambo.codes/posts/2025-05-12-cracking-the-dave-and-busters-anomaly",6
"China Makes High-Speed Laser Links in Orbit","https://spectrum.ieee.org/satellite-internet-china-crosslink",6
"How to buy a chicken sandwich in Shenzhen: China's $100B livestream sales sector","https://restofworld.org/2022/how-to-buy-chicken-sandwich-shenzhen/",6
"New study sheds light on health differences between sexes","https://medicalxpress.com/news/2025-05-health-differences-sexes.html",6
"The British Airways position on various border disputes","https://drewdevault.com/2025/05/05/2025-05-05-BA-on-border-disputes.html",6
"Show HN: Reactylon – A new way to build XR with React and Babylon.js","https://github.com/simonedevit/reactylon",6
"Eucalyptus for Brazil's steelmaking dries out communities in Minas Gerais","https://news.mongabay.com/2025/04/eucalyptus-for-brazils-steelmaking-dries-out-communities-in-minas-gerais/",6
"How to practice 'deep reading' (2024)","https://www.npr.org/2024/04/30/1196979151/how-to-practice-deep-reading",6
"Jerry Lee Lewis' marriage to a 13-year-old wrecked his career (2008)","https://www.dailymail.co.uk/tvshowbiz/article-1021569/Great-Balls-Scandal-How-Jerry-Lee-Lewis-marriage-13-year-old-wrecked-career.html",5
"The 600-Year History of the Singular 'They' (2022)","https://www.mentalfloss.com/posts/singular-they-history",5
"SPITBOL – high performance implementation of SNOBOL for x64","https://github.com/spitbol/x64",5
"Returning to My Roots in Hardware","https://dancrimp.nz/2025/03/31/hardware/",5
"Pakistan's use of J-10C jets and missiles exposes potency of Chinese weaponry","https://www.theguardian.com/world/2025/may/14/pakistans-use-of-j-10c-jets-and-missiles-exposes-potency-of-chinese-arms",5
"US District Ct. for W. Pa. allows removal of Venezuelans under Alien Enemies Act [pdf]","https://storage.courtlistener.com/recap/gov.uscourts.pawd.318716/gov.uscourts.pawd.318716.72.0_4.pdf",5
"AMD EPYC 4565P and EPYC 4585PX Benchmarks Against Xeon 6369P","https://www.phoronix.com/review/amd-epyc-4585px-4565p-benchmarks",5
"Econ 101 Is Underrated: Pharma Price Controls","https://marginalrevolution.com/marginalrevolution/2025/05/econ-101-is-underrated.html",5
"Moment of heart's formation captured in images for first time","https://www.theguardian.com/science/2025/may/13/heart-cells-mouse-embryo-science-research",5
"New Intel CPU Flaw Bypasses Spectre v2 Defenses to Leak Kernel Memory","https://cyberinsider.com/new-intel-cpu-flaw-bypasses-spectre-v2-defenses-to-leak-kernel-memory/",5
"Rethinking Memory in AI: Taxonomy, Operations, Topics, and Future Directions","https://arxiv.org/abs/2505.00675",5
"Show HN: I Built Remind Me AI. It's Like Unlimited GPT Tasks. Try the Demo","https://app.arcade.software/share/PrR3lG51cRjJkk6vEz3R",5
"DESQview","https://en.wikipedia.org/wiki/DESQview",5
"Ask HN: Should You Include a Certificate in a SAML AuthnRequest?","item?id=43962144",5
"Doom on the Oldest Digital Computer in America [video]","https://www.youtube.com/watch?v=no0CkQk7id0",5
"The Compound Interest of Small Ideas","https://www.chrbutler.com/the-compound-interest-of-small-ideas",5
"Sotheby's – Modern Evening Auction – Tue May 13 25 [video]","https://www.youtube.com/watch?v=bnKW3ydMsMQ",4
"Ask HN: How do you like the Framework matte screen?","item?id=43974583",4
"Apple helped China become America's biggest tech rival","https://www.thetimes.com/business-money/technology/article/how-apple-helped-china-become-americas-biggest-tech-rival-8f83tttv5",4
"NASA turns the screams of a dying star into music","https://www.space.com/astronomy/nasa-turns-the-screams-of-a-dying-star-into-music",4
"HTML Time Tags and DRY (HARC Stack)","https://rakujourney.wordpress.com/2025/05/12/harc-stack-semantic-time/",4
"Google Search Engineer Rants on DOJ's Anti-Trust Case","https://www.seroundtable.com/google-search-engineer-x-doj-rant-39397.html",4
"Who Was Friedrich Nietzsche's "Übermensch"?","https://www.thecollector.com/who-was-friedrich-nietzche-ubermensch/",4
"Python lib generates its code on-the-fly based on usage","https://github.com/cofob/autogenlib",4
"'Fallout' Renewed for Season 3","https://www.newsweek.com/entertainment/tv/fallout-already-renewed-season-3-2071295",4
"OpenSSH Config Tags How To","https://mrod.space/2023/09/04/using-tags-in-ssh-config",4
"Biological Organisation as Closure of Constraints","https://www.sciencedirect.com/science/article/abs/pii/S0022519315001009",4
"ZB-1 Radio Homing Adapter and Security Cover","https://timeandnavigation.si.edu/multimedia-asset/zb-1-radio-homing-adapter-and-security-cover",4
"We Trade with Ants: The Little Speakers","https://www.fortressofdoors.com/wetradewithants-thelittlespeakers/",4
"Java build tooling could be so much better (Seattle Java User Group) [video]","https://www.youtube.com/watch?v=REOCaHmUkH4",4
"WireGuard and Web UI and Adblock and DNS Caching","https://github.com/nguyenanhung/dmad",4
"LPython: Novel, Fast, Retargetable Python Compiler (2023)","https://lpython.org/blog/2023/07/lpython-novel-fast-retargetable-python-compiler/",3
"Phones Aren't the Problem – Consumption Is","https://anandsanwal.me/banning-mobile-phones-schools/",3
"LithOS: An Operating System for Efficient Machine Learning on GPUs","https://arxiv.org/abs/2504.15465",3
"Preview release of ty, a type checker for Python","https://twitter.com/charliermarsh/status/1922333022658978089",3
"Backslash: Rate Constrained Optimized Training of Large Language Models","https://arxiv.org/abs/2504.16968",3
"AnduinOS – Windows-like, Ubuntu-based Linux distro made by a Microsoft engineer","https://github.com/Anduin2017/AnduinOS",3
"Lemmings: DMA Design Redefined Puzzle Games [video]","https://www.youtube.com/watch?v=8FTOySSAPo8",3
"Why Is Google Pushing AI on My Kids?","https://www.crossplay.news/p/why-is-google-pushing-ai-on-my-kids",3
"isc.ro","https://isc.ro/",3
"The overlooked masterpiece full of coded messages about World War One","https://www.bbc.com/culture/article/20250423-the-masterpiece-full-of-coded-messages-about-ww1",3
"TwoFold (2f), CLI text expander/template engine","https://github.com/ShinyTrinkets/twofold.ts",3
"Incus: System container and virtual machine manager","https://github.com/lxc/incus",3
"A MAZE. / Berlin – 14th international games and playful media festival","https://2025.amaze-berlin.de/",3
"The Transaction Concept: Virtues and Limitations (1981) [pdf]","https://jimgray.azurewebsites.net/papers/thetransactionconcept.pdf",3
"Legion Health (YC S21) is hiring engineers to help fix mental health with AI","https://www.workatastartup.com/jobs/75011",0
