title,link,score
"Anyone on the Internet Can Ring Your Doorbell","https://www.abgeo.dev/blog/anyone-can-ring-your-doorbell",124
"Lisp in Web-Based Applications (2001)","https://sep.turbifycdn.com/ty/cdn/paulgraham/bbnexcerpts.txt",123
"A blueprint for formal verification of Apple corecrypto","https://security.apple.com/blog/formal-verification-corecrypto/",120
"Blood Pumping Mechanism of the Hoof (2020)","https://horses.extension.org/blood-pumping-mechanism-of-the-hoof/",119
"Reverse engineering circuitry in a Spacelab computer from 1980","https://www.righto.com/2026/05/reverse-engineering-spacelab-computer.html",117
"Ebola Outbreak Now Third Largest Recorded and "Spreading Rapidly"","https://arstechnica.com/health/2026/05/ebola-outbreak-now-third-largest-recorded-and-spreading-rapidly/",116
"Perceptual Image Codec: What Matters in Practical Learned Image Compression","https://apple.github.io/ml-pico/",115
"Mounting git commits as folders with NFS (2023)","https://jvns.ca/blog/2023/12/04/mounting-git-commits-as-folders-with-nfs/",115
"Converting an Integer to a Decimal String in Under Two Nanoseconds","https://onlinelibrary.wiley.com/doi/10.1002/spe.70079",114
"Silk: Open-source cooperative fiber scheduler","https://github.com/ClickHouse/silk",113
"New map reveals lost roads of the Roman Empire","https://www.scientificamerican.com/article/new-high-resolution-map-transforms-what-we-know-about-roman-roads-and-the-roman-empire/",112
"The first British person in space","https://www.bbc.com/culture/article/20260518-helen-sharman-the-story-behind-the-first-british-person-in-space",107
"White Rabbit – sub-nanosecond synchronization for large distributed systems","https://ohwr.org/projects/white-rabbit/",105
"Launch HN: Superset (YC P26) – IDE for the agents era","https://github.com/superset-sh/superset",105
"FatGid: FreeBSD 14.x kernel local privilege escalation","https://fatgid.io/",105
"CODA: Rewriting Transformer Blocks as GEMM-Epilogue Programs","https://arxiv.org/abs/2605.19269",105
"Show HN: Open-source .docx editor library for building document apps","https://github.com/eigenpal/docx-editor",105
"BambuStudio has been violating PrusaSlicer AGPL license since their fork","https://github.com/jarczakpawel/OrcaSlicer-bambulab/blob/main/bambu_agpl.md",105
"Neutron scattering explains why gluten-free pasta falls apart (2025)","https://phys.org/news/2025-09-science-spaghetti-neutron-gluten-free.html",103
"Launch HN: Runtime (YC P26) – Sandboxed coding agents for everyone on a team","https://www.runtm.com/",101
"Chess invariants","http://muratbuffalo.blogspot.com/2026/05/chess-invariants.html",100
"Thinking in an array language (2022)","https://github.com/razetime/ngn-k-tutorial/blob/main/12-thinking-in-k.md",100
"Mocked by a scandal sheet, Kierkegaard endured months of personal attacks","https://www.plough.com/en/topics/faith/discipleship/when-kierkegaard-got-cancelled",100
"Stable Audio 3","https://arxiv.org/abs/2605.17991",99
"Michael Keating has died","https://www.bigfinish.com/news/v/michael-keating-1947-2026",98
"Bug 1950764: Work Around Crash on Intel Raptor Lake CPU","https://phabricator.services.mozilla.com/D301917",97
"Show HN: CPU-only transcription for YouTube, TikTok, X, Instagram videos","https://github.com/kouhxp/yapsnap",97
"War game exposed U.S. vulnerability to low-tech warfare","https://nsarchive.gwu.edu/news/2024-11-01/rigged-war-game-exposed-us-vulnerability-low-tech-warfare",97
"PyTorch Landscape","https://pytorch.landscape2.io",97
"The TTY Demystified (2008)","https://www.linusakesson.net/programming/tty/index.php",96
"Building Pi with Pi","https://lucumr.pocoo.org/2026/5/24/pi-oss/",95
"Show HN: Agent.email – sign up via curl, claim with a human OTP","item?id=48225596",95
"Testing distributed systems with AI agents","https://github.com/shenli/distributed-system-testing",95
"ArcBrush – Node-based 2D image editor","https://arcbrush.com/",94
"Comparing an LZ4 Decompressor on Four Legacy CPUs","https://bumbershootsoft.wordpress.com/2026/05/09/comparing-an-lz4-decompressor-on-four-legacy-cpus/",94
"The Mercury logic programming system","https://github.com/Mercury-Language/mercury",94
"A scoping review of bicycling interventions’ impacts on well-being","https://www.frontiersin.org/journals/sports-and-active-living/articles/10.3389/fspor.2026.1807791/full",93
"What is a Demand Coop","https://cahootzcoops.com/blog/what-is-a-demand-coop",93
"Museum of Pocket Calculating Devices","https://www.calculators.de/",91
"Scientists solve 200-year-old puzzle of how tobacco plants make nicotine","https://www.york.ac.uk/news-and-events/news/2026/research/200-year-old-puzzle-tobacco-plants-nicotine/",89
"We Reverse-Engineered Docker Sandbox's Undocumented MicroVM API","https://rivet.dev/blog/2026-02-04-we-reverse-engineered-docker-sandbox-undocumented-microvm-api/",89
"Where are all the UK red telephone kiosks?","https://www.thek6project.co.uk/",89
"In 1979 engineer Hugh Padgham discovered "gated reverb" – by accident","https://producelikeapro.com/blog/how-one-recording-mistake-created-a-musical-phenomenon-in-the-80s/",89
"When Fast Fourier Transform Meets Transformer for Image Restoration (2024)","https://github.com/deng-ai-lab/SFHformer",88
"Lisp in Vim (2019)","https://susam.net/lisp-in-vim.html",87
"Using HTTP/2 Cleartext for a server in Go 1.24","https://www.clarityboss.com/blog/go-http2-cleartext-h2c-cloud-run",86
"Microsoft's 6502 BASIC is now Open Source (2025)","https://opensource.microsoft.com/blog/2025/09/03/microsoft-open-source-historic-6502-basic/",85
"A self-powered computer in actual credit-card size (~1mm thick)","https://old.reddit.com/r/electronics/comments/1td7yxl/i_built_a_fully_selfpowered_computer_in_actual/",85
"No way to parse integers in C (2022)","https://blog.habets.se/2022/10/No-way-to-parse-integers-in-C.html",85
"Artificial egg hatched 26 healthy chickens","https://www.nationalgeographic.com/science/article/artificial-egg-colossal-chickens-moa-dodo",84
"Magic the Gathering format: Fun 40","https://fabiensanglard.net/mtg/fun/",84
"All the bugs they found","https://andreapivetta.com/posts/all-the-bugs-they-found.html",84
"I love my Bluetooth keyboard","https://liquidbrain.net/blog/i-love-my-bluetooth-keyboard/",83
"What Is Happening to Publishing?","https://resobscura.substack.com/p/what-is-happening-to-publishing",83
"Noroboto: Lying Fonts and Mitigation in Rust","https://tritium.legal/blog/noroboto",82
"Swap tables, flash-friendly swap, swap_ops, and more","https://lwn.net/SubscriberLink/1072657/394b87abd7cc215e/",82
"Alignment pretraining: AI discourse creates self-fulfilling (mis)alignment","https://arxiv.org/abs/2601.10160",81
"IBM invented semiconductor manufacturing automation","https://spectrum.ieee.org/semiconductor-fabrication",80
"C constructs that still don't work in C++","https://lospino.so/blog/c-constructs-that-still-dont-work-in-cpp/",79
"Earth's Radio Bubble: Every signal we've ever sent into space","https://www.thescientificdrop.com/2026/05/earths-radio-bubble-every-signal-weve.html",78
"Highest Random Weight in Elixir","https://jola.dev/posts/highest-random-weight-in-elixir",77
"Simulating Infinity in Conway's Game of Life with Modern C++","https://ryanjk5.github.io/posts/GOLDE/",74
"Show HN: Superlog (YC P26) – Observability that installs itself and fixes bugs","https://superlog.sh/",73
"An automated A.I. WWE news channel on YouTube tries to pronounce "WWE"","https://twitter.com/LarryBundyJr/status/2058140468219707566",70
"A 1955 Los Alamos computer experiment changed our understanding of chaos","https://www.lanl.gov/media/publications/1663/science-of-unpredictability",69
"AI keeps inventing fake cases. Lawyers keep citing them","https://www.scientificamerican.com/article/why-lawyers-keep-citing-fake-cases-invented-by-ai/",69
"RISC-V and Floating-Point","https://fprox.substack.com/p/risc-v-and-floating-point",68
"HTML-in-Canvas Demos","https://github.com/GoogleChromeLabs/css-web-ui-demos/blob/main/html-in-canvas/awesome-html-in-canvas.md",67
"LAN-LOK: The Antarctic DOS Sabotage Game Lost for 34 Years","https://alphapixeldev.com/lan-lok-the-antarctic-dos-sabotage-game-lost-for-34-years-part-1/",66
"Deciphering the Hashihara Castle Town Map","https://www.obayashi.co.jp/en/kikan_obayashi/detail/kikan_64_project.html",66
"Autoregressive next token prediction and KV Cache in transformers","https://medium.com/advanced-deep-learning/autoregressive-next-token-prediction-kv-cache-in-transformers-afad22285baf",66
"Solving the “Zork” Mystery","https://www.dpolakovic.space/blogs/zork-part2",65
"Data Centers Now Consume 6% of US Electricity–and the Backlash Has Begun","https://singularityhub.com/2026/05/22/data-centers-now-consume-6-of-electricity-in-the-us-and-the-backlash-has-begun/",63
"We made our filesystem 47× faster by deleting it","https://microsandbox.dev/blog/oci-filesystem-47x-faster",62
"Waymo expands pause to four cities as robotaxis keep driving into floods","https://techcrunch.com/2026/05/21/waymo-pauses-service-in-four-cities-as-robotaxis-keep-driving-into-floods/",62
"Getting an old Computer online with Android Ethernet tethering","https://82mhz.net/posts/2026/05/getting-an-old-computer-online-with-android-ethernet-tethering/",61
"Curly braces: An evolution of Unix and C","https://thalia.dev/blog/unix-braces/",61
"Staged publishing and new install-time controls for npm","https://github.blog/changelog/2026-05-22-staged-publishing-and-new-install-time-controls-for-npm/",61
"Bun's unreleased Rust port has 13,365 unsafe blocks","https://bun.com/bun-unsafe-audit",61
"A new book about humanity's obsession with gold","https://www.economist.com/culture/2026/05/14/the-weird-wild-story-of-humanitys-obsession-with-gold",61
"Étienne Ghys: The Shape of Letters: From Leonardo da Vinci to Donald Knuth","https://www.youtube.com/watch?v=1OIxzewWilc",61
"Yeunjoo Choi from Igalia on Chromium","https://theconsensus.dev/p/2026/05/20/yeunjoo-choi-from-igalia-on-chromium.html",59
"What is the history of the ERROR_ARENA_TRASHED error code?","https://devblogs.microsoft.com/oldnewthing/20260519-00/?p=112339",58
"Iowa to mandate students take Intellectual Freedom classes amid low enrollment","https://www.kcrg.com/2026/05/20/iowa-lawmakers-move-mandate-students-take-center-intellectual-freedom-classes-amid-low-enrollment/",56
"Fast Factorial Algorithms","http://www.luschny.de/math/factorial/FastFactorialFunctions.htm",55
"Tool mapping 90 companies in the photonics and CPO supply chain","https://leonardo-boquillon.com/photonic-cop-supply-chain",55
"The two oldest printing presses","https://museumplantinmoretus.be/en/worlds-two-oldest-printing-presses",55
""Stick" – A primitive/fun interactive demo of a tiny rig to animate layout","https://cosmiciron.github.io/layoutmaster/exclusion-assembly.html",54
"CopyFail: From Pod to Host","https://xint.io/blog/copy-fail-pod-to-host",54
"Schlitz Is Gone, but First It's Getting One Last Hurrah","https://www.milwaukeemag.com/schlitz-is-gone/",52
"API proposed by Chrome: Declarative partial updates","https://developer.chrome.com/blog/declarative-partial-updates",52
"New Attack "Megaladon" Compromises 5.5K+ GitHub Repos","https://www.theregister.com/security/2026/05/22/megalodon-chums-the-waters-in-55k-github-repo-poisonings/5245342",52
"D. Trump Jr. and Eric Trump Running Felony Fraud Scheme Prosecutable in New York","https://cmarmitage.substack.com/p/donald-trump-jr-and-eric-trump-are",51
"PopuLoRA: Co-Evolving LLM Populations for Reasoning Self- Play","https://vmax.ai/team/populora-co-evolving-llm-populations-for-reasoning-self-play",51
"Simulated Evolution on the PICO-8","https://bumbershootsoft.wordpress.com/2026/05/16/simulated-evolution-on-the-pico-8/",51
"LoRA and Weight Decay (2023)","https://irhum.github.io/blog/lorawd/",50
"Byrne's Euclid","https://www.c82.net/euclid/",49
"Book Review: On the Calculation of Volume","https://www.stephendiehl.com/posts/calculation_of_volume/",48
"Show HN: Anyone interested in a tool helps to explore C++ ASTs","https://uvic-aurora.github.io/acav-manual/index.html",47
"The political polarization of health outcomes in the USA","https://www.nature.com/articles/s41562-026-02474-9",47
"Handling the great code forge fragmentation","https://www.alexselimov.com/posts/forge_fragmentation/",47
"Tobacco plant can produce five psychedelics, including psilocybin and DMT","https://phys.org/news/2026-04-tobacco-psychedelics-psilocybin-dmt.html",46
"Don't know where your data is from? Bayesian modeling for unknown coordinates","https://christopherkrapu.com/blog/2026/dont-know-where-your-data-is-from/",44
"1k-year-old dingo bones show that it was injured, cared for, and ritually buried","https://www.popsci.com/environment/dingo-bones-ritual-burial-australia/",44
"Neoclassical C++: segmented iterators revisited","https://boostedcpp.net/2026/05/18/neoclassical-c-segmented-iterators-revisited-1/",44
"Selling SaaS in Germany","https://embedworkflow.com/blog/selling-saas-in-germany-austria-and-switzerland-dach/",43
"Key, in sight – A guide, of sorts, to keyboard customization","https://aresluna.org/key-in-sight/",43
"We ended up with Palantir and how to replace it","https://berthub.eu/articles/posts/some-notes-on-palantir/",41
"Nvidia Removes Gaming Revenue Category from Financial Reports","https://www.guru3d.com/story/nvidia-removes-gaming-revenue-category-from-financial-reports/",41
"Thoughts on People and Blogs","https://afranca.com.br/thoughts-on-people-and-blogs/",40
"Why Do We Sleep Under Blankets, Even on the Hottest Nights? (2017)","https://www.atlasobscura.com/articles/blankets-summer-hot",39
"NeuralNote","https://github.com/DamRsn/NeuralNote",39
"West Coast Cities Turn to Vacancy Taxes to Grapple with Housing Crisis","https://www.theurbanist.org/west-coast-cities-turn-to-vacancy-taxes-to-grapple-with-housing-crisis/",38
"Domain-Camouflaged Injection Attacks Evade Detection in Multi-Agent LLM Systems","https://arxiv.org/abs/2605.22001",38
"Show HN: Pg_deltax, Apache-licensed alternative to TimescaleDB","https://github.com/xataio/deltax",38
"Tristan Davey's Punch Card Archive","https://punchcards.tristandavey.com/",37
"TorQ: Kdb+ Production Framework","https://github.com/DataIntellectTech/TorQ",35
"Gnutella: A Protocol Outliving the World That Created It","https://rickcarlino.com/notes/p2p/gnutella-explanation.html",35
"Bournegol??? (2014)","https://oldhome.schmorp.de/marc/bournegol.html",35
"Show HN: I Made a Claude Skill for Spec-Driven Development (SDD)","https://github.com/FredAntB/Spec-Driven-Development",35
"Show HN: Pablo – a Chrome extension that copies UI from any website","https://www.usepablo.dev/",33
"San Francisco immigration court shuts down after purge of judges","https://apnews.com/article/san-francisco-immigration-court-closed-asylum-8a0946a7cd4bcc9bd925d075cabef44a",32
"Anthropic blames dystopian sci-fi for training AI models to act "evil"","https://arstechnica.com/ai/2026/05/anthropic-blames-dystopian-sci-fi-for-training-ai-models-to-act-evil/",32
"Ordinary WiFi can now identify people with near perfect accuracy","https://www.sciencedaily.com/releases/2026/05/260522023127.htm",32
"Revised^7 Report on Scheme, Large: Procedural Fascicle Draft is now public","https://r7rs.org/large/fascicles/proc/",31
"Local LLMs perform better when you teach them to ask before they answer","https://www.xda-developers.com/local-llm-clarifying-questions-system-prompt/",31
"Java: Rethink Domain Primitives with Valhalla","https://dfa1.github.io/articles/rethink-domain-primitives-with-valhalla.html",31
"Serving Netflix Video Traffic at 400Gb/S and Beyond (2022) [pdf]","https://nabstreamingsummit.com/wp-content/uploads/2022/05/2022-Streaming-Summit-Netflix.pdf",31
"The day my ping took countermeasures","https://blog.cloudflare.com/the-day-my-ping-took-countermeasures/",30
"Triangle Tessellation with Clamped Parallelograms","https://filmicworlds.com/blog/compute-tessellation-with-clamped-parallelograms/",30
"Era: From Nature publication to catalyzing Computational Discovery","https://research.google/blog/empirical-research-assistance-era-from-nature-publication-to-catalyzing-computational-discovery/",30
"Companies Are Just a Graph of Algorithms","https://danielmiessler.com/blog/companies-graph-of-algorithms",29
"Jimmy Carr on Why Everyone Is Wrong About AI [video]","https://www.youtube.com/watch?v=jaYOskvlq18",29
"The Worlds Left to Conquer","https://ludic.mataroa.blog/blog/the-worlds-left-to-conquer/",28
"Evaluating Spec CPU2026","https://chipsandcheese.com/p/evaluating-spec-cpu2026",27
"Show HN: Yt-x v0.8.0 – Browse, play, and download YouTube from the terminal","https://github.com/Benexl/yt-x",27
"Ontology vs. Semantic Layer","https://lowhangingdata.com/article/ontology-vs-semantic-layer/",26
"The Hardware Lottery","https://hardwarelottery.github.io/",26
"Star Citizen game has reached $1B in funding","https://robertsspaceindustries.com/en/funding-goals",25
"Buildcraft Is a Compiler Problem","https://mitander.xyz/posts/buildcraft-is-a-compiler-problem/",24
"Bytecode VMs in surprising places (2024)","https://dubroy.com/blog/bytecode-vms-in-surprising-places/",23
"Cheap attack drones break through Israel's Iron Dome","https://www.dw.com/en/cheap-attack-drones-break-through-israels-iron-dome/a-77235132",23
"Of Course They Booed","https://2ndbreakfast.audreywatters.com/of-c/",23
"Show HN: Dari-docs – Optimize your docs using parallel coding agents","https://github.com/mupt-ai/dari-docs",23
"Earliest Uses of Various Mathematical Symbols","https://mathshistory.st-andrews.ac.uk/Miller/mathsym/",22
"Google is currently struggling to define words like disregard, stop and ignore","https://www.engadget.com/2179762/google-is-currently-struggling-to-define-words-like-disregard-stop-and-ignore/",22
"What it takes to transpose a matrix","https://gudok.xyz/transpose/",21
"There's Never Been a Better Time to Study Computer Science","https://www.theatlantic.com/technology/2026/05/computer-science-major-coding-ai/687279/",21
"C++26: More Function Wrappers","https://www.sandordargo.com/blog/2026/05/20/cpp26-copyable-function",21
"Show HN: Twixt – transform one word into another in four moves","https://twixt.games/",20
"Reflections on Building Forum Software","https://www.counting-stuff.com/reflections-on-building-forum-software/",20
"Ask HN: Did Messages get removed from Google Takeout?","item?id=48253165",20
"Alberta will vote on whether to remain part of Canada. What now?","https://www.bbc.com/news/articles/c809jg1gj9yo",18
"Awesome Neuroscience","https://github.com/analyticalmonk/awesome-neuroscience",17
"Gorilla: A fast, scalable, in-memory time series database (2016)","https://blog.acolyer.org/2016/05/03/gorilla-a-fast-scalable-in-memory-time-series-database/",16
"Miranda's Rescue was paid to save dogs, but is accused of killing them instead","https://kymkemp.com/2026/05/22/paid-to-save-them-accused-of-killing-them-the-investigation-of-mirandas-rescue/",16
"Just You Wait","https://shiflett.org/blog/2026/just-you-wait",16
"Show HN: Geomatic – a command-driven geometry studio enabled with autodiff","https://www.tinyvolt.com/geomatic",15
"We are Poles, so, of course, we print in Latin","https://www.ustc.ac.uk/news/we-are-poles-so-of-course-we-print-in-latin",15
"Official Kotlin Support for Visual Studio Code Is Now Available in Alpha","https://blog.jetbrains.com/kotlin/2026/05/official-kotlin-support-for-visual-studio-code-is-now-available-in-alpha/",15
"Snuffleupagus, a newly described species, is an adorable little predator","https://www.cbc.ca/radio/asithappens/snuffleupagus-fish-9.7207623",14
"Aube – Node.js package manager in Rust","https://aube.en.dev/",14
"When does learning from data work (math starting from basic probability)","https://prateekchandrajha.github.io/vc-rademacher.html",14
"Open Source Burnout Claims Another Project","https://vlad.website/nvim-treesitter-burnout/",14
"Show HN: A platform to find people to jam on side projects with","https://www.letsjam.live/",13
"Predicting the 2026 Bristol Bay and Kodiak Salmon Runs","https://www.salmonfinder.com/2026/05/13/bristol-bay-kodiak-predictions-2026",12
"Show HN: The Front Page – Newspaper-style front page for Hacker News","https://thefrontpage.dev/",12
"Show HN: Kanban CLI (A local-first, agent-first task manager for the terminal)","https://codeberg.org/hydrafog/kanban",12
"Parsing IPv6 Addresses Crazily Fast with AVX-512","https://lemire.me/blog/2026/05/23/parsing-ipv6-addresses-crazily-fast-with-avx-512/",12
"Limerick","https://www.worldwidewords.org/surprise.html",12
"The Forgotten Art of the LAN Party (2023)","https://www.superjumpmagazine.com/the-forgotten-art-of-the-lan-party/",12
"Google Discover's headline rewrites strike again","https://www.theverge.com/tech/936822/google-discovers-headline-rewrites-strike-again",12
"Jira Is Turing Complete","https://seriot.ch/computation/jira.html",12
"Trump Mobile Leaks Customers' Data and the Phone Isn't Even Out Yet","https://gizmodo.com/trump-mobile-leaks-customers-data-and-the-phone-isnt-even-out-yet-2000762600",12
"Ask HN: Why didn't the C64 come with Simons' BASIC in the box from 1983 onward?","item?id=48260307",11
"Show HN: A satirical idle game about running an AI startup","https://game.trae.academy/",11
"You Only Use 10% of Printf() – Here Are Things They Didn't Teach You [video]","https://www.youtube.com/watch?v=kdnN0kk7MS0",11
"$100 CPU Shootout: Comparing the Ryzen 5 5500, Core i3-14100F, & Core i3-12100F","https://www.tomshardware.com/pc-components/cpus/100-budget-cpu-shootout-ddr4",10
"CVE-2026-9256: Nginx 1.31.1 and 1.30.1","https://www.cve.org/CVERecord?id=CVE-2026-9256",10
"Self-hosted wikis shouldn't need an ops team","https://leafwiki.com/blog/self-hosted-wikis-shouldnt-need-an-ops-team/",10
"HP QuickWeb, Singular and Pointless","https://gekk.info/articles/hp-quickweb.htm",10
"Fatherhood Dramatically Rewires Your Brain","https://www.sciencealert.com/fatherhood-dramatically-rewires-your-brain-scans-reveal",9
"The Skeuomorphism Nobody Talks About [video]","https://www.youtube.com/watch?v=3Q-G9x315-g",9
"The Security of Ephemeral Pages","https://schalkneethling.com/posts/the-security-of-ephemeral-pages/",9
"Wildlife is watching us, too – and changing their behavior in response","https://news.yale.edu/2026/05/21/wildlife-watching-us-too-and-changing-their-behavior-response",9
"A new suite of modern tools for editing and publishing IETF RFCs","https://www.ietf.org/blog/new-tools-coming-for-editing-and-publishing-rfcs/",9
"The AWS Service Quotas That Will Take Down Your Production at 3 Am","https://medium.com/@yalovoy/the-aws-service-quotas-that-will-take-down-your-production-at-3-am-and-you-cannot-raise-them-fast-d88723fcfcb7",9
"DashAttention: Differentiable and Adaptable Sparse Hierarchical Attention","https://arxiv.org/abs/2605.18753",9
"Splinter Cell veteran says realistic modern lighting has screwed up stealth game","https://www.rockpapershotgun.com/splinter-cell-veteran-says-realistic-modern-lighting-has-screwed-up-stealth-games-it-gets-very-hard-to-tell-whats-light-whats-shadow-whats-dark-whats-safe",8
"Bullwhip Effect","https://en.wikipedia.org/wiki/Bullwhip_effect",8
"Linus Torvalds to 'start being more hardnosed' about 'pointless pull requests'","https://www.theregister.com/oses/2026/05/25/linus-torvalds-to-start-being-more-hardnosed-about-pointless-pull-requests-some-of-which-come-from-ais/5245549",8
"Claude Code MIT Dashboard","https://github.com/BEKO2210/My_Dash",8
"The XGO Programming Language","https://github.com/goplus/xgo",8
"Notes about reading messages with the Python email packages","https://utcc.utoronto.ca/~cks/space/blog/python/EmailPackagesNotes",7
"Dad Books Are a Dying Breed","https://www.wsj.com/business/media/dad-books-are-a-dying-breed-d9a28b49",7
"Understanding WebAuthn credential protection policy","https://pilcrowonpaper.com/blog/16",6
"Collabora and Flipper: Opening Up the RK3576","https://www.collabora.com/news-and-blog/news-and-events/collabora-flipper-opening-up-the-rk3576.html",6
"Apple Preparing New 'Gen AI' Website Ahead of WWDC","https://www.macrumors.com/2026/05/23/apple-gen-ai-subdomain/",6
"Python Articles","https://www.pythonmorsels.com/articles/",6
"Secure Boot and Microsoft CA Rollover – a heads-up for distributions","https://blog.einval.com/2026/05/22#secure_boot_ca_rollover",6
"Pope Leo Warns of Risks from A.I. In 42,300-Word Encyclical","https://www.nytimes.com/2026/05/25/world/europe/pope-leo-encyclical.html",5
"AI MOD Music Remastering at 32-bit 96 kHz","https://github.com/Kind-Computers/quinlight-audio",5
"Show HN: Play nbsdgames to increase your brain (exclamation mark)","https://github.com/abakh/nbsdgames",5
"Ask HN: Best worldwide / classic phone games?","item?id=48257769",5
"Eve Agent V2 Unleashed – open-source local coding agent, powered by Ollama, FREE","https://github.com/JeffGreen311/eve-agent-v2-unleashed",5
"Three Years of Abstractionless C","https://replicated.wiki/blog/abc",4
"First ever Cray T3D Supercomputer goes up for auction with $81,000 reserve","https://www.tomshardware.com/tech-industry/supercomputers/first-ever-cray-t3d-supercomputer-goes-up-for-auction-with-usd81-000-reserve-europes-fastest-supercomputer-in-june-1996-goes-on-the-block",4
"Show HN: Rendering Chinese text on a Commodore 64","https://github.com/lionello/han64",3
"Jensen–Shannon Divergence","https://en.wikipedia.org/wiki/Jensen%E2%80%93Shannon_divergence",3
"I Bypassed Adobe and Microsoft to Build a Git-Tracked Book Production Pipeline","https://www.djspeckhals.com/posts/2026-05-22-how-i-bypassed-adobe-and-microsoft-to-build-a-git-tracked-book-production-pipeline/",3
"Flick (YC F25) Is Hiring Front End Engineer to Build Figma for AI Filmmaking","https://www.ycombinator.com/companies/flick/jobs/Tdu6FH6-senior-frontend-engineer",0
