title,link,score
"The Fantasy of a Nonprofit Dating App","https://www.theatlantic.com/family/archive/2025/02/nonprofit-dating-app/681720/",22
"Luculent: Manually hinted monospace font, crisp at tiny sizes (2015)","http://eastfarthing.com/luculent/",22
"Show HN: Neuro Tools, a collection of tools to help neurodivergent people","https://neurotools.app",22
"Optimizing eBPF I/O latency accounting when running 37M IOPS, on 384 CPUs","https://tanelpoder.com/posts/optimizing-ebpf-biolatency-accounting/",21
"Over half of UK businesses who replaced workers with AI regret their decision","https://www.techradar.com/pro/over-half-of-uk-businesses-who-replaced-workers-with-ai-regret-their-decision",21
"Unpacking Packed Executables","https://neugierig.org/software/blog/2025/04/unpacking.html",21
"Pakistan pulled off one of the fastest solar revolutions in the world","https://www.cnn.com/2025/05/01/climate/pakistan-solar-boom",20
"Creating the Commodore 64: The Engineers' Story","https://spectrum.ieee.org/commodore-64",20
"BSSG – My journey from dynamic CMS to bash static site generator","https://it-notes.dragas.net/2025/04/07/launching-bssg-my-journey-from-dynamic-cms-to-bash-static-site-generator/",20
"Generating Mazes with Inductive Graphs (2017)","https://jelv.is/blog/Generating-Mazes-with-Inductive-Graphs/",20
"Thinking Forth (2011)","https://thinking-forth.sourceforge.net/",19
"Why is English so weirdly different from other languages?","https://aeon.co/essays/why-is-english-so-weirdly-different-from-other-languages",19
"Zuckerberg: "The average American has 3 friends, but has demand for 15"","https://twitter.com/romanhelmetguy/status/1917656951174947075",19
"Albert Stevens, the most radioactive man","https://en.wikipedia.org/wiki/Albert_Stevens",19
"Ukraine Is Turning to 18th Century Tech for Defense","https://spectrum.ieee.org/airships-drones-ukraine",19
"U.S. Economy Shrank in First Quarter","https://www.nytimes.com/2025/04/30/business/us-economy-gdp-tariffs.html",19
"STASI's Zersetzung and Modern Psychological Warfare","https://www.mariobekes.com.au/from-berlin-to-the-digital-age-stasis-zersetzung-and-the-modern-battle-of-psychological-warfare/",19
"Building Private Processing for AI Tools on WhatsApp","https://engineering.fb.com/2025/04/29/security/whatsapp-private-processing-ai-tools/",17
"The end of an AI that shocked the world: OpenAI retires GPT-4","https://arstechnica.com/ai/2025/04/the-ai-that-sparked-tech-panic-and-scared-world-leaders-heads-to-retirement/",17
"Beyond Performance: Measuring the environmental impact of analytical databases","https://arxiv.org/abs/2504.18980",17
"Show HN: Got laid off. Got sick of ghost jobs. Built something","https://app.ghostjobs.io/",17
"The Linux Memory Manager","https://nostarch.com/linux-memory-manager",17
"Tokyo Metropolitan Area Outer Underground Discharge Channel","https://www.japan.travel/en/spot/1524/",17
"Payment processors shouldn't be able to charge through an expired card","item?id=43840806",17
"Windows 11 users losing data due to Microsoft's forced BitLocker encryption","https://www.neowin.net/news/windows-11-users-reportedly-losing-data-due-to-microsofts-forced-bitlocker-encryption/",16
"Why MFA is getting easer to bypass and what to do about it","https://arstechnica.com/security/2025/05/phishing-attacks-that-defeat-mfa-are-easier-than-ever-so-what-are-we-to-do/",16
"Skin wounds in humans heal nearly three times slower than in other primates","https://phys.org/news/2025-04-skin-wounds-humans-slower-primates.html",16
"Self-Hosted RSS with FreshRSS, Docker, and Tailscale","https://eric.mann.blog/containerized-rss/",16
"Meander, a procedural river generator with beautiful visualizations","https://rarevolume.com/work/meander/",16
"Elon Musk's xAI in Memphis: 35 gas turbines, no air pollution permits","https://www.eenews.net/articles/elon-musks-xai-in-memphis-35-gas-turbines-no-air-pollution-permits/",16
"New Order Sparks 'Martial Law' Concerns","https://www.newsweek.com/donald-trump-new-order-sparks-martial-law-concerns-2065618",16
"World's largest '100 per cent electric' ship launched","https://www.abc.net.au/news/2025-05-02/incat-launches-worlds-largest-battery-electric-ship-hull096/105243498",15
"The most subversive thing you can do is blog","https://snook.ca/archives/writing/subversive",15
"American Wages Fall Behind as Cost of Health Insurance Triples Since 2000","https://www.moneygeek.com/resources/rising-cost-of-health-insurance/",15
"The ancient psychedelics myth: Tourists told stories 'they find interesting'","https://www.theguardian.com/science/2025/may/01/the-ancient-psychedelics-myth-people-tell-tourists-the-stories-they-think-are-interesting-for-them",15
"AI companions unsafe for teens under 18, researchers say","https://mashable.com/article/ai-companions-for-teens-unsafe",15
"Felix86: Play x86-64 games on RISC-V","https://github.com/OFFTKP/felix86",15
"Shoes on at home or shoes off? If you care about your health, it's a no-brainer","https://www.theguardian.com/lifeandstyle/commentisfree/2025/apr/30/shoes-on-at-home-or-shoes-off-if-you-care-about-your-health-its-a-no-brainer",15
"Forensic Fandom","https://exiledfan.substack.com/p/introducing-forensic-fandom",15
"The GLP-1 Saga Continues, and How","https://www.science.org/content/blog-post/glp-1-saga-continues-and-how",14
"Epic vs. Apple Contempt Order","https://www.documentcloud.org/documents/25924283-epic-v-apple-contempt-order/",14
"The entire 1941 Japanese film Kanzashi can be watched on its Wikipedia page","https://en.wikipedia.org/wiki/Ornamental_Hairpin",13
"NPM should remove the default license from new packages (ISC)","https://extremq.com/npm-default-license.html",13
"The DOS game from 1984 recreated","https://github.com/dominikwilkowski/beast",13
"Judge Rules Apple Violated Court Order on App Store Anti-Steering Provisions","https://daringfireball.net/2025/04/gonzales_rogers_apple_app_store_ruling",13
"Pkg.pl: An experimental package manager for Scryer Prolog","https://github.com/bakaq/pkg.pl",13
"Multiboard 3D Printed Storage System","https://www.multiboard.io",12
"Making of Monkeys.zip","https://www.lukeschaefer.dev/posts/making-of-monkeys/",12
"Just Because You Can Prove It Doesn't Make It True","https://www.nytimes.com/2025/04/30/books/review/proof-adam-kucharski.html",12
"Humble Bundle raises prices for Euro and Canadian subscribers","https://old.reddit.com/r/BuyFromEU/comments/1k7ycn9/humble_bundle_raises_prices_for_euro_and_canadian/",12
"The Joy of Aeroplane Mode Programming","https://blog.mattbearman.com/aeroplane-mode-code/",12
"Meta tightens privacy policy around Ray-Ban glasses to boost AI training","https://www.theverge.com/news/658602/meta-ray-ban-privacy-policy-ai-training-voice-recordings",12
"RSA cofounder: The world would've been better without cryptocurrencies","https://www.theregister.com/2025/04/29/crypto_pioneers/",12
"Apple referred to criminal prosecutor for 'thwarting' order to change App Store","https://www.ft.com/content/1ac69bc1-6269-4a18-9757-2528bc1e2673",12
"Janet Jackson's cursed bassline was the scourge of notebook makers for years","https://www.pcgamer.com/hardware/gaming-laptops/turns-out-janet-jacksons-laptop-crashing-cursed-bassline-was-the-scourge-of-notebook-makers-for-at-least-half-a-decade/",12
"Low Background Steel – Content from Before AI","https://lowbackgroundsteel.ai",12
"RustAssistant: Using LLMs to Fix Compilation Errors in Rust Code","https://www.microsoft.com/en-us/research/publication/rustassistant-using-llms-to-fix-compilation-errors-in-rust-code/",11
"Origins of common lung cancer that affects smokers discovered","https://medicalxpress.com/news/2025-05-common-lung-cancer-affects-smokers.html",11
"What USAF Bomber Pilots Would Wear During a Nuclear Apocalypse (2017)","https://www.twz.com/7975/this-is-what-usaf-bomber-pilots-would-wear-during-a-nuclear-apocalypse",11
"The SEP has achieved what Wikipedia can only dream of (2015)","https://qz.com/480741/this-free-online-encyclopedia-has-achieved-what-wikipedia-can-only-dream-of",11
"WebRTC sandbox – live demo of WebRTC datachannel/video/audio","https://turnwebrtc.com/sandbox",11
"Thirteen new MCP servers from Cloudflare you can use today","https://blog.cloudflare.com/thirteen-new-mcp-servers-from-cloudflare/",11
"Programming languages should have a tree traversal primitive","https://blog.tylerglaiel.com/p/programming-languages-should-have",11
"Node.js implementation of the BitTorrent DHT protocol","https://www.npmjs.com/package/bittorrent-dht",11
"Show HN: NanoAgent, zero-dependency 1k-LOC AI-agent runtime","https://github.com/hbbio/nanoagent",11
"Show HN: OSle – A 510 bytes OS in x86 assembly","https://github.com/shikaan/osle",10
"Fast(er) regular expression engines in Ruby","https://serpapi.com/blog/faster-regular-expression-engines-in-ruby/",10
"The antibiotic that takes the bite out of Lyme","https://news.northwestern.edu/stories/2025/04/the-antibiotic-that-takes-the-bite-out-of-lyme/?fj=1",10
"Quebec to ban cellphones in elementary and high schools","https://nationalpost.com/news/quebec-to-ban-cellphones-in-elementary-and-high-schools/wcm/2236fcf8-e1c2-4a05-afa8-304958896934",10
"Show HN: Self-Hosted HTTPS Tunnel in 300 LoC with Go, Caddy, and Cloudflare","https://nexo.sh/posts/building-your-own-https-tunnel/",10
"CNCF and Synadia Align on Securing the Future of the Nats.io Project","https://www.cncf.io/announcements/2025/05/01/cncf-and-synadia-align-on-securing-the-future-of-the-nats-io-project/",10
"The little-known database at the heart of Kennedy's vaccine conspiracy theory","https://www.nbcnews.com/health/health-news/kennedy-vaccine-safety-datalink-conspiracy-theory-rcna203411",10
"Understanding Information Architecture","https://prezi.com/aafmvya6bk7t/understanding-information-architecture/",10
"Raspberry Pi cuts product returns by 50% by changing up its pin soldering","https://arstechnica.com/gadgets/2025/04/raspberry-pi-cuts-product-returns-by-50-by-changing-up-its-pin-soldering/",10
"Making PyPI's test suite 81% faster","https://blog.trailofbits.com/2025/05/01/making-pypis-test-suite-81-faster/",9
"EFF: Security Experts Urging Trump Administration to Leave Chris Krebs Alone","https://www.eff.org/press/releases/eff-leads-prominent-security-experts-urging-trump-administration-leave-chris-krebs",9
"I Recorded Everything I Said for Three Months. AI Has Replaced My Memory","https://www.wsj.com/tech/personal-tech/ai-personal-assistant-wearable-tech-impressions-28156b57",9
"A affordable retrocomputer compatible with the C64","item?id=43857629",9
"PicoCalc Lisp Machine","http://www.ulisp.com/show?56ZO",9
"Reddit data breach: undeletes all your post & comments, again ...","https://old.reddit.com/r/privacy/comments/1kcmzy9/reddit_undeleted_your_posts_again/",9
"Comparison with Traditional Mathematics","https://aplwiki.com/wiki/Comparison_with_traditional_mathematics",9
"NASA's Psyche spacecraft hits a speed bump on the way to a metal asteroid","https://arstechnica.com/space/2025/04/engineers-probe-pressure-drop-in-psyche-spacecrafts-propulsion-system/",9
"Recognizing Patterns in Memory (2022)","https://www.timdbg.com/posts/recognizing-patterns/",9
"Jetbrains Mellum code completion model now on Hugging Face","https://blog.jetbrains.com/ai/2025/04/mellum-goes-open-source-a-purpose-built-llm-for-developers-now-on-hugging-face/",9
"New Quantum GPS Backup Is 50 Times More Precise Than Alternatives","https://singularityhub.com/2025/04/24/new-quantum-gps-backup-is-50-times-more-precise-than-state-of-the-art-alternatives/",9
"Behavioral Sink","https://en.wikipedia.org/wiki/Behavioral_sink",9
"New species of methane-producing archaea discovered in the human gut","https://phys.org/news/2025-04-microbiologists-species-methane-archaea-human.html",8
"Chariot and Saucer","https://jewishreviewofbooks.com/american-jewry/18531/chariot-and-saucer/",8
"Show HN: I made an AI that generates SVG logos","https://vanlogo.co/?may",8
"GCC 15 is now available, with support for more draft C++26 features","https://isocpp.org//blog/2025/05/gcc-15-is-now-available-with-support-for-more-draft-cpp26-features1",8
"Meta's Reality Labs posts $4.2B loss in first quarter","https://www.cnbc.com/2025/04/30/metas-reality-labs-posts-4point2-billion-loss-in-first-quarter.html",8
"Llama2.c64: a port of llama2.c to the Commodore C64","https://github.com/ytmytm/llama2.c64",8
"Well, That's One Way to Address America's Vaping Problem","https://www.theatlantic.com/health/archive/2025/04/vapes-china-tariffs-trump/682647/",8
"Study links PFAS contamination of drinking water to a range of rare cancers","https://keck.usc.edu/news/study-links-pfas-contamination-of-drinking-water-to-a-range-of-rare-cancers/",8
"DragonFlyBSD 6.4.1 Released","https://www.dragonflybsd.org/release64/",8
"Restoring oil wells back to nature with moss","https://uwaterloo.ca/news/restoring-oil-wells-back-nature-moss",8
"Microsoft Telnet Server MS-TNAP Authentication Bypass","https://github.com/gavz/hfwintelnet",8
"Medicine Spares Cancer Patients from Grisly Surgeries and Harsh Therapies","https://www.nytimes.com/2025/04/27/health/cancer-immunotherapy-solid-tumors.html",8
"The danger of target=_blank and opener","https://www.pixelstech.net/article/1537002042-the-danger-of-target%3d_blank-and-opener",8
"Show HN: Maybe – The personal finance app for everyone","https://maybefinance.com/",7
"Upstream Linux support for Rockchip RK3588","https://www.collabora.com/news-and-blog/news-and-events/rockchip-rk3588-upstream-support-progress-future-plans.html",7
"Establishment of the Religious Liberty Commission","https://www.whitehouse.gov/presidential-actions/2025/05/establishment-of-the-religious-liberty-commission/",7
"Zuck's vision would wipe out the way the whole ad stack works","https://www.theverge.com/meta/659506/mark-zuckerberg-ai-facebook-ads",7
"Ngrok is also now your Kubernetes ingress","https://ngrok.com/blog-post/ngrok-kubernetes-ingress",7
"Art of the Hedgerow","https://engelsbergideas.com/notebook/the-art-of-the-hedgerow/",7
"Juno reveals Io's inner structure and volcanic activity; investigates cyclones","https://www.nasaspaceflight.com/2025/04/juno-io-jupiter-cyclones/",7
"Two-phase chip cooling with manifold-capillary structures enables 10⁵ COP","https://www.sciencedirect.com/science/article/pii/S2666386425001195",6
"Apple updates App Store Guidelines to allow links to external payments","https://9to5mac.com/2025/05/01/apple-app-store-guidelines-external-links/",6
"Solar panels to be fitted on all new-build homes in England by 2027","https://www.theguardian.com/environment/2025/may/01/solar-panels-fitted-all-new-build-homes-england-by-2027",6
"Autonomous trucks in Texas, no safety driver","https://www.axios.com/2025/05/01/autonomous-vehicles-trucks-aurora-texas-pastries",6
"The digital countermove to Trump tariffs","https://www.ft.com/content/b882f3a7-f8c9-4247-9662-3494eb37c30b",6
"Language equivariance as a way of figuring out what an AI "means"","https://www.lesswrong.com/posts/wfDfPCkPcvi4N7tZN/alignment-from-equivariance-ii-language-equivariance-as-a",6
"Elvish – Powerful scripting language and versatile interactive shell","https://github.com/elves/elvish",6
"Ask HN: Parents of young kids: how do you teach that hitting is not acceptable?","item?id=43854137",6
"Army made a tank it doesn't need and can't use. Now it's figuring out what to do","https://www.defenseone.com/policy/2025/04/army-made-tank-it-doesnt-need-and-cant-use-now-its-figuring-out-what-do-it/404877/",5
"Gonzalez Rogers Rules That Apple Violated Her 2021 Court Order","https://daringfireball.net/2025/04/gonzales_rogers_apple_app_store_ruling",5
"The first driverless semis have started running regular longhaul routes","https://www.cnn.com/2025/05/01/business/first-driverless-semis-started-regular-routes",5
"Things XSLT can't do (2012)","https://archive.ph/2dly2",5
"Wget to Wipeout: Malicious Go Modules Fetch Destructive Payload","https://socket.dev/blog/wget-to-wipeout-malicious-go-modules-fetch-destructive-payload",5
"Apple must pay Optis $502M lump sum in UK patent dispute, court rules","https://www.reuters.com/world/uk/apple-must-pay-optis-502-million-lump-sum-uk-patent-dispute-court-rules-2025-05-01/",5
"Grindr Pivots to Anthropic, Amazon to Power AI Wingman Feature","https://www.bloomberg.com/news/articles/2025-04-30/grindr-pivots-to-anthropic-amazon-to-power-ai-wingman-feature",5
"Snake halts Japanese bullet trains after wrapping around power line","https://www.bbc.com/news/articles/cx26zn3340yo",5
"Amid tariff turmoil, these warehouses are in big demand in L.A","https://www.latimes.com/business/story/2025-05-01/jump-in-demand-for-bonded-warehouses-that-delay-tariff-payments",5
"Mixture of Tunable Experts-DeepSeek R1 Behavior Modification at Inference Time","https://huggingface.co/blog/rbrt/mixture-of-tunable-experts",5
"Fixing web browser history leaks","https://blog.lukaszolejnik.com/fixing-web-browser-history-leaks/",5
"American dads are spending more time with their kids since Covid","https://www.nytimes.com/2025/04/30/opinion/father-child-care-pandemic.html",5
"Democrats and Republicans Cite Science","https://www.nature.com/articles/d41586-025-01311-9",5
"Bypassing a web application firewall with autocomplete","https://jessie.cafe/posts/bypassing-a-waf-with-autocomplete/",4
"Eco-voxels: reconfigurable building blocks for Earth and space construction","https://techxplore.com/news/2025-04-eco-voxels-reconfigurable-blocks-earth.html",4
"GitHub now provides a warning about hidden Unicode text","https://github.blog/changelog/2025-05-01-github-now-provides-a-warning-about-hidden-unicode-text/",4
"Fusion Reactor Called 'Norm' Could Outperform Everything We've Built So Far","https://gizmodo.com/fusion-reactor-called-norm-could-outperform-everything-weve-built-so-far-2000595322",4
"Libogc Allegations Rock Wii Homebrew Community","https://hackaday.com/2025/05/01/libogc-allegations-rock-wii-homebrew-community/",4
"Nvidia and Anthropic Clash over AI Chip Export Controls","https://www.cnbc.com/2025/05/01/nvidia-and-anthropic-clash-over-us-ai-chip-restrictions-on-china.html",4
"'Dream OLED' with blue PHOLED ready for mass production, says LG Display","https://www.flatpanelshd.com/news.php?subaction=showfull&id=1746074116",4
"$100K in 48 Hours: Inside Osmo's Membership Site Launch","https://www.youtube.com/watch?v=nH3ulhZBMbY",4
"Windows has trouble finding Win32 resource if it contains an accented character","https://devblogs.microsoft.com/oldnewthing/20250430-00/?p=111129",3
"New study reveals how cleft lip and cleft palate can arise","https://news.mit.edu/2025/new-study-reveals-how-cleft-lip-and-cleft-palate-can-arise-0417",3
"Intel details 14A performance and Turbo Cells for maximum CPU and GPU frequency","https://www.tomshardware.com/pc-components/cpus/intel-details-14a-performance-and-new-turbo-cells-that-unlock-maximum-cpu-and-gpu-frequency",3
"Elite athletes warned to avoid one-night stands over risk of failing drug tests","https://www.theguardian.com/sport/2025/may/01/elite-athletes-warned-to-avoid-one-night-stands-over-risk-of-failing-drug-tests",3
"Waypoint Transit (YC W25) is hiring a software engineer","https://www.workatastartup.com/jobs/75517",0
