title,link,score
"US power demand to reach record highs in 2026–2027 driven by AI and data centers","https://www.reuters.com/business/energy/us-power-use-beat-record-highs-2026-2027-ai-use-surges-eia-says-2026-04-07/",13
"US Navy tests laser weapon that shoots down drones on the USS George H.W. Bush","https://www.tomshardware.com/tech-industry/us-navy-tests-laser-weapon-that-shoots-down-drones-on-the-uss-george-h-w-bush-supercarrier-system-tracked-engaged-and-neutralized-multiple-target-drones-has-essentially-unlimited-power-source",13
"Voice Modems","https://computer.rip/2026-04-26-voice-modems.html",12
"The disappearing AI middle class","https://thenewstack.io/disappearing-ai-middle-class/",12
"Utah data center will generate and consume more power than state, nears approval","https://www.sltrib.com/news/2026/04/25/hyperscale-data-center-may-be/",12
"Show HN: Talisman – A Android instrument played with two thumbs","https://talisman.by-igor.com/",12
"How OpenAI Kills Oracle","https://www.wheresyoured.at/how-openai-kills-oracle/",12
"Useknockout – open-source background removal API, 40× cheaper than remove.bg","https://github.com/useknockout/api",12
"Avnac: Open-source local-first Canva alternative","https://avnac.design/",12
"Simple Sabotage of Agents","https://alexschroeder.ch/view/2026-03-12-agent-sabotage",11
"How I leared what a decoupling capacitor is for, the hard way","https://nbelakovski.substack.com/p/how-i-learned-what-a-decoupling-capacitor",11
"Show HN: Agent MCP Studio – build multi-agent MCP systems in a browser tab","https://www.agentmcp.studio",11
"Software engineering may no longer be a lifetime career","https://www.seangoedecke.com/software-engineering-may-no-longer-be-a-lifetime-career/",10
"High energy sports drinks boost performance even if you spit them out","https://www.theguardian.com/science/2009/apr/15/high-energy-carbohydrate-drinks-performance-brain",10
"Trump's Final Term Ends in 999 Days (Countdown)","https://logwork.com/countdown-h5o4",10
"Former MIT president says the US is losing the innovation race to China","https://www.npr.org/2026/04/25/nx-s1-5772703/former-mit-president-says-the-us-is-losing-the-innovation-race-to-china",10
"The Military Rockets That Launched the Space Age (2023)","https://airandspace.si.edu/stories/editorial/military-rockets-launched-space-age",9
"Show HN: Matrirc – run irssi in 2026, talk to people on Matrix","https://github.com/pawelb0/matrirc",9
"Our Principles","https://openai.com/index/our-principles/",9
"Apple IIc: A smaller, sleeker Apple II from 1984","https://dfarq.homeip.net/apple-iic/",9
"The bull case for graph DBs in law","https://alanyahya.com/writing/bull-case-graph-dbs-law",9
"Enterprises Are Rethinking Kubernetes","https://www.infoworld.com/article/4161056/enterprises-are-rethinking-kubernetes.html",9
"Things C++26 define_static_array can't do","https://quuxplusone.github.io/blog/2026/04/24/define-static-array/",7
"Remembering the 1984 Unix PC. Why did it fail so hard?","https://tech.slashdot.org/story/26/04/26/2038235/remembering-the-1984-unix-pc-why-did-it-fail-so-hard",7
"Spanish archaeologists discover trove of ancient shipwrecks in Bay of Gibraltar","https://www.theguardian.com/science/2026/apr/15/hidden-treasures-spanish-archaeologists-discover-trove-of-ancient-shipwrecks-in-bay-of-gibraltar",7
"A New Idea to Save the Climate? Dam the Bering Strait.","https://www.nytimes.com/2026/04/24/climate/amoc-bering-strait-dam.html",7
"Boats crash/break and can kill their passengers when falling certain distances","https://bugs.mojang.com/browse/MC/issues/MC-119369",7
"DeepSeek V4 is a display of Huawei AI chip's capabilities","https://www.technologyreview.com/2026/04/24/1136422/why-deepseeks-v4-matters/",6
"Oil jumps, stock futures slip as US-Iran talks stall","https://www.reuters.com/business/energy/global-markets-global-markets-2026-04-26/",6
"How to Kill a Philosophical Zombie","https://sopathaye.substack.com/p/how-to-kill-a-philosophical-zombie",6
""That's how floating point errors and triangle numbers solved a mystery."","https://unsung.aresluna.org/thats-how-floating-point-errors-and-triangle-numbers-solved-a-mystery/",6
"SciRS2 – Scientific Computing and AI in Rust without C/C++/Fortran dependencies","https://github.com/cool-japan/scirs",6
"Feels like a good time to seriously rethink how OSs and UIs are designed","https://twitter.com/sama/status/2048428561481265539",5
"Millions Are Turning to a Cheaper, Electricity-Free Cooling Solution","https://economictimes.indiatimes.com/news/international/us/say-goodbye-to-traditional-air-conditioning-millions-are-turning-to-a-cheaper-electricity-free-cooling-solution/articleshow/130510992.cms?from=mdr",5
"A ShaderToy-like playground for ASCII art","https://play.ertdfgcvb.xyz",5
"New Type of Neuroplasticity Rewires the Brain After a Single Experience","https://www.quantamagazine.org/a-new-type-of-neuroplasticity-rewires-the-brain-after-a-single-experience-20260424/",5
"Kenya's Sebastian Sawe becomes first man to run sub two-hour marathon","https://www.cnn.com/2026/04/26/sport/sabastian-sawe-marathon-world-record",5
"Adding a team was the wrong strategic decision","https://learnings.aleixmorgadas.dev/p/adding-a-team-was-the-wrong-strategic",5
"10-cm Japanese origami CubeSat unfolds to 25X its folded size","https://newatlas.com/space-systems/japanese-origami-cubesat/",5
"Show HN: Paper Millionaire – A Startup Stock Option Horror Roguelike","https://paper-millionaire.pagey.site/",4
"Liebherr delivers electric excavator to Bulgarian copper mine","https://electrek.co/2026/04/26/liebherr-delivers-330-ton-electric-excavator-to-bulgarian-copper-mine/",4
"The Pareto principle is how AI takes jobs","https://www.msn.com/en-us/money/smallbusiness/the-pareto-principle-is-how-ai-actually-takes-jobs/ar-AA212n3N",4
"Getting my daily news from a dot matrix printer 2024","https://aschmelyun.com/blog/getting-my-daily-news-from-a-dot-matrix-printer/",4
"Legendary Qualcomm, Apple, and Nuvia alumni form new CPU startup – Nuvacore","https://www.tomshardware.com/pc-components/cpus/legendary-qualcomm-apple-and-nuvia-alumni-form-new-cpu-startup-nuvacore-promises-to-rewrite-the-rules-of-silicon",4
"Annotated source code for the Elite Demonstration Disc","https://elite.bbcelite.com/demo/",4
"China blocks Meta's $2B purchase of AI startup Manus","https://finance.yahoo.com/sectors/technology/articles/china-blocks-foreign-acquisition-ai-082548254.html",3
"Stt.ai MCP Server","https://pypi.org/project/sttai-mcp/0.1.0/",3
"Graphite open source hybrid image editor","https://www.graphite.art/",3
"Terra API (YC W21) Hiring: Applied AI Strategist (Health Intelligence)","https://www.ycombinator.com/companies/terra-api/jobs/DY7BCZU-applied-ai-strategist-market-intelligence-health",0
