title,link,score
"Founder of GitLab battles cancer by founding companies","https://sytse.com/cancer/",1356
"Wine 11 rewrites how Linux runs Windows games at kernel with massive speed gains","https://www.xda-developers.com/wine-11-rewrites-linux-runs-windows-games-speed-gains/",1304
"Goodbye to Sora","https://twitter.com/soraofficialapp/status/2036532795984715896",1140
"Thoughts on slowing the fuck down","https://mariozechner.at/posts/2026-03-25-thoughts-on-slowing-the-fuck-down/",1119
"Microsoft's "fix" for Windows 11","https://www.sambent.com/microsofts-plan-to-fix-windows-11-is-gaslighting/",1046
"Why so many control rooms were seafoam green (2025)","https://bethmathews.substack.com/p/why-so-many-control-rooms-were-seafoam",1035
"Running Tesla Model 3's computer on my desk using parts from crashed cars","https://bugs.xdavidhu.me/tesla/2026/03/23/running-tesla-model-3s-computer-on-my-desk-using-parts-from-crashed-cars/",977
"Tell HN: Litellm 1.82.7 and 1.82.8 on PyPI are compromised","https://github.com/BerriAI/litellm/issues/24512",935
"Spanish legislation as a Git repo","https://github.com/EnriqueLop/legalize-es",799
"AI overly affirms users asking for personal advice","https://news.stanford.edu/stories/2026/03/ai-advice-sycophantic-models-research",771
"People inside Microsoft are fighting to drop mandatory Microsoft Account","https://www.windowscentral.com/microsoft/windows-11/people-inside-microsoft-are-fighting-to-drop-windows-11s-mandatory-microsoft-account-requirements-during-setup",755
"Apple Business","https://www.apple.com/newsroom/2026/03/introducing-apple-business-a-new-all-in-one-platform-for-businesses-of-all-sizes/",728
"LinkedIn uses 2.4 GB RAM across two tabs","item?id=47561489",724
"Claude Code Cheat Sheet","https://cc.storyfox.cz",697
"Apple discontinues the Mac Pro","https://9to5mac.com/2026/03/26/apple-discontinues-the-mac-pro/",656
"Hold on to Your Hardware","https://xn--gckvb8fzb.com/hold-on-to-your-hardware/",652
"Show HN: I took back Video.js after 16 years and we rewrote it to be 88% smaller","https://videojs.org/blog/videojs-v10-beta-hello-world-again",644
"Shell Tricks That Make Life Easier (and Save Your Sanity)","https://blog.hofstede.it/shell-tricks-that-actually-make-life-easier-and-save-your-sanity/",639
"ChatGPT won't let you type until Cloudflare reads your React state","https://www.buchodi.com/chatgpt-wont-let-you-type-until-cloudflare-reads-your-react-state-i-decrypted-the-program-that-does-it/",636
"I decompiled the White House's new app","https://thereallo.dev/blog/decompiling-the-white-house-app",633
"Go hard on agents, not on your filesystem","https://jai.scs.stanford.edu/",617
"Anatomy of the .claude/ folder","https://blog.dailydoseofds.com/p/anatomy-of-the-claude-folder",615
"Miscellanea: The War in Iran","https://acoup.blog/2026/03/25/miscellanea-the-war-in-iran/",603
"The 'paperwork flood': How I drowned a bureaucrat before dinner","https://sightlessscribbles.com/posts/the-paperwork-flood/",592
"TurboQuant: Redefining AI efficiency with extreme compression","https://research.google/blog/turboquant-redefining-ai-efficiency-with-extreme-compression/",569
"Flighty Airports","https://flighty.com/airports",567
"Say No to Palantir in Europe","https://action.wemove.eu/sign/2026-03-palantir-petition-EN",553
"Copilot edited an ad into my PR","https://notes.zachmanson.com/copilot-edited-an-ad-into-my-pr/",544
"Nitrile and latex gloves may cause overestimation of microplastics","https://news.umich.edu/nitrile-and-latex-gloves-may-cause-overestimation-of-microplastics-u-m-study-reveals/",542
"Make macOS consistently bad unironically","https://lr0.org/blog/p/macos/",532
"Voyager 1 runs on 69 KB of memory and an 8-track tape recorder","https://techfixated.com/a-1977-time-capsule-voyager-1-runs-on-69-kb-of-memory-and-an-8-track-tape-recorder-4/",526
"ARC-AGI-3","https://arcprize.org/arc-agi/3",497
"FCC updates covered list to include foreign-made consumer routers","https://www.fcc.gov/document/fcc-updates-covered-list-include-foreign-made-consumer-routers",495
"Jury finds Meta liable in case over child sexual exploitation on its platforms","https://www.cnn.com/2026/03/24/tech/meta-new-mexico-trial-jury-deliberation",488
"CSS is DOOMed","https://nielsleenheer.com/articles/2026/css-is-doomed-rendering-doom-in-3d-with-css/",482
"Epoch confirms GPT5.4 Pro solved a frontier math open problem","https://epoch.ai/frontiermath/open-problems/ramsey-hypergraphs",480
"Apple randomly closes bug reports unless you "verify" the bug remains unfixed","https://lapcatsoftware.com/articles/2026/3/11.html",470
"Desk for people who work at home with a cat","https://soranews24.com/2026/03/27/japan-now-has-a-special-desk-for-people-who-work-at-home-with-a-pet-catphotos/",458
"I Built an Open-World Engine for the N64 [video]","https://www.youtube.com/watch?v=lXxmIw9axWw",452
"Iran-linked hackers breach FBI director's personal email","https://www.reuters.com/world/us/iran-linked-hackers-claim-breach-of-fbi-directors-personal-email-doj-official-2026-03-27/",448
"I wanted to build vertical SaaS for pest control, so I took a technician job","https://www.onhand.pro/p/i-wanted-to-build-vertical-saas-for-pest-control-i-took-a-technician-job-instead",446
"My minute-by-minute response to the LiteLLM malware attack","https://futuresearch.ai/blog/litellm-attack-transcript/",438
"The Cognitive Dark Forest","https://ryelang.org/blog/posts/cognitive-dark-forest/",435
"Arm AGI CPU","https://newsroom.arm.com/blog/introducing-arm-agi-cpu",422
"AI got the blame for the Iran school bombing. The truth is more worrying","https://www.theguardian.com/news/2026/mar/26/ai-got-the-blame-for-the-iran-school-bombing-the-truth-is-far-more-worrying",405
"Supreme Court Sides with Cox in Copyright Fight over Pirated Music","https://www.nytimes.com/2026/03/25/us/politics/supreme-court-cox-music-copyright.html",402
"A Faster Alternative to Jq","https://micahkepe.com/blog/jsongrep/",392
"Police used AI facial recognition to wrongly arrest TN woman for crimes in ND","https://www.cnn.com/2026/03/29/us/angela-lipps-ai-facial-recognition",391
"GitHub is once again down","https://www.githubstatus.com/incidents/kp06czybl7dw",386
"South Korea Mandates Solar Panels for Public Parking Lots","https://www.reutersconnect.com/item/south-korea-mandates-solar-panels-for-public-parking-lots/dGFnOnJldXRlcnMuY29tLDIwMjY6bmV3c21sX01UMU5VUlBITzAwMFZKRjFZQQ",378
"VitruvianOS – Desktop Linux Inspired by the BeOS","https://v-os.dev",366
"Neovim 0.12.0","https://github.com/neovim/neovim/releases/tag/v0.12.0",358
"Olympic Committee bars transgender athletes from women’s events","https://www.nytimes.com/2026/03/26/world/olympics/ioc-transgender-athletes-ban.html?unlocked_article_code=1.WFA.U8U0.iEs61HsUkQj5",358
"‘Energy independence feels practical’: Europeans building mini solar farms","https://www.euronews.com/2026/03/26/suddenly-energy-independence-feels-practical-europeans-are-building-mini-solar-farms-at-ho",352
"False claims in a widely-cited paper","https://statmodeling.stat.columbia.edu/2026/03/24/false-claims-in-a-published-no-corrections-no-consequences-welcome-to-the-business-school/",340
"Swift 6.3","https://www.swift.org/blog/swift-6.3-released/",339
"FreeCAD  v1.1","https://blog.freecad.org/2026/03/25/freecad-version-1-1-released/",338
"Show HN: I put an AI agent on a $7/month VPS with IRC as its transport layer","https://georgelarson.me/writing/2026-03-23-nullclaw-doorman/",337
"Log File Viewer for the Terminal","https://lnav.org/",335
"Data centers are transitioning from AC to DC","https://spectrum.ieee.org/data-center-dc",335
"CERN uses ultra-compact AI models on FPGAs for real-time LHC data filtering","https://theopenreader.org/Journalism:CERN_Uses_Tiny_AI_Models_Burned_into_Silicon_for_Real-Time_LHC_Data_Filtering",325
"Cocoa-Way – Native macOS Wayland compositor for running Linux apps seamlessly","https://github.com/J-x-Z/cocoa-way",322
"From zero to a RAG system: successes and failures","https://en.andros.dev/blog/aa31d744/from-zero-to-a-rag-system-successes-and-failures/",322
"Miasma: A tool to trap AI web scrapers in an endless poison pit","https://github.com/austin-weeks/miasma",318
"LG's new 1Hz display is the secret behind a new laptop's battery life","https://www.pcworld.com/article/3096432/lgs-new-1hz-display-is-the-secret-behind-a-new-laptops-battery-life.html",317
"AMD's Ryzen 9 9950X3D2 Dual Edition crams 208MB of cache into a single chip","https://arstechnica.com/gadgets/2026/03/amds-ryzen-9-9950x3d2-dual-edition-crams-208mb-of-cache-into-a-single-chip/",309
"John Bradley, author of xv, has died","https://voxday.net/2026/03/25/rip-john-bradley/",309
"Pretext: TypeScript library for multiline text measurement and layout","https://github.com/chenglou/pretext",304
"The bee that everyone wants to save","https://naturalist.bearblog.dev/the-bee-that-everyone-wants-to-save/",284
"A nearly perfect USB cable tester","https://blog.literarily-starved.com/2026/02/technology-the-nearly-perfect-usb-cable-tester-does-exist/",280
"Full network of clitoral nerves mapped out for first time","https://www.theguardian.com/society/2026/mar/29/full-network-clitoral-nerves-mapped-out-first-time-women-pelvic-surgery",278
"Windows 3.1 tiled background .bmp archive","https://github.com/andreasjansson/win-3.1-backgrounds",275
"Government agencies buy commercial data about Americans in bulk","https://www.npr.org/2026/03/25/nx-s1-5752369/ice-surveillance-data-brokers-congress-anthropic",271
"We rewrote JSONata with AI in a day, saved $500k/year","https://www.reco.ai/blog/we-rewrote-jsonata-with-ai",270
"No Terms. No Conditions","https://notermsnoconditions.com",259
"New Apple Silicon M4 and M5 HiDPI Limitation on 4K External Displays","https://smcleod.net/2026/03/new-apple-silicon-m4-m5-hidpi-limitation-on-4k-external-displays/",255
"Further human + AI + proof assistant work on Knuth's "Claude Cycles" problem","https://twitter.com/BoWang87/status/2037648937453232504",253
"CERN to host a new phase of Open Research Europe","https://home.cern/news/news/cern/cern-host-europes-flagship-open-access-publishing-platform",253
"CERN to host a new phase of Open Research Europe","https://home.cern/news/news/cern/cern-host-europes-flagship-open-access-publishing-platform",253
"Claude Code runs Git reset –hard origin/main against project repo every 10 mins","https://github.com/anthropics/claude-code/issues/40710",244
"Philly courts will ban all smart eyeglasses starting next week","https://www.inquirer.com/news/philadelphia/smart-glasses-ai-meta-courts-20260326.html",238
"Linux is an interpreter","https://astrid.tech/2026/03/28/0/linux-is-an-interpreter/",238
"HyperAgents: Self-referential self-improving agents","https://github.com/facebookresearch/hyperagents",233
"C++26 is done: ISO C++ standards meeting Trip Report","https://herbsutter.com/2026/03/29/c26-is-done-trip-report-march-2026-iso-c-standards-meeting-london-croydon-uk/",232
"Everything old is new again: memory optimization","https://nibblestew.blogspot.com/2026/03/everything-old-is-new-again-memory.html",226
"ISBN Visualization","https://annas-archive.gd/isbn-visualization?",224
"Hypura – A storage-tier-aware LLM inference scheduler for Apple Silicon","https://github.com/t8/hypura",221
"The bot situation on the internet is worse than you could imagine","https://gladeart.com/blog/the-bot-situation-on-the-internet-is-actually-worse-than-you-could-imagine-heres-why",218
"Alzheimer's disease mortality among taxi and ambulance drivers (2024)","https://www.bmj.com/content/387/bmj-2024-082194",215
"Debunking Zswap and Zram Myths","https://chrisdown.name/2026/03/24/zswap-vs-zram-when-to-use-what.html",214
"The first 40 months of the AI era","https://lzon.ca/posts/other/thoughts-ai-era/",212
"Earthquake scientists reveal how overplowing weakens soil at experimental farm","https://www.washington.edu/news/2026/03/19/earthquake-scientists-reveal-how-overplowing-weakens-soil-at-experimental-farm/",212
"Sodium-ion EV battery breakthrough delivers 11-min charging and 450 km range","https://electrek.co/2026/03/25/sodium-ion-ev-battery-delivers-11-min-charging-450-km-range/",206
"OpenTelemetry profiles enters public alpha","https://opentelemetry.io/blog/2026/profiles-alpha/",203
"Opera: Rewind The Web to 1996 (Opera at 30)","https://www.web-rewind.com",197
"Velxio 2.0 – Emulate Arduino, ESP32, and Raspberry Pi 3 in the Browser","https://github.com/davidmonterocrespo24/velxio",195
"Slovenia becomes first EU country to introduce fuel rationing","https://www.bbc.com/news/articles/c77m4zx6zvmo",193
"OpenCiv1 – open-source rewrite of Civ1","https://github.com/rajko-horvat/OpenCiv1",191
"Private equity turned vulnerable elderly people into human ATMs","https://www.theguardian.com/society/2026/mar/28/the-great-care-home-cash-grab-how-private-equity-turned-vulnerable-elderly-people-into-human-atms",189
"My MacBook keyboard is broken and it's insanely expensive to fix","https://tobiasberg.net/posts/my-macbook-keyboard-is-broken-and-its-insanely-expensive-to-fix/",183
"I turned my Kindle into my own personal newspaper","https://manualdousuario.net/en/how-to-kindle-personal-newspaper/",182
"Show HN: Turbolite – a SQLite VFS serving sub-250ms cold JOIN queries from S3","https://github.com/russellromney/turbolite",180
"Coding Agents Could Make Free Software Matter Again","https://www.gjlondon.com/blog/ai-agents-could-make-free-software-matter-again/",177
"Show HN: Twitch Roulette – Find live streamers who need views the most","https://twitchroulette.net/",177
"I tried to prove I'm not AI. My aunt wasn't convinced","https://www.bbc.com/future/article/20260324-i-tried-to-prove-im-not-an-ai-deepfake",176
"Interoperability Can Save the Open Web (2023)","https://spectrum.ieee.org/doctorow-interoperability",176
"Ball Pit","https://codepen.io/mrdoob_/full/NPRwLZd",176
"What if AI doesn't need more RAM but better math?","https://adlrocha.substack.com/p/adlrocha-what-if-ai-doesnt-need-more",175
"Improved Git Diffs with Delta, Fzf and a Little Shell Scripting","https://nickjanetakis.com/blog/awesome-git-diffs-with-delta-fzf-and-a-little-shell-scripting",172
"curl > /dev/sda: How I made a Linux distro that runs wget | dd","https://astrid.tech/2026/03/24/0/curl-to-dev-sda/",171
"Last gasps of the rent seeking class?","https://geohot.github.io//blog/jekyll/update/2026/02/26/the-last-gasps-of-the-rent-seeking-class.html",168
"Ask HN: Founders of estonian e-businesses – is it worth it?","item?id=47500239",166
"15 Years of Forking","https://www.waterfox.com/blog/15-years-of-forking/",164
"Show HN: ProofShot – Give AI coding agents eyes to verify the UI they build","https://github.com/AmElmo/proofshot",161
"The curious case of retro demo scene graphics","https://www.datagubbe.se/aipixels/",158
"Show HN: A plain-text cognitive architecture for Claude Code","https://lab.puga.com.br/cog/",155
"OpenBSD on Motorola 88000 Processors","http://miod.online.fr/software/openbsd/stories/m88k1.html",154
"A Verilog to Factorio Compiler and Simulator (Working RISC-V CPU)","https://github.com/ben-j-c/verilog2factorio",151
"Paper Tape Is All You Need – Training a Transformer on a 1976 Minicomputer","https://github.com/dbrll/ATTN-11",145
"Android’s new sideload settings will carry over to new devices","https://www.androidauthority.com/android-sideload-carry-over-3652845/",143
"An unstoppable mushroom is tearing through North American forests","https://www.bbc.com/future/article/20260325-an-unstoppable-mushroom-is-tearing-through-north-american-forests",142
"Should QA exist?","https://www.rubick.com/should-qa-exist/",138
"Building FireStriker: Making Civic Tech Free","https://firestriker.org/blog/building-firestriker-why-im-making-civic-tech-free",138
"Stripe Projects: Provision and manage services from the CLI","https://projects.dev/",137
"Agent-to-agent pair programming","https://axeldelafosse.com/blog/agent-to-agent-pair-programming",135
"The RISE RISC-V Runners: free, native RISC-V CI on GitHub","https://riseproject.dev/2026/03/24/announcing-the-rise-risc-v-runners-free-native-risc-v-ci-on-github/",134
"Telnyx package compromised on PyPI","https://telnyx.com/resources/telnyx-python-sdk-supply-chain-security-notice-march-2026",132
"Gaza toddler returned with alleged torture wounds after Israeli detention","https://www.independent.co.uk/news/world/middle-east/gaza-toddler-torture-idf-israel-detention-b2947167.html",130
"Whistler: Live eBPF Programming from the Common Lisp REPL","https://atgreen.github.io/repl-yell/posts/whistler/",129
"Colorado House passes bill to limit surveillance pricing and wage setting","https://coloradonewsline.com/briefs/surveillance-pricing-wage-setting/",127
"“Disregard That” Attacks","https://calpaterson.com/disregard.html",127
"A laser-based process that enables adhesive-free paper packaging","https://www.fraunhofer.de/en/press/research-news/2026/march-2026/sealing-paper-packaging-without-adhesives.html",126
"Gzip decompression in 250 lines of Rust","https://iev.ee/blog/gzip-decompression-in-250-lines-of-rust/",126
"Niche Museums","https://www.niche-museums.com/",123
"The European AllSky7 fireball network","https://www.allsky7.net/#archive",121
"Hacking old hardware by renaming to .zip [video]","https://www.youtube.com/watch?v=P1kfuCkWo24",120
"Musketeer d'Artagnan's remains believed found under Dutch church","https://www.bbc.co.uk/news/articles/cm2rew2dgzzo",119
"Embracing Bayesian methods in clinical trials","https://jamanetwork.com/journals/jama/fullarticle/2847011",113
"Go Naming Conventions: A Practical Guide","https://www.alexedwards.net/blog/go-naming-conventions",112
"Chicago artist creates tourism posters for city's neighborhoods","https://www.chicagotribune.com/2026/03/25/chicago-neighborhood-posters/",112
"Netscape News Feed Straight Out of the Late 00s","https://isp.netscape.com/",111
"Arm releases first in-house chip, with Meta as debut customer","https://www.cnbc.com/2026/03/24/arm-launches-its-own-cpu-with-meta-as-first-customer.html",111
"TSA lines are so out of control that travelers are hiring line-sitters","https://www.washingtonpost.com/travel/2026/03/28/tsa-line-sitters/",107
"Building a Blog with Elixir and Phoenix","https://jola.dev/posts/building-a-blog-with-elixir-and-phoenix",107
"Why are executives enamored with AI, but ICs aren't?","https://johnjwang.com/post/2026/03/27/why-are-executives-enabled-with-ai-but-ics-arent/",105
"The road signs that teach travellers about France","https://www.bbc.com/travel/article/20260327-the-road-signs-that-teach-travellers-about-france",104
"Solar is winning the energy race","https://www.dw.com/en/solar-is-winning-the-energy-race/a-76517556",104
"Optimizing a lock-free ring buffer","https://david.alvarezrosa.com/posts/optimizing-a-lock-free-ring-buffer/",102
"21,864 Yugoslavian .yu domains","https://jacobfilipp.com/yu/",101
"Wikipedia bans AI-generated content in its online encyclopedia","https://www.theguardian.com/technology/2026/mar/27/wikipedia-bans-ai",100
"Building a coding agent in Swift from scratch","https://github.com/ivan-magda/swift-claude-code",98
"Show HN: Veil – Dark mode PDFs without destroying images, runs in the browser","https://veil.simoneamico.com/",98
"Detecting file changes on macOS with kqueue","https://www.vegardstikbakke.com/kqueue/",97
"Adults Lose Skills to AI. Children Never Build Them","https://www.psychologytoday.com/us/blog/the-algorithmic-mind/202603/adults-lose-skills-to-ai-children-never-build-them",97
"Midnight train from GA: A view of America from the tracks as airports struggle","https://apnews.com/article/airports-shutdown-long-lines-train-travel-amtrak-e4d8ea591b3b036142c2bf2dee7dff5a",96
"Show HN: QuickBEAM – run JavaScript as supervised Erlang/OTP processes","https://github.com/elixir-volt/quickbeam",96
"AyaFlow: A high-performance, eBPF-based network traffic analyzer written in Rust","https://github.com/DavidHavoc/ayaFlow",95
"The Future of SCIP","https://sourcegraph.com/blog/the-future-of-scip",95
"Show HN: Fio: 3D World editor/game engine – inspired by Radiant and Hammer","https://github.com/ViciousSquid/Fio",95
"1929: Inside the Greatest Crash in Wall Street History","https://www.nybooks.com/articles/2026/03/26/tick-tick-boom-1929-andrew-ross-sorkin/",91
"15 years, one server, 8GB RAM and 500k users – how Webminal refuses to die","https://community.webminal.org/t/15-years-one-server-8gb-ram-and-500k-users-how-webminal-refuses-to-die/8803",90
"ICAO issued new power bank restriction on flight","https://www.icao.int/news/new-power-bank-restrictions-will-safeguard-international-aviation",90
"There is no spoon – A software engineers primer for demystified ML","https://github.com/dreddnafious/thereisnospoon",90
"The rise and fall of IBM's 4 Pi aerospace computers: an illustrated history","https://www.righto.com/2026/03/ibm-4-pi-computer-history.html",88
"Undroidwish – A single-file, batteries-included Tcl/Tk binary for many platforms","https://androwish.org/home/wiki?name=undroidwish",87
"Show HN: Optio – Orchestrate AI coding agents in K8s to go from ticket to PR","https://github.com/jonwiggins/optio",87
"No one is happy with NASA's new idea for private space stations","https://arstechnica.com/space/2026/03/what-happens-next-with-nasas-plan-to-replace-the-iss-source-it-could-get-ugly/",87
"Show HN: BreezePDF – Free, in-browser PDF editor","https://breezepdf.com/?v=3",85
"Cat Itecture: Better Cat Window Boxes (2023)","https://gwern.net/catitecture",85
"Microsoft Set for Worst Quarter Since 2008","https://finance.yahoo.com/news/microsoft-set-worst-quarter-since-103556906.html",85
"Kyushu Railway Company Train Varieties","https://www.jrkyushu.co.jp/english/train/index.html",84
"Show HN: Create a full language server in Go with 3.17 spec support","https://github.com/owenrumney/go-lsp",84
"Lat.md: Agent Lattice: a knowledge graph for your codebase, written in Markdown","https://github.com/1st1/lat.md",84
"Sky Wins Irish Court Order to Unmask 300 Pirate IPTV Users via Revolut Bank","https://torrentfreak.com/sky-wins-irish-court-order-to-unmask-300-pirate-iptv-users-via-revolut-bank/",83
"I'll buy your electronics to feed our robot","https://www.dayworkx.com/",82
"When do we become adults, really?","https://www.newyorker.com/culture/annals-of-inquiry/when-do-we-become-adults-really",81
"Twice this week, I have come across embarassingly bad data","https://successfulsoftware.net/2026/03/29/stop-publishing-garbage-data-its-embarrassing/",81
"Trust signals as sparklines for Hacker News","https://hn-trustspark.com/",81
"Cloudflare's Gen 13 servers: trading cache for cores for 2x performance","https://blog.cloudflare.com/gen13-launch/",81
"rpg.actor Game Jam","https://rpg.actor/jam",80
"The Legibility of Serif and Sans Serif Typefaces (2022)","https://library.oapen.org//handle/20.500.12657/53344",80
"More on Version Control","https://bramcohen.com/p/more-on-version-control",77
"Canadian man says U.S. border officers made him give DNA sample","https://www.cbc.ca/news/canada/windsor/us-border-dna-canadian-man-cbp-cross-larson-dingell-raskin-9.7144472",77
"Memorial to IT Workers Who Have Fallen in Ukraine","https://dou.ua/memorial/",77
"Designing AI for Disruptive Science","https://www.asimov.press/p/ai-science",77
"Show HN: Sheet Ninja – Google Sheets as a CRUD Back End for Vibe Coders","https://sheetninja.io",76
"First Western Digital, now Sony: The tech giant suspends SD card sales","https://mashable.com/article/sony-sd-card-sales-suspended-memory-shortage",75
"The ANSI art "telecomics" of the 1992 election","https://breakintochat.com/blog/2026/03/25/don-lokke-and-mack-the-mouse/",75
"The risk of AI isn't making us lazy, but making "lazy" look productive","item?id=47555081",74
"Sunsetting the Techempower Framework Benchmarks","https://github.com/TechEmpower/FrameworkBenchmarks/issues/10932",74
"Chroma Context-1: Training a Self-Editing Search Agent","https://www.trychroma.com/research/context-1",71
"Fets and Crosses: Tic-Tac-Toe built from 2458 discrete transistors","https://schilk.co/projects/fetsncrosses/",70
"C++26: A User-Friednly assert() macro","https://www.sandordargo.com/blog/2026/03/25/cpp26-user-friendly-assert",68
"Zero Days: Electric Motorcycles Are a Security Nightmare","https://persephonekarnstein.github.io/post/zero-days/",68
"Sylve – Proxmox Alternative by FreeBSD","https://sylve.io/",66
"Creating West Coast Buddhism (2024)","https://letter.palladiummag.com/p/creating-west-coast-buddhism",63
"Matadisco – Decentralized Data Discovery","https://matadisco.org/",63
"How much precision can you squeeze out of a table?","https://www.johndcook.com/blog/2026/03/26/table-precision/",62
"School uses AI to remove 200 books, including Orwell's 1984 and Twilight","https://www.lbc.co.uk/article/librarian-gobsmacked-school-ai-remove-books-5HjdWsc_2/",60
"Show HN: Crazierl – An Erlang Operating System","https://crazierl.org/demo/",59
"The road to electric in charts and data","https://www.rac.co.uk/drive/electric-cars/choosing/road-to-electric/",59
"Building a Mostly IPv6 Only Home Network","https://varunpriolkar.com/2026/03/building-a-mostly-ipv6-only-home-network/",59
"The Strait of Hormuz Oil Shock Is Now Heading West","https://www.bloomberg.com/graphics/2026-iran-war-hormuz-closure-oil-shock",58
"Stop picking my Go version for me","https://blog.howardjohn.info/posts/go-mod-version/",58
"About the Atmosphere","https://toni.org/2026/03/27/about-the-atmosphere/",57
"The case for becoming a manager","https://newsletter.thelongcommit.com/p/the-case-for-becoming-a-manager",57
"AI bug reports went from junk to legit overnight, says Linux kernel czar","https://www.theregister.com/2026/03/26/greg_kroahhartman_ai_kernel/",57
"The Hackers Who Tracked My Sleep Cycle","https://glama.ai/blog/2026-03-26-the-hackers-who-tracked-my-sleep-cycle",56
