title,link,score
"PlainBudget – Minimalist Plain Text Budgeting","https://plainbudget.com/",94
"Monitoring my Minecraft server with OpenTelemetry and Prometheus","https://www.dash0.com/blog/monitoring-minecraft-with-opentelemetry",93
"FedRAMP 20x – One Month in and Moving Fast","https://www.fedramp.gov/2025-04-24-fedramp-20x-one-month-in-and-moving-fast/",92
"Show HN: A backend agnostic Ruby framework for building reactive desktop apps","https://codeberg.org/skinnyjames/hokusai",92
"One hundred and one rules of effective living","https://mitchhorowitz.substack.com/p/101-rules-of-effective-living",91
"Charles Bukowski, William Burroughs, and the Computer (2009)","https://realitystudio.org/bibliographic-bunker/charles-bukowski-william-burroughs-and-the-computer/",91
"Radxa Orion O6 brings Arm to the midrange PC (with caveats)","https://www.jeffgeerling.com/blog/2025/radxa-orion-o6-brings-arm-midrange-pc",91
"The Linux Kernel's PGP Web of Trust","https://blog.kleine-koenig.org/ukl/the-linux-kernels-pgp-web-of-trust.html",90
"Ink and Algorithms: Techniques, tools and the craft of pen plotting","https://penplotter.art/",89
"What if humanity forgot how to make CPUs?","https://twitter.com/lauriewired/status/1922015999118680495",88
"How much information is in DNA?","https://dynomight.substack.com/p/dna",88
"Prepare your apps for Google Play's 16 KB page size compatibility requirement","https://android-developers.googleblog.com/2025/05/prepare-play-apps-for-devices-with-16kb-page-size.html",88
"OpenTelemetry protocol with Apache Arrow","https://opentelemetry.io/blog/2025/otel-arrow-phase-2/",87
"Show HN: Lumoar – Free SOC 2 tool for SaaS startups","https://www.lumoar.com",87
"Booting the RP2350 from UART","https://pfister.dev/blog/2025/rp2350-uart-bl.html",87
"Absolute Zero: Reinforced Self-Play Reasoning with Zero Data","https://arxiv.org/abs/2505.03335",86
"Prolog's Eternal September (2017)","https://storytotell.org/prologs-eternal-september",86
"Show HN: A5","https://github.com/felixpalmer/a5",85
"Trial by Fire: The crash of Aeroflot flight 1492","https://admiralcloudberg.medium.com/trial-by-fire-the-crash-of-aeroflot-flight-1492-ee61cebcf6ec",85
"Persuasion methods for engineering managers","https://newsletter.manager.dev/p/5-powerful-persuasion-methods-for",83
"Why GADTs matter for performance (2015)","https://blog.janestreet.com/why-gadts-matter-for-performance/",81
"How to (actually) prove it – New Frontiers of Mathematics and Computing in Lean","https://kirancodes.me/posts/log-how-to-prove-it-maths.html",81
"Show HN: I’m 16 years old and working on my first startup, a study app","https://www.notiv.app/",81
"Applications of Classical Physics","http://pmaweb.caltech.edu/Courses/ph136/yr2012/",80
"The Audio Stack Is a Crime Scene","https://fireborn.mataroa.blog/blog/i-want-to-love-linux-it-doesnt-love-me-back-post-2-the-audio-stack-is-a-crime-scene/",79
"Show HN: Codigo – The Programming Language Repository","https://codigolangs.com",78
"Dasung Paperlike 13K is a 13.3 inch E Ink color monitor","https://liliputing.com/dasung-paperlike-13k-is-a-13-3-inch-e-ink-color-monitor-crowdfunding/",78
"Twitch star HasanAbi says he was detained, questioned by border agents","https://www.washingtonpost.com/immigration/2025/05/12/hasan-piker-detained-border-agents-twitch/",77
"Show HN: GlassFlow – OSS streaming dedup and joins from Kafka to ClickHouse","https://github.com/glassflow/clickhouse-etl",76
"Why not object capability languages?","https://blog.plan99.net/why-not-capability-languages-a8e6cbdf9682",76
"Has anyone coined the term “fast tech” yet?","https://chaos.social/@gsuberland/114485304658708399",76
"Show HN: LoopMix128 – Fast C PRNG (.46ns), 2^128 Period, BigCrush/PractRand Pass","https://github.com/danielcota/LoopMix128",75
"An $18M grant would have drastically reduced food waste. Then the EPA cut it","https://grist.org/food-and-agriculture/trump-epa-community-change-grants-program-food-waste/",75
"Engineers develop wearable heart attack detection technology","https://medicalxpress.com/news/2025-04-wearable-heart-technology.html",74
"In praise of grobi for auto-configuring X11 monitors","https://michael.stapelberg.ch/posts/2025-05-10-grobi-x11-monitor-autoconfig/",74
"VMware perpetual license holders receive cease-and-desist letters from Broadcom","https://arstechnica.com/gadgets/2025/05/broadcom-sends-cease-and-desist-letters-to-subscription-less-vmware-users/",74
"Garbage collection of object storage at scale","https://www.warpstream.com/blog/taking-out-the-trash-garbage-collection-of-object-storage-at-massive-scale",73
"Optimizing My Hacker News Experience","https://reorientinglife.substack.com/p/optimizing-my-hacker-news-experience",73
"Armbian Updates: OMV support, boot improvents, Rockchip optimizations","https://www.armbian.com/newsflash/armbian-updates-nas-support-lands-boot-systems-improve-and-rockchip-optimizations-arrive/",73
"A brief history of the numeric keypad","https://www.doc.cc/articles/a-brief-history-of-the-numeric-keypad",73
"Show HN: I’ve built an IoT device to let my family know when I’m in a meeting","https://nullonerror.org/2025/05/11/i-have-built-an-iot-device-to-let-my-family-know-when-i-am-in-a-meeting/",72
"Inventing the Adventure Game (1984)","http://www.warrenrobinett.com/inventing_adventure/",72
"How to Average in Prolog (2017)","https://storytotell.org/how-to-average-in-prolog",72
"DeepSeek’s founder is threatening US dominance in AI race","https://www.bloomberg.com/news/features/2025-05-13/deepseek-races-after-chatgpt-as-china-s-ai-industry-soars",71
"When Suno covers my song (very useful) – a study with variations","http://rochus-keller.ch/?p=1350",71
"Arduino is at work to make bio-based PCBs","https://blog.arduino.cc/2025/04/22/arduino-is-at-work-to-make-bio-based-pcbs/",71
"Block Diffusion: Interpolating Autoregressive and Diffusion Language Models","https://m-arriola.com/bd3lms/",71
"Dart added support for cross-compilation","https://dart.dev/tools/dart-compile#cross-compilation-exe",70
"Show HN: Hyper – Standards-first React alternative","https://nuejs.org/blog/standards-first-react-alternative/",70
"Revisiting Image Maps","https://css-tricks.com/revisiting-image-maps/",69
"Ash (Almquist Shell) Variants","https://www.in-ulm.de/~mascheck/various/ash/",69
"Telling Lies: Bowie and Online Music Distribution in 1996","https://cybercultural.com/p/online-music-distribution-1996/",69
"Ask HN: Is Slack Down?","item?id=43968044",68
"Coffee for people who don't like coffee","https://ostwilkens.se/blog/coffee",64
"Will protein design tools solve the snake antivenom shortage?","https://www.owlposting.com/p/will-protein-design-tools-solve-the",63
"Linear Programming for Fun and Profit","https://modal.com/blog/resource-solver",62
"Show HN: BlenderQ – A TUI for managing multiple Blender renders","https://github.com/KyleTryon/BlenderQ",62
"The surgeon who used F1 pitstop techniques to save lives of babies","https://www.thetimes.com/sport/formula-one/article/professor-martin-elliott-interview-surgeon-f1-pitstops-babies-ferrari-j3sbkjssk",62
"After 16 years, we're renewing the StackOverflow Brand","https://meta.stackexchange.com/questions/408823/after-16-years-we-re-renewing-the-brand",60
"US Copyright Office: Generative AI Training [pdf]","https://www.copyright.gov/ai/Copyright-and-Artificial-Intelligence-Part-3-Generative-AI-Training-Report-Pre-Publication-Version.pdf",59
"Show HN: Hydra (YC W22) – Serverless Analytics on Postgres","https://www.hydra.so/",59
"Using obscure graph theory to solve programming languages problems","https://reasonablypolymorphic.com/blog/solving-lcsa/",58
"TheForger's Win32 API Tutorial","https://winprog.org/tutorial/",58
"Hollow Core Fiber (HCF)","https://www.holightoptic.com/what-is-hollow-core-fiber-hcf%ef%bc%9f/",58
"Most AI spending driven by FOMO, not ROI, CEOs tell IBM","https://www.theregister.com/2025/05/06/ibm_ai_investments/",58
"Terence Tao started a YouTube channel","https://www.youtube.com/channel/UCCGfqB7qtWIktmPyf5UMcbw",57
"NetBSD 10.x Kernel Math_emulation","https://mezzantrop.wordpress.com/2025/02/04/netbsd-10-x-kernel-math_emulation/",57
"37signals is completing its on-prem move","https://www.theregister.com/2025/05/09/37signals_cloud_repatriation_storage_savings/",57
"DNA is maybe 60-750MB of data","https://dynomight.net/dna/",57
"The Acid King (2001)","https://www.rollingstone.com/feature/acid-lsd-king-william-leonard-pickard-prison-pete-wilkinson-184390/",56
"Adaptive Hashing","https://quotenil.com/adaptive-hashing.html",55
"IPinfo started offering free unlimited country-level geolocation and ASN details","https://ipinfo.io/lite",55
"Scientists Looking to Leave the U.S. for More Welcoming Environments","https://www.spiegel.de/international/world/exodus-of-expertise-scientists-looking-to-leave-the-u-s-for-more-welcoming-environments-a-989ca73f-1dc9-4205-8405-1dc901c3623a",54
"Writing that changed how I think about programming languages","https://bernsteinbear.com/blog/pl-writing/",53
"Remote workers more likely to start their own business","https://www.theregister.com/2025/05/12/remote_work_leads_to_more_startups/",53
"Replicube: A puzzle game about writing code to create shapes","https://store.steampowered.com/app/3401490/Replicube/",52
"Android and Wear OS are getting a redesign","https://blog.google/products/android/material-3-expressive-android-wearos-launch/",52
"We can no longer run Microsoft Store on 1809/LTSC 2019","https://github.com/fernvenue/microsoft-store",52
"Philips debuts 3D printable components to repair products","https://www.tomshardware.com/3d-printing/philips-debuts-3d-printable-components-to-repair-products",52
"EM-LLM: Human-Inspired Episodic Memory for Infinite Context LLMs","https://github.com/em-llm/EM-LLM-model",50
"Alephic Writing Style Guide","https://www.alephic.com/company/writing",50
"Implicit UVs: Real-time semi-global parameterization of implicit surfaces [pdf]","https://baptiste-genest.github.io/papers/implicit_uvs.pdf",50
"Adventures in Imbalanced Learning and Class Weight","http://andersource.dev/2025/05/05/imbalanced-learning.html",49
"The Surreal Landscapes of Industrial Waste in Russia","https://www.comradegallery.com/journal/photo-essay-the-unworldly-photos-of-industrial-waste-pollution-landscapes-in-russia-environmental-policy",47
"uBlock Origin Lite beta version for Safari","https://github.com/uBlockOrigin/uBOL-home/issues/327",47
"The Emacs Widget Toolkit","https://appetrosyan.github.io/posts/emacs-widget.html",47
"A Taxonomy of Bugs","https://ruby0x1.github.io/machinery_blog_archive/post/a-taxonomy-of-bugs/index.html",46
"Creating a static website for all my bookmarks","https://alexwlchan.net/2025/bookmarks-static-site/",46
"Migrating to Codeberg","https://guix.gnu.org/blog/2025/migrating-to-codeberg/",46
"2.5D Rendering on PlayDate","https://www.ligeiagames.com/ligeia-blog/castle-kellmore-rendering",46
"Policy of Transience","https://www.chiark.greenend.org.uk/~sgtatham/quasiblog/transience/",45
"FCC threatens EchoStar licenses for spectrum that SpaceX wants to use","https://arstechnica.com/tech-policy/2025/05/fcc-threatens-echostar-licenses-for-spectrum-that-spacex-wants-to-use/",45
"What the hell are rare earth elements?","https://media.hubspot.com/what-the-hell-are-rare-earth-elements",45
"6502 Illegal Opcodes in the Siemens PC 100 Assembly Manual","https://www.pagetable.com/?p=1798",45
"Farmers Sued over Deleted Climate Data. So the Government Will Put It Back","https://www.nytimes.com/2025/05/12/climate/trump-deleted-climate-website-farmers-lawsuit.html",45
"Mipmap selection in too much detail","https://pema.dev/2025/05/09/mipmaps-too-much-detail/",44
"Ask HN: How do you store the knowledge gained in a day?","item?id=43976045",44
"Six Days in the Dark","https://tonyyo11.github.io/posts/Six-Days-in-the-Dark/",44
"Have you ever seen an emolument fly?","https://reason.com/volokh/2025/05/11/have-you-ever-seen-an-emolument-fly/",44
"A tool to verify estimates, II: a flexible proof assistant","https://terrytao.wordpress.com/2025/05/09/a-tool-to-verify-estimates-ii-a-flexible-proof-assistant/",43
"US Copyright Office Has Thoughts on AI. Big Tech May Not Like It","https://www.businessinsider.com/ai-training-copyright-laws-big-tech-fair-use-openai-meta-2025-5",43
"Backdoor found in popular ecommerce components","https://sansec.io/research/license-backdoor",43
"Everything That Has Changed Since Congestion Pricing Started in New York","https://www.nytimes.com/interactive/2025/05/11/upshot/congestion-pricing.html",41
"Another World","https://www.anotherworld.fr/anotherworld_uk/another_world.htm",41
"PyPI Organizations (2023)","https://blog.pypi.org/posts/2023-04-23-introducing-pypi-organizations/",40
"Is there a balance to be struck between simple hierarchical models and","https://statmodeling.stat.columbia.edu/2024/05/26/is-there-a-balance-to-be-struck-between-simple-hierarchical-models-and-more-complex-hierarchical-models-that-augment-the-simple-frameworks-with-more-modeled-interactions-when-analyzing-real-data/",40
"Turritopsis dohrnii: Immortal jellyfish","https://www.nhm.ac.uk/discover/immortal-jellyfish-secret-to-cheating-death.html",39
"Detecting if an expression is constant in C","https://nrk.neocities.org/articles/c-constexpr-macro#detecting-if-an-expression-is-constant-in-c",39
"The Internet 1997 – 2021","https://www.opte.org/the-internet",39
"SDFs and the Fast sweeping algorithm in Jax","https://rohangautam.github.io/blog/fast_sweeping/fastsweeping/",39
"Parametric Modeling with Grasshopper","https://baharmon.github.io/basics",39
"How “The Great Gatsby” took over high school","https://www.newyorker.com/books/page-turner/how-the-great-gatsby-took-over-high-school",37
"Initial USA Unemployment Claims","https://fred.stlouisfed.org/series/ICSA",37
"The Rise and Fall of the Visual Telegraph (2017)","https://parisianfields.com/2017/11/05/the-rise-and-fall-of-the-visual-telegraph/",37
"Cracking the Dave and Buster's Anomaly","https://rambo.codes/posts/2025-05-12-cracking-the-dave-and-busters-anomaly",36
"Mill as a direct style build tool","https://mill-build.org/blog/12-direct-style-build-tool.html",36
"3D printing in vivo for non-surgical implants and drug delivery","https://www.science.org/doi/10.1126/science.adt0293",36
"BM Boys: the Nigerian sextortion network hiding in plain sight on TikTok","https://www.theguardian.com/us-news/2025/may/11/sextortion-nigeria-bm-boys-tiktok",36
"Ticketmaster will show the full price of your ticket up front to comply with law","https://www.theverge.com/news/665087/ticketmaster-all-in-prices-junk-fees",36
"How (memory) safe is Zig? (2021)","https://www.scattered-thoughts.net/writing/how-safe-is-zig/",35
"Microsoft laying off 6k employees","https://www.theverge.com/news/659401/microsoft-layoffs-three-percent-workforce",35
"Cosmos 482 Descent Craft tracker","http://astria.tacc.utexas.edu/AstriaGraph/",35
"The Screamer – A yell-on yell-off light","https://rulethepla.net/the-screamer/",35
"Fewer people want to work in the U.S.","https://www.axios.com/2025/05/13/us-jobs-foreign-workers",35
"Dolla dolla bill, y'all: Reverse engineering a banknote validator","https://something.fromnothing.blog/posts/dolla-dolla-bill-yall/",34
"Toward a Sparse and Interpretable Audio Codec","https://arxiv.org/abs/2505.05654",34
"Cogentcore: Open-source framework for building multi-platform apps with Go","https://github.com/cogentcore/core",34
"Chrome's New Embedding Model: Smaller, Faster, Same Quality","https://dejan.ai/blog/chromes-new-embedding-model/",33
"When graphic design saves lives","https://news.harvard.edu/gazette/story/2025/05/when-graphic-design-saves-lives/",32
"The Microsoft unit working to thwart hackers","https://www.bloomberg.com/news/features/2025-05-09/microsoft-s-hacker-hunters-inside-the-secretive-mstic-unit",32
"In-Memory Ferroelectric Differentiator","https://www.nature.com/articles/s41467-025-58359-4",32
"Hill or High Water","https://royalsociety.org/blog/2025/05/hill-or-high-water/",31
"How Bail Bonds Work","https://finbarr.site/2025/05/10/how-bail-bonds-work.html",31
"The Anarchitecture Group","https://www.spatialagency.net/database/the.anarchitecture.group",31
"Three Faces of American Capitalism: Buffett, Musk, and Trump","https://www.newyorker.com/news/the-financial-page/three-faces-of-american-capitalism-buffett-musk-and-trump",31
"Before the Undo Command, There Was the Electric Eraser","https://spectrum.ieee.org/electric-eraser",31
"Ash Framework – Model your domain, derive the rest","https://ash-hq.org/",30
"Cardiac: A CARDboard Illustrative Aid to Computation [pdf]","https://www.cs.drexel.edu/~bls96/museum/CARDIAC_manual.pdf",30
"Binary Formats Are Better Than JSON in Browsers","https://adamfaulkner.github.io/binary_formats_are_better_than_json_in_browsers.html",30
"OpenEoX to Standardize End-of-Life (EOL) and End-of-Support (EOS) Information","https://openeox.org/",30
"Makepad 1.0: Rust UI Framework","https://makepad.nl",30
"Nintendo warns that it can brick Switch consoles if it detects hacking, piracy","https://arstechnica.com/gaming/2025/05/nintendo-threatens-to-brick-switch-consoles-for-hacking-piracy/",30
"Algebraic Effects: Another mistake carried through to perfection?","https://kjosib.github.io/Counterpoint/effects.html",29
"Lead Bullets (2011)","https://a16z.com/lead-bullets/",28
"Let's be real about dependencies","https://wiki.alopex.li/LetsBeRealAboutDependencies",27
"FDA moves to ban fluoride supplements for kids, removing a key tool for dentists","https://www.npr.org/sections/shots-health-news/2025/05/13/g-s1-66476/fda-fluoride-prescription-ingestible-treatments",26
"Philips will let you fix your trimmer with 3D printable parts and accessories","https://www.theverge.com/news/665187/philips-fixables-3d-printing-personal-health-trimmer-oneblade-prura-research-printables",26
"Larry Tesler: Smalltalk Kernel Language Manual [pdf]","https://bitsavers.org/pdf/xerox/smalltalk/Tesler_-_Smalltalk_Kernel_Language_Manual_197709.pdf",26
"Cosmos-482 descent craft re-entry prediction","https://blogs.esa.int/rocketscience/2025/05/07/reentry-prediction-soviet-era-venera-venus-lander-cosmos-482-descent-craft/",26
"Unique Games Conjecture","https://en.wikipedia.org/wiki/Unique_games_conjecture",26
"A sub-millisecond GC for .NET?","https://blog.applied-algorithms.tech/a-sub-millisecond-gc-for-net",26
"Andreas Kling's Keynote Presentation on the Ladybird Browser [video]","https://www.youtube.com/watch?v=9YM7pDMLvr4",26
"AMD GPU Programming in Julia","https://amdgpu.juliagpu.org/dev/",26
"Passing Messages","https://thedailywtf.com/articles/passing-messages",26
"Show HN: Checking Pope's election results with smoke test script for chimney","https://github.com/donobu-inc/donobu-papal-election-tests/blob/main/tests/papal_election_smoke.test.ts",26
"A visual history of the safety pin","https://museumofeverydaylife.org/current-exhibitions/a-visual-history-of-the-safety-pin",25
"Show HN: The missing inbox for GitHub pull requests","https://github.com/pvcnt/mergeable",25
"Show HN: MMORPG prototype inspired by World of Warcraft","https://github.com/nickyvanurk/everwilds",25
"Microbe that infests hospitals can digest medical-grade plastic ― a first","https://www.nature.com/articles/d41586-025-01412-5",25
"Show HN: AG-UI Protocol – Bring Agents into Frontend Applications","https://github.com/ag-ui-protocol/ag-ui",24
"Lightweight open source reCaptcha alternative","https://github.com/altcha-org/altcha",23
"The Height Enigma (CSS)","https://www.joshwcomeau.com/css/height-enigma/",23
"Show HN: Make your own voice AI in two clicks","https://unmute.sh/",23
"QueryLeaf: SQL for Mongo","https://github.com/beekeeper-studio/queryleaf",23
"Why alien languages could be far stranger than we imagine Essays","https://aeon.co/essays/why-alien-languages-could-be-far-stranger-than-we-imagine",23
"Show HN: Mycelium","https://github.com/mycweb/mycelium",22
"ChatGPT may be polite, but it's not cooperating with you","https://www.theguardian.com/technology/ng-interactive/2025/may/13/chatgpt-ai-big-tech-cooperation",22
"Show HN: Blog comments, nice looking, open source – Talkyard","https://blog-comments.talkyard.io/demo/",22
"The Myth of the Genius Hacker","https://www.ft.com/content/55221f2d-00b3-4856-9158-dfdd0263bd0c",22
"Ada in China (1994)","https://dl.acm.org/doi/pdf/10.1145/181476.181483",21
"Interagency Grizzly Bear Committee","https://igbconline.org/",21
"A star has been destroyed by a wandering supermassive black hole","https://arstechnica.com/science/2025/05/a-star-has-been-destroyed-by-a-wandering-supermassive-black-hole/",21
"The world needs more modest, linear growth companies","https://signalvnoise.com/svn3/the-world-needs-more-modest-linear-growth-companies-please-make-some/",20
"Loko Scheme, an optimizing, bare-metal Scheme compiler","https://scheme.fail/",20
"Backblaze Drive Stats for Q1 2025","https://www.backblaze.com/blog/backblaze-drive-stats-for-q1-2025/",20
"Replacing tmux and GNU screen with Emacs","https://www.masteringemacs.org/article/replacing-tmux-gnu-screen-emacs",20
"Bot countermeasures impact on the quality of life on the web","https://notes.volution.ro/v1/2025/05/remarks/3770e0c4/",20
"GM says new battery chemistry will enable 400-mile range EVs","https://www.theverge.com/news/665223/gm-lmr-ev-battery-chemistry-range-miles",19
"For better or for worse, the overload (2024)","https://consteval.ca/2024/07/25/overload/",19
"Elon Musk's apparent power play at the Copyright Office backfired","https://www.theverge.com/politics/666179/maga-elon-musk-sacks-copyright-office-perlmutter",19
"Show HN: Sprigman – Pac-Man Recreated in a Limited Tile Based JavaScript Engine","https://sprig.hackclub.com/share/X4EGvOFk1q8FroEPCj1G",19
"Scoring the European Citizen in the AI Era","https://arxiv.org/abs/2505.02791",19
"What were the MS-DOS programs that the moricons.dll icons were intended for?","https://devblogs.microsoft.com/oldnewthing/20250507-00/?p=111157",18
"Welcome to the age of paranoia as deepfakes and scams abound","https://www.wired.com/story/paranoia-social-engineering-real-fake/",18
"Show HN: Translate between dialects and share SQL queries on the browser","https://sqlscope.netlify.app",18
"Qatar's $400M jet for Trump is a gold-plated security nightmare","https://www.theregister.com/2025/05/13/presidents_trump_747_qatar/",18
"Progress towards universal Copy/Paste shortcuts on Linux","https://mark.stosberg.com/universal-copy-paste/",18
"Ron Buckton laid off from Microsoft","https://twitter.com/rbuckton/status/1922364558426911039",18
"Fine-tuned acoustic waves can knock drones out of the sky","https://www.economist.com/science-and-technology/2025/02/05/fine-tuned-acoustic-waves-can-knock-drones-out-of-the-sky",18
"VPN firm says it didn't know customers had lifetime subscriptions, cancels them","https://arstechnica.com/gadgets/2025/05/vpn-firm-says-it-didnt-know-customers-had-lifetime-subscriptions-cancels-them/",17
"Map of Palaeohispanic Coins and Inscriptions","http://hesperia.ucm.es/consulta_hesperia/mapas.php",17
"ChatGPT may be polite, but it's not cooperating with you","https://www.theguardian.com/technology/ng-interactive/2025/may/13/chatgpt-ai-big-tech-cooperation",17
"Multiplexing","https://buttondown.com/jaffray/archive/multiplexing/",17
"Dutch ingenuity: A brainless soft robot running on air","https://arstechnica.com/science/2025/05/dutch-scientists-built-a-brainless-soft-robot-that-runs-on-air/",17
"Nissan to slash 11,000 jobs, close 7 plants","https://www.usatoday.com/story/money/cars/2025/05/13/nissan-layoffs-plants-closing/83595549007/",17
"Shingles vaccine reduces risk of heart disease by 23%, study of one million","https://www.cnn.com/2025/05/09/health/shingles-heart-disease-vaccine-shots-wellness",17
"The Heart of Innovation: Why Most Startups Fail","https://commoncog.com/the-heart-of-innovation-why-startups-fail/",17
"Eye-tracking study reveals where women and men look when viewing a female butt","https://www.psypost.org/eye-tracking-study-reveals-where-women-and-men-look-when-viewing-a-female-butt/",17
"Alone Together: Disconnection Is Our Generation's Black Death","https://josef.cn/blog/black-death",17
"Write the most clever code you can","https://buttondown.com/hillelwayne/archive/write-the-most-clever-code-you-possibly-can/",17
"FlyLoop – AI Agent for Scheduling Meetings and Managing Your Calendar","item?id=43972660",16
"Petrichor","https://en.wikipedia.org/wiki/Petrichor",16
"If Everyone Has Trauma, Everyone Has Trauma","https://freddiedeboer.substack.com/p/if-everyone-has-trauma-everyone-has",16
"Ask HN: Not sure about the future of tech","item?id=43967944",16
"CFPB: Withdrawal of Rules, Policy Statements, and Advisory Opinions Since 2011","https://www.federalregister.gov/documents/2025/05/12/2025-08286/interpretive-rules-policy-statements-and-advisory-opinions-withdrawal",16
"Show HN: I made a site for finding people to build cool tech projects with","https://guildorigin.com/",15
"Microsoft to lay off 6k workers despite streak of profitable quarters","https://www.theguardian.com/technology/2025/may/13/microsoft-layoffs",15
"Show HN: Vom Decision Platform (Cursor for Decision Analyst)","https://www.vomdecision.com",15
"Timeline of the Far Future","https://en.wikipedia.org/wiki/Timeline_of_the_far_future",15
"Rerum Novarum ("The thirst for innovation") (1891)","https://www.vatican.va/content/leo-xiii/en/encyclicals/documents/hf_l-xiii_enc_15051891_rerum-novarum.html",15
"Zillow to bar publicly marketed listings not shared via MLS","https://www.realestatenews.com/2025/04/10/zillow-to-bar-publicly-marketed-listings-not-shared-via-mls",14
"The Battle to Bottle Palm Wine (2021)","https://www.atlasobscura.com/articles/palm-wine-in-united-states",14
"Qwen3 Technical Report [pdf]","https://github.com/QwenLM/Qwen3/blob/main/Qwen3_Technical_Report.pdf",14
