title,link,score
"Reverse engineering iWork","https://andrews.substack.com/p/reverse-engineering-iwork",121
"A stateful browser agent using self-healing DOM maps","https://100x.bot/a/a-stateful-browser-agent-using-self-healing-dom-maps",120
"The zipper is getting its first major upgrade in 100 years","https://www.wired.com/story/the-zipper-is-getting-its-first-major-upgrade-in-100-years/",117
"ImapGoose","https://whynothugo.nl/journal/2025/10/15/introducing-imapgoose/",117
"Recreating the Canon Cat document interface","https://lab.alexanderobenauer.com/updates/the-jasper-report",117
"Switch to Jujutsu Already: A Tutorial","https://www.stavros.io/posts/switch-to-jujutsu-already-a-tutorial/",116
"Copy-and-Patch: A Copy-and-Patch Tutorial","https://transactional.blog/copy-and-patch/tutorial",115
"RFCs: Blueprints of the Internet","https://ackreq.github.io/posts/what-are-rfcs/",114
"Resizeable Bar Support on the Raspberry Pi","https://www.jeffgeerling.com/blog/2025/resizeable-bar-support-on-raspberry-pi",114
"NeXT Computer Offices","https://archive.org/details/NeXTComputerOffices",114
"NVIDIA DGX Spark In-Depth Review: A New Standard for Local AI Inference","https://lmsys.org/blog/2025-10-13-nvidia-dgx-spark/",114
"The working-class hero of Bletchley Park you didn't see in the movies","https://www.theguardian.com/world/2025/oct/12/move-over-alan-turing-meet-the-working-class-hero-of-bletchley-park-you-didnt-see-in-the-movies",113
"Let's write a macro in Rust","https://hackeryarn.com/post/rust-macros-1/",113
"What Happened in 2007?","https://whathappenedin2007.com/",113
"VOC injection into a house reveals large surface reservoir sizes","https://www.pnas.org/doi/10.1073/pnas.2503399122",112
"Who invented deep residual learning?","https://people.idsia.ch/~juergen/who-invented-residual-neural-networks.html",111
"Silver Snoopy Award","https://www.nasa.gov/space-flight-awareness/silver-snoopy-award/",111
"With deadline looming 4 of 9 universities reject Trumps pact to remake higher ed","https://arstechnica.com/culture/2025/10/with-deadline-looming-4-of-9-universities-reject-trumps-compact-to-remake-higher-ed/",111
"When if is just a function","https://ryelang.org/blog/posts/if-as-function-blogpost-working-on-it_ver1/",110
"David Byrne Radio","https://www.davidbyrne.com/radio#filter=all&sortby=date:desc",110
"Nvidia has produced the first Blackwell wafer on US soil","https://www.xda-developers.com/nvidia-produced-first-blackwell-wafer-us-soil/",109
"Next steps for BPF support in the GNU toolchain","https://lwn.net/Articles/1039827/",109
"The people rescuing forgotten knowledge trapped on old floppy disks","https://www.bbc.com/future/article/20251009-rescuing-knowledge-trapped-on-old-floppy-disks",109
"3D-Printed Automatic Weather Station","https://3dpaws.comet.ucar.edu",109
"Docker Systems Status: Full Service Disruption","https://www.dockerstatus.com/pages/incident/533c6539221ae15e3f000031/68f5e1c741c825463df7486c",108
"Pebble is officially back on iOS and Android","https://twitter.com/ericmigi/status/1979576965494710564",107
"Most users cannot identify AI bias, even in training data","https://www.psu.edu/news/bellisario-college-communications/story/most-users-cannot-identify-ai-bias-even-training-data",107
"Picturing Mathematics","https://mathenchant.wordpress.com/2025/10/18/picturing-mathematics/",106
"Ask HN: How does one build large front end apps without a framework like React?","item?id=45615193",106
"Jeep wrangler owners waiting for answers week after an update bricked their cars","https://www.thedrive.com/news/jeep-wrangler-4xe-owners-still-waiting-for-answers-a-week-after-an-update-bricked-their-cars",106
"Forgejo v13.0 Is Available","https://forgejo.org/2025-10-release-v13-0/",105
"Abstraction, not syntax","https://ruudvanasseldonk.com/2025/abstraction-not-syntax",102
"Could the XZ backdoor been detected with better Git/Deb packaging practices?","https://optimizedbyotto.com/post/xz-backdoor-debian-git-detection/",101
"A Tower on Billionaires' Row Is Full of Cracks. Who's to Blame?","https://www.nytimes.com/2025/10/19/nyregion/432-park-avenue-condo-tower.html",101
"Completing a BASIC language interpreter in 2025","https://nanochess.org/ecs_basic_2.html",101
"An initial investigation into WDDM on ReactOS","https://reactos.org/blogs/investigating-wddm/",100
"Metropolis 1998 lets you design every building in an isometric, pixel-art city (2024)","https://arstechnica.com/gaming/2024/08/metropolis-1998-lets-you-design-every-building-in-an-isometric-pixel-art-city/",100
"MIT physicists improve the precision of atomic clocks","https://news.mit.edu/2025/mit-physicists-improve-atomic-clocks-precision-1008",98
"Lead Limited Brain and Language Development in Neanderthals and Other Hominids?","https://today.ucsd.edu/story/did-lead-limit-brain-and-language-development-in-neanderthals-and-other-extinct-hominids",98
"Deterministic multithreading is hard (2024)","https://www.factorio.com/blog/post/fff-415",97
"Silicon Valley's capture of our political institutions is all but complete","https://www.bloodinthemachine.com/p/silicon-valleys-capture-of-our-political",97
"How to Assemble an Electric Heating Element from Scratch","https://solar.lowtechmagazine.com/2025/10/how-to-build-an-electric-heating-element-from-scratch/",96
"SWE-Grep and SWE-Grep-Mini: RL for Fast Multi-Turn Context Retrieval","https://cognition.ai/blog/swe-grep",96
"Reverse engineering a 27MHz RC toy communication using RTL SDR","https://nitrojacob.wordpress.com/2025/09/03/reverse-engineering-a-27mhz-rc-toy-communication-using-rtl-sdr/",96
"Improving PixelMelt's Kindle Web Deobfuscator","https://shkspr.mobi/blog/2025/10/improving-pixelmelts-kindle-web-deobfuscator/",95
"The early Unix history of chown() being restricted to root","https://utcc.utoronto.ca/~cks/space/blog/unix/ChownRestrictionEarlyHistory",95
"The Wi-Fi Revolution (2003)","https://www.wired.com/2003/05/wifirevolution/",95
"Lost Jack Kerouac story found among assassinated mafia boss' belongings","https://www.sfgate.com/sf-culture/article/lost-jack-kerouac-chapter-found-mafia-boss-estate-21098566.php",94
"Lux: A luxurious package manager for Lua","https://github.com/lumen-oss/lux",94
"Free applicatives, the handle pattern, and remote systems","https://exploring-better-ways.bellroy.com/free-applicatives-the-handle-pattern-and-remote-systems.html",94
"GoFundMe CEO: economy is so bad his customers crowdfund to pay for groceries","https://finance.yahoo.com/news/gofundme-ceo-says-economy-bad-182843671.html",93
"What Dynamic Typing Is For","https://unplannedobsolescence.com/blog/what-dynamic-typing-is-for/",92
"State of AI Report 2025","https://www.stateof.ai/",92
"Read your way through Hà Nội","https://vietnamesetypography.com/samples/read-your-way-through-ha-noi/",91
"Our Paint – A featureless but programmable painting program","https://www.WellObserve.com/OurPaint/index_en.html",89
"Prefix sum: 20 GB/s (2.6x baseline)","https://github.com/ashtonsix/perf-portfolio/tree/main/delta",89
"How does Turbo listen for Turbo Streams","https://ducktypelabs.com/how-does-turbo-listen-for-turbo-streams/",88
"Windows 11 update breaks localhost, prompting mass uninstall workaround","https://www.theregister.com/2025/10/16/windows_11_update_localhost/",88
"Bible and Quran apps flagged NSFW by F-Droid","https://forum.f-droid.org/t/nsfw-flag-incorrectly-added-to-bible-and-quran-apps/33401",87
"Kagi Specials","https://blog.kagi.com/kagi-specials",87
"I wish SSDs gave you CPU performance style metrics about their activity","https://utcc.utoronto.ca/~cks/space/blog/tech/SSDWritePerfMetricsWish",86
"The macOS LC_COLLATE hunt: Or why does sort order differently on macOS and Linux (2020)","https://blog.zhimingwang.org/macos-lc_collate-hunt",85
"Tahoe's Elephant","https://eclecticlight.co/2025/10/12/last-week-on-my-mac-tahoes-elephant/",85
"Create a Custom Interactive dashboard using SVG","https://0xmm.in/posts/custom_dash/",84
"Introduction to reverse-engineering vintage synth firmware","https://ajxs.me/blog/Introduction_to_Reverse-Engineering_Vintage_Synth_Firmware.html",83
"Life, Work, Death and the Peasant, Part V: Life in Cycles","https://acoup.blog/2025/10/17/collections-life-work-death-and-the-peasant-part-v-life-in-cycles/",83
"4000 gone: Inside NASA's brain drain","https://www.planetary.org/articles/4000-gone-inside-nasas-brain-drain",83
"Smithsonian Open Access","https://www.si.edu/openaccess",82
"Who's Submitting AI-Tainted Filings in Court?","https://cyberlaw.stanford.edu/whos-submitting-ai-tainted-filings-in-court/",82
"Show HN: Lights Out: my 2D Rubik's Cube-like Game","https://raymondtana.github.io/projects/pages/Lights_Out.html",82
"Researchers Discover the Optimal Way to Optimize","https://www.quantamagazine.org/researchers-discover-the-optimal-way-to-optimize-20251013/",80
"Event Sourcing, CQRS and Micro Services: Real FinTech Example","https://lukasniessen.medium.com/this-is-a-detailed-breakdown-of-a-fintech-project-from-my-consulting-career-9ec61603709c",80
"Show HN: Inkeep (YC W23) – Agent Builder to create agents in code or visually","https://github.com/inkeep/agents",78
"CRDT and SQLite: Local-First Value Synchronization","https://marcobambini.substack.com/p/the-secret-life-of-a-local-first",78
"Salesforce told ICE it could help speed up hiring of immigration officers","https://www.sfchronicle.com/sf/article/salesforce-told-ice-help-speed-hiring-officers-21105202.php",77
"The Hidden Math of Ocean Waves Crashes Into View","https://www.quantamagazine.org/the-hidden-math-of-ocean-waves-crashes-into-view-20251015/",77
"Promoted on Sunday, Fired on Monday: Inside a NASA Office's Sudden Closure","https://www.planetary.org/articles/promoted-on-sunday-fired-on-monday-inside-a-nasa-offices-sudden-closure",76
"Uber will offer gig work like AI data labeling to drivers while not on the road","https://www.cnbc.com/2025/10/16/uber-will-offer-us-drivers-more-gig-work-including-ai-data-labeling.html",76
"Show HN: Pyversity – Fast Result Diversification for Retrieval and RAG","https://github.com/Pringled/pyversity",75
"Original C64 Lode Runner Source Code","https://github.com/Piddewitt/Loderunner",75
"Preparing for AI's economic impact: exploring policy responses","https://www.anthropic.com/research/economic-policy-responses",75
"MD RAID or DRBD can be broken from userspace when using O_DIRECT","https://bugzilla.kernel.org/show_bug.cgi?id=99171",74
"A Early History of Algebraic Data Types","https://www.hillelwayne.com/post/algdt-history/",72
"TaxCalcBench: Evaluating Frontier Models on the Tax Calculation Task","https://arxiv.org/abs/2507.16126",70
"LaTeXpOsEd: A Systematic Analysis of Information Leakage in Preprint Archives","https://arxiv.org/abs/2510.03761",70
"Can we know whether a profiler is accurate?","https://stefan-marr.de/2025/10/can-we-know-whether-a-profiler-is-accurate/",69
"The White House is already one of the most blocked accounts on Bluesky","https://techcrunch.com/2025/10/19/the-white-house-is-already-one-of-the-most-blocked-accounts-on-bluesky/",68
"Email bombs exploit lax authentication in Zendesk","https://krebsonsecurity.com/2025/10/email-bombs-exploit-lax-authentication-in-zendesk/",68
"Eon – An Effects-Based OCaml Nameserver","https://ryan.freumh.org/eon.html",66
"California to begin selling affordable state-branded insulin beginning next year","https://apnews.com/article/california-affordable-insulin-415edd0b915677d2051d22b4b8f8121c",66
"Apple M4 Series Feature Support","https://asahilinux.org/docs/platform/feature-support/m4/",65
"Credential Stuffing","https://ciamweekly.substack.com/p/credential-stuffing",65
"Best xkcd","https://www.heavyconsulting.net/bestxkcd/",64
"Microwave technique allows energy-efficient chemical reactions","https://phys.org/news/2025-10-microwave-technique-energy-efficient-chemical.html",64
"Improving the Trustworthiness of JavaScript on the Web","https://blog.cloudflare.com/improving-the-trustworthiness-of-javascript-on-the-web/",64
"Some graphene firms have reaped its potential but others are struggling","https://www.theguardian.com/business/2025/oct/13/lab-to-fab-are-promises-of-a-graphene-revolution-finally-coming-true",64
"KDE Connect: Enabling communication between all your devices","https://community.kde.org/KDEConnect",64
"Scheme Reports at Fifty","https://crumbles.blog/posts/2025-10-18-scheme-reports-at-fifty.html",63
"Adding Breadcrumbs to a Rails Application","https://avohq.io/blog/breadcrumbs-rails",63
"The story of X-Copy on the Amiga","https://spillhistorie.no/2025/10/10/the-story-of-x-copy-on-the-amiga/",63
"Japan asks OpenAI to keep Sora 2's hands off anime IP","https://www.theregister.com/2025/10/15/japan_openai_copyrighted_anime/",63
"Pointer Pointer","https://pointerpointer.com",60
"Trap the Critters with Paint","https://deepanwadhwa.github.io/freeze_trap/",60
"Keyboard Holders, Generation 1","https://cceckman.com/writing/keyboard-holders-gen1/",60
"New computer model helps reveal how the brain both adapts and misfires","https://now.tufts.edu/2025/10/16/flight-simulator-brain-reveals-how-we-learn-and-why-minds-sometimes-go-course",59
"Show HN: Metorial (YC F25) – Vercel for MCP","https://github.com/metorial/metorial",59
"Nvidia DGX Spark and Apple Mac Studio = 4x Faster LLM Inference with EXO 1.0","https://blog.exolabs.net/nvidia-dgx-spark/",59
"LINQ and Learning to Be Declarative","https://www.nickstambaugh.dev/posts/LINQ-and-being-declarative",59
"Jupyter Collaboration has a history slider","https://blog.jupyter.org/exploring-a-documents-timeline-in-jupyterlab-6084f96db263",57
"Show HN: ServiceRadar – open-source Network Observability Platform","https://github.com/carverauto/serviceradar",57
"How one of the longest dinosaur trackways in the world was uncovered in the UK","https://www.bbc.co.uk/news/resources/idt-5f8c77b0-92bc-40f2-bf21-6793abbe5ffe",56
"Space junk falls on Western Australian minesite","https://www.abc.net.au/news/2025-10-19/wa-space-debris-reentry-investigation/105909612",56
"Second Chances on YouTube","https://blog.youtube/inside-youtube/second-chances-on-youtube/",56
"UEFI shell vulnerabilities allow attackers to bypass Secure Boot","https://eclypsium.com/blog/bombshell-the-signed-backdoor-hiding-in-plain-sight-on-framework-devices/",56
"Nexperia – Update on Company Developments","https://www.nexperia.com/about/news-events/press-releases/update-on-company-developments",56
"Why every Rust crate feels like a research paper on abstraction","https://daymare.net/blogs/everbody-so-creative/",55
"Judge says body cameras for Chicago officers "was not a suggestion"","https://www.cbsnews.com/chicago/news/judge-homeland-security-federal-agents-chicago-body-cameras/",55
"Satellite images show ancient hunting traps used by South American social groups","https://phys.org/news/2025-10-satellite-images-reveal-ancient-south.html",54
"Bevy TLDR – Game development with Bevy summarized","https://taintedcoders.com/bevy/tldr",54
"QuickDrawViewer: A Mac OS X utility to visualise QuickDraw (PICT) files","https://github.com/wiesmann/QuickDrawViewer",53
"Moonlander.BAS","https://basic-code.bearblog.dev/moonlander/",53
"What's Behind the Mysterious Ancient Wall in the Gobi Desert?","https://news.artnet.com/art-world/the-hunt-gobi-wall-mongolia-2674588",52
"The Cancer Imaging Archive (TCIA)","https://www.cancerimagingarchive.net/",52
"Using Pegs in Janet","https://articles.inqk.net/2020/09/19/how-to-use-pegs-in-janet.html",52
"How I ditched smartphones","https://discuss.techlore.tech/t/how-i-ditched-smartphones/15315",51
"Nanochat","https://simonwillison.net/2025/Oct/13/nanochat/",50
"From Hollywood to horticulture: Cate Blanchett on a mission to save seeds","https://www.bbc.com/news/articles/cwy7ekl4yl8o",48
"ISP Blocking of No-IP's Dynamic DNS Enters Week 2","https://torrentfreak.com/isp-blocking-of-no-ips-dynamic-dns-enters-week-2-251019/",48
"If the Gumshoe Fits: The Thomas Pynchon Experience","https://www.bookforum.com/print/3202/if-the-gumshoe-fits-62416",48
"Cartridge Chaos: The Official Nintendo Region Converter and More","https://nicole.express/2025/not-just-for-robert.html",48
"Medical student ate 700 eggs in a month and his cholesterol levels dropped","https://nypost.com/2024/09/25/lifestyle/harvard-medical-student-nick-norwitz-ate-720-eggs-in-a-month-and-cholesterol-levels-dropped/",48
"Using CUE to unify IoT sensor data","https://aran.dev/posts/cue/using-cue-to-unify-iot-sensor-data/",47
"Beating the L1 cache with value speculation (2021)","https://mazzo.li/posts/value-speculation.html",47
"Oskar Speck's 1932 Kayak Journey from Germany to Australia","https://nswskc.wordpress.com/2002/10/24/incredible-journey-50/",45
"LoC Is a Dumb Metric for Functions","https://theaxolot.wordpress.com/2025/10/18/loc-is-a-dumb-metric-for-functions/",45
"Show HN: We packaged an MCP server inside Chromium","https://github.com/browseros-ai/BrowserOS/blob/main/docs/browseros-mcp/how-to-guide.mdx",45
"Bat v0.26.0 Released","https://github.com/sharkdp/bat/releases/tag/v0.26.0",44
"The Trinary Dream Endures","https://www.robinsloan.com/lab/trinary-dream/",44
"Cruz Godar Generative Art Gallery","https://cruzgodar.com/gallery/",44
"Show HN: A large format XY scanning hyperspectral camera","https://www.anfractuosity.com/projects/waverider/",44
"Generalized Orders of Magnitude","https://arxiv.org/abs/2510.03426",44
"Printing Petscii Faster","https://retrogamecoders.com/printing-petscii-faster/",44
"Show HN: Open-Source Voice AI Badge Powered by ESP32+WebRTC","https://github.com/VapiAI/vapicon-2025-hardware-workshop",43
"D'Angelo's Genius Was Pure, and Rare","https://www.newyorker.com/culture/postscript/dangelos-genius-was-pure-and-rare",43
"Don't Force Your LLM to Write Terse [Q/Kdb] Code: An Information Theory Argument","https://medium.com/@gabiteodoru/dont-force-your-llm-to-write-terse-code-an-argument-from-information-theory-for-q-kdb-developers-04077c5b7038",42
"Feed me up, Scotty – custom RSS feed generation using CSS selectors","https://feed-me-up-scotty.vincenttunru.com/",42
"Sharp Bilinear Filters: Big Clean Pixels for Pixel Art","https://bumbershootsoft.wordpress.com/2025/10/11/sharp-bilinear-filters-big-clean-pixels-for-pixel-art/",42
"Carbonized 1,300-Year-Old Bread Loaves Unearthed in Turkey","https://ancientist.com/1300-year-old-communion-bread-unearthed-in-karaman-a-loaf-for-the-farmer-christ/",41
"Automerge","https://automerge.org/",41
"RMS Lifestyle","https://www.stallman.org/rms-lifestyle.html",39
"Frank founder Charlie Javice sentenced for JPMorgan fraud","https://www.bbc.com/news/articles/c4gwj15djdxo",39
"Police Break Up Lego Theft Ring, Recovering Hundreds of Beheaded Figurines","https://www.nytimes.com/2025/10/18/us/lego-theft-california-arrest.html",38
"Dutch intelligence services now share less information with US","https://www.dutchnews.nl/2025/10/dutch-intelligence-services-now-share-less-information-with-us/",38
"Show HN: Trott – search,sort,extract social media videos(ig,yt,tiktok)","https://trott.hattimatimlabs.in",37
"Show HN: The Shape of YouTube","https://soy.leg.ovh/",36
"A magnetic field orientation that changes the fundamental design of motors","https://www.paranetics.com/copy-of-home",35
"Peeking Inside Gigantic Zips with Only Kilobytes","https://ritiksahni.com/blog/peeking-inside-gigantic-zips-with-only-kilobytes/",33
"Why We Need Arabic Language Models","https://www.natureasia.com/en/nmiddleeast/article/10.1038/nmiddleeast.2025.142",32
"Major AWS outage takes down Fortnite, Alexa, Snapchat, and more","https://www.theverge.com/news/802486/aws-outage-alexa-fortnite-snapchat-offline",31
"The Underscore Music Player","https://kottke.org/25/10/the-underscore-music-player",31
"The Spherical Cows of Programming","https://programmingsimplicity.substack.com/p/the-spherical-cows-of-programming",31
"Cyberpsychology's Influence on Modern Computing","https://cacm.acm.org/research/cyberpsychologys-influence-on-modern-computing/",30
"Eco-friendly technology removes toxic PFAS from water","https://phys.org/news/2025-10-eco-friendly-technology-toxic-pfas.html",29
"The U.S. is the bribery cop. Is that about to change?","https://www.npr.org/2025/06/20/1254460243/foreign-corrupt-practices-act-bribery-glencore-sudan-oil",29
"Show HN: Specific (YC F25) – Build backends with specifications instead of code","https://specific.dev/",29
"Looking at kmalloc() and the SLUB Memory Allocator (2019)","https://ruffell.nz/programming/writeups/2019/02/15/looking-at-kmalloc-and-the-slub-memory-allocator.html",29
"Only 40% of Workers Have High-Quality Jobs, Gallup Finds","https://www.gallup.com/analytics/691241/american-job-quality-study.aspx",28
"Show HN: Compression-Resistant Data Transfers","https://github.com/ianling/steg-experiments",27
"Sodium batteries are finally catching up","https://www.sciencedaily.com/releases/2025/10/251016223116.htm",27
"Carefully Educated to Be Idiots","https://www.hilarylayne.com/p/very-carefully-educated-to-be-idiots",26
"Covid mRNA vaccine sparks immune response to fight cancer","https://medicalxpress.com/news/2025-10-covid-mrna-vaccine-immune-response.html",26
"Pawn is a simple, typeless, 32-bit extension language with a C-like syntax","https://www.compuphase.com/pawn/pawn.htm",25
"Breakthrough Vitamin K Compounds May Reverse Alzheimer's Damage","https://scitechdaily.com/breakthrough-vitamin-k-compounds-may-reverse-alzheimers-damage/",25
"The Rise and Fall of the Powdered Wig (2020)","https://www.battlefields.org/learn/head-tilting-history/rise-and-fall-powdered-wig",25
"Programming language agnosticism is the only way to move forward in life","item?id=45632180",25
"Better SRGB to Greyscale Conversion","https://30fps.net/pages/better-srgb-to-greyscale/",24
"BQN "Macros" with •Decompose (2023)","https://saltysylvi.github.io/blog/bqn-macros.html",24
"BitLocker encryption permanently locks users' backup drives causing loss of data","https://www.tomshardware.com/software/windows/bitlocker-reportedly-auto-locks-users-backup-drives-causing-loss-of-3tb-of-valuable-data-windows-automatic-disk-encryption-can-permanently-lock-your-drives",24
"A laser pointer at 2B FPS [video]","https://www.youtube.com/watch?v=o4TdHrMi6do",24
"Functions Are Asymmetric","https://www.elbeno.com/blog/?p=1804",23
"Acid Drop","https://github.com/acidvegas/acid-drop",23
"Designing EventQL, an Event Query Language","https://docs.eventsourcingdb.io/blog/2025/10/20/designing-eventql-an-event-query-language/",22
"When Pollution Spikes in Southeast Asia, Rainfall Shifts from Land to Sea","https://e360.yale.edu/digest/southeast-asia-aerosols-rainfall?asds",22
"Ask HN: Those who applied to the OpenAI Grove program, did you ever hear back?","item?id=45637945",22
"Virtual Memory for Real-time RISC-V systems using hPMP","https://arxiv.org/abs/2504.04498",22
"GifCities – The Geocities Animated GIF Search from Internet Archive","https://gifcities.org/",22
"Pica Numbers","https://home.octetfont.com/blog/pica-number.html",22
"Show HN: Cmux – Coding Agent Multiplexer","https://github.com/coder/cmux",22
"Show HN: Land use visualization for European countries","https://onsland.koenvangilst.nl/",21
"Elixir/Ports and external process wiring","https://mw.ludd.net/wiki/Elixir/Ports_and_external_process_wiring",21
"NASA should go all-in on nuclear propulsion","https://bigthinkmedia.substack.com/p/why-nasa-should-go-all-in-on-nuclear",21
"Subway station study reveals fungal communities","https://phys.org/news/2025-09-subway-station-reveals-fungal-communities.html",20
"Discussion of the Benefits and Drawbacks of the Git Pre-Commit Hook","https://yeldirium.de/2025/10/09/pre-commit-hooks/index.html",20
"The Hunt for the World's Oldest Story","https://www.newyorker.com/magazine/2025/10/20/review-the-roots-of-ancient-mythology-books",20
"Let's Build the GPT Tokenizer: A Complete Guide to Tokenization in LLMs","https://www.fast.ai/posts/2025-10-16-karpathy-tokenizers",20
"More About Jumps Than You Wanted to Know","https://gpfault.net/posts/asm-tut-4.html",20
"Show HN: Browser-based PDF form fields detection (YOLO-based)","https://commonforms.simplepdf.com/",19
"bbcli – A TUI and CLI to browse BBC News like a hacker","https://github.com/hako/bbcli",19
"Spyware maker NSO Group blocked from Targeting WhatsApp","https://techcrunch.com/2025/10/18/spyware-maker-nso-group-blocked-from-whatsapp/",19
"Google Coral NPU: ML accelerator core designed for energy-efficient edge AI","https://github.com/google-coral/coralnpu",19
"China Is Already Winning the Trade War America Wanted","https://www.bloomberg.com/news/features/2025-10-19/us-china-trade-war-xi-is-winning-against-trump",19
"Teen sues to destroy the nudify app that left her in constant fear","https://arstechnica.com/tech-policy/2025/10/teen-haunted-by-fake-nudes-sues-to-kill-nudify-app-block-telegram-bots/",19
"Replua.nvim – an Emacs-style scratch buffer for executing Lua","https://github.com/mghaight/replua.nvim",18
"BoE chief: Brexit impact on UK economy negative for foreseeable future","https://news.sky.com/story/brexit-impact-on-uk-economy-negative-for-foreseeable-future-bank-of-england-chief-says-13452747",18
"A Tiny Typo May Explain Centuries-Old Mystery Bout Chaucer's 'Canterbury Tales'","https://www.smithsonianmag.com/smart-news/a-tiny-typo-may-explain-a-centuries-old-mystery-about-chaucers-canterbury-tales-and-troilus-and-criseyde-180986991/",17
"Using Emacs as a TUI","https://blog.natfu.be/emacs-in-terminal-ergonomics/",17
"Brussels opens the door to reviewing the ban on ICE vehicles from 2035","https://www.coface.com/news-economy-and-insights/brussels-opens-the-door-to-reviewing-the-ban-on-internal-combustion-engine-vehicles-from-2035",17
"The optimistic case for protein foundation model companies","https://www.owlposting.com/p/the-optimistic-case-for-protein-foundation-193",17
"I built an F5 QKview scanner for CISA ED 26-01","https://www.usenabla.com/blog/emergency-scanning-cisa-endpoint",16
