title,link,score
"Plain Vanilla Web","https://plainvanillaweb.com/index.html",1451
"From: Steve Jobs. "Great idea, thank you."","https://blog.hayman.net/2025/05/06/from-steve-jobs-great-idea.html",1188
"Void: Open-source Cursor alternative","https://github.com/voideditor/void",931
"Ty: A fast Python type checker and language server","https://github.com/astral-sh/ty",905
"Mozilla Firefox – Official GitHub repo","https://github.com/mozilla-firefox/firefox",792
"The Barbican","https://arslan.io/2025/05/12/barbican-estate/",696
"The world could run on older hardware if software optimization was a priority","https://twitter.com/ID_AA_Carmack/status/1922100771392520710",674
"My new deadline: 20 years to give away virtually all my wealth","https://www.gatesnotes.com/home/home-page-topic/reader/n20-years-to-give-away-virtually-all-my-wealth",670
"ALICE detects the conversion of lead into gold at the LHC","https://www.home.cern/news/news/physics/alice-detects-conversion-lead-gold-lhc",630
"A critical look at MCP","https://raz.sh/blog/2025-05-02_a_critical_look_at_mcp",613
"First American pope elected and will be known as Pope Leo XIV","https://www.cnn.com/world/live-news/new-pope-conclave-day-two-05-08-25",602
"LegoGPT: Generating Physically Stable and Buildable Lego","https://avalovelace1.github.io/LegoGPT/",587
"Business books are entertainment, not strategic tools","https://theorthagonist.substack.com/p/why-reading-business-books-is-a-waste",575
"Waiting for Postgres 18: Accelerating Disk Reads with Asynchronous I/O","https://pganalyze.com/blog/postgres-18-async-io",571
"NSF faces shake-up as officials abolish its 37 divisions","https://www.science.org/content/article/exclusive-nsf-faces-radical-shake-officials-abolish-its-37-divisions",565
"Leaving Google","https://www.airs.com/blog/archives/670",544
"Vision Now Available in Llama.cpp","https://github.com/ggml-org/llama.cpp/blob/master/docs/multimodal.md",543
"I hacked a dating app (and how not to treat a security researcher)","https://alexschapiro.com/blog/security/vulnerability/2025/04/21/startups-need-to-take-security-seriously",540
"Reservoir Sampling","https://samwho.dev/reservoir-sampling/",527
"Ask HN: What are good high-information density UIs (screenshots, apps, sites)?","item?id=43925732",524
"A simple 16x16 dot animation from simple math rules","https://tixy.land",516
"One-Click RCE in Asus's Preinstalled Driver Software","https://mrbruh.com/asusdriverhub/",511
"Mistral ships Le Chat – enterprise AI assistant that can run on prem","https://mistral.ai/news/le-chat-enterprise",505
"Ask HN: How are you acquiring your first hundred users?","item?id=43970837",493
"High tariffs become 'real' with our first $36K bill","https://blog.adafruit.com/2025/05/08/high-tariffs-become-real-with-our-first-36k-bill/",478
"Car companies are in a billion-dollar software war","https://insideevs.com/features/759153/car-companies-software-companies/",452
"Observations from people-watching","https://skincontact.substack.com/p/21-observations-from-people-watching",449
"US Copyright Office found AI companies breach copyright. Its boss was fired","https://www.theregister.com/2025/05/12/us_copyright_office_ai_copyright/",442
"Rust’s dependencies are starting to worry me","https://vincents.dev/blog/rust-dependencies-scare-me/?",417
"US vs. Google amicus curiae brief of Y Combinator in support of plaintiffs [pdf]","https://storage.courtlistener.com/recap/gov.uscourts.dcd.223205/gov.uscourts.dcd.223205.1300.1.pdf",410
"Sofie: open-source web based system for automating live TV news production","https://nrkno.github.io/sofie-core/",378
"Multiple security issues in GNU Screen","https://www.openwall.com/lists/oss-security/2025/05/12/1",371
"I built a native Windows Todo app in pure C (278 KB, no frameworks)","https://github.com/Efeckc17/simple-todo-c",371
"Branch Privilege Injection: Exploiting branch predictor race conditions","https://comsec.ethz.ch/research/microarch/branch-privilege-injection/",366
"Can you trust that permission pop-up on macOS?","https://wts.dev/posts/tcc-who/",364
"RybbitL Open source Google Analytics replacement","https://github.com/rybbit-io/rybbit",360
"FastVLM: Efficient vision encoding for vision language models","https://github.com/apple/ml-fastvlm",353
"I ruined my vacation by reverse engineering WSC","https://blog.es3n1n.eu/posts/how-i-ruined-my-vacation/",349
"Writing an LLM from scratch, part 13 – attention heads are dumb","https://www.gilesthomas.com/2025/05/llm-from-scratch-13-taking-stock-part-1-attention-heads-are-dumb",346
"The FTC puts off enforcing its 'click-to-cancel' rule","https://www.theverge.com/news/664730/ftc-delay-click-to-cancel-rule",337
"The great displacement is already well underway?","https://shawnfromportland.substack.com/p/the-great-displacement-is-already",334
"Gmail to SQLite","https://github.com/marcboeker/gmail-to-sqlite",334
"Mycoria is an open and secure overlay network that connects all participants","https://mycoria.org/",333
"WASM 2.0","https://www.w3.org/TR/wasm-core-2/",330
"Why Bell Labs Worked","https://1517.substack.com/p/why-bell-labs-worked",328
"Show HN: Hyvector – A fast and modern SVG editor","https://www.hyvector.com",326
"A community-led fork of Organic Maps","https://www.comaps.app/news/2025-05-12/3/",324
"21 GB/s CSV Parsing Using SIMD on AMD 9950X","https://nietras.com/2025/05/09/sep-0-10-0/",319
"In a high-stress work environment, prioritize relationships","https://wqtz.bearblog.dev/high-stress-job-relationships/",308
"Using NASA’s SMAP satellite to detect L-band interference","https://radioandnukes.substack.com/p/how-dare-you-transmit-at-14-ghz",308
"Microservices are a tax your startup probably can't afford","https://nexo.sh/posts/microservices-for-startups/",308
"Google is building its own DeX: First look at Android's Desktop Mode","https://www.androidauthority.com/android-desktop-mode-leak-3550321/",307
"Continuous Thought Machines","https://pub.sakana.ai/ctm/",304
"Starlink User Terminal Teardown","https://www.darknavy.org/blog/a_first_glimpse_of_the_starlink_user_ternimal/",304
"Ask HN: Cursor or Windsurf?","item?id=43959710",296
"Google to back three new nuclear projects","https://www.esgtoday.com/google-to-back-three-new-advanced-nuclear-projects/",291
"Itter.sh – Micro-Blogging via Terminal","https://www.itter.sh/",287
"University of Texas-led team solves a big problem for fusion energy","https://news.utexas.edu/2025/05/05/university-of-texas-led-team-solves-a-big-problem-for-fusion-energy/",282
"PDF to Text, a challenging problem","https://www.marginalia.nu/log/a_119_pdf/",281
"The Deathbed Fallacy (2018)","https://www.hjorthjort.xyz/2018/02/21/the-deathbed-fallacy.html",281
"Web search on the Anthropic API","https://www.anthropic.com/news/web-search-api",271
"Open Hardware Ethernet Switch project, part 1","https://serd.es/2025/05/08/Switch-project-pt1.html",264
"Build iOS Apps on Linux and Windows","https://forums.swift.org/t/xtool-cross-platform-xcode-replacement-build-ios-apps-on-linux-and-more/79803",261
"Show HN: Using eBPF to see through encryption without a proxy","https://github.com/qpoint-io/qtap",258
"Scraperr – A Self Hosted Webscraper","https://github.com/jaypyles/Scraperr",255
"High-school shop students attract skilled-trades job offers","https://www.wsj.com/lifestyle/careers/skilled-trades-high-school-recruitment-fd9f8257",254
"Address of Pope Leo XIV to the College of Cardinals","https://www.vatican.va/content/leo-xiv/en/speeches/2025/may/documents/20250510-collegio-cardinalizio.html",254
"Air Traffic Control","https://computer.rip/2025-05-11-air-traffic-control.html",253
"Klarna changes its AI tune and again recruits humans for customer service","https://www.customerexperiencedive.com/news/klarna-reinvests-human-talent-customer-service-AI-chatbot/747586/",253
"Why are banks still getting authentication so wrong?","https://jamal.haba.sh/its-2025-why-are-banks-still-getting-authentication-so-wrong/",252
"Create and edit images with Gemini 2.0 in preview","https://developers.googleblog.com/en/generate-images-gemini-2-0-flash-preview/",252
"Nextcloud cries foul over Google Play Store app rejection","https://www.theregister.com/2025/05/13/nextcloud_play_store_complaint/",250
"How friction is being redistributed in today's economy","https://kyla.substack.com/p/the-most-valuable-commodity-in-the",250
"For $595, you get what nobody else can give you for twice the price (1982) [pdf]","https://s3data.computerhistory.org/brochures/commodore.commodore64.1982.102646264.pdf",249
"Avoiding AI is hard – but our freedom to opt out must be protected","https://theconversation.com/avoiding-ai-is-hard-but-our-freedom-to-opt-out-must-be-protected-255873",246
"Man 'Disappeared' by ICE Was on El Salvador Flight Manifest, Hacked Data Shows","https://www.404media.co/man-disappeared-by-ice-was-on-el-salvador-flight-manifest-hacked-data-shows/",245
"Show HN: eInk optimized manga with Kindle Comic Converter (+Kobo/ReMarkable)","https://github.com/ciromattia/kcc",239
"Title of work deciphered in sealed Herculaneum scroll via digital unwrapping","https://www.finebooksmagazine.com/fine-books-news/title-work-deciphered-sealed-herculaneum-scroll-digital-unwrapping",236
"CryptPad: An Alternative to the Google Suite","https://cryptpad.org/",235
"Progress toward fusion energy gain as measured against the Lawson criteria","https://www.fusionenergybase.com/articles/continuing-progress-toward-fusion-energy-breakeven-and-gain-as-measured-against-the-lawson-criteria",232
"'We Currently Have No Container Ships,' Seattle Port Says","https://www.newsweek.com/seattle-port-says-no-container-ships-tariffs-2069464",231
"A flat pricing subscription for Claude Code","https://support.anthropic.com/en/articles/11145838-using-claude-code-with-your-max-plan",230
"Mac Themes Garden","https://damien.zone/introducing-mac-themes-garden/",229
"Reviving a modular cargo bike design from the 1930s","https://www.core77.com/posts/136773/Reviving-a-Modular-Cargo-Bike-Design-from-the-1930s",225
"Show HN: Aberdeen – An elegant approach to reactive UIs","https://aberdeenjs.org/",223
"Why I'm resigning from the National Science Foundation","https://time.com/7285045/resigning-national-science-foundation-library-congress/",223
"Flattening Rust’s learning curve","https://corrode.dev/blog/flattening-rusts-learning-curve/",220
"Universe expected to decay in 10⁷⁸ years, much sooner than previously thought","https://phys.org/news/2025-05-universe-decay-years-sooner-previously.html",220
"WebGL Water (2010)","https://madebyevan.com/webgl-water/",219
"June Huh dropped out to become a poet, now he’s won a Fields Medal (2022)","https://www.quantamagazine.org/june-huh-high-school-dropout-wins-the-fields-medal-20220705/",218
"Ruby 3.5 Feature: Namespace on read","https://bugs.ruby-lang.org/issues/21311",217
"Data manipulations alleged in study that paved way for Microsoft's quantum chip","https://www.science.org/content/article/data-manipulations-alleged-study-paved-way-microsoft-s-quantum-chip",217
"Sierpiński Triangle? In My Bitwise and?","https://lcamtuf.substack.com/p/sierpinski-triangle-in-my-bitwise",217
"Samsung is paying $350M for audio brands B&W, Denon, Marantz and Polk","https://www.engadget.com/audio/samsung-is-paying-350-million-for-audio-brands-bowers--wilkins-denon-marantz-and-polk-131514754.html",217
"LTXVideo 13B AI video generation","https://ltxv.video/",216
"Fandom sells gaming media brand Giant Bomb to long-term staff","https://about.fandom.com/news/fandom-sells-giant-bomb-to-independent-creators",214
"Microsoft Teams will soon block screen capture during meetings","https://www.bleepingcomputer.com/news/microsoft/microsoft-teams-will-soon-block-screen-capture-during-meetings/",208
"Amazon's Vulcan Robots Now Stow Items Faster Than Humans","https://spectrum.ieee.org/amazon-stowing-robots",208
"Audiobookshelf: Self-hosted audiobook and podcast server","https://www.audiobookshelf.org/",207
"All BART trains were stopped due to ‘computer networking problem’","https://www.kqed.org/news/12039472/bart-shuts-down-entire-train-service-due-to-computer-networking-problem",206
"Dotless Domains","https://lab.avl.la/dotless/",200
"Intellect-2 Release: The First 32B Model Trained Through Globally Distributed RL","https://www.primeintellect.ai/blog/intellect-2-release",199
"Continuous glucose monitors reveal variable glucose responses to the same meals","https://examine.com/research-feed/study/1jjKq1/",197
"The Epochalypse Project","https://epochalypse-project.org/",195
"Yggdrasil is an experimental compact routing scheme that is fully decentralised","https://yggdrasil-network.github.io/about.html",194
"RIP Usenix ATC","https://bcantrill.dtrace.org/2025/05/11/rip-usenix-atc/",191
"Type-constrained code generation with language models","https://arxiv.org/abs/2504.09246",190
"Brandon's Semiconductor Simulator","https://brandonli.net/semisim/",189
"Notes on rolling out Cursor and Claude Code","https://ghiculescu.substack.com/p/nobody-codes-here-anymore",189
"Dead Reckoning","https://www.damninteresting.com/dead-reckoning/",188
"Bus stops here: Shanghai lets riders design their own routes","https://www.sixthtone.com/news/1017072",185
"I failed a take-home assignment from Kagi Search","https://bloggeroo.dev/articles/202504031434",185
"What’s new in Swift 6.2","https://www.hackingwithswift.com/articles/277/whats-new-in-swift-6-2",185
"Embracer Games Archive is preserving 75000 video games and needs contributions","https://embracergamesarchive.com/",184
"DNS piracy blocking orders: Google, Cloudflare, and OpenDNS respond differently","https://torrentfreak.com/dns-piracy-blocking-orders-google-cloudflare-and-opendns-respond-differently-250511/",180
"Odin: A programming language made for me","https://zylinski.se/posts/a-programming-language-for-me/",179
"Build your own Siri locally and on-device","https://thehyperplane.substack.com/p/build-your-own-siri-locally-on-device",177
"Launch HN: Miyagi (YC W25) turns YouTube videos into online, interactive courses","item?id=43972425",176
"Dusk OS","https://duskos.org/",171
"Slow software for a burning world","https://bonfirenetworks.org/posts/slow_software_for_a_burning_world/",170
"Reverse engineering the 386 processor's prefetch queue circuitry","http://www.righto.com/2025/05/386-prefetch-circuitry-reverse-engineered.html",170
"HealthBench – An evaluation for AI systems and human health","https://openai.com/index/healthbench/",169
"Ghost students are creating problems for California colleges","https://www.sfgate.com/bayarea/article/ghost-students-creating-problem-calif-colleges-20311708.php",169
"Burrito Now, Pay Later","https://enterprisevalue.substack.com/p/burrito-now-pay-later",167
"Understanding LucasArts' iMUSE System","https://github.com/meshula/LabMidi/blob/main/LabMuse/imuse-technical.md",165
"Fui: C library for interacting with the framebuffer in a TTY context","https://github.com/martinfama/fui",164
"'It cannot provide nuance': UK experts warn AI therapy chatbots are not safe","https://www.theguardian.com/technology/2025/may/07/experts-warn-therapy-ai-chatbots-are-not-safe-to-use",163
"Show HN: HelixDB – Open-source vector-graph database for AI applications (Rust)","https://github.com/HelixDB/helix-db/",162
"LSP client in Clojure in 200 lines of code","https://vlaaad.github.io/lsp-client-in-200-lines-of-code",162
"OpenAI for Countries","https://openai.com/global-affairs/openai-for-countries/",162
"It Awaits Your Experiments","https://www.rifters.com/crawl/?p=11511",161
"A conversation about AI for science with Jason Pruet","https://www.lanl.gov/media/publications/1663/0125-qa-jason-pruet",161
"Fleurs du Mal","https://fleursdumal.org",161
"A Formal Analysis of Apple's iMessage PQ3 Protocol [pdf]","https://www.usenix.org/system/files/conference/usenixsecurity25/sec25cycle1-prepub-595-linker.pdf",160
"Show HN: Airweave – Let agents search any app","https://github.com/airweave-ai/airweave",158
"How to start a school with your friends","https://prigoose.substack.com/p/how-to-start-a-university",157
"Launch HN: Nao Labs (YC X25) – Cursor for Data","item?id=43938607",156
"'I paid for the whole GPU, I am going to use the whole GPU'","https://modal.com/blog/gpu-utilization-guide",154
"Fan Service","https://flak.tedunangst.com/post/fan-service",151
"Gig Companies Violate Workers Rights","https://www.hrw.org/news/2025/05/12/us-major-companies-violate-gig-workers-rights",151
"The cult of doing business","https://www.commonwealmagazine.org/calvert-work-entrepreneur-ethic-baker-review-job",151
"A Typical Workday at a Japanese Hardware Tool Store [video]","https://www.youtube.com/watch?v=A98jyfB5mws",150
"Writing N-body gravity simulations code in Python","https://alvinng4.github.io/grav_sim/5_steps_to_n_body_simulation/",148
"Detect and crash Chromium bots","https://blog.castle.io/detect-and-crash-chromium-bots-with-one-weird-trick-bots-hate-it/",145
"Wise refuses to let us access our $60k AUD","https://hey.paris/posts/wise/",144
"The Academic Pipeline Stall: Why Industry Must Stand for Academia","https://www.sigarch.org/the-academic-pipeline-stall-why-industry-must-stand-for-academia/",144
"Odin, a pragmatic C alternative with a Go flavour","http://bitshifters.cc/2025/05/04/odin.html",142
"Airbnb is in midlife crisis mode","https://www.wired.com/story/airbnb-is-in-midlife-crisis-mode-reinvention-app-services/",141
"Membrane: Media Framework for Elixir","https://membrane.stream/",141
"Failed Soviet Venus lander Kosmos 482 crashes to Earth after 53 years in orbit","https://www.space.com/space-exploration/launches-spacecraft/failed-soviet-venus-lander-kosmos-482-crashes-to-earth-after-53-years-in-orbit",140
"Starcloud","https://www.ycombinator.com/companies/starcloud",140
"ToyDB rewritten: a distributed SQL database in Rust, for education","https://github.com/erikgrinaker/toydb",140
"Comparison of C/POSIX standard library implementations for Linux","https://www.etalabs.net/compare_libcs.html",140
"15 Years of Shader Minification","https://www.ctrl-alt-test.fr/2025/15-years-of-shader-minification/",138
"Ex-UK Special Forces break silence on 'war crimes' by colleagues","https://www.bbc.com/news/articles/cj3j5gxgz0do",138
"Europe launches program to lure scientists away from the US","https://es.wired.com/articulos/europa-lanza-iniciativa-para-atraer-talento-cientifico-tras-recortes-en-ee-uu",137
"Ask HN: How much better are AI IDEs vs. copy pasting into chat apps?","item?id=43922759",137
"Vagus Nerve Stimulation Erases PTSD: Study","https://neurosciencenews.com/vagus-nerve-stimulation-ptsd-28818/",137
"Foundation DB Record Layer SQL API","https://foundationdb.github.io/fdb-record-layer/SQL_Reference.html",136
"Past, present, and future of Sorbet type syntax","https://blog.jez.io/history-of-sorbet-syntax/",136
"Why the Apple II Didn't Support Lowercase Letters (2020)","https://www.vintagecomputing.com/index.php/archives/2833/why-the-apple-ii-didnt-support-lowercase-letters",134
"The History and Legacy of Visual Basic","https://retool.com/visual-basic",134
"Absolute Zero Reasoner","https://andrewzh112.github.io/absolute-zero-reasoner/",132
"Show HN: Xenolab – Rasp Pi monitor for my pet carnivourus plants","https://github.com/blackrabbit17/xenolab",131
"Why are coffee stains darker at the edges?","https://www.why.is/svar.php?id=5513",130
"Stability by Design","https://potetm.com/devtalk/stability-by-design.html",130
"I learned Snobol and then wrote a toy Forth","https://ratfactor.com/snobol/",128
"Launch HN: ParaQuery (YC X25) – GPU Accelerated Spark/SQL","item?id=43964505",128
"Why 536 was 'the worst year to be alive' (2018)","https://www.science.org/content/article/why-536-was-worst-year-be-alive",127
"Build real-time knowledge graph for documents with LLM","https://cocoindex.io/blogs/knowledge-graph-for-docs/",126
"Insurers launch cover for losses caused by AI chatbot errors","https://www.ft.com/content/1d35759f-f2a9-46c4-904b-4a78ccc027df",126
"Microsoft is Cutting 3% of All Workers","https://www.cnbc.com/2025/05/13/microsoft-is-cutting-3percent-of-workers-across-the-software-company.html",126
"CrowdStrike CEO cuts his voting power by 92% with unexplained gifts","https://www.bloomberg.com/news/articles/2025-05-12/billionaire-crowdstrike-ceo-cuts-voting-power-by-92-with-unexplained-gifts",126
"Making PyPI's test suite faster","https://blog.trailofbits.com/2025/05/01/making-pypis-test-suite-81-faster/",125
"Egyptologist uncovers hidden messages on Paris’s iconic obelisk","https://news.artnet.com/art-world/hidden-messages-paris-luxor-obelisk-2636508",125
"Not a three-year-old chimney sweep (2022)","https://fakehistoryhunter.net/2022/07/26/not-a-3-year-old-chimney-sweep/",125
"How the US built 5k ships in WWII","https://www.construction-physics.com/p/how-the-us-built-5000-ships-in-wwii",125
"An Introduction to Solid Queue for Ruby on Rails","https://blog.appsignal.com/2025/05/07/an-introduction-to-solid-queue-for-ruby-on-rails.html",124
"React Three Ecosystem","https://www.react-three.org/",124
"Implementing a Struct of Arrays","https://brevzin.github.io/c++/2025/05/02/soa/",123
"My stackoverflow question was closed so here's a blog post about CoreWCF","https://richardcocks.github.io/2025-05-08-CoreWCF.html",123
"I hacked my clock to control my focus","https://www.paepper.com/blog/posts/how-i-hacked-my-clock-to-control-my-focus.md/",122
"Fingers wrinkle the same way every time they’re in the water too long","https://www.binghamton.edu/news/story/5547/do-your-fingers-wrinkle-the-same-way-every-time-youre-in-the-water-too-long-new-research-says-yes",121
"Y Combinator says Google is a monopolist, no comment about its OpenAI ties","https://techcrunch.com/2025/05/13/y-combinator-says-google-is-a-monopolist-that-has-stunted-the-startup-ecosystem/",121
"An online exhibition of pretty software bugs","https://glitchgallery.org/",121
"RPG in a Box","https://rpginabox.com/",119
"Show HN: Basecoat – shadcn/UI components, no React required","item?id=43971688",118
"TransMLA: Multi-head latent attention is all you need","https://arxiv.org/abs/2502.07864",117
"Wtfis: Passive hostname, domain and IP lookup tool for non-robots","https://github.com/pirxthepilot/wtfis",117
"Show HN: CLI that spots fake GitHub stars, risky dependencies and licence traps","https://github.com/m-ahmed-elbeskeri/Starguard",117
"Show HN: Code Claude Code","https://github.com/RVCA212/codesys",117
"Anti-Personnel Computing (2023)","https://erratique.ch/writings/anti-personnel-computing",116
"Tailscale 4via6 – Connect Edge Deployments at Scale","https://tailscale.com/blog/4via6-connectivity-to-edge-devices",116
"Demonstrably Secure Software Supply Chains with Nix","https://nixcademy.com/posts/secure-supply-chain-with-nix/",116
"As US vuln-tracking falters, EU enters with its own security bug database","https://www.theregister.com/2025/05/13/eu_security_bug_database/",115
"Strain gauge made out of PCB","https://github.com/vapetrov/PCB_strain_gauge",115
"Podfox: First Container-Aware Browser","https://val.packett.cool/blog/podfox/",115
"Static as a Server","https://overreacted.io/static-as-a-server/",115
"WeightWatchers files bankruptcy","https://www.wsj.com/articles/weightwatchers-files-bankruptcy-to-adapt-to-chemically-induced-weight-loss-future-a63aa8ac",114
"Show HN: US Routing – Python library for fast local routing in the US","https://github.com/ivanbelenky/us-routing",114
"Usenix ATC Announcement","https://www.usenix.org/blog/usenix-atc-announcement",113
"Spade Hardware Description Language","https://spade-lang.org/",112
"How to avoid P hacking","https://www.nature.com/articles/d41586-025-01246-1",110
"Intel: Winning and Losing","https://www.abortretry.fail/p/intel-winning-and-losing",107
"Show HN: Oliphaunt – A native Mastodon client for macOS","https://testflight.apple.com/join/Epq1P3Cw",103
"2024 sea level 'report cards' map futures of U.S. coastal communities","https://news.wm.edu/2025/05/06/2024-sea-level-report-cards-map-futures-of-u-s-coastal-communities/",103
"The Beam","https://www.erlang-solutions.com/blog/the-beam-erlangs-virtual-machine/",102
"In the Network of the Conclave","https://www.unibocconi.it/en/news/network-conclave",102
"NASA study reveals Venus crust surprise","https://science.nasa.gov/science-research/astromaterials/nasa-study-reveals-venus-crust-surprise/",101
"White House fires head of Copyright Office amid Library of Congress shakeup","https://www.washingtonpost.com/politics/2025/05/11/white-house-copyright-office-director-fired/",101
"JEP 515: Ahead-of-Time Method Profiling","https://openjdk.org/jeps/515",100
"New Tool: lsds – List All Linux Block Devices and Settings in One Place","https://tanelpoder.com/posts/lsds-list-linux-block-devices-and-their-config/",100
"Gonzalo Guerrero","https://en.wikipedia.org/wiki/Gonzalo_Guerrero",98
"I can’t understand Apple’s Critical Alert policy (2023)","https://jhan.bearblog.dev/i-cant-understand-apples-critical-alert-policy/",98
"How to title your blog post or whatever","https://dynomight.net/titles/",96
"Google Doc Templates for Startups","https://www.templatesbypaul.com/",96
"OpenAI's Stargate project struggling to get off the ground, due to tariffs","https://techcrunch.com/2025/05/12/openais-stargate-project-reportedly-struggling-to-get-off-the-ground-thanks-to-tariffs/",96
"eBPF Mystery: When is IPv4 not IPv4? When it's pretending to be IPv6","https://blog.gripdev.xyz/2025/05/06/ebpf-mystery-when-is-ipv4-not-ipv4-when-its-ipv6/",95
"Don't unwrap options: There are better ways (2024)","https://corrode.dev/blog/rust-option-handling-best-practices/",94
"Reverse Engineering "DNA Sequences" in the Lost World: Jurassic Park Video Game","https://32bits.substack.com/p/under-the-microscope-the-lost-world",94
"A Rust Documentation Ecosystem Review","https://www.harudagondi.space/blog/rust-documentation-ecosystem-review/",94
