title,link,score
"bolt-ts: A TypeScript Compiler Implemented in Rust","https://github.com/bvanjoi/bolt-ts",16
"AI Is Killing Wikipedia's Human Traffic","https://gizmodo.com/ai-is-killing-wikipedias-human-traffic-2000673686",16
"Reddit requires CirclejerkSopranos ban political jokes, memes, current-events","https://old.reddit.com/r/CirclejerkSopranos/comments/1ob5b3n/mod_update_reddit_cracking_down_on/",15
"TP-Link conducts Wi-Fi 8 trials, promises better reliability and lower latency","https://www.techspot.com/news/109837-tp-link-conducts-successful-wi-fi-8-trials.html",15
"Watching 25,000 Dice Neatly Arrange Themselves Shouldn't Be This Fascinating","https://www.sciencealert.com/packing-density-shear-force-dice-inside-cylinder-physics",15
"Jane Goodall and Gary Larson","https://mariakonnikova.substack.com/p/funny-or-offensive",15
"Backblaze says HDDs are "lasting longer"","https://arstechnica.com/gadgets/2025/10/backblaze-owner-of-317230-hdds-says-hdds-are-lasting-longer/",15
"Effect of a honey-sweetened beverage on muscle soreness and recovery","https://pubmed.ncbi.nlm.nih.gov/39355153/",14
"Warning: Gmail client Show Original can omit lines of the original","item?id=45633892",14
"mRNA Covid vaccines spark immune response that may aid cancer survival","https://www.newscientist.com/article/2500546-mrna-covid-vaccines-spark-immune-response-that-may-aid-cancer-survival/",14
"What to do after detecting a signal from extraterrestrial intelligence","https://arxiv.org/abs/2510.14506",14
"The Rise and Fall of Hunter S. Thompson (Part 3 of 3)","https://www.honest-broker.com/p/the-rise-and-fall-of-hunter-s-thompson-aa8",14
"Oma: An attempt at reworking APT's interface","https://github.com/AOSC-Dev/oma",13
"Redis Backplane for Hubots","https://github.com/hubot-friends/hubot-redis-backplane",13
"Electrostatic charges pull roundworms through air to its insect targets","https://www.science.org/content/article/bull-s-eye-static-electricity-pulls-worm-through-air-its-insect-victim",13
"Meta Is Building a Smart TV in VR","https://www.lowpass.cc/p/meta-horizon-tv-app-smart-tv-ui",13
"Just Some Pictures of London Vents Looking Spectacular","https://londonist.com/london/art-and-photography/adventurous-vents",13
"'Dangerous design choices' trapped teens in Cybertruck crash, lawsuit claims","https://oaklandside.org/2025/10/14/dangerous-design-choices-trapped-piedmont-teens-in-cybertruck-crash-lawsuit-claims/",13
"Alibaba Cloud: AI Models, Reducing Footprint of Nvidia GPUs, and Cloud Streaming","https://boilingsteam.com/tgs2025-a-talk-with-alibaba-cloud/",13
"DoorDash Order, Delivered by Waymo","https://waymo.com/blog/2025/10/your-doordash-order-delivered-by-waymo",13
"Federal agency overseeing US nuclear stockpile will furlough most of workforce","https://www.cnn.com/2025/10/19/politics/national-nuclear-security-administration-furloughs-shutdown",12
"Immix: A Mark-Region Garbage Collector (2008) [pdf]","https://www.steveblackburn.org/pubs/papers/immix-pldi-2008.pdf",12
"Caveat Prompter","https://surfingcomplexity.blog/2025/10/12/caveat-promptor/",12
"Smart jab can shrink head and neck cancer tumours within six weeks, trial finds","https://www.theguardian.com/science/2025/oct/19/smart-jab-shrink-head-neck-cancer-tumours-six-weeks-research",12
"A 2020 MacBook Air can hash every North American phone number in four hours","https://matthodges.com/posts/2025-10-19-privacy-theater-pii-phone-numbers/",12
"95% of kids with "bubble boy" disease cured by one-time gene therapy","https://newatlas.com/disease/ada-scid-gene-therapy-cure/",12
"Wrongfully imprisoned for more than 40 years, US man faces deportation to India","https://www.bbc.com/news/articles/clykvypl9gxo",12
"Why AI and Defense Are Soaked in Capital While Food and Water Go Thirsty","https://www.globalagtechinitiative.com/digital-farming/the-great-vc-misallocation-why-ai-and-defense-are-soaked-in-capital-while-food-and-water-go-thirsty/",12
"A cacao rush drives 'alarming' deforestation in Liberia","https://news.mongabay.com/2025/10/a-cacao-rush-drives-alarming-deforestation-in-liberia/",12
"Creative destruction is a miracle. It's also a political problem","https://www.theargumentmag.com/p/creative-destruction-is-a-miracle",12
"Alpine Ajax: Radio Controlled HTML Elements","https://alpine-ajax.js.org/",12
"Show HN: Web-directive.js – A directive pattern for native HTML","https://github.com/asika32764/web-directive",11
"Susan Stamberg, NPR's "founding mother", dies at 87","https://www.npr.org/2025/10/16/1184880448/susan-stamberg-obituary",11
"The Adventures and Experiences of the First Slovak Novel","https://publicdomainreview.org/essay/the-adventures-and-experiences-of-the-first-slovak-novel/",11
"Dumper: CLI utility for creating database backups – PostgreSQL, MySQL and others","https://github.com/elkirrs/dumper",11
"Show HN: I Built an AI Maturity Model for Software Engineers (and No One Cared)","https://github.com/Gigacore/AI-Maturity-Model",11
"Limp Bizkit announces death of bassist Sam Rivers aged 48","https://www.theguardian.com/music/2025/oct/19/limp-bizkit-announces-death-of-bassist-sam-rivers-aged-48",11
"Show HN: Code First CDC from Postgres to ClickHouse with MooseStack","https://github.com/514-labs/debezium-cdc",11
"Hackers Had Been Lurking in Cyber Firm F5 Systems Since 2023","https://www.bloomberg.com/news/articles/2025-10-18/hackers-had-been-lurking-in-cyber-firm-f5-systems-since-2023",11
"Vaginal condition treatment update: Men should get treated, too","https://arstechnica.com/health/2025/10/vaginal-condition-treatment-update-men-should-get-treated-too/",10
"Show HN: Open-source implementation of Stanford's self-learning agent framework","https://github.com/kayba-ai/agentic-context-engine",10
"Show HN: Silly Morse code chat app using WebSockets","https://noamtamir.github.io/morwse/",10
"Spray Cooling – Recreating Supercomputer Cooling on a Desktop CPU [video]","https://www.youtube.com/watch?v=yEBSuk20gvc",10
"Armed man wearing 'non-offending pedophile' sign storms stage at Wikipedia con","https://www.nbcnews.com/news/us-news/armed-man-upends-nyc-wikipedia-conference-rcna238250",10
"Football Shouldn't Be a Billboard for the Dictators","https://jacobin.com/2025/10/kagame-rwanda-qatar-uae-football-sportswashing/",10
"Computable Babylonian Diaries Project","https://christopherwolfram.com/babylonian-astronomy/",10
"Firefox Interop Feature Ranking","https://interop-rank.jakearchibald.com/",10
"RSS is still pretty great (2024)","https://www.pcloadletter.dev/blog/rss/",9
"RSS is still pretty great (2024)","https://www.pcloadletter.dev/blog/rss/",9
"Nvidia and TSMC Celebrate First Nvidia Blackwell Wafer Produced in the US","https://blogs.nvidia.com/blog/tsmc-blackwell-manufacturing/",9
"Doctor Who archive expert shares positive update on missing episode","https://www.radiotimes.com/tv/sci-fi/doctor-who-missing-episodes-update-teases-announcement-newsupdate/",9
"Ibuprofen May Have Anti-Cancer Properties","https://www.sciencealert.com/a-common-pain-relief-drug-may-have-anti-cancer-properties",9
"Snail farmer of London, mafia friends, and a £20M vendetta against the taxman","https://www.londoncentric.media/p/terry-ball-the-snail-farmer-his-mafia",9
"Dynamic Routing on WireGuard for Everyone","https://github.com/encodeous/nylon",9
"Liver fat, not weight, predicts health risks in obese children","https://medicalxpress.com/news/2025-09-liver-fat-weight-health-obese.html",9
"Ask HN: Is there an open source HN?","item?id=45633083",9
"Seeing plasma in colour: new imaging from ST40","https://tokamakenergy.com/2025/10/15/seeing-plasma-in-colour-new-imaging-from-st40/",9
"Kiss founding guitarist Ace Frehley dies aged 74","https://www.bbc.com/news/articles/cj41vwgv47no",9
"Bears have attacked over 100 people in Japan since March","https://www.popsci.com/environment/bear-attacks-japan/",9
"Show HN: Nova: Open-source solution for CAD file conflicts","https://github.com/agg111/nova",8
"The Apple App Store is down","https://developer.apple.com/system-status/",8
"Show HN: Proxmox-GitOps: Container Automation Metaframework (Recursive Monorepo)","https://github.com/stevius10/Proxmox-GitOps",8
"From cloud to OCP? Be ready to wrangle firmware","https://www.thestack.technology/insurer-slashes-compute-costs-with-cloud-repatriation-shift-to-ocp-but/",8
"The UPS chaos shows tariffs have arrived on our doorsteps","https://www.businessinsider.com/ups-chaos-shows-tariffs-have-finally-arrived-on-our-doorsteps-2025-10",8
"Go rate limiter that writes 95%-99% less I/O","https://github.com/etalazz/vsa",8
"Bit banged 100 MBit/s Ethernet transmission on RPi Pico","https://github.com/steve-m/Pico-100BASE-TX",8
"Apple employees concerned about new Siri","https://www.bloomberg.com/news/newsletters/2025-10-19/apple-m5-ipad-pro-vision-pro-macbook-pro-impressions-review-touch-screen-mac-mgxnn1w8",8
"Perovskite: The 'wonder material' that could transform solar","https://www.bbc.com/future/article/20251015-perovskite-the-wonder-material-that-could-transform-solar-energy",8
"Enchanting Imposters","https://daily.jstor.org/enchanting-imposters/",7
"Karryon Air New Zealand's first electric aircraft trial in NZ lift-off","https://karryon.com.au/industry-news/airline/air-new-zealand-electric-jet/",7
"Show HN: Syna – Minimal ML and RL Framework Built from Scratch with NumPy","https://github.com/sql-hkr/syna",7
"The Privacy Theater of Hashed PII","https://matthodges.com/posts/2025-10-19-privacy-theater-pii-phone-numbers/",7
"Google phases out Privacy Sandbox","https://www.forbes.com/sites/zakdoffman/2025/10/19/phased-out-google-confirms-bad-news-for-all-3-billion-chrome-users/",7
"Infra-red in-situ (IRIS) inspection of silicon","https://www.bunniestudios.com/blog/2023/infra-red-in-situ-iris-inspection-of-silicon/",7
"First Ford, Now Jeep. Automakers Are Hit by Lack of Parts","https://www.wsj.com/business/autos/car-industry-supply-chain-issues-218b19b9",7
"Soft multistable magnetic-responsive metamaterials","https://www.science.org/doi/10.1126/sciadv.adu3749",7
"Stop treating scientific code like an afterthought: record, share and value it","https://www.nature.com/articles/d41586-025-03196-0",7
"Leonardo da Vinci's To-Do List from 1490: The Plan of a Renaissance Man","https://www.openculture.com/2025/09/leonardo-da-vincis-to-do-list-from-1490.html",7
"Researchers demonstrate centimetre-level positioning using smartwatches","https://www.otago.ac.nz/news/newsroom/researchers-demonstrate-centimetre-level-positioning-using-smartwatches",7
"If You Get the Chance","https://collabfund.com/blog/if-you-get-the-chance/",7
"Treat your morning ritual like an opening chess move","https://herbertlui.net/treat-your-morning-ritual-like-an-opening-chess-move/",7
"Penrose Tiling Visualization","https://fanyangxyz.github.io/penrose-ii/",7
"Artificial Intelligence – A Modern Approach (visualization of concepts)","http://aimacode.github.io/aima-javascript/",7
"Results from blood test for 50 cancers","https://www.bbc.com/news/articles/c205g21n1zzo",7
"Gentoo Bug Filed: moor-2.6.1 aborts if user is assumed to be Russian","https://bugs.gentoo.org/show_bug.cgi?id=964663",7
"Cheapest ARM Debugger is RISC-V","https://bogdanthegeek.github.io/blog/projects/v003-dap/",6
"Show HN: MarkdownConverters – Convert any file format to clean Markdown","https://markdownconverters.com",6
"Something from "space" may have just struck a United Airlines flight over Utah","https://arstechnica.com/space/2025/10/something-from-space-may-have-just-struck-a-united-airlines-flight-over-utah/",6
"Multi-Tenant SaaS's Wildcard TLS: An Overview of DNS-01 Challenges","https://www.skeptrune.com/posts/wildcard-tls-for-multi-tenant-systems/",6
"LibCube: Find new sounds from audio synths easier","https://github.com/cslr/libcube-public/wiki",6
"Meh and Hyper for Normal Keyboards (2023)","https://kevinkipp.com/blog/meh-and-hyper-for-normal-keyboards/",6
"Scheme Reports at Fifty: Where do we go from here?","https://crumbles.blog/posts/2025-10-18-scheme-reports-at-fifty.html",6
"Revelling in illusion: Jean Baudrillard","https://www.spectator.co.uk/article/revelling-in-illusion-the-french-sociologist-cum-philosopher-who-hit-peak-absurdity-back-in-1991/",6
"The Tonnetz","https://thetonnetz.com/",6
"Alpenglow – an experimental high performance rasterization engine","https://phetsims.github.io/alpenglow/",6
"China Accuses US of Cyberattack on National Time Center","https://english.kyodonews.net/articles/-/63069",6
"Show HN: AlgoSync – a social media built for developers, founders, & tech people","https://www.algosyncverse.com/",6
"Patat: Terminal-based presentations using Pandoc","https://github.com/jaspervdj/patat",5
"Naming code, the value-identity relation","https://tangrammer.codeberg.page/on-the-clojure-move/output/posts/naming-code.html",5
"Show HN: CheckHN – A checklist for the most popular Hacker News posts","https://checkhn.ad-si.com",5
"Show HN: Jotite – A whimsical Linux Markdown note-taking app","https://github.com/maxberggren/jotite",5
"Photos from NeXT","https://exhibits.stanford.edu/menuez/browse/next-computer-inc?per_page=96&sort=pub_year_isi+asc%2C+title_sort+asc&view=masonry",5
"Any decent error message is a kind of oracle","https://digitalseams.com/blog/any-decent-error-message-is-a-kind-of-oracle",5
"Anting (Behavior)","https://en.wikipedia.org/wiki/Anting_(behavior)",5
"Show HN: AI File Sorter 0.9.7","https://github.com/hyperfield/ai-file-sorter",5
"Après Moi, Le Déluge","https://en.wikipedia.org/wiki/Apr%C3%A8s_moi,_le_d%C3%A9luge",5
"Enron inks deal with Sun to further broadband Net service","https://us.cnn.com/2000/TECH/computing/01/24/enron.broadband.idg/index.html",5
"Algebraic Curves: An Introduction to Algebraic Geometry. William Fulton [pdf]","https://dept.math.lsa.umich.edu/~wfulton/CurveBook.pdf",5
"TiVo won the court battles, but lost the TV war","https://www.theverge.com/tech/802254/tivo-time-warp-patent-courtoom-battles-lost-tv-war",5
"Industries being killed by millennials (2018)","https://www.the-independent.com/life-style/millennials-industry-casual-dining-weddings-beer-razors-golf-motorcycles-fabric-softener-a8574281.html",5
"Apple wants "to own a sport end to end"","https://sixcolors.com/link/2025/10/apple-wants-to-own-a-sport-end-to-end/",5
"New Comet Could Be 7B Years Old and Contain $455T of Nickel","https://cowboystatedaily.com/2025/10/17/new-comet-could-be-7-billion-years-old-and-contain-455-trillion-of-nickel/",5
"Ask HN: DOS Based "Multitaskers"","item?id=45628555",5
"Jobs Often Go Overseas. One Company Is Bringing Them to Rural America","https://www.wsj.com/economy/jobs/these-jobs-often-go-overseas-one-company-is-bringing-them-to-rural-america-127f110c",5
"Hard disk LEDs and noisy machines (2023)","https://blogsystem5.substack.com/p/hard-disk-leds-and-noisy-machines",5
"Jensen Huang says Nvidia went from 95% market share in China to 0%","https://fortune.com/2025/10/19/jensen-huang-nvidia-china-market-share-ai-chips-trump-trade-war/",5
"Optus among companies earning billions in Australia but paying no income tax","https://www.theguardian.com/australia-news/2025/oct/03/optus-among-companies-earning-billions-in-australia-but-paying-no-income-tax",5
"mRNA-based Covid vaccines generate improved responses to immunotherapy","https://medicalxpress.com/news/2025-10-mrna-based-covid-vaccines-generate.html",5
"The Tonnetz","https://thetonnetz.com/",5
"An Introduction to Mars Terraforming, 2025 Workshop Summary","https://arxiv.org/abs/2510.07344",5
"Hydrogel-based expanding pill for weight loss shows promising results in trial","https://www.uhs.nhs.uk/whats-new/press-releases/weight-loss-pill-aims-to-bridge-gap-in-obesity-treatments",4
"Researchers demonstrate centimetre-level positioning using smartwatches","https://www.otago.ac.nz/news/newsroom/researchers-demonstrate-centimetre-level-positioning-using-smartwatches",4
"Better GPS Precision, Smartwatches","https://techxplore.com/news/2025-10-smartwatches-centimeter-accuracy-tracking-algorithms.html",4
"The first non-opioid painkiller","https://worksinprogress.co/issue/the-first-non-opioid-painkiller/",4
"An Introduction to Multisets","https://arxiv.org/abs/2110.12902",4
"Replacing Parts of Strings in C64 Basic","https://retrogamecoders.com/mid-c64-strings/",4
"Show HN: Odyis: lunar lander (1979) clone written in Rust","https://ad301.org/blog/odyis.php",4
"Ask HN: Estimation of copyright material used by LLM","item?id=45631710",4
"PSOS-C and the Full Attribution Chain","https://www.aivojournal.org/closing-the-loop/",4
"Writing a JSON Parser in BQN","https://tony-zorman.com/posts/bqn-json.html",4
"We organized the Rust Clippy feature freeze","https://blog.goose.love",4
"Testing tricky network services with Linux Namespaces","https://angelofailla.com/posts/2025/10/16/testing-with-linux-namespaces/",4
"Librephone","https://irreal.org/blog/?p=13342",4
"Photos of the Llano Estacado","https://www.ars.usda.gov/plains-area/lubbock-tx/cropping-systems-research-laboratory/wind-erosion-and-water-conservation-research/docs/llano/",4
"Show HN: OneClickPRD – Save hours vibe coding with concise PRDs","https://oneclickprd.com/",4
"A library and CLI app for rendering project templates","https://copier.readthedocs.io/en/stable/",3
"A Group of Fans, LARP'ing Every Heist Movie Ever Made, Goes for Extra Realism","https://abcnews.go.com/International/louvre-museum-closes-after-robbery-french-minister/story?id=126657104",3
"A 15yo autistic boy's tinkering triggered WA's biggest ever data breach","https://www.abc.net.au/news/2025-10-17/joshua-unwittingly-triggered-major-wa-health-data-breach-autism/105455250",3
"Computer Science from Scratch: Interpreters, Art, Emulators, and ML in Python","https://computersciencefromscratch.com/",3
"Infisical (YC W23) Is Hiring Full Stack Engineers","https://www.ycombinator.com/companies/infisical/jobs/0gY2Da1-full-stack-engineer-global",0
