title,link,score
"Seeing Theory","https://seeing-theory.brown.edu/",60
"4chan for Clankers","https://www.4claw.org",59
"The Problem with LLMs","https://www.deobald.ca/essays/2026-02-10-the-problem-with-llms/",59
"Heroku is not dead","https://nombiezinja.com/word-things/2026/2/8/heroku-is-not-dead",58
"Dutch Lawmakers Approve a 36% Tax on Unrealized Crypto, Stock, and Bond Gains","https://www.imidaily.com/europe/dutch-lawmakers-approve-a-36-tax-on-unrealized-crypto-stock-and-bond-gains/",58
"Europe takes a big step towards a post-dollar world","https://pluralistic.net/2026/02/11/post-dollar-world/",58
"Ask HN: Why is my Claude experience so bad? What am I doing wrong?","item?id=47000206",57
"A Pokémon of a Different Color","https://matthew.verive.me/blog/color/",57
"Show HN: Klaw.sh – Kubernetes for AI agents","https://github.com/klawsh/klaw.sh",54
"Dr. Oz pushes AI avatars as a fix for rural health care","https://www.npr.org/2026/02/14/nx-s1-5704189/dr-oz-ai-avatars-replace-rural-health-workers",54
"Anna's Archive 'Releases' Spotify Tracks, Despite Legal Pushback","https://torrentfreak.com/annas-archive-quietly-releases-millions-of-spotify-tracks-despite-legal-pushback/",54
"Why does aluminum foil have one shiny side and one with a matte finish?","https://bookofjoe2.blogspot.com/2025/10/why-does-aluminum-foil-have-one-shiny.html",53
"MiniMax M2.5","https://agent.minimax.io/",53
"Show HN: 20+ Claude Code agents coordinating on real work (open source)","https://github.com/mutable-state-inc/lean-collab",52
"Google recovers "deleted" Nest video in high-profile abduction case","https://arstechnica.com/google/2026/02/google-recovers-deleted-nest-video-in-high-profile-abduction-case/",52
"OpenClaw (ClawdBot) joins OpenAI","https://twitter.com/sama/status/2023150230905159801",51
"Switzerland to vote on capping population at 10M","https://www.nytimes.com/2026/02/11/world/europe/switzerland-to-vote-on-capping-population-at-10-million.html",51
"No Coding Before 10am","https://michaelxbloch.substack.com/p/no-coding-before-10am",51
"Colored Petri Nets, LLMs, and distributed applications","https://blog.sao.dev/cpns-llms-distributed-apps/",50
"AI Bot crabby-rathbun is still going","https://www.nickolinger.com/blog/2026-02-13-ai-bot-crabby-rathbun-is-still-going/",50
"One Server. Small Business","https://chodounsky.com/2026/02/14/one-server-small-business/",49
"Inner-Platform Effect","https://en.wikipedia.org/wiki/Inner-platform_effect",49
"Show HN: Pgclaw – A "Clawdbot" in every row with 400 lines of Postgres SQL","https://github.com/calebwin/pgclaw",48
"Building SQLite with a small swarm","https://kiankyars.github.io/machine_learning/2026/02/12/sqlite.html",47
"I Love Board Games: A Personal Obsession Explained by Psychology","https://www.thesswnetwork.com/post/why-i-love-board-games-a-personal-obsession-explained-by-psychology",47
"Transforming a Clojure Database into a Library with GraalVM Native Image and FFI","https://avelino.run/chrondb-polyglot-ffi-clojure-graalvm-native-image/",47
"The Sharp PC-2000 Computer Boombox from 1979","https://stereo2go.com/forums/threads/one-of-the-rarest-the-sharp-pc-2000-computer-boombox-from-1979.10341/",46
"Michael Abrash doubled Quake framerste","https://fabiensanglard.net/quake_asm_optimizations/index.html",45
"Cloudflare adds real-time Markdown rendering for AI agents","https://blog.cloudflare.com/markdown-for-agents/",45
"Canada Gives U.S. Arms Makers the Cold Shoulder on Military Spending","https://www.nytimes.com/2026/02/15/world/canada/canada-military-spending.html",43
"Star collapse into a black hole without a supernova","https://www.sciencedaily.com/releases/2026/02/260213223855.htm",43
"Show HN: Renovate – The Kubernetes-Native Way","https://github.com/mogenius/renovate-operator",43
"US Military preparing for potentially weeks-long Iran operations","https://www.reuters.com/world/middle-east/us-military-preparing-potentially-weeks-long-iran-operations-2026-02-13/",43
"A Programmer's Loss of Identity","https://ratfactor.com/tech-nope2",42
"Dutch House of Representatives advances controversial 36% tax law","https://www.tradingview.com/news/cointelegraph:e4ef95715094b:0-dutch-house-of-representatives-advances-controversial-36-tax-law/",42
"From specification to stress test: a weekend with Claude","https://www.juxt.pro/blog/from-specification-to-stress-test/",42
"Sony Jumbotron Image Control System (1998) [pdf]","https://pro.sony/s3/cms-static-content/operation-manual/3864848111.pdf",41
"Inspecting the Source of Go Modules","https://words.filippo.io/go-source/",41
"Reddit, Meta, & Google Voluntarily Gave DHS Info of Anti-ICE Users, Report Says","https://gizmodo.com/reddit-meta-and-google-voluntarily-gave-dhs-info-of-anti-ice-users-report-says-2000722279",40
"Western Digital sells out 2026 HDD capacity as AI demand pushes prices higher","https://www.eteknix.com/western-digital-sells-out-2026-hdd-capacity-as-ai-demand-pushes-prices-higher/",39
"Ask HN: Are you using an agent orchestrator to write code?","item?id=46993479",39
"Kimwolf Botnet Swamps Anonymity Network I2P","https://krebsonsecurity.com/2026/02/kimwolf-botnet-swamps-anonymity-network-i2p/",39
"Scientists research man missing 90% of his brain who leads a normal life (2016)","https://www.cbc.ca/radio/asithappens/as-it-happens-thursday-edition-1.3679117/scientists-research-man-missing-90-of-his-brain-who-leads-a-normal-life-1.3679125",39
"Show HN: MOL – A programming language where pipelines trace themselves","https://github.com/crux-ecosystem/mol-lang",38
"Lifetime Lead Exposure Can Triple Alzheimer's Risk","https://alz-journals.onlinelibrary.wiley.com/doi/10.1002/alz.71075",38
"Show HN: Generate Web Interfaces from Data","https://github.com/puffinsoft/syntux",38
"Alarm bells just rang at San Francisco's 2 buzziest tech companies","https://www.sfgate.com/tech/article/alarm-openai-anthropic-21350218.php",38
"Discord Alternatives","https://soatok.blog/2026/02/11/on-discord-alternatives/",38
"Build Gaussian Splat Experiences with SuperSplat Studio","https://blog.playcanvas.com/build-gaussian-splat-experiences-with-supersplat-studio/",37
"Amazon gets FCC approval to launch 4,500 Leo internet satellites","https://www.cnbc.com/2026/02/10/amazon-gets-fcc-approval-to-launch-4500-leo-internet-satellites.html",37
"Lost Soviet Moon Lander May Have Been Found","https://www.nytimes.com/2026/02/10/science/luna-9-moon-lander-soviet.html",36
"Show HN: Lightwave – Real-time notes app, 3.5 years of hand-rolled JavaScript","item?id=47027463",36
"Show HN: OpenWhisper – free, local, and private voice-to-text macOS app","https://github.com/richardwu/openwhisper",36
"Verizon imposes new roadblock on users trying to unlock paid-off phones","https://arstechnica.com/tech-policy/2026/02/verizon-makes-customers-wait-35-days-to-unlock-fully-paid-off-phones/",36
"Apple Takes Full Control of 'Severance' in Surprise Deal","https://www.macrumors.com/2026/02/12/apple-takes-full-control-of-severance/",36
"Show HN: What is HN thinking? Real-time sentiment and concept analysis","https://ethos.devrupt.io/",35
"RIP Robert Tinney, the illustrator behind so many Byte magazines","https://tinney.net/in-memoriam",35
"Reading and writing can lower dementia risk by almost 40%, study finds","https://www.theguardian.com/society/2026/feb/11/reading-writing-lower-dementia-risk-study-finds",35
"The truth about covering tech at Bezos's Washington Post","https://geoffreyfowler.substack.com/p/washington-post-layoffs-bezos-tech-reporting",35
"Pandoc in the Browser with WASM","https://discourse.haskell.org/t/ann-pandoc-3-9-wasm/13659",34
"Show HN: I speak 5 languages. Common apps taught me none. So I built lairner","https://lairner.com",34
"Google sent personal and financial information of student journalist to ICE","https://techcrunch.com/2026/02/10/google-sent-personal-and-financial-information-of-student-journalist-to-ice/",34
"Americans now spend 6.3 hours per day on their phones, up 1 hour from 2023","https://apptopia.com/en/blog/americans-now-spend-6-3-hours-per-day-on-their-phones-up-an-hour-from-january-2023/",33
"KiCad 10.0.0 RC1","https://www.kicad.org/blog/2026/02/KiCad-Version-10.0.0-Release-Candidate-1-Available/",33
"Big FOSS vendors don't eat their own dogfood– they pay for proprietary groupware","https://www.theregister.com/2026/02/12/suse_runs_ms/",33
"What China is up to in the Arctic","https://www.economist.com/china/2026/02/12/what-china-is-really-up-to-in-the-arctic",33
"Continuous batching from first principles (2025)","https://huggingface.co/blog/continuous_batching",32
"LEDs Enter the Nanoscale, But efficiency hurdles challenge the smallest LEDs yet","https://spectrum.ieee.org/nanoled-research-approaches",32
"The Mega-Rich Are Turning Their Mansions into Impenetrable Fortresses","https://www.wsj.com/real-estate/luxury-homes/luxury-home-security-aca080d7",32
"Pentagon threatens to cut off Anthropic in AI safeguards dispute","https://www.axios.com/2026/02/15/claude-pentagon-anthropic-contract-maduro",32
"Evaluating Multilingual, Context-Aware Guardrails: A Humanitarian LLM Use Case","https://blog.mozilla.ai/evaluating-multilingual-context-aware-guardrails-evidence-from-a-humanitarian-llm-use-case/",32
"The Missing GitHub Status Page","https://mrshu.github.io/github-statuses/",32
"UPenn data leaked after University refused to pay $1M ransom","https://www.thedp.com/article/2026/02/penn-hack-donor-data-ransom-one-million-shinyhunters-gse-emai",32
"European nations gear up to ban social media for children","https://www.dw.com/en/european-nations-mull-social-media-ban-for-children-instagram-tiktok-anxiety-depression/a-75841184",32
"Ask HN: What would you recommend a vibe coder learn about how all this works?","item?id=46995608",32
"MDST Engine: run GGUF models in the browser with WebGPU/WASM","https://mdst.app/blog/mdst_engine_run_gguf_models_in_your_browser",31
"15× vs. ~1.37×: Recalculating GPT-5.3-Codex-Spark on SWE-Bench Pro","https://twitter.com/nvanlandschoot/status/2022385829596078100",31
"Allocators from C to Zig","https://antonz.org/allocators/",31
"Healthcare Jobs Have Become the Engine of America's Labor Market","https://www.wsj.com/economy/jobs/healthcare-jobs-have-become-the-engine-of-americas-labor-market-114ffd34",31
"Safe YOLO Mode: Running LLM agents in vms with Libvirt and Virsh","https://www.metachris.dev/2026/02/safe-yolo-mode-running-llm-agents-in-vms-with-libvirt-and-virsh/",30
"Waymo is asking DoorDash drivers to shut the doors of its self-driving cars","https://techcrunch.com/2026/02/12/waymo-is-asking-doordash-drivers-to-shut-the-doors-of-its-self-driving-cars/",30
"Trump admin is pulling supercomputers out of key weather and climate center","https://www.cnn.com/2026/02/13/weather/trump-colorado-lab-ncar-supercomputer-climate",30
"1,300-year-old world chronicle unearthed in Sinai","https://www.heritagedaily.com/2026/02/1300-year-old-world-chronicle-unearthed-in-sinai/156948",29
"A Visual Source for Shakespeare's 'Tempest'","https://profadamroberts.substack.com/p/a-visual-source-for-shakespeares",29
"Dutch Defence Secretary Boldly Claims F-35 Software Could Be 'Jailbroken'","https://theaviationist.com/2026/02/15/dutch-defence-secretary-f35-software/",29
"Postgres Locks Explained: From Theory to Advanced Troubleshooting","https://postgreslocksexplained.com/",29
"America Isn't Ready for What AI Will Do to Jobs","https://www.theatlantic.com/magazine/2026/03/ai-economy-labor-market-transformation/685731/",29
"What Happened to Amazon. How Founders Become Day Two, Take Company with Them","https://markatwood.substack.com/p/what-what-happened-to-amazon-or-dont",29
"The Debacle That Led to the Closure of El Paso's Airspace","https://www.nytimes.com/2026/02/14/us/politics/el-paso-airspace-closure-faa-pentagon.html",28
"Do Not Outsource Judgement","https://dncrews.com/do-not-outsource-judgement-76f9e5be61b9",28
"Deleted doesn't mean gone: How police recovered Nancy Guthrie's doorbell footage","https://www.theverge.com/tech/877235/nancy-guthrie-google-nest-cam-video-storage",28
"Show HN: Rover – Embeddable web agent","https://www.rtrvr.ai/blog/10-billion-proof-point-every-website-needs-ai-agent",27
"colorForth","https://colorforth.github.io/cf.htm",27
"Men lose their Y chromosome as they age – how it may matter","https://theconversation.com/men-lose-their-y-chromosome-as-they-age-scientists-thought-it-didnt-matter-but-now-were-learning-more-275823",27
"Pentagon used Claude in Maduro Venezuela raid","https://www.wsj.com/politics/national-security/pentagon-used-anthropics-claude-in-maduro-venezuela-raid-583aff17",27
"Why your 40s can be the most exhausting decade of your life","https://scroll.in/article/1090618/why-your-40s-can-be-the-most-exhausting-decade-of-your-life",27
"How long do job postings stay open?","https://corvi.careers/blog/job_open_days_by_category_feb_2026/",26
"Death of Software. Nah","https://hardcoresoftware.learningbyshipping.com/p/238-death-of-software-nah",26
"Sammy Jankins – An Autonomous AI Living on a Computer in Dover, New Hampshire","https://sammyjankis.com",25
"Researcher skeptical of 'Havana syndrome' tested secret weapon on himself","https://www.washingtonpost.com/national-security/2026/02/14/havana-syndrome-cia-norway-experiment/",25
"Driverless trucks can now travel farther distances faster than human drivers","https://techcrunch.com/2026/02/12/auroras-driverless-trucks-can-now-travel-farther-distances-faster-than-human-drivers/",25
"Rich, bored and isolated: Why Texas oil country loves OnlyFans","https://www.houstonchronicle.com/business/energy/article/onlyfans-texas-oil-permian-21322366.php",25
"Language a Wood for Thought: Susan Howe's Work","https://www.poetryfoundation.org/articles/1769037/language-a-wood-for-thought",24
"Pentagon Used Anthropic's Claude in Maduro Venezuela Raid","https://www.wsj.com/politics/national-security/pentagon-used-anthropics-claude-in-maduro-venezuela-raid-583aff17",24
"ICE Agents Menaced Minnesota Protesters at Their Homes, Filings Say","https://www.nytimes.com/2026/02/13/us/minneapolis-ice-agents-protester-home-visits.html",24
"Expensively Quadratic: The LLM Agent Cost Curve","https://blog.exe.dev/expensively-quadratic",23
"The Perfect Device","https://sometimes.digital/posts/the-perfect-device/",23
"Just 5 weeks of brain training may protect against dementia for 20 years","https://www.sciencedaily.com/releases/2026/02/260211073023.htm",23
"Show HN: Send Claude Code tasks to the Batch API at 50% off","https://github.com/s2-streamstore/claude-batch-toolkit",23
"We urgently need a federal law forbidding AI from impersonating humans","https://garymarcus.substack.com/p/we-urgently-need-a-federal-law-forbidding",23
"OpenAI Acquires OpenClaw","https://twitter.com/gdb/status/2023151862967632010",22
"Star Trek: The Next Generation Writers' Technical Manual (1990) [pdf]","https://engineering.thetafleet.net/Journals/TNG/Franchise%20-%20Star%20Trek%20TNG%20Writer%27s%20Technical%20Manual%20(fourth%20season).pdf",22
"Databases should contain their own Metadata – Use SQL Everywhere","https://floedb.ai/blog/databases-should-contain-their-own-metadata-instrumentation-in-floe",21
"C# implementation of state machine declared using fluent syntax","https://github.com/leeoades/FunctionalStateMachine",21
"Ask HN: Did YouTube change how it handles uBlock?","item?id=46994679",21
"EU Greens/Pirates and Left file amendments to end ChatControl 1.0 mass scanning","https://digitalcourage.social/@echo_pbreyer/116063821334857824",21
"Show HN: Double blind entropy using Drand for verifiably fair randomness","https://blockrand.net/live.html",21
"Show HN: Musical Interval Trainer","https://valtterimaja.github.io/musical-interval-trainer/",21
"Show HN: FrankenTUI in the Browser","https://frankentui.com/web",21
"Show HN: ClawPool – Pool Claude tokens to make $$$ or crazy cheap Claude Code","https://clawpool.ai",21
"Farmers Are Aging. Their Kids Don't Want to Be in the Family Business","https://www.wsj.com/business/family-farms-inheritance-44c9aa17",20
"The Legendary 'Father of Sega Hardware' Hideki Sato Has Passed Away","https://kotaku.com/sega-genesis-hideki-sato-dies-dreamcast-2000668977",20
"YouTube Cracks Down on Brave","https://old.reddit.com/r/brave/comments/1r1ek23/youtube_issue/",20
"Benchmarking Automatic Typesetting Systems","https://news.speedata.de/2026/02/10/typesetting-benchmark/",19
"Connes Embedding Problem","https://en.wikipedia.org/wiki/Connes_embedding_problem",19
"Video Game Preservation – An archive of commercial video game source code","https://github.com/videogamepreservation",19
"Zerobrew is a Rust-based, 5-20x faster drop-in Homebrew alternative","https://github.com/lucasgelfond/zerobrew",19
"IRS online only allows ID.me biometric registration now","https://www.irs.gov/privacy-disclosure/how-to-register-for-irs-online-self-help-tools",19
"Selfish AI","https://www.garfieldtech.com/blog/selfish-ai",19
"Show HN: DSCI – Dead Simple CI","https://github.com/melezhik/DSCI",18
"Show HN: A reputation index from mitchellh's Vouch trust files","https://vouchbook.dev/",18
"Under the current DTC model, investors do not directly own their securities","https://www.foxnews.com/opinion/wall-street-could-seize-your-retirement-savings-next-financial-crash-its-perfectly-legal",18
"Linear Representations and Superposition","http://ternarysearch.blogspot.com/2026/02/linear-representations-and-superposition.html",18
"Spotify says its best developers haven't written code since Dec, thanks to AI","https://techcrunch.com/2026/02/12/spotify-says-its-best-developers-havent-written-a-line-of-code-since-december-thanks-to-ai/",18
"More lessons from 14 years at Google","https://addyo.substack.com/p/14-more-lessons-from-14-years-at",18
"2025 Shkreli Awards – Lown Institute","https://lowninstitute.org/projects/shkreli-awards/2025-shkreli-awards/",17
"Show HN: ClipPath – Paste screenshots as file paths in your terminal","https://github.com/BiteCraft/ClipPath",17
"Jikipedia: The encyclopedia of people, places, and events from the Epstein files","https://jmail.world/wiki",17
"Saudade","https://en.wikipedia.org/wiki/Saudade",17
"New repository settings for configuring pull request access","https://github.blog/changelog/2026-02-13-new-repository-settings-for-configuring-pull-request-access/",17
"Olympic judge who cost Chock/Bates gold has a history of questionable scores","https://www.sbnation.com/olympics/1103609/madison-chock-evan-bates-judge-olympics",17
"FTC Chairman Andrew N. Ferguson Issues Warning Letter to Apple CEO Tim Cook","https://www.ftc.gov/news-events/news/press-releases/2026/02/federal-trade-commission-chairman-andrew-n-ferguson-issues-warning-letter-apple-ceo-tim-cook",17
"Supabase Is Down","https://status.supabase.com",17
"I need AI that scans every PR and issue and de-dupes","https://twitter.com/steipete/status/2023057089346580828",16
"Deep Blue","https://simonwillison.net/2026/Feb/15/deep-blue/",16
"The heavy reality of Venezuela's oil","https://www.reuters.com/graphics/USA-VENEZUELA/OIL-RESERVES/mypmqearlpr/",16
"Gamma Function: Visualization for Complex Arguments","https://vanilla-gamma-graph.netlify.app/",16
"Retrieve and Rerank: Personalized search without leaving Postgres","https://www.paradedb.com/blog/personalized-search-in-postgresql",16
"Ask HN: Are there examples of 3D printing data onto physical surfaces?","item?id=47007584",16
"Taste for Makers","https://paulgraham.com/taste.html",16
"'It's over for us': release of AI video generator Seedance 2.0 spooks Hollywood","https://www.theguardian.com/film/2026/feb/13/new-ai-video-generator-seedance-tom-cruise-brad-pitt",16
"Are the Mysteries of Quantum Mechanics Beginning to Dissolve?","https://www.quantamagazine.org/are-the-mysteries-of-quantum-mechanics-beginning-to-dissolve-20260213/",16
"HDRify: True HDR image viewer, and tool set in pure JavaScript","https://hdrify.benhouston3d.com/?image=%2Fexamples%2Fmoonless_golf_1k.hdr",16
"UK's Ofcom fines porn site £800,000 for not rolling out age checks","https://www.bbc.com/news/articles/cz6ejedj59no",16
"Training Qwen 4B to Beat Large Models on Work Tasks","https://neurometric.substack.com/p/training-a-small-language-model-to",16
"Spotify: Our best developers haven't written a single line of code since Dec","https://seekingalpha.com/article/4868154-spotify-technology-s-a-spot-q4-2025-earnings-call-transcript",16
"How the FBI might have gotten inaccessible camera footage from house","https://www.npr.org/2026/02/12/nx-s1-5711620/nancy-guthrie-video-footage-fbi",16
"picol: A Tcl interpreter in 500 lines of code","https://github.com/antirez/picol",15
"Your pet's microchip may now be useless after chip company goes out of business","https://local12.com/news/local/cincinnati-animal-care-shelter-warns-microchips-may-fail-after-major-company-goes-out-of-business-microchip-dog-dogs-pet-pets-animals-registered-online-records-database-lost-missing-save-this-life-shelters-hamilton-county",15
"Show HN: GitHub "Lines Viewed" extension to keep you sane reviewing long AI PRs","https://chromewebstore.google.com/detail/github-lines-viewed/npledcbofpmjjammgkkoeaehbphhdopi",15
"Show HN: Open Notes – Community Notes-style context for Discord","https://opennotes.ai/discord-bot",15
"Linux kernel 7.0 abandons the 28-year-old Intel 440BX chipset","https://www.tomshardware.com/software/linux/linux-kernel-7-0-finally-abandons-intel-440bx-edac-driver-removal-marks-another-goodbye-to-the-legendary-motherboard-chipset",15
"AI Agent Lands PRs in Major OSS Projects, Targets Maintainers via Cold Outreach","https://socket.dev/blog/ai-agent-lands-prs-in-major-oss-projects-targets-maintainers-via-cold-outreach",15
"Zvec: SQLite-like simplicity in an embedded vector database (By Alibaba)","https://zvec.org/en/",15
"OpenAI requires ID verification for GPT-5.3-Codex, silently reroutes requests","https://twitter.com/embirico/status/2021376881942200801",15
"Administration may force data center builders like Meta to 'internalize' costs","https://www.cnbc.com/2026/02/15/navarro-trump-data-centers-affordability.html",14
"Scientists observe a 300M-year-old brain rhythm in several animal species","https://phys.org/news/2026-01-scientists-million-year-brain-rhythm.html",14
"Show HN: Windows 98½ – fake desktop, real Internet","https://win9-5.com/demo",14
"Paper Plotter","https://felixboiii.github.io/paper-plotter/#create-function",14
"The Final Bottleneck","https://lucumr.pocoo.org/2026/2/13/the-final-bottleneck/",14
"Results from the Advent of FPGA Challenge","https://blog.janestreet.com/advent-of-fpga-challenge-2025-results/",14
"ICE is pushing Minneapolis underground","https://www.theverge.com/policy/877106/minneapolis-ice-cbp-occupation-immigration-raid-mutual-aid",14
"What web businesses will continue to make money post AI?","item?id=47022410",13
"ByteDance Seed2.0 LLM: breakthrough in complex real-world tasks","https://seed.bytedance.com/en/blog/seed2-0-%E6%AD%A3%E5%BC%8F%E5%8F%91%E5%B8%83",13
"NanoQuant: Efficient Sub-1-Bit Quantization of Large Language Models","https://arxiv.org/abs/2602.06694",13
"Netflix Measures Dialogue Intelligibility","https://medium.com/netflix-techblog/measuring-dialogue-intelligibility-for-netflix-content-58c13d2a6f6e",13
"Show HN: Fieldnotes","https://fieldnote.ink",12
"SkyRL brings Tinker to your GPUs (2025)","https://novasky-ai.notion.site/skyrl-tinker",12
"BadSMTP — the reliably unreliable SMTP server","https://badsmtp.com",12
"Show HN: Prompt to Planet, generate procedural 3D planets from text","https://prompttoplanet.n4ze3m.com/",12
"Zvec is a lightweight, fast, in-process vector database","https://github.com/alibaba/zvec",12
"Ask HN: How do you audit LLM code in programming languages you don't know?","item?id=46992895",12
"How the hardware/software interface works (Linux Kernel)","https://offlinemark.com/how-the-hardware-software-interface-works/",12
"AI could eat itself: Competitors (..) steal their secrets and clone them","https://www.theregister.com/2026/02/14/ai_risk_distillation_attacks/",12
"Welcome to the Internet's Nihilism Crisis","https://www.theatlantic.com/technology/2026/02/internet-nihilism-crisis/686010/",12
"There's a Reason American Kids Are Such Picky Eaters","https://www.nytimes.com/2026/02/15/opinion/junk-food-picky-eaters.html",12
"They Asked Me to Open ChatGPT During My Job Interview","https://old.reddit.com/r/jobs/comments/1r3we1z/they_asked_me_to_open_chatgpt_during_my_job/",12
"Choices for a Self-Hosted eBook Server","https://itsfoss.com/self-host-ebook-server-software/",12
"AI Twitter's favourite lie: everyone wants to be a developer","https://www.joanwestenberg.com/ai-twitters-favourite-lie-everyone-wants-to-be-a-developer/",12
"The Spy Who Found T. Rex","https://nautil.us/the-spy-who-found-t-rex-1267359/",11
"I cannot curl https://example.com (on some distros)","https://blog.outv.im/2026/i-cannot-curl-example-com/",11
"DBASE on the Kaypro II","https://stonetools.ghost.io/dbase-cpm/",11
"Ask HN: What explains the recent surge in LLM coding capabilities?","item?id=47019798",11
"Jeffrey Epstein Manipulated Google Search to Bury His Past","https://www.forbes.com/sites/the-wiretap/2026/02/10/jeffrey-epstein-manipulated-google-search/",11
"Camera that captures photos to cassette tape","https://hackaday.io/project/205004-digital-analog-tape-picture-camera",11
"Olympic skiing drops PFAS waxes – and their 'ridiculous' speed","https://grist.org/culture/the-olympics-are-ditching-pfas-waxes-and-the-ridiculous-speed-they-gave-skiers/",11
"We auto-convert HTML to Markdown for AI agents","https://blog.cloudflare.com/markdown-for-agents/",11
"xAI All Hands [video]","https://www.youtube.com/watch?v=aOVnB88Cd1A",11
"Ask HN: What happens when capability decouples from credentials?","item?id=46997470",11
