title,link,score
"How I bypassed Amazon's Kindle web DRM","https://blog.pixelmelt.dev/kindle-web-drm/",1729
"FSF announces Librephone project","https://www.fsf.org/news/librephone-project",1571
"NanoChat – The best ChatGPT that $100 can buy","https://github.com/karpathy/nanochat",1515
"Apple M5 chip","https://www.apple.com/newsroom/2025/10/apple-unleashes-m5-the-next-big-leap-in-ai-performance-for-apple-silicon/",1256
"A small number of samples can poison LLMs of any size","https://www.anthropic.com/research/small-samples-poison",1200
"Andrej Karpathy – It will take a decade to work through the issues with agents","https://www.dwarkesh.com/p/andrej-karpathy",1162
"Migrating from AWS to Hetzner","https://digitalsociety.coop/posts/migrating-to-hetzner-cloud/",1103
"Replacement.ai","https://replacement.ai",944
"TurboTax’s 20-year fight to stop Americans from filing taxes for free (2019)","https://www.propublica.org/article/inside-turbotax-20-year-fight-to-stop-americans-from-filing-their-taxes-for-free",901
"The <output> Tag","https://denodell.com/blog/html-best-kept-secret-output-tag",840
"Claude Skills","https://www.anthropic.com/news/skills",802
"Android's sideloading limits are its most anti-consumer move","https://www.makeuseof.com/androids-sideloading-limits-are-anti-consumer-move-yet/",798
"The Rapper 50 Cent, Adjusted for Inflation","https://50centadjustedforinflation.com/",791
"Ryanair flight landed at Manchester airport with six minutes of fuel left","https://www.theguardian.com/business/2025/oct/10/ryanair-flight-landed-at-manchester-airport-with-six-minutes-of-fuel-left-flight-log-suggests",733
"Claude Haiku 4.5","https://www.anthropic.com/news/claude-haiku-4-5",725
"Dutch government takes control of Chinese-owned chipmaker Nexperia","https://www.cnbc.com/2025/10/13/dutch-government-takes-control-of-chinese-owned-chipmaker-nexperia.html",725
"No science, no startups: The innovation engine we're switching off","https://steveblank.com/2025/10/13/no-science-no-startups-the-unseen-engine-were-switching-off/",722
"Claude Skills are awesome, maybe a bigger deal than MCP","https://simonwillison.net/2025/Oct/16/claude-skills/",719
"What Americans die from vs. what the news reports on","https://ourworldindata.org/does-the-news-reflect-what-we-die-from",703
"Ruby core team takes ownership of RubyGems and Bundler","https://www.ruby-lang.org/en/news/2025/10/17/rubygems-repository-transition/",661
"Show HN: I invented a new generative model and got accepted to ICLR","https://discrete-distribution-networks.github.io/",655
"Meow.camera","https://meow.camera/",653
"Wireguard FPGA","https://github.com/chili-chips-ba/wireguard-fpga",639
"I built physical album cards with NFC tags to teach my son music discovery","https://fulghum.io/album-cards",591
"IDEs we had 30 years ago and lost (2023)","https://blogsystem5.substack.com/p/the-ides-we-had-30-years-ago-and",582
"Amazon’s Ring to partner with Flock","https://techcrunch.com/2025/10/16/amazons-ring-to-partner-with-flock-a-network-of-ai-cameras-used-by-ice-feds-and-police/",572
"Live Stream from the Namib Desert","https://bookofjoe2.blogspot.com/2025/10/live-stream-from-namib-desert.html",561
"Zed is now available on Windows","https://zed.dev/blog/zed-for-windows-is-here",544
"Don’t Look Up: Sensitive internal links in the clear on GEO satellites [pdf]","https://satcom.sysnet.ucsd.edu/docs/dontlookup_ccs25_fullpaper.pdf",542
"Beliefs that are true for regular software but false when applied to AI","https://boydkane.com/essays/boss",532
"Doing well in your courses: Andrej's advice for success (2013)","https://cs.stanford.edu/people/karpathy/advice.html",527
"New Work by Gary Larson","https://www.thefarside.com/new-stuff",525
"Ireland is making basic income for artists program permanent","https://www.artnews.com/art-news/news/ireland-basic-income-artists-program-permanent-1234756981/",488
"America is getting an AI gold rush instead of a factory boom","https://www.washingtonpost.com/business/2025/10/13/manufacturing-artificial-intelligence/",486
"The pivot","https://www.antipope.org/charlie/blog-static/2025/10/the-pivot-1.html",482
"Surveillance data challenges what we thought we knew about location tracking","https://www.lighthousereports.com/investigation/surveillance-secrets/",480
"Leaving serverless led to performance improvement and a simplified architecture","https://www.unkey.com/blog/serverless-exit",478
"Major AWS Outage Happening","https://old.reddit.com/r/aws/comments/1obd3lx/dynamodb_down_useast1/",477
"GNU Health","https://www.gnuhealth.org/about-us.html",470
"Software update bricks some Jeep 4xe hybrids over the weekend","https://arstechnica.com/cars/2025/10/software-update-bricks-some-jeep-4xe-hybrids-over-the-weekend/",465
"Show HN: SQLite Online – 11 years of solo development, 11K daily users","https://sqliteonline.com/",463
"Ripgrep 15.0","https://github.com/BurntSushi/ripgrep/releases/tag/15.0.0",459
"4Chan Lawyer publishes Ofcom correspondence","https://alecmuffett.com/article/117792",457
"Examples are the best documentation","https://rakhim.exotext.com/examples-are-the-best-documentation",454
"Smartphones and being present","https://herman.bearblog.dev/being-present/",437
"Macro Splats 2025","https://danybittel.ch/macro.html",424
"EVs are depreciating faster than gas-powered cars","https://restofworld.org/2025/ev-depreciation-blusmart-collapse/",423
"GrapheneOS is ready to break free from Pixels","https://www.androidauthority.com/graphene-os-major-android-oem-partnership-3606853/",421
"Gemini 3.0 spotted in the wild through A/B testing","https://ricklamers.io/posts/gemini-3-spotted-in-the-wild/",419
"Titan submersible’s $62 SanDisk memory card found undamaged at wreckage site","https://www.tomshardware.com/pc-components/microsd-cards/tragic-oceangate-titan-submersibles-usd62-sandisk-memory-card-found-undamaged-at-wreckage-site-12-stills-and-nine-videos-have-been-recovered-but-none-from-the-fateful-implosion",416
"Bots are getting good at mimicking engagement","https://joindatacops.com/resources/how-73-of-your-e-commerce-visitors-could-be-fake",411
"DOJ seizes $15B in Bitcoin from 'pig butchering' scam based in Cambodia","https://www.cnbc.com/2025/10/14/bitcoin-doj-chen-zhi-pig-butchering-scam.html",408
"New York Times, AP, Newsmax and others say they won't sign new Pentagon rules","https://apnews.com/article/pentagon-press-access-defense-department-rules-95878bce05096912887701eaa6d019c6",400
"Root System Drawings","https://images.wur.nl/digital/collection/coll13/search",395
"Your data model is your destiny","https://notes.mtb.xyz/p/your-data-model-is-your-destiny",395
"OpenAI researcher announced GPT-5 math breakthrough that never happened","https://the-decoder.com/leading-openai-researcher-announced-a-gpt-5-math-breakthrough-that-never-happened/",394
"Anthropic's Prompt Engineering Tutorial (2024)","https://github.com/anthropics/prompt-eng-interactive-tutorial",391
"./watch","https://dotslashwatch.com/",390
"When you opened a screen shot of a video in Paint, the video was playing in it","https://devblogs.microsoft.com/oldnewthing/20251014-00/?p=111681",387
"Schleswig-Holstein completes migration to open source email","https://news.itsfoss.com/schleswig-holstein-email-system-migration/",384
"Free software hasn't won","https://dorotac.eu/posts/fosswon/",382
"Tinnitus Neuromodulator","https://mynoise.net/NoiseMachines/neuromodulationTonesGenerator.php",380
"Elixir 1.19","https://elixir-lang.org/blog/2025/10/16/elixir-v1-19-0-released/",380
"Show HN: Halloy – Modern IRC client","https://github.com/squidowl/halloy",377
"M5 MacBook Pro","https://www.apple.com/macbook-pro/",370
"Hyperflask – Full stack Flask and Htmx framework","https://hyperflask.dev/",361
"Why Is SQLite Coded In C","https://www.sqlite.org/whyc.html",354
"Novo Nordisk's Canadian Mistake","https://www.science.org/content/blog-post/novo-nordisk-s-canadian-mistake",352
"Syntax highlighting is a waste of an information channel (2020)","https://buttondown.com/hillelwayne/archive/syntax-highlighting-is-a-waste-of-an-information/",345
"Ask HN: What are you working on? (October 2025)","item?id=45561428",345
"Tor browser removing various Firefox AI features","https://blog.torproject.org/new-alpha-release-tor-browser-150a4/",344
"Liquibase continues to advertise itself as "open source" despite license switch","https://github.com/liquibase/liquibase/issues/7374",343
"Xubuntu.org Might Be Compromised","https://old.reddit.com/r/Ubuntu/comments/1oa4549/xubuntuorg_might_be_compromised/",342
"Upcoming Rust language features for kernel development","https://lwn.net/Articles/1039073/",341
"IRS open sources its fact graph","https://github.com/IRS-Public/fact-graph",339
"Spotlight on pdfly, the Swiss Army knife for PDF files","https://chezsoi.org/lucas/blog/spotlight-on-pdfly.html",338
"ADS-B Exposed","https://adsb.exposed/",336
"Space Elevator","https://neal.fun/space-elevator/",334
"Why the push for Agentic when models can barely follow a simple instruction?","https://forum.cursor.com/t/why-the-push-for-agentic-when-models-can-barely-follow-a-single-simple-instruction/137154",328
"AMD and Sony's PS6 chipset aims to rethink the current graphics pipeline","https://arstechnica.com/gaming/2025/10/amd-and-sony-tease-new-chip-architecture-ahead-of-playstation-6/",325
"Unpacking Cloudflare Workers CPU Performance Benchmarks","https://blog.cloudflare.com/unpacking-cloudflare-workers-cpu-performance-benchmarks/",317
"You did no fact checking, and I must scream","https://shkspr.mobi/blog/2025/10/i-have-no-facts-and-i-must-scream/",314
"Show HN: I built a simple ambient sound app with no ads or subscriptions","https://ambisounds.app/",312
"Pixnapping Attack","https://www.pixnapping.com/",309
"Airliner hit by possible space debris","https://avbrief.com/united-max-hit-by-falling-object-at-36000-feet/",307
"DoorDash and Waymo launch autonomous delivery service in Phoenix","https://about.doordash.com/en-us/news/waymo",306
"Intercellular communication in the brain through a dendritic nanotubular network","https://www.science.org/doi/10.1126/science.adr7403",300
"Pwning the Nix ecosystem","https://ptrpa.ws/nixpkgs-actions-abuse",291
"Chen-Ning Yang, Nobel laureate, dies at 103","https://www.chinadaily.com.cn/a/202510/18/WS68f3170ea310f735438b5bf2.html",287
"SQL Anti-Patterns","https://datamethods.substack.com/p/sql-anti-patterns-you-should-avoid",282
"Ask HN: How to stop an AWS bot sending 2B requests/month?","item?id=45613567",279
"Exploring PostgreSQL 18's new UUIDv7 support","https://aiven.io/blog/exploring-postgresql-18-new-uuidv7-support",277
"K8s with 1M nodes","https://bchess.github.io/k8s-1m/",276
"How bad can a $2.97 ADC be?","https://excamera.substack.com/p/how-bad-can-a-297-adc-be",275
"Flowistry: An IDE plugin for Rust that focuses on relevant code","https://github.com/willcrichton/flowistry",271
"Why I Chose Elixir Phoenix over Rails, Laravel, and Next.js","https://akarshc.com/post/phoenix-for-my-project.html",270
"Codex Is Live in Zed","https://zed.dev/blog/codex-is-live-in-zed",268
"Are hard drives getting better?","https://www.backblaze.com/blog/are-hard-drives-getting-better-lets-revisit-the-bathtub-curve/",266
"SmolBSD – build your own minimal BSD system","https://smolbsd.org",262
"Apple Vision Pro upgraded with M5 chip","https://www.apple.com/newsroom/2025/10/apple-vision-pro-upgraded-with-the-m5-chip-and-dual-knit-band/",261
"Hacker News Live Feed","https://jerbear2008.github.io/hn-live/",260
"How AI hears accents: An audible visualization of accent clusters","https://accent-explorer.boldvoice.com/",260
"Astronomers 'image' a mysterious dark object in the distant Universe","https://www.mpg.de/25518363/1007-asph-astronomers-image-a-mysterious-dark-object-in-the-distant-universe-155031-x",259
"Entire Linux Network stack diagram (2024)","https://zenodo.org/records/14179366",257
"Cloudflare Sandbox SDK","https://sandbox.cloudflare.com/",256
"GOG has had to hire private investigators to track down IP rights holders","https://www.thegamer.com/gog-private-investigators-off-the-grid-ip-rights-holders/",256
"Writing an LLM from scratch, part 22 – training our LLM","https://www.gilesthomas.com/2025/10/llm-from-scratch-22-finally-training-our-llm",253
"EQ: A video about all forms of equalizers","https://www.youtube.com/watch?v=CLAt95PrwL4",252
"Flies keep landing on North Sea oil rigs","https://theconversation.com/thousands-of-flies-keep-landing-on-north-sea-oil-rigs-then-taking-off-a-few-hours-later-heres-why-265622",249
"Modern Linux tools","https://ikrima.dev/dev-notes/linux/linux-modern-tools/",249
"Steve Jobs and Cray-1 to be featured on 2026 American Innovations $1 coin","https://www.usmint.gov/news/press-releases/united-states-mint-releases-2026-american-innovation-one-dollar-coin-program-designs",244
"How to sequence your DNA for <$2k","https://maxlangenkamp.substack.com/p/how-to-sequence-your-dna-for-2k",243
"Talent","https://www.felixstocker.com/blog/talent",240
"America's future could hinge on whether AI slightly disappoints","https://www.noahpinion.blog/p/americas-future-could-hinge-on-whether",240
"Strudel REPL – a music live coding environment living in the browser","https://strudel.cc",240
"Modern iOS Security Features – A Deep Dive into SPTM, TXM, and Exclaves","https://arxiv.org/abs/2510.09272",237
"CamoLeak: Critical GitHub Copilot Vulnerability Leaks Private Source Code","https://www.legitsecurity.com/blog/camoleak-critical-github-copilot-vulnerability-leaks-private-source-code",234
"Next Steps for the Caddy Project Maintainership","https://caddy.community/t/next-steps-for-the-caddy-project-maintainership/33076",231
"How to turn liquid glass into a solid interface","https://tidbits.com/2025/10/09/how-to-turn-liquid-glass-into-a-solid-interface/",223
"American solar farms","https://tech.marksblogg.com/american-solar-farms.html",222
"A Gemma model helped discover a new potential cancer therapy pathway","https://blog.google/technology/ai/google-gemma-ai-cancer-therapy-discovery/",222
"JustSketchMe – Digital Posing Tool","https://justsketch.me",220
"Why the open social web matters now","https://werd.io/why-the-open-social-web-matters-now/",219
"New coding models and integrations","https://ollama.com/blog/coding-models",219
"iPad Pro with M5 chip","https://www.apple.com/newsroom/2025/10/apple-introduces-the-powerful-new-ipad-pro-with-the-m5-chip/",217
"Electricity can heal wounds three times as fast (2023)","https://www.chalmers.se/en/current/news/mc2-how-electricity-can-heal-wounds-three-times-as-fast/",216
"F5 says hackers stole undisclosed BIG-IP flaws, source code","https://www.bleepingcomputer.com/news/security/f5-says-hackers-stole-undisclosed-big-ip-flaws-source-code/",211
"A conspiracy to kill IE6 (2019)","https://blog.chriszacharias.com/a-conspiracy-to-kill-ie6",211
"Why did containers happen?","https://buttondown.com/justincormack/archive/ignore-previous-directions-8-devopsdays/",208
"Intel Announces Inference-Optimized Xe3P Graphics Card with 160GB VRAM","https://www.phoronix.com/review/intel-crescent-island",206
"Just talk to it – A way of agentic engineering","https://steipete.me/posts/just-talk-to-it",204
"Every vibe-coded website is the same page with different words. So I made that","https://vibe-coded.lol/",202
"Pyrefly: Python type checker and language server in Rust","https://pyrefly.org/?featured_on=talkpython",202
"DeepSeek OCR","https://github.com/deepseek-ai/DeepSeek-OCR",201
"AMD's Chiplet APU: An Overview of Strix Halo","https://chipsandcheese.com/p/amds-chiplet-apu-an-overview-of-strix",201
"US Government Uptime Monitor","https://usa-status.com/",197
"Show HN: Duck-UI – Browser-Based SQL IDE for DuckDB","https://demo.duckui.com",196
"PlayStation 3 Architecture (2021)","https://www.copetti.org/writings/consoles/playstation-3",196
"Ruby Blocks","https://tech.stonecharioteer.com/posts/2025/ruby-blocks/",191
"America’s semiconductor boom [video]","https://www.youtube.com/watch?v=T-jt3qBzJ4A",191
"Attention is a luxury good","https://seths.blog/2025/10/attention-is-a-luxury-good/",190
"Nvidia DGX Spark: great hardware, early days for the ecosystem","https://simonwillison.net/2025/Oct/14/nvidia-dgx-spark/",188
"Free Programing Books","https://github.com/EbookFoundation/free-programming-books",187
"Fastmail desktop app","https://www.fastmail.com/blog/desktop-app/",186
"Secret diplomatic message deciphered after 350 years","https://www.nationalarchives.gov.uk/explore-the-collection/the-collection-blog/secret-diplomatic-message-deciphered-after-350-years/",184
"StageConnect: Behringer protocol is open source","https://github.com/OpenMixerProject/StageConnect",184
"Is Postgres read heavy or write heavy?","https://www.crunchydata.com/blog/is-postgres-read-heavy-or-write-heavy-and-why-should-you-care",182
"DDoS Botnet Aisuru Blankets US ISPs in Record DDoS","https://krebsonsecurity.com/2025/10/ddos-botnet-aisuru-blankets-us-isps-in-record-ddos/",181
"Post office in France rolls out croissant-scented stamp","https://www.ctvnews.ca/world/article/french-post-office-rolls-out-croissant-scented-stamp/",179
"Zoo of array languages","https://ktye.github.io/",178
"AppLovin nonconsensual installs","https://www.benedelman.org/applovin-nonconsensual-installs/",178
"Show HN: I made an esoteric programming language that's read like a spellbook","https://github.com/sirbread/spellscript",176
"AI has a cargo cult problem","https://www.ft.com/content/f2025ac7-a71f-464f-a3a6-1e39c98612c7",176
"Comparing the power consumption of a 30 year old refrigerator to a new one","https://ounapuu.ee/posts/2025/10/14/fridge-power-consumption/",175
"Mac Source Ports – Run old games on new Macs","https://www.macsourceports.com/",173
"Mysterious Intrigue Around an x86 "Corporate Entity Other Than Intel/AMD"","https://www.phoronix.com/news/x86-Opcodes-Not-AMD-Or-Intel",173
"Look at how unhinged GPU box art was in the 2000s (2024)","https://www.xda-developers.com/absolutely-unhinged-gpu-box-art-from-the-early-2000s/",171
"A kernel stack use-after-free: Exploiting Nvidia's GPU Linux drivers","https://blog.quarkslab.com/./nvidia_gpu_kernel_vmalloc_exploit.html",171
"Compare Single Board Computers","https://sbc.compare/",170
"Show HN: Firm, a text-based work management system","https://github.com/42futures/firm",169
"Using a laptop as an HDMI monitor for an SBC","https://danielmangum.com/posts/laptop-hdmi-monitor-sbc/",168
"JIT: So you want to be faster than an interpreter on modern CPUs","https://www.pinaraf.info/2025/10/jit-so-you-want-to-be-faster-than-an-interpreter-on-modern-cpus/",168
"Hacker News – The Good Parts","https://smartmic.bearblog.dev/why-hacker-news/",167
"Ask HN: What are people doing to get off of VMware?","item?id=45635940",165
"Pipelining in psql (PostgreSQL 18)","https://postgresql.verite.pro/blog/2025/10/01/psql-pipeline.html",165
"Love C, hate C: Web framework memory problems","https://alew.is/lava.html",165
"The reason GCC is not a library (2000)","https://gcc.gnu.org/legacy-ml/gcc/2000-01/msg00572.html",164
"Friendship Begins at Home","https://3quarksdaily.com/3quarksdaily/2025/10/friendship-begins-at-home.html",161
"How to tame a user interface using a spreadsheet","https://blog.gingerbeardman.com/2025/10/11/how-to-tame-a-user-interface-using-a-spreadsheet/",159
"A years-long Turkish alphabet bug in the Kotlin compiler","https://sam-cooper.medium.com/the-country-that-broke-kotlin-84bdd0afb237",159
"Why study programming languages (2022)","https://people.csail.mit.edu/rachit/post/why-study-programming-languages/",158
"Forth: The programming language that writes itself","https://ratfactor.com/forth/the_programming_language_that_writes_itself.html",157
"Duke Nukem: Zero Hour N64 ROM Reverse-Engineering Project Hits 100%","https://github.com/Gillou68310/DukeNukemZeroHour",157
"Solution to CIA’s Kryptos sculpture is found in Smithsonian vault","https://www.nytimes.com/2025/10/16/science/kryptos-cia-solution-sanborn-auction.html",157
"The case for the return of fine-tuning","https://welovesota.com/article/the-case-for-the-return-of-fine-tuning",156
"Show HN: AI toy I worked on is in stores","https://www.walmart.com/ip/SANTA-SMAGICAL-PHONE/16364964771",156
"test-ipv6.com will stay online","https://status.test-ipv6.com",156
"CRISPR-like tools that finally can edit mitochondria DNA","https://www.nature.com/articles/d41586-025-03307-x",155
"A 4k-Room Text Adventure Written by One Human in QBasic No AI","https://the-ventureweaver.itch.io/tlote4111",154
"Things I've learned in my 7 years implementing AI","https://www.jampa.dev/p/llms-and-the-lessons-we-still-havent",154
"Show HN: Open source, logical multi-master PostgreSQL replication","https://github.com/pgEdge/spock",151
"Fast calculation of the distance to cubic Bezier curves on the GPU","https://blog.pkh.me/p/46-fast-calculation-of-the-distance-to-cubic-bezier-curves-on-the-gpu.html",150
"Asking AI to build scrapers should be easy right?","https://www.skyvern.com/blog/asking-ai-to-build-scrapers-should-be-easy-right/",148
"Interviewing Intel's Chief Architect of x86 Cores","https://chipsandcheese.com/p/interviewing-intels-chief-architect",146
"MPTCP for Linux","https://www.mptcp.dev/",146
"The Unix Executable as a Smalltalk Method [pdf]","https://programmingmadecomplicated.wordpress.com/wp-content/uploads/2025/10/onward25-jakubovic.pdf",145
"Benjie's Humanoid Olympic Games","https://generalrobots.substack.com/p/benjies-humanoid-olympic-games",145
"A modern approach to preventing CSRF in Go","https://www.alexedwards.net/blog/preventing-csrf-in-go",145
"Coral NPU: A full-stack platform for Edge AI","https://research.google/blog/coral-npu-a-full-stack-platform-for-edge-ai/",143
"Windows 11 25H2 October Update Bug Renders Recovery Environment Unusable","https://www.techpowerup.com/342032/windows-11-25h2-october-update-bug-renders-recovery-environment-unusable",142
"Abandoned land drives dangerous heat in Houston, study finds","https://stories.tamu.edu/news/2025/10/07/abandoned-land-drives-dangerous-heat-in-houston-texas-am-study-finds/",141
"Why an abundance of choice is not the same as freedom","https://aeon.co/essays/why-an-abundance-of-choice-is-not-the-same-as-freedom",141
"Garbage collection for Rust: The finalizer frontier","https://soft-dev.org/pubs/html/hughes_tratt__garbage_collection_for_rust_the_finalizer_frontier/",141
"ESP32 and Termux","https://blog.gavide.dev/blog/esp32-and-termux",141
"Claude Code vs. Codex: I built a sentiment dashboard from Reddit comments","https://www.aiengineering.report/p/claude-code-vs-codex-sentiment-analysis-reddit",139
"GNU Octave Meets JupyterLite: Compute Anywhere, Anytime","https://blog.jupyter.org/gnu-octave-meets-jupyterlite-compute-anywhere-anytime-8b033afbbcdc",138
"LLMs are getting better at character-level text manipulation","https://blog.burkert.me/posts/llm_evolution_character_manipulation/",138
"Root cause analysis? You're doing it wrong","https://entropicthoughts.com/root-cause-analysis-youre-doing-it-wrong",137
"Dosbian: Boot to DOSBox on Raspberry Pi","https://cmaiolino.wordpress.com/dosbian/",136
"The Accountability Problem","https://www.jamesshore.com/v2/blog/2025/the-accountability-problem",136
"Lace: A New Kind of Cellular Automata Where Links Matter","https://www.novaspivack.com/science/introducing-lace-a-new-kind-of-cellular-automata",136
"Show HN: Scriber Pro – Offline AI transcription for macOS","https://scriberpro.cc/hn/",136
"Build a Superscalar 8-Bit CPU (YouTube Playlist) [video]","https://www.youtube.com/watch?v=bwjMLyBU4RU&list=PLyR4neQXqQo5nPdEiMbaEJxWiy_UuyNN4&index=1",135
"Wireshark 4.6.0 Supports macOS Pktap Metadata (PID, Process Name, etc.)","https://nuxx.net/blog/2025/10/14/wireshark-4-6-0-supports-macos-pktap-metadata-pid-process-name-etc/",135
"AWS Multiple Services Down in us-east-1","https://health.aws.amazon.com/health/status?ts=20251020",134
"Matrices can be your friends (2002)","https://www.sjbaker.org/steve/omniv/matrices_can_be_your_friends.html",134
"WebMCP","https://github.com/jasonjmcghee/WebMCP",133
"Recursive Language Models (RLMs)","https://alexzhang13.github.io/blog/2025/rlm/",133
"The Sveriges Riksbank Prize in Economic Sciences in Memory of Alfred Nobel 2025","https://www.nobelprize.org/prizes/economic-sciences/2025/summary/",132
"Nostr and ATProto (2024)","https://shreyanjain.net/2024/07/05/nostr-and-atproto.html",132
"What is going on with all this radioactive shrimp?","https://www.consumerreports.org/health/food-safety/radioactive-shrimp-explained-a5493175857/",129
"Legends of the games industry: Roger Dean","https://spillhistorie.no/2025/10/03/legends-of-the-games-industry-roger-dean/",129
"How America got hooked on ultraprocessed foods","https://www.nytimes.com/interactive/2025/10/16/well/eat/ultraprocessed-food-junk-history.html",128
"The Spilhaus Projection: A world map according to fish","https://southernwoodenboatsailing.com/news/the-spilhaus-projection-a-world-map-according-to-fish",127
"MAML – A new configuration language","https://maml.dev/",127
"AGI is not imminent, and LLMs are not the royal road to getting there","https://garymarcus.substack.com/p/the-last-few-months-have-been-devastating",127
"A liver transplant from start to finish","https://press.asimov.com/articles/liver",126
"Understanding Spec-Driven-Development: Kiro, Spec-Kit, and Tessl","https://martinfowler.com/articles/exploring-gen-ai/sdd-3-tools.html",125
"Europe's Digital Sovereignty Paradox – "Chat Control" Update","https://www.process-one.net/blog/chat-control-update-oct-2025/",123
"Dead or Alive creator Tomonobu Itagaki, 58 passes away","https://www.gamedeveloper.com/design/dead-or-alive-creator-tomonobu-itagaki-has-passed-away-at-58",123
"Gleam OTP – Fault Tolerant Multicore Programs with Actors","https://github.com/gleam-lang/otp",121
