title,link,score
"Big banks explore venturing into crypto world together with joint stablecoin","https://www.wsj.com/finance/banking/crypto-stablecoin-big-banks-a841059e",75
"Graduate Student Solves Classic Problem About the Limits of Addition","https://www.quantamagazine.org/graduate-student-solves-classic-problem-about-the-limits-of-addition-20250522/",75
"Advice to Tenstorrent","https://github.com/geohot/tt-tiny",74
"Show HN: Lnk – Git-native dotfiles manager","https://github.com/yarlson/lnk",74
"Teachable Machine","https://teachablemachine.withgoogle.com/",73
"Strengths and limitations of diffusion language models","https://www.seangoedecke.com/limitations-of-text-diffusion-models/",72
"Please Fund More Science (2020)","https://blog.samaltman.com/please-fund-more-science",72
"Visualizing entire Chromium include graph","https://blog.bkryza.com/posts/visualizing-chromium-include-graph/",72
"Launch HN: Nomi (YC X25) – Copilot for Sales","item?id=44098706",71
""Microsoft has simply given us no other option," Signal blocks Windows Recall","https://arstechnica.com/security/2025/05/signal-resorts-to-weird-trick-to-block-windows-recall-in-desktop-app/",71
"AI makes bad managers","https://staysaasy.com/management/2025/05/26/AI-management.html",70
"Can a corporation be pardoned?","https://papers.ssrn.com/sol3/papers.cfm?abstract_id=5202339",69
"What I discovered when I asked Amazon to tell me everything Alexa had heard","https://www.theguardian.com/technology/2025/may/24/what-i-discovered-when-i-asked-amazon-to-tell-me-everything-alexa-had-heard",69
"Claude Code does our releases now","https://www.aluxian.com/claude-code-does-our-releases-now/",68
"Fast, Simple and Open Firebase Alternative: TrailBase","https://github.com/trailbaseio/trailbase/releases/tag/v0.12.0",68
"Show HN: Curved Space Shader in Three.js (via 4D sphere projection)","https://github.com/bntre/CurvedSpaceShader",68
"Demoting i686-PC-windows-gnu to Tier 2","https://blog.rust-lang.org/2025/05/26/demoting-i686-pc-windows-gnu/",67
"Building an agentic image generator that improves itself","https://simulate.trybezel.com/research/image_agent",67
"Show HN: High-resolution surface analysis with Lidar data","https://github.com/r-follador/delta-relief",66
"Alone and Adrift in the Pacific","https://www.theatlantic.com/magazine/archive/2025/06/commercial-fisherman-shipwreck/682580/",66
"Into The Tunnel: The secret life of wind tunnels","https://jordanwtaylor2.substack.com/p/into-the-tunnel",66
"CRDTs #2: Turtles All the Way Down","https://jhellerstein.github.io/blog/crdt-turtles/",66
"Space is not a wall: toward a less architectural level design","https://www.blog.radiator.debacle.us/2025/05/space-is-not-wall-toward-less.html",65
"Show HN: Samchika – A Java Library for Fast, Multithreaded File Processing","https://github.com/MayankPratap/Samchika",65
"3 Years of Remote Work","https://www.brendangregg.com/blog/2025-05-22/3-years-of-extremely-remote-work.html",65
"Why top posting has won (2018)","https://www.solipsys.co.uk/new/WhyTopPostingHasWon.html?ye25hn",64
"A Bead Too Far: Rethinking Global Connections Before Columbus","https://peterfrankopan.substack.com/p/a-bead-too-far-rethinking-global",64
"Tales from Mainframe Modernization","https://oppi.li/posts/tales_from_mainframe_modernization/",64
"Violating memory safety with Haskell's value restriction","https://welltypedwit.ch/posts/value-restriction",63
"Programming on 34 Keys (2022)","https://oppi.li/posts/programming_on_34_keys/",63
"Domain Theory Lecture Notes","https://liamoc.net/forest/dt-001Y/index.xml",61
"Ask HN: Selling software to company I work for as an employee","item?id=44050009",59
"The Philosophy of Byung-Chul Han (2020)","https://newintrigue.com/2020/06/29/the-philosophy-of-byung-chul-han/",59
"The Fractured Entangled Representation Hypothesis","https://github.com/akarshkumar0101/fer",59
"Japan and the Birth of Modern Shipbuilding","https://www.construction-physics.com/p/how-japan-invented-modern-shipbuilding",59
"Quantum Picturalism","https://quantuminpictures.org/",58
"How we made our OCR code more accurate","https://pieces.app/blog/how-we-made-our-optical-character-recognition-ocr-code-more-accurate",58
"CD / Blur [video]","https://www.youtube.com/watch?v=xDLxFGXuPEc",58
"Show HN: Representing Agents as MCP Servers","https://github.com/lastmile-ai/mcp-agent/tree/main/examples/mcp_agent_server",58
"Exposed Industrial Control Systems and Honeypots in the Wild [pdf]","https://gsmaragd.github.io/publications/EuroSP2025-ICS/EuroSP2025-ICS.pdf",57
"Sesame Scheme: Unintended Consequences of Allergen Food Labeling","https://www.choicesmagazine.org/choices-magazine/submitted-articles/unintended-consequences-of-allergen-food-labeling",57
"New method for creating large 3D models of urban areas is faster and cheaper","https://techxplore.com/news/2025-05-action-movies-urban-method-large.html",56
"Launch HN: SIM Studio (YC X25) – Figma-Like Canvas for Agent Workflows","item?id=44052766",55
"Show HN: Evolved.lua – An Evolved Entity Component System for Lua","https://github.com/BlackMATov/evolved.lua",55
"TorrentFreak is wrong about Google DNS notification","https://write.as/bortzmeyer/no-torrentfreak-what-you-write-about-google-public-dns-is-not-true",54
"Autopsy of an LHC Beam Dump","https://home.cern/news/news/accelerators/autopsy-lhc-beam-dump",54
"Meta must be held liable for Facebook abuse that killed my father","https://www.opendemocracy.net/en/5050/meta-must-be-held-liable-for-facebook-abuse-that-killed-my-father/",54
"Goethe's Faustian Life","https://www.commonwealmagazine.org/goethe-mitchell-wilson-faust-johann-biography",53
"One of the Most Popular Games on the Planet","https://kotaku.com/grow-a-garden-roblox-5-million-active-users-record-pc-1851781824",53
"A Comedian Saves a Model Railroad with Purchase of a New Jersey Home","https://www.wsj.com/lifestyle/model-railroad-james-murray-ac709a96",53
"Using the Apple ][+ with the RetroTink-5X","https://nicole.express/2025/apple-ii-more-like-apple-5x.html",52
"The UI future is colourful and dimensional","https://www.flarup.email/p/the-future-is-colourful-and-dimensional",51
"Changelog: Lazy trees (faster Nix builds)","https://determinate.systems/posts/changelog-determinate-nix-352/",51
"Google shows off Android XR smart glasses with in-lens display","https://www.macrumors.com/2025/05/20/google-android-xr-smart-glasses/",50
"Trade Secrecy in Willy Wonka's Chocolate Factory (2009)","https://papers.ssrn.com/sol3/papers.cfm?abstract_id=1430463",50
"A boy who came back: the near-death, and changed life, of my son Max","https://www.theguardian.com/lifeandstyle/2025/may/24/the-boy-who-came-back-the-near-death-and-changed-life-of-my-son-max",50
"The Verse Calculus: A Core Calculus for Functional Logic Programming [pdf]","https://simon.peytonjones.org/assets/pdfs/verse-March23.pdf",49
"Show HN: GetStack.dev – Track GitHub open-source trends","https://getstack.dev",49
"Show HN: A Simple Server to Match Long/Lat to a TimeZone","https://github.com/LittleGreenViper/LGV_TZ_Lookup",49
"Ruffle – open-source Flash player","https://ruffle.rs",48
"Problems in AI alignment: A scale model","https://muldoon.cloud/2025/05/22/alignment.html",48
"Most leading chatbots routinely exaggerate science findings","https://www.uu.nl/en/news/most-leading-chatbots-routinely-exaggerate-science-findings",47
"Disabling kernel functions in your process (2009)","https://chadaustin.me/2009/03/disabling-functions/",47
"The Next Abstraction","https://substack.com/inbox/post/164096497",47
"Ask HN: What projects do you donate to?","item?id=44071321",46
"Soda Can Stove","https://www.thesodacanstove.com/alcohol-stove/how-to-build/",46
"Ask HN: What HN posts inspired or changed your perspective the most?","item?id=44069690",46
"SVG Favicons in Action","https://css-tricks.com/svg-favicons-in-action/",45
"Scheming a mise-en-abîme in BQN","https://panadestein.github.io/blog/posts/si.html",45
"Show HN: Photoshop Clone Built in React","https://github.com/chase-manning/react-photo-studio",45
"Far – Sublime Inspired Find and Replace","https://github.com/ibilalkayy/far",45
"Sugar-Coated Poison: Benign Generation Unlocks LLM Jailbreaking","https://arxiv.org/abs/2504.05652",45
"Making Postgres Distributed with FoundationDB","https://fabianlindfors.se/blog/making-postgres-distributed/",44
"Async from scratch 3: Pinned against the wall","https://natkr.com/2025-05-22-async-from-scratch-3/",44
"Zoo CAD Engine Overview","https://zoo.dev/research/zoo-cad-engine-overview",44
"Rust Coreutils 0.1.0 Release","https://github.com/uutils/coreutils/releases/tag/0.1.0",43
"CSS Painting API","https://developer.mozilla.org/en-US/docs/Web/API/CSS_Painting_API",42
"A 10x Faster TypeScript with Anders Hejlsberg [video]","https://www.youtube.com/watch?v=UJfF3-13aFo",41
"128GB RAM Ryzen AI MAX+, $1699 – Bosman Undercuts All Other Local LLM Mini-PCs","https://www.hardware-corner.net/bosman-m5-local-llm-mini-pc-20250525/",40
"EU plans new mass surveillance law mandating data retention, built-in backdoors","https://ec.europa.eu/info/law/better-regulation/",40
"Show HN: Whenish – Plan Group Events in iMessages","https://apps.apple.com/us/app/whenish/id6745035749",40
"Reverse Engineering iOS Shortcuts Deeplinks","https://blog.alexbeals.com/posts/reverse-engineering-ios-deeplinking-for-shortcuts",39
"Iron Spring PL/I Compiler","http://www.iron-spring.com/",38
"Hydra: Vehicles on the island – 'After the works they abandon them here'","https://en.protothema.gr/2025/05/19/hydra-see-photos-of-vehicles-on-the-island-after-the-works-they-abandon-them-here-say-residents/",38
"Improving performance of original dav1d video decoder","https://code.videolan.org/videolan/dav1d/-/merge_requests/1788",37
"Show HN: SweepIQ – A simple AI tool to help you learn more, faster","https://www.sweepiq.com",37
"Free-Threaded Python Library Compatibility Checker","https://ft-checker.com/",37
"Where hyperscale hardware goes to retire: Ars visits a big ITAD site","https://arstechnica.com/information-technology/2025/05/where-hyperscale-hardware-goes-to-retire-ars-visits-a-very-big-itad-site/",36
"Is Astrophotography Without Tracking Possible? (2022)","https://astroimagery.com/astrophotography/heres-how-to-do-astrophotography-without-tracking/",36
"CPanel's IPv6 Overhaul","https://blog.apnic.net/2025/05/21/cpanels-ipv6-overhaul/",36
"Show HN:  Olelo Foil - NACA Airfoil Sim","https://foil.olelohonua.com/",36
"Show HN: Web Apps for Python Devs with Auto-Generated UI","https://davia.ai/",36
"Python Tooling at Scale: LlamaIndex’s Monorepo Overhaul","https://www.llamaindex.ai/blog/python-tooling-at-scale-llamaindex-s-monorepo-overhaul",36
"The Annotated Kolmogorov-Arnold Network (Kan)","https://alexzhang13.github.io/blog/2024/annotated-kan/",36
"US Treasury to stop producing pennies next year","https://www.bbc.com/news/articles/cx2j07858lno",36
"GitHub MCP exploited: Accessing private repositories via MCP","https://invariantlabs.ai/blog/mcp-github-vulnerability",35
"Calendars, Contacts and Files in Stalwart","https://stalw.art/blog/collaboration/",35
"'Strange metals' point to a whole new way to understand electricity","https://www.science.org/content/article/strange-metals-point-whole-new-way-understand-electricity",35
"How AppHarvest’s indoor farming scheme imploded (2023)","https://www.lpm.org/investigate/2023-11-16/a-celebrated-startup-promised-kentuckians-green-jobs-it-gave-them-a-grueling-hell-on-earth",35
"Clojure MCP","https://github.com/bhauman/clojure-mcp",34
"Practicing graphical debugging using visualizations of the Hilbert curve","https://akkartik.name/debugUIs.html",34
"Buying a Robot Cat and Falling into the Weird World of Animal-Robot Research","https://thereader.mitpress.mit.edu/the-weird-world-of-animal-robot-research/",33
"Show HN: Pi Co-pilot – Evaluation of AI apps made easy","https://withpi.ai/",33
"Launch HN: Opusense (YC X25) – AI assistant for construction inspectors on site","item?id=44042791",33
"Building (Open Source) Custom Dashboards Is Harder Than You Think","https://langfuse.com/blog/2025-05-21-customizable-dashboards",33
"All That Glitters","https://magazine.atavist.com/all-that-glitters-jona-rechnitz-lawsuit-jadelle-jewelry-coba-ethereummax-mayweather/",33
"MinIO Guts Management Dashboard","https://github.com/minio/object-browser/pull/3509",32
"voyage-3.5 and voyage-3.5-lite: improved quality for a new retrieval frontier","https://blog.voyageai.com/2025/05/20/voyage-3-5/",32
"µPC: Scaling Predictive Coding to 100 Layer Networks","https://arxiv.org/abs/2505.13124",32
"Sqawk: A fusion of SQL and Awk: Applying SQL to text-based data files","https://github.com/jgarzik/sqawk",31
"You could have invented Transformers","https://gwern.net/blog/2025/you-could-have-invented-transformers",31
"Fanaka – a handbook for African success in the international software industry","https://fanaka.readthedocs.io",31
"GrapheneOS: Where Licenses Matter More Than People","https://fireborn.mataroa.blog/blog/grapheneos-where-licenses-matter-more-than-people/",31
"Emilua is an execution engine. As a runtime for your Lua programs","https://docs.emilua.org/api/0.11/index.html",30
"Show HN: Wall Go – browser remake of a Devil's Plan 2 mini-game","https://schaoss.github.io/wall-go/",30
"How I found a Star Wars website made by the CIA","https://ourbigbook.com/cirosantilli/cia-2010-covert-communication-websites",30
"Personal Computer Origins: The Datapoint 2200","https://thechipletter.substack.com/p/personal-computer-origins-the-datapoint",30
"From RPC to transactions and durable executions","https://www.pramodb.com/index.php/2025/05/21/from-rpc-to-transactions-and-durable-executions/",30
"Authors Are Accidentally Leaving AI Prompts in Their Novels","https://www.404media.co/authors-are-accidentally-leaving-ai-prompts-in-their-novels/",30
"Python in LibreOffice (LibrePythonista Extension)","https://extensions.libreoffice.org/en/extensions/show/99231",30
"GodAmp: Reimplementation of Winamp 2.9 in Godot, with cross-platform support","https://github.com/Dowsley/GodAmp",30
"Show HN: Open-source protein and ligand viewer","https://github.com/David-OConnor/daedalus",29
"DIY Cybersickness Remedies","https://spectrum.ieee.org/diy-cybersickness-remedies",29
"Some Life Lessons from VAX/VMS (2013)","https://davewentzel.com/content/some-life-lessons-from-vax-vms/",29
"Access Control Syntax","https://journal.stuffwithstuff.com/2025/05/26/access-control-syntax/",28
"Shenandoah Students Creating VR Experience Following the Lewis and Clark Trail","https://www.su.edu/blog/2025/05/21/shenandoah-students-creating-vr-experience-that-follows-the-lewis-and-clark-trail/",28
"Stopping AI scrapers from taking down my server","https://jade.ellis.link/blog/2025/05/18/actually-stopping-forgejo-ai-scraping",28
"The Next-Gen Mainboard Designed with AmigaOS4 and MorphOS in Mind","https://mirari.vitasys.nl/",28
"DumPy: NumPy except it's OK if you're dum","https://dynomight.net/dumpy/",28
"On "Vibe Coding"","https://tante.cc/2025/05/23/on-vibe-coding/",28
"$200k and still no recovery from Google's algorithm","https://medium.com/@lucwiesman/looking-to-recover-from-the-google-helpful-content-update-or-any-algorithm-update-45c25d0d2b62",28
"You Don't Need Re-Ranking: Understanding the Superlinked Vector Layer","https://superlinked.com/vectorhub/articles/why-do-not-need-re-ranking",27
"The dystopia of '1984' is already here","https://english.elpais.com/culture/2025-05-26/orwell-was-right-the-dystopia-of-1984-is-already-here.html",26
"Having your compile-time cake and eating it too","https://0x44.xyz/blog/comptime-1",26
"Ask HN: Building LLM apps? How are you handling user context?","item?id=44097699",26
"Azul CTO: Java at 30 Still Rules Enterprise Dev","https://thenewstack.io/azul-cto-java-at-30-still-rules-enterprise-dev/",26
"Unix Workstations – The Computer Collection","https://www.computercollection.net/index.php/unix-workstations/",26
"Study finds a 50% decline in the use of semicolons over the last two decades","https://theconversation.com/semicolons-are-becoming-increasingly-rare-their-disappearance-should-be-resisted-257019",25
"MinIO Community version 2.0 is going back to be an object browser only","https://github.com/minio/object-browser/blob/master/CHANGELOG.md",25
"In-Depth Guide to the Best Free Fonts","https://beautifulwebtype.com",25
"I Hated Smart Glasses, but Google's Android XR Let Me See a New Future","https://www.cnet.com/tech/computing/i-hated-smart-glasses-but-googles-android-xr-let-me-see-a-new-future/",25
"Erlang/OTP 28 Highlights","https://www.erlang.org/blog/highlights-otp-28/",25
"The Last Nomads","https://www.thedial.world/articles/news/issue-28/georgia-adjara-highlands-nomads",24
"Solving the mystery of a dinosaur mass grave at the 'River of Death'","https://www.bbc.com/news/articles/c0k3x8lmje1o",24
"Sims, BattleBots, Cellular Automata God and Go (2001)","https://www.gamestudies.org/0102/pearce/",23
"Drawing power out of CCS port","https://openinverter.org/forum/viewtopic.php?t=3551",23
"People who believe that AI might become conscious","https://www.bbc.com/news/articles/c0k3700zljjo",23
"How MiniDisc Worked","https://obsoletesony.substack.com/p/how-minidisc-worked",23
"Tires Don't Work the Way You Think They Do [video]","https://www.youtube.com/watch?v=8I7QsgYm_NU",23
"What3Words – The Algorithm","https://cybergibbons.com/security-2/what3words-the-algorithm/",23
"Portugal, the Mamluks, and the Age of Discovery","https://www.historytoday.com/archive/feature/portugal-mamluks-and-age-discovery",22
"$1M Revenue, $0 Profit: Our D2C Reality Check","https://www.indiehackers.com/post/1m-revenue-0-profit-our-d2c-reality-check-66e1d61d28",22
"Slime (2021)","https://granta.com/slime/",22
"Kangaroo: A flash cache optimized for tiny objects (2021)","https://engineering.fb.com/2021/10/26/core-infra/kangaroo/",22
"Building Twice: A clone of Once","https://stanko.io/building-twice-a-clone-of-once-gJKxLYCe26Ak",22
"Year 2038 Problem","https://en.wikipedia.org/wiki/Year_2038_problem",21
"Show HN: Fwtui – A terminal UI for managing UFW (built with Bubble Tea)","https://github.com/Beny406/fwtui",21
"A Wolf in Sheep's Clothing: White Labeling and Partnerships in the HVAC Industry","https://www.heatpumped.org/p/web-confusion",21
"Raspberry Pi Modems","https://niiccoo2.xyz/raspberry-pi-modems/",21
"Bash implementation of Tabloid, the clickbait programming language","https://github.com/notweerdmonk/tabloid.bash",21
"JupyterLite – Jupyter in the Browser","https://github.com/jupyterlite/jupyterlite",20
"Why Buy a Camper When You Could Build a Stealthier One Out of Pallets Yourself?","https://www.jalopnik.com/1867574/youtuber-built-stealthy-camper-out-of-pallets/",20
"Deadlocks in Go: the dark side of concurrency (2021)","https://www.craig-wood.com/nick/articles/deadlocks-in-go/",20
"Accelerating Docker Builds by Halving EC2 Boot Time","https://depot.dev/blog/accelerating-builds-improve-ec2-boot-time",20
"Our Journey Through Linux/Unix Landscapes","https://blog.kalvad.com/our-journey-through-linux-unix-landscapes/",20
"Glaxnimate – Fast and simple vector graphics editor","https://glaxnimate.org",19
"Giant Sequoias Are Taking Root in an Unexpected Place: Detroit","https://www.smithsonianmag.com/smart-news/giant-sequoias-are-taking-root-in-an-unexpected-place-detroit-180986557/",19
"The 44 Year Old Computer Magazine That Changed Everything [video]","https://www.youtube.com/watch?v=QSnw5pPEPBc",19
"Guide to the Systems Engineering Body of Knowledge (SEBoK) (2024)","https://sebokwiki.org/wiki/Guide_to_the_Systems_Engineering_Body_of_Knowledge_(SEBoK)",19
"Retrieve the comments history of any YouTube user across 1.4B users","https://youtube-tools.lolarchiver.com/",18
"Implementing complex numbers and FFT with just datatypes (2023)","https://gist.github.com/VictorTaelin/5776ede998d0039ad1cc9b12fd96811c",18
"The way of code: Rick Rubin","https://www.thewayofcode.com/",18
"Robert Musil Forgotten Plays Inspired His Greatest Work of Fiction","https://lithub.com/the-austrian-writer-whose-forgotten-plays-inspired-his-greatest-work-of-fiction/",18
"OpenAI Says It Will Build Massive Data Centers in the UAE","https://www.nytimes.com/2025/05/22/technology/openai-uae-data-centers.html",18
"W3C: Minimum Common Web Platform API","https://min-common-api.proposal.wintertc.org/",18
"'Noisy, ugly, planet-destroying temple': Australian locals on Tesla factory","https://www.news.com.au/national/south-australia/noisy-ugly-planetdestroying-temple-adelaide-locals-revolt-over-tesla-plan/news-story/87a1a6f5092cdde39c40fe26a231f830",17
"Computer Science major has seventh highest unemployment rate","https://www.newsweek.com/computer-science-popular-college-major-has-one-highest-unemployment-rates-2076514",17
"Show HN: rtcollector - A modular, RedisTimeSeries-native observability agent","https://github.com/xe-nvdk/rtcollector",17
"Use ramoops for logging under Linux (2021)","https://embear.ch/posts/using-ramoops/",17
"Kermit the Frog gives commencement speech at University of Maryland","https://apnews.com/article/kermit-frog-university-of-maryland-commencement-7976fbba353fef1bb2ca818944f9728d",17
"8% of the reviews submitted to Tripadvisor in 2024 were fake","https://www.cnbc.com/2025/05/26/heres-how-many-fake-reviews-tripadvisor-found-on-its-website-in-2024-.html",17
"Scientist busts myths about how humans burn calories–and why (2022)","https://www.science.org/content/article/scientist-busts-myths-about-how-humans-burn-calories-and-why",17
"New DSL "MassQL" lets scientists query mass spectrometry data","https://news.ucr.edu/articles/2025/05/12/new-computer-language-helps-spot-hidden-pollutants",16
"Ultra-low power, miniature electrophysiological electronics","https://starfishneuroscience.com/blog/ultra-low-power-miniature-electrophysiological-electronics/",16
"Reflections on Neuralese","https://www.greaterwrong.com/posts/qehggwKRMEyWqvjZG/reflections-on-neuralese",16
"AI cheating surge pushes schools into chaos","https://www.axios.com/2025/05/26/ai-chatgpt-cheating-college-teachers",16
"The reverse-centaur apocalypse is upon us","https://pluralistic.net/2024/08/02/despotism-on-demand/",16
"Tech Conferences are ramping up security to quell employee protests","https://www.cnbc.com/2025/05/26/tech-conferences-are-ramping-up-security-to-quell-employee-protests-.html",16
"Microsoft's ICC email block reignites European data sovereignty concerns","https://www.computerweekly.com/opinion/Microsofts-ICC-email-block-reignites-European-data-sovereignty-concerns",16
"MIT physicists discover a new type of superconductor that's also a magnet","https://news.mit.edu/2025/mit-physicists-discover-new-type-superconductor-also-magnet-0522",16
"Gilded Fish: Illustrations of Histoire naturelle des dorades de la Chine c.1780","https://publicdomainreview.org/collection/chinese-fishes/",16
"Mutmut – Python Mutation Tester","https://github.com/boxed/mutmut",15
"Kugelmugel","https://en.wikipedia.org/wiki/Kugelmugel",15
"Rork – Build any cross-platform mobile app, fast","https://rork.com",15
"FreeBSD: The Report of My Death Was an Exaggeration","https://freebsdfoundation.org/blog/the-report-of-my-death-was-an-exaggeration/",15
"KumoRFM: Gen-purpose model for making instant predictions over relational data","https://kumo.ai/company/news/kumo-relational-foundation-model/",15
"Grammars of Formal Uncertainty","https://arxiv.org/abs/2505.20047",14
"Forester, a tool for scientific and mathematical hypertexts","https://www.forester-notes.org/index/index.xml",14
"Gamers and reviewers should learn from the mess with the Nvidia RTX 5060","https://www.theverge.com/pc-gaming/672637/nvidia-rtx-5060-review-meddling-gamersnexus-wake-up-call",14
"Letter to Arc Members 2025","https://browsercompany.substack.com/p/letter-to-arc-members-2025",14
"From confectioners to robots – Tor Alva in Mulegns is unveiled","https://ethz.ch/en/news-and-events/eth-news/news/2025/05/from-confectioners-to-robots-tor-alva-in-mulegns-is-unveiled.html",14
"The End of A/B Testing: How AI-Gen UIs Can Revolutionize Front End Development","https://blog.fka.dev/blog/2025-05-26-the-end-of-ab-testing-how-ai-generated-uis-will-revolutionize-frontend-development/",14
"U.S. Dept of Defense GitHub marked as archived, with it projects like ATAK-CIV","https://github.com/deptofdefense",14
"The Old, Old, Old Man","https://publicdomainreview.org/essay/the-old-old-very-old-man",14
"Claude 4: behavior directly inspired by our Alignment Faking paper","https://www-cdn.anthropic.com/4263b940cabb546aa0e3283f35b686f4f3b2ff47.pdf#page=34",14
"MinIO developers introduce update stripping community edition of UI features","https://old.reddit.com/r/selfhosted/comments/1kva3pw/avoid_minio_developers_introduce_trojan_horse/",14
"Judges Weigh Taking Control of Their Own Security Amid Threats","https://www.wsj.com/us-news/law/trump-judges-security-marshals-6e080ac6",14
"Gemma 3n Architectural Innovations – Speculation and poking around in the model","https://old.reddit.com/r/LocalLLaMA/comments/1kuy45r/gemma_3n_architectural_innovations_speculation/",14
"Do we need publicly-owned social networks to escape Silicon Valley?","https://english.elpais.com/opinion/2025-05-25/do-we-need-publicly-owned-social-networks-to-escape-silicon-valley.html",14
"Machinist and Machine","https://punkx.org/jackdoe/misery.html",14
"Discrete Text Diffusion Explained","https://aaronlou.com/blog/2024/discrete-diffusion/",14
"Ask HN: Career Change Confusion","item?id=44088732",14
"The IBM Enhanced Keyboard turns 40","https://sharktastica.co.uk/articles/enhanced_40",14
"What we lose when weather balloons don't fly","https://www.washingtonpost.com/climate-environment/interactive/2025/weather-balloon-launches-staff-cuts/",13
"Domain Modelers Will Win the AI Era","https://www.0toreal.com/posts/domain-modelers-will-win/",13
