title,link,score
"The 667MHz Machine","https://www.0xsid.com/blog/667mhz-machine",56
"Shipment of KitKat bars stolen en route from Italy to Poland","https://apnews.com/article/nestle-switzerland-candy-bar-stolen-kitkat-51073cce27a0e193651aa7f31aaa506e",56
"Ohm's Peg-to-WASM Compiler","https://ohmjs.org/blog/2026/03/12/peg-to-wasm",55
"Circuit-level PDP-11/34 emulator","https://github.com/dbrll/ll-34",55
"VHDL's Crown Jewel","https://www.sigasi.com/opinion/jan/vhdls-crown-jewel/",54
"Observations from carbon dioxide monitoring","https://grieve-smith.com/ftn/2026/03/nine-observations-from-carbon-dioxide-monitoring/",54
"Byte Magazine Archive 1975 to 1995","https://www.worldradiohistory.com/Byte_Magazine.htm",54
"The loneliness of A Room of One’s Own","https://newrepublic.com/article/206731/loneliness-room-one-virginia-woolf-hold-up",52
"Cuts in publishing and book reviewing imperil the future of narrative nonfiction","https://newrepublic.com/article/207659/non-fiction-publishing-threat-important-ever",52
"Siclair Microvision (1977)","https://r-type.org/articles/art-452.htm",51
"StationeryObject","https://stationeryobject.com/archive/",51
"The Failure of the Thermodynamics of Computation (2010)","https://sites.pitt.edu/~jdnorton/Goodies/Idealization/index.html",50
"Sandboxing AI agents, 100x faster","https://blog.cloudflare.com/dynamic-workers/",50
"Wikipedia officially bans AI-generated content","https://nypost.com/2026/03/28/tech/wikipedia-officially-bans-ai-generated-encyclopedia-entries/",49
"Can It Resolve DOOM? Game Engine in 2k DNS Records","https://core-jmp.org/2026/03/can-it-resolve-doom-game-engine-in-2000-dns-records/",49
"Fast regex search: indexing text for agent tools","https://cursor.com/blog/fast-regex-search",49
"Model Collapse Is Happening, We Just Pretend It Isn't","https://cacm.acm.org/blogcacm/model-collapse-is-already-happening-we-just-pretend-it-isnt/",49
"AI isn't killing jobs, it's 'unbundling' them into lower-paid chunks","https://www.theregister.com/2026/03/24/ai_job_unbundling/",48
"Local Bernstein theory, and lower bounds for Lebesgue constants","https://terrytao.wordpress.com/2026/03/23/local-bernstein-theory-and-lower-bounds-for-lebesgue-constants/",48
"The Epistemology of Microphysics","https://www.edwardfeser.com/unpublishedpapers/microphysics.html",47
"I use excalidraw to manage my diagrams for my blog","https://blog.lysk.tech/excalidraw-frame-export/",45
"I am definitely missing the pre-AI writing era","https://www.lesswrong.com/posts/BJ4pnropWdnzzgeJc/i-am-definitely-missing-the-pre-ai-writing-era",45
"Taming LLMs: Using Executable Oracles to Prevent Bad Code","https://john.regehr.org/writing/zero_dof_programming.html",45
"Google Just Patented the End of Your Website","https://www.forbes.com/sites/joetoscano1/2026/03/06/google-just-patented-the-end-of-your-website/",44
"Show HN: Public transit systems as data – lines, stations, railcars, and history","https://publictransit.systems",43
"The State of Immutable Linux","https://justingarrison.com/blog/state-of-immutable-linux/",43
"HD Audio Driver for Windows 98SE / Me","https://github.com/andrew-hoffman/wdmhda",42
"Canadian man says he was denied entry, forced to submit DNA sample at US border","https://www.ctvnews.ca/london/article/canadian-man-denied-entry-forced-to-submit-dna-sample-at-us-border/",42
"Memory That Collaborates","https://datahike.io/notes/collaborate-without-infrastructure/",42
"HandyMKV for MakeMKV and HandBrake Automation","https://github.com/dmars8047/handymkv",40
"Modeling what makes paper-folding puzzles hard","https://www.dailyunfold.com/blog/spatial-difficulty",39
"Typing and Keyboards","https://lzon.ca/posts/series/grateful/typing-and-keyboards/",38
"Ötzi the Iceman's DNA Reveals a Living Relative 5k Years Later","https://blog.familytreedna.com/otzi-the-iceman-dna/",38
"Can I hear a difference between MP3s and uncompressed audio?","https://82mhz.net/posts/2026/03/can-i-hear-a-difference-between-mp3s-and-uncompressed-audio/",38
"The Sudden Fall of OpenAI's Most Hyped Product Since ChatGPT","https://www.wsj.com/tech/ai/the-sudden-fall-of-openais-most-hyped-product-since-chatgpt-64c730c9",37
"Anthropic's Mythos leak: 3k files in a public CMS, and what the docs revealed","https://medium.com/ai-advances/anthropic-claude-mythos-leak-analysis-b77c1b304eb8",37
"The Last Contract: William T. Vollmann's Battle to Publish an Epic (2025)","https://www.metropolitanreview.org/p/the-last-contract",36
"AI Isn't Lightening Workloads. It's Making Them More Intense","https://www.wsj.com/tech/ai/ai-isnt-lightening-workloads-its-making-them-more-intense-e417dd2c",35
"Can AI Exit Vim?","https://theadamcolton.github.io/can-ai-exit-vim",34
"ODF is the future, OOXML is the past","https://blog.documentfoundation.org/blog/2026/03/27/odf-is-the-future-ooxml-is-the-past/",34
"Interview: Nobonoko, Master of the Minimal Sequencer","https://fi-le.net/nobo/",32
"Show HN: I made a "programming language" looking for feedback","https://github.com/alonsovm44/glupe",32
"Be careful: chatting with AI about your case is discoverable","https://harvardlawreview.org/blog/2026/03/united-states-v-heppner/",32
"ARM to make processors for first time in their history","https://newsroom.arm.com/news/arm-agi-cpu-launch",32
""Roadrunner": a bipedal, wheeled robot for multi-modal locomotion [video]","https://www.youtube.com/watch?v=9kae-UAME1U",30
"Show HN: Foundry: a Markdown-first CMS written in Go","https://github.com/sphireinc/Foundry",30
"A lawyer won Anthropic's hackathon – what everyone missed","https://hadleylab.org/blogs/2026-03-22-the-lawyer-who-won/",30
"Gonon: Building a Clock with No Numerals","https://tonygaeta.com/perceptor/code/gonon",29
"Monado became the foundation for OpenXR runtimes","https://www.collabora.com/news-and-blog/news-and-events/how-monado-became-the-foundation-for-openxr-runtimes.html",29
"Solving Semantle with the Wrong Embeddings","https://victoriaritvo.com/blog/robust-semantle-solver/",29
"Go Naming Conventions: A Practical Guide","https://www.alexedwards.net/blog/go-naming-conventions",29
"California pledges to open 7% of its land and waters to Indigenous tribes","https://www.latimes.com/environment/story/2026-03-17/california-pledges-to-open-land-waters-to-indigenous-tribes",29
"Hamilton-Jacobi-Bellman Equation: Reinforcement Learning and Diffusion Models","https://dani2442.github.io/posts/continuous-rl/",27
"Building an E2E Encrypted Chat Application with LanceDB and Libsodium","https://www.justinrmiller.com/building-an-e2e-encrypted-chat-application-with-lancedb-and-libsodium/",26
"RSA and Python","https://xnacly.me/posts/2023/rsa/",26
"Codex Plugins","https://developers.openai.com/codex/plugins",26
"Nobody Reads Your Setup Docs","https://hanzilla.co/blog/mcp-onboarding-ten-agents-one-command/",26
"VR Is Not Dead","https://yadin.com/notes/vr-abides/",26
"Arizona bill would require voter approval of government surveillance","https://azcapitoltimes.com/news/2026/03/26/gop-bill-would-require-voter-approval-of-government-surveillance/",26
"Openrouter Going Rogue?","https://old.reddit.com/r/openrouter/comments/1s6d2cw/openrouter_is_holding_funds_hostage_no_support/",25
"The Many Roots of Our Suffering: Reflections on Robert Trivers (1943–2026)","https://quillette.com/2026/03/25/the-many-roots-of-our-suffering-reflections-on-robert-trivers-1943-2026/",24
"RustTraining: Beginner, advanced, expert level Rust training material","https://github.com/microsoft/RustTraining",24
"Hardware Image Compression","https://www.ludicon.com/castano/blog/2026/03/hardware-image-compression/",23
"Nginx – Open-Sourced Session Persistence, Multipath TCP and More","https://blog.nginx.org/blog/nginx-oss-1-29-6-and-1-29-7-open-sourced-session-persistence-multipath-tcp-and-more",23
"A Message from the Ruby Central Board","https://rubycentral.org/news/a-message-from-the-ruby-central-board/",23
"Show HN: Grafana TUI – Browse Grafana dashboards in the terminal","https://github.com/lovromazgon/grafana-tui",23
"I Can't See Apple's Vision","https://matduggan.com/i-cant-see-apples-vision/",23
"Is Another Financial Crisis Lurking in Private Credit?","https://www.wsj.com/economy/is-another-financial-crisis-lurking-in-private-credit-cad379b1",22
"What category theory teaches us about dataframes","https://mchav.github.io/what-category-theory-teaches-us-about-dataframes/",22
"Airfare Is Just the Beginning","https://www.theatlantic.com/newsletters/2026/03/expensive-plane-tickets-oil-iran/686604/",22
"Stripe Is Down","https://dashboard.stripe.com/login",19
"Eclipse GlassFish: This Isn't Your Father's GlassFish","https://foojay.io/today/eclipse-glassfish-this-isnt-your-fathers-glassfish/",19
"Quantum frontiers may be closer than they appear","https://blog.google/innovation-and-ai/technology/safety-security/cryptography-migration-timeline/",19
"TreeTrek – A raw Git repository viewer web app","https://repo.autonoma.ca/treetrek",19
"Artificial Cleverness: The system that knows everything and understands nothing","https://formallycurious.substack.com/p/artificial-cleverness",18
"Show HN: Pgsemantic – Point at your Postgres DB, get vector search instantly","https://github.com/varmabudharaju/pgsemantic",18
"What Does a Hologram Trademark Signify When the Hologram Isn't There?","https://blog.ericgoldman.org/archives/2026/03/what-does-a-hologram-trademark-signify-when-the-hologram-isnt-there-upper-deck-v-pixels.htm",17
"Douglas Lenat's Automated Mathematician Source Code","https://github.com/white-flame/am",16
"Show HN: Timezone App – Visual meeting scheduler for distributed teams","https://timezoneapp.co/",16
"The Ozempicization of the Economy","https://kyla.substack.com/p/the-ozempicization-of-the-economy",16
"India's maternal mortality drops nearly 80% since 1990: Global study","https://economictimes.indiatimes.com/news/india/indias-maternal-mortality-drops-nearly-80-since-1990-global-study/articleshow/129862726.cms?from=mdr",16
"What to Do About Those Menu Item Icons in macOS 26 Tahoe","https://mastodon.social/@stroughtonsmith/116262411548746327",15
"ninja: a small build system with a focus on speed","https://github.com/ninja-build/ninja",14
"Show HN: DeepRepo – AI architecture diagrams from GitHub repos","https://deeprepo.dev",14
"Show HN: Payphone Tag is territory game using Australia's 15,000 payphones","https://payphonetag.com",14
"AI software for smart glasses wins £1M prize for helping people with dementia","https://www.theguardian.com/society/2026/mar/18/ai-smart-glasses-1m-prize-technology-dementia",14
"Glaxnimate vector graphics editor now part of KDE","https://glaxnimate.org/news/releases/0.6.0/",14
"Aria Gen 2 Glasses","https://www.projectaria.com/glasses/?_fb_noscript=1",14
"The decline and fall of the Roman currency empire","https://www.economist.com/finance-and-economics/2026/03/26/the-decline-and-fall-of-the-roman-currency-empire",14
"Outbreak linked to raw cheese grows; 9 cases total, one with kidney failure","https://arstechnica.com/health/2026/03/kidney-failure-case-reported-in-raw-cheese-outbreak-maker-still-denies-link/",14
"Show HN: Agent Orchestrator, a local-first Harness Engineering control plane","item?id=47562440",13
"Ask HN: Best stack for building a tiny game with an 11-year-old?","item?id=47563423",13
"How ICE's Surveillance System Works [video]","https://www.youtube.com/watch?v=aRUhgrqnpGY",13
"We Added a Console Notice to Internationalizationext – and Why We Removed It","https://www.locize.com/blog/i18next-support-notice/",12
"Tech CEOs suddenly love blaming AI for mass job cuts. Why?","https://www.bbc.com/news/articles/cde5y2x51y8o",12
"Show HN: I made a free list of 100 places to promote your SaaS","https://launchdirectories.com",12
"NASA releases new Webb, Hubble images of Saturn","https://science.nasa.gov/missions/webb/nasa-webb-hubble-share-most-comprehensive-view-of-saturn-to-date/",12
"Isolated Web Apps","https://chromeos.dev/en/web/isolated-web-apps",12
"How to Survive in the Tech industry in 2026","https://blog.phuaxueyong.com/post/2026-03-23-how-to-survive-tech-in-2026/",11
"How We Rewrote 130K Lines from React to Svelte in Two Weeks","https://strawberrybrowser.com/blog/react-to-svelte",11
"The Comedy of Errors That Was the First-Ever Space Walk","https://nautil.us/the-comedy-of-errors-that-was-the-first-ever-space-walk-1279052",11
"Digitizing photos from the 1998 Game Boy Camera","https://swiftrocks.com/digitizing-photos-from-the-1998-game-boy-camera",11
"Computer chip material inspired by the human brain could slash AI energy use","https://www.cam.ac.uk/research/news/new-computer-chip-material-inspired-by-the-human-brain-could-slash-ai-energy-use",11
"Show HN: Windows 95–style Weather App for iPhone","https://apps.apple.com/us/app/weather-exe/id6761195944",11
"Kldload 1.0 – ZFS on root for Linux","https://kldload.com/",11
"Reddit Users Are Being Targeted by Stake's Covert Advertising Tactics","https://old.reddit.com/r/redscarepod/comments/1s3xvw6/how_reddit_users_are_being_maliciously_targeted/",11
"Show HN: Mantyx – A platform to orchestrate, manage, and share your agents","https://mantyx.io/",11
"How to implement the Outbox pattern in Go and Postgres","https://www.youtube.com/watch?v=hJ4S-5MirvU",11
"The stay-at-home boyfriend is now an economic trend as more women than men work","https://fortune.com/2026/03/28/men-home-women-workforce-economics-gender-change/",11
"Corn tortillas in California now must contain folic acid","https://apnews.com/article/folic-acid-birth-defect-latino-corn-tortilla-13bad611bd3cc590d0e098635791eb04",10
"An investigation of the forces behind the age-verification bills","https://lwn.net/Articles/1062779/",10
"Ask HN: What's the latest concensus on OpenAI vs. Anthropic $20/month tier?","item?id=47559143",10
"You can't imitation-learn how to continual-learn","https://www.lesswrong.com/posts/9rCTjbJpZB4KzqhiQ/you-can-t-imitation-learn-how-to-continual-learn",10
"Nixbook OS: A set-and-forget modern operating system designed for simplicity","https://nixbookos.org/",10
"Show HN: OS3-RNode, an RNode-Compatible LoRa Modem on CH32V003","https://netmonk.org/works/rnode-on-os3-ch32v003/",9
"Phantom of Heilbronn","https://en.wikipedia.org/wiki/Phantom_of_Heilbronn",9
"Terminal Trove","https://terminaltrove.com/explore/",9
"Moretti replication published in AER","https://blog.michaelwiebe.com/p/moretti-replication-published-in",8
"How the Navajo Nation is tackling diabetes with a return to its ancestral diet","https://coloradosun.com/2026/03/27/how-the-navajo-nation-is-tackling-diabetes-with-a-return-to-its-ancestral-diet/",8
"Google's TurboQuant AI-compression algorithm can reduce LLM memory usage by 6x","https://arstechnica.com/ai/2026/03/google-says-new-turboquant-compression-can-lower-ai-memory-usage-without-sacrificing-quality/",8
"Working on Products People Hate","https://www.seangoedecke.com/working-on-products-people-hate/",8
"Druids: Batteries-included library to coordinate and deploy coding agents","https://druids.dev/welcome",8
"Google employees new AI tool Agent Smith got so popular that it was restricted","https://www.businessinsider.com/google-agent-smith-employees-ai-driven-coding-2026-3",7
"Show HN: Pglens – 27 read-only PostgreSQL tools for AI agents via MCP","https://github.com/janbjorge/pglens",7
"Apple scales back its AI ambitions and sticks to selling hardware","https://www.neowin.net/news/report-apple-scales-back-its-ai-ambitions-and-sticks-to-selling-hardware/",7
"Nucleus – A minimalist container engine written in Rust","https://github.com/sumant1122/Nucleus",7
"One ant for $220: The new frontier of wildlife trafficking","https://www.bbc.com/news/articles/cg4g44zv37qo",7
"Can Electrical Stimulation Restore Sight?","https://spectrum.ieee.org/optic-nerve-damage-electrical-stimulation",7
"Ask HN: How are you keeping AI coding agents from burning money?","item?id=47559293",7
"How I Survive Red Eyes","https://kiranrao.ca/2026/03/29/redeye.html",6
"SWE-bench will hit 90% this year","https://fabraix.com/blog/swe-bench-90-percent",6
"Towards Scalable Dataframe Systems","https://arxiv.org/abs/2001.00888",6
"Grade Caps Fail the Game Theory Exam","https://www.thecrimson.com/article/2026/3/27/kominers-harvard-grade-cap/",6
"As Platforms Decay, Let's Put Users First (2023)","https://www.eff.org/deeplinks/2023/04/platforms-decay-lets-put-users-first",6
"Inverted Pendulum Logo","http://closedbridge.com",6
"Riding the Memory Boom and Trying to Avoid the Bust","https://www.nextplatform.com/store/2026/03/24/riding-the-memory-boom-and-trying-to-avoid-the-bust/5211466",6
"Quadratic Micropass Type Inference","https://articles.luminalang.com/a/micropass-inference/",6
"Quantum Control Plane","https://github.com/mareksuchodolski12-hash/kwantowy",5
"Towards end-to-end automation of AI research","https://www.nature.com/articles/s41586-026-10265-5",5
"The Digital Leviathan","https://brownstone.org/articles/the-digital-leviathan/",5
"Show HN: /slot-machine development (CC vs. Codex; CE vs. superpowers)","https://github.com/pejmanjohn/slot-machine",5
"Apple forces on-device age verification in UK release of iOS 26.4","https://support.apple.com/en-gb/126788",5
"Ada and Spark on ARM Cortex-M – A Tutorial with Arduino and Nucleo Examples","http://inspirel.com/articles/Ada_On_Cortex.html",5
"The sun and thousands of its twins migrated across the Milky Way just in time","https://www.scientificamerican.com/article/the-sun-and-thousands-of-its-twins-migrated-across-the-milky-way-just-in/",5
"When Coupled Volcanoes Talk, These Researchers Listen","https://www.quantamagazine.org/when-coupled-volcanoes-talk-these-researchers-listen-20260327/",4
"A School District Tried to Help Train Waymos to Stop for School Buses","https://www.wired.com/story/a-school-district-tried-to-help-train-waymos-to-stop-for-school-buses-it-didnt-work/",4
"Back to FreeBSD – Part 2 – Jails","https://hypha.pub/back-to-freebsd-part-2",4
"LLMs Can Write Production Quality Code","https://escobyte.substack.com/p/writing-high-quality-production-code",4
"SimpleLogin CLI","https://github.com/mexcool/simplelogin-cli",4
"Linux, Finally for Everyone","https://yololinux.com/",3
"Teenage Engineering's PO-32 acoustic modem and synth implementation","https://github.com/ericlewis/libpo32",3
"InpharmD (YC W21) Is Hiring – Senior Ruby on Rails Developer","https://inpharmd.com/jobs/senior-ruby-on-rails-engineer",0
