title,link,score
"Claude 4","https://www.anthropic.com/news/claude-4",1994
"Mozilla to shut down Pocket and Fakespot","https://support.mozilla.org/en-US/kb/future-of-pocket",1197
"Postgres IDE in VS Code","https://techcommunity.microsoft.com/blog/adforpostgresql/announcing-a-new-ide-for-postgresql-in-vs-code-from-microsoft/4414648",1016
"Trump administration halts Harvard's ability to enroll international students","https://www.nytimes.com/2025/05/22/us/politics/trump-harvard-international-students.html",894
"Gemini Diffusion","https://simonwillison.net/2025/May/21/gemini-diffusion/",880
"Veo 3 and Imagen 4, and a new tool for filmmaking called Flow","https://blog.google/technology/ai/generative-media-models-io-2025/",827
"OpenAI to buy AI startup from Jony Ive","https://www.bloomberg.com/news/articles/2025-05-21/openai-to-buy-apple-veteran-jony-ive-s-ai-device-startup-in-6-5-billion-deal",817
"Find Your People","https://foundersatwork.posthaven.com/find-your-people",772
"Devstral","https://mistral.ai/news/devstral",696
"Claude 4 System Card","https://simonwillison.net/2025/May/25/claude-4-system-card/",677
"German court sends VW execs to prison over Dieselgate scandal","https://www.politico.eu/article/german-court-vw-execs-prison-dieselgate-scandal-volkswagen-environment-illegal-pollution/",656
"The scientific “unit” we call the decibel","https://lcamtuf.substack.com/p/decibels-are-ridiculous",640
"I used o3 to find a remote zeroday in the Linux SMB implementation","https://sean.heelan.io/2025/05/22/how-i-used-o3-to-find-cve-2025-37899-a-remote-zeroday-vulnerability-in-the-linux-kernels-smb-implementation/",638
"Reinvent the Wheel","https://endler.dev/2025/reinvent-the-wheel/",590
"By default, Signal doesn't recall","https://signal.org/blog/signal-doesnt-recall/",576
"That fractal that's been up on my wall for years","https://chriskw.xyz/2025/05/21/Fractal/",562
"John Carmack talk at Upper Bound 2025","https://twitter.com/ID_AA_Carmack/status/1925710474366034326",545
"CSS Minecraft","https://benjaminaster.com/css-minecraft/",543
"At Amazon, some coders say their jobs have begun to resemble warehouse work","https://www.nytimes.com/2025/05/25/business/amazon-ai-coders.html",534
"How to live on $432 a month in America","https://shagbark.substack.com/p/how-to-live-on-432-a-month-in-america",505
"Open Source Society University – Path to a free self-taught education in CS","https://github.com/ossu/computer-science",496
"Hacker News now runs on top of Common Lisp","https://lisp-journey.gitlab.io/blog/hacker-news-now-runs-on-top-of-common-lisp/",480
"Google shared my phone number","https://danq.me/2025/05/21/google-shared-my-phone-number/",456
"Litestream: Revamped","https://fly.io/blog/litestream-revamped/",450
"Gemma 3n preview: Mobile-first AI","https://developers.googleblog.com/en/introducing-gemma-3n/",439
"Denmark to raise retirement age to 70","https://www.telegraph.co.uk/world-news/2025/05/23/denmark-raise-retirement-age-70/",434
"Root for your friends","https://josephthacker.com/personal/2025/05/13/root-for-your-friends.html",425
"Scientific conferences are leaving the US amid border fears","https://www.nature.com/articles/d41586-025-01636-5",414
"Show HN: Defuddle, an HTML-to-Markdown alternative to Readability","https://github.com/kepano/defuddle",405
"Why I no longer have an old-school cert on my HTTPS site","https://rachelbythebay.com/w/2025/05/22/ssl/",401
"Owls in Towels","https://owlsintowels.org/",387
"Duolingo CEO tries to walk back AI-first comments, fails","https://htxt.co.za/2025/05/duolingo-ceo-tries-to-walk-back-ai-first-comments-fails/",377
"Planetfall","https://somethingaboutmaps.wordpress.com/2025/05/20/planetfall/",350
"Lottie is an open format for animated vector graphics","https://lottie.github.io/",343
"For algorithms, a little memory outweighs a lot of time","https://www.quantamagazine.org/for-algorithms-a-little-memory-outweighs-a-lot-of-time-20250521/",340
"A new class of materials that can passively harvest water from air","https://blog.seas.upenn.edu/penn-engineers-discover-a-new-class-of-materials-that-passively-harvest-water-from-air/",338
"Show HN: Rotary Phone Dial Linux Kernel Driver","https://gitlab.com/sephalon/rotary_dial_kmod",334
"Google AI Ultra","https://blog.google/products/google-one/google-ai-ultra/",319
"The Future of Flatpak","https://lwn.net/Articles/1020571/",303
"Ask HN: What are you working on? (May 2025)","item?id=44090387",302
"The NSA Selector","https://github.com/wenzellabs/the_NSA_selector",301
"Lieferando.de has captured 5.7% of restaurant related domain names","https://mondaybits.com/lieferando-captured-6-percent-of-restaurant-related-domain-names/",300
"Improving performance of rav1d video decoder","https://ohadravid.github.io/posts/2025-05-rav1d-faster/",300
"Good Writing","https://paulgraham.com/goodwriting.html",299
"Show HN: A Tiling Window Manager for Windows, Written in Janet","https://agent-kilo.github.io/jwno/",296
"Does Earth have two high-tide bulges on opposite sides? (2014)","http://physics.stackexchange.com/questions/121830/does-earth-really-have-two-high-tide-bulges-on-opposite-sides",293
"Why old games never die, but new ones do","https://pleromanonx86.wordpress.com/2025/05/06/why-old-games-never-die-but-new-ones-do/",292
"Why Algebraic Effects?","https://antelang.org/blog/why_effects/",290
"You’re a little company, now act like one (2009)","https://longform.asmartbear.com/little-company/",289
"I Built My Own Audio Player","https://nexo.sh/posts/why-i-built-a-native-mp3-player-in-swiftui/",289
"Animated Factorization (2012)","http://www.datapointed.net/visualizations/math/factorization/animated-diagrams/",283
"Collaborative Text Editing Without CRDTs or OT","https://mattweidner.com/2025/05/21/text-without-crdts.html",283
"LLM function calls don't scale; code orchestration is simpler, more effective","https://jngiam.bearblog.dev/mcp-large-data/",281
"Ask HN: Anyone struggling to get value out of coding LLMs?","item?id=44095189",280
"Why does Debian change software?","https://blog.liw.fi/posts/2025/why-debian-changes/",278
"TIL: timeout in Bash scripts","https://heitorpb.github.io/bla/timeout/",273
"GitHub issues is almost the best notebook in the world","https://simonwillison.net/2025/May/26/notes/",273
"“ZLinq”, a Zero-Allocation LINQ Library for .NET","https://neuecc.medium.com/zlinq-a-zero-allocation-linq-library-for-net-1bb0a3e5c749",269
"Display any CSV file as a searchable, filterable, pretty HTML table","https://github.com/derekeder/csv-to-html-table",266
"Fast Allocations in Ruby 3.5","https://railsatscale.com/2025-05-21-fast-allocations-in-ruby-3-5/",264
"Chomsky on what ChatGPT is good for (2023)","https://chomsky.info/20230503-2/",261
"Tachy0n: The Last 0day Jailbreak","https://blog.siguza.net/tachy0n/",260
"Mermaid: Generation of diagrams like flowcharts or sequence diagrams from text","https://github.com/mermaid-js/mermaid",253
"MCP is the coming of Web 2.0 2.0","https://www.anildash.com//2025/05/20/mcp-web20-20/",249
"You can choose tools that make you happy","https://borretti.me/article/you-can-choose-tools-that-make-you-happy",243
"Ten years of JSON Web Token and preparing for the future","https://self-issued.info/?p=2708",234
"Cloudflare CEO: Football piracy blocks will claim lives","https://torrentfreak.com/cloudflare-ceo-football-piracy-blocks-will-claim-lives-i-pray-no-one-dies-250526/",233
"The Xenon Death Flash: How a Camera Nearly Killed the Raspberry Pi 2","https://magnus919.com/2025/05/the-xenon-death-flash-how-a-camera-nearly-killed-the-raspberry-pi-2/",230
"Modification of acetaminophen to reduce liver toxicity and enhance drug efficacy","https://www.societyforscience.org/regeneron-sts/2025-student-finalists/chloe-lee/",227
"Sleep apnea pill shows striking success in large clinical trial","https://www.science.org/content/article/sleep-apnea-pill-shows-striking-success-large-clinical-trial",225
"Lossless video compression using Bloom filters","https://github.com/ross39/new_bloom_filter_repo/blob/main/README.md",220
"Plwm – An X11 window manager written in Prolog","https://github.com/Seeker04/plwm",219
"Getting a paper accepted","https://maxwellforbes.com/posts/how-to-get-a-paper-accepted/",218
"Red Programming Language","https://www.red-lang.org/p/about.html",213
"A South Korean grand master on the art of the perfect soy sauce","https://www.theguardian.com/world/2025/may/21/without-time-there-is-no-flavour-a-south-korean-grand-master-on-the-art-of-the-perfect-soy-sauce",212
"We’ll be ending web hosting for your apps on Glitch","https://blog.glitch.com/post/changes-are-coming-to-glitch/",211
"Bagel: Open-source unified multimodal model","https://bagel-ai.org/",210
"Jjui – A Nice TUI for Jujutsu","https://github.com/idursun/jjui",208
"Show HN: PgDog – Shard Postgres without extensions","https://github.com/pgdogdev/pgdog",205
"Design Pressure: The Invisible Hand That Shapes Your Code","https://hynek.me/talks/design-pressure/",205
"Hong Kong's Famous Bamboo Scaffolding Hangs on (For Now)","https://www.nytimes.com/2025/05/24/world/asia/hongkong-bamboo-scaffolding.html",203
"Peer Programming with LLMs, for Senior+ Engineers","https://pmbanugo.me/blog/peer-programming-with-llms",203
"CAPTCHAs are over (in ticketing)","https://behind.pretix.eu/2025/05/23/captchas-are-over/",198
"Remote Prompt Injection in Gitlab Duo Leads to Source Code Theft","https://www.legitsecurity.com/blog/remote-prompt-injection-in-gitlab-duo",197
"Writing your own CUPS printer driver in 100 lines of Python (2018)","https://behind.pretix.eu/2018/01/20/cups-driver/",197
"Show HN: SQLite JavaScript - extend your database with JavaScript","https://github.com/sqliteai/sqlite-js",196
"Rocky Linux 10 Will Support RISC-V","https://rockylinux.org/news/rockylinux-support-for-riscv",196
"Show HN: DaedalOS – Desktop Environment in the Browser","https://github.com/DustinBrett/daedalOS",195
"An upgraded dev experience in Google AI Studio","https://developers.googleblog.com/en/google-ai-studio-native-code-generation-agentic-tools-upgrade/",195
"Show HN: SVG Animation Software","https://expressive.app/expressive-animator/",194
"The Dawn of Nvidia's Technology","https://blog.dshr.org/2025/05/the-dawn-of-nvidias-technology.html",190
"How I ended up flying for Yemen's national airline – and survived","https://www.pprune.org/terms-endearment/653181-yemenia-expat-contract-full-info.html",190
"Introducing the Llama Startup Program","https://ai.meta.com/blog/llama-startup-program/?_fb_noscript=1",189
"Google is burying the web alive","https://nymag.com/intelligencer/article/google-ai-mode-search-results-bury-the-web.html",187
"Ask HN: Go deep into AI/LLMs or just use them as tools?","item?id=44079303",185
"I have tinnitus. I don't recommend it","https://blog.greg.technology/2025/05/20/tinnitus.html",184
"Lone coder cracks 50-year puzzle to find Boggle's top-scoring board","https://www.ft.com/content/0ab64ced-1ed1-466d-acd3-78510d10c3a1",176
"Caesar's Last Breath","https://charliesabino.com/caesars-last-breath/",175
"Particle Life simulation in browser using WebGPU","https://lisyarus.github.io/blog/posts/particle-life-simulation-in-browser-using-webgpu.html",174
"Trading with Claude, and writing your own MCP server","https://dangelov.com/blog/trading-with-claude/",174
"Show HN: hcker.news – an ergonomic, timeline-based Hacker News front page","https://hcker.news",174
"Kotlin-Lsp: Kotlin Language Server and Plugin for Visual Studio Code","https://github.com/Kotlin/kotlin-lsp",173
"How to Make a Living as a Writer","https://thewalrus.ca/how-to-make-a-living-as-a-writer/",172
"DumPy: NumPy except it's OK if you're dum","https://dynomight.net/dumpy/",171
"Lisping at JPL (2002)","https://flownet.com/gat/jpl-lisp.html",167
"How to Install Windows NT 4 Server on Proxmox","https://blog.pipetogrep.org/2025/05/23/how-to-install-windows-nt-4-server-on-proxmox/",164
"AI, Heidegger, and Evangelion","https://fakepixels.substack.com/p/ai-heidegger-and-evangelion",164
"Writing A Job Runner (In Elixir) (Again) (10 years later)","https://github.com/notactuallytreyanastasio/genstage_tutorial_2025/blob/main/README.md",164
"Live facial recognition cameras may become 'commonplace' as police use soars","https://www.theguardian.com/technology/2025/may/24/police-live-facial-recognition-cameras-england-and-wales",163
"Possible new dwarf planet found in our solar system","https://www.minorplanetcenter.net/mpec/K25/K25K47.html",163
"Storefront Web Components","https://shopify.dev/docs/api/storefront-web-components",163
"MCP explained without hype or fluff","https://blog.nilenso.com/blog/2025/05/12/mcp-explained-without-hype-or-fluff/",163
"Trying to teach in the age of the AI homework machine","https://www.solarshades.club/p/dispatch-from-the-trenches-of-the",162
"Now you can watch the Internet Archive preserve documents in real time","https://www.theverge.com/news/672682/internet-archive-microfiche-lo-fi-beats-channel",161
"Show HN: DoubleMemory – more efficient local-first read-it-later app","https://doublememory.com",160
"Show HN: I built a more productive way to manage AI chats","https://contextch.at",160
"Roto: A Compiled Scripting Language for Rust","https://blog.nlnetlabs.nl/introducing-roto-a-compiled-scripting-language-for-rust/",159
"Microsoft-backed UK tech unicorn Builder.ai collapses into insolvency","https://www.ft.com/content/9fdb4e2b-93ea-436d-92e5-fa76ee786caa",158
"The world of Japan's PC-98 computer","https://strangecomforts.com/the-strange-world-of-japans-pc-98-computer/",157
"Show HN: Genetic Boids Web Simulation","https://attentionmech.github.io/genetic-boids/",156
"On File Formats","https://solhsa.com/oldernews2025.html#ON-FILE-FORMATS",155
"Positional preferences, order effects, prompt sensitivity undermine AI judgments","https://www.cip.org/blog/llm-judges-are-unreliable",154
"Sketchy Calendar","https://www.inkandswitch.com/ink/notes/sketchy-calendar/",153
"Show HN: ClipJS – Edit your videos from a PC or phone","https://clipjs.vercel.app/",152
"Robin: A multi-agent system for automating scientific discovery","https://arxiv.org/abs/2505.13400",151
"Semantic search engine for ArXiv, biorxiv and medrxiv","https://arxivxplorer.com/",149
"Ancient law requires a bale of straw to hang from Charing Cross rail bridge","https://www.ianvisits.co.uk/articles/ancient-law-requires-a-bale-of-hay-to-hang-from-charing-cross-rail-bridge-81318/",148
"How to cheat at settlers by loading the dice (2017)","https://izbicki.me/blog/how-to-cheat-at-settlers-of-catan-by-loading-the-dice-and-prove-it-with-p-values.html",148
"Tariffs in American History","https://imprimis.hillsdale.edu/tariffs-in-american-history/",147
"TSMC bets on unorthodox optical tech","https://spectrum.ieee.org/microled-optical-chiplet",142
"'Strange metals' point to a whole new way to understand electricity","https://www.science.org/content/article/strange-metals-point-whole-new-way-understand-electricity",142
"Dependency injection frameworks add confusion","http://rednafi.com/go/di_frameworks_bleh/",140
"The value isn't in the code (2022)","https://jonayre.uk/blog/2022/10/30/the-real-value-isnt-in-the-code/",140
"Beyond Semantics: Unreasonable Effectiveness of Reasonless Intermediate Tokens","https://arxiv.org/abs/2505.13775",137
"Remembering Alasdair MacIntyre","https://www.wordonfire.org/articles/remembering-alasdair-macintyre-1929-2025/",137
"U.S. Spy Agencies–One-Stop Shop to Buy Your Personal Data","https://theintercept.com/2025/05/22/intel-agencies-buying-data-portal-privacy/",137
"32 bits that changed microprocessor design","https://spectrum.ieee.org/bellmac-32-ieee-milestone",136
"The Newark airport crisis","https://www.theverge.com/planes/673462/newark-airport-delay-air-traffic-control-tracon-radar",135
"The Machine Stops (1909)","https://standardebooks.org/ebooks/e-m-forster/short-fiction/text/the-machine-stops",134
"The Curious Case of the Pygmy Nuthatch","https://slate.com/culture/2025/05/birds-movies-charlies-angels-2000-pygmy-nuthatch.html",133
"Loading Pydantic models from JSON without running out of memory","https://pythonspeed.com/articles/pydantic-json-memory/",132
"Data breach exposes 184M passwords, likely captured by malware","https://www.zdnet.com/article/massive-data-breach-exposes-184-million-passwords-for-google-microsoft-facebook-and-more/",130
"Britain's police are restricting speech in worrying ways","https://www.economist.com/britain/2025/05/15/britains-police-are-restricting-speech-in-worrying-ways",130
"Ask HN: How do you promote your personal projects with a limited budget?","item?id=44051755",130
"Attention Wasn't All We Needed","https://www.stephendiehl.com/posts/post_transformers/",129
"The "AI 2027" Scenario: How realistic is it?","https://garymarcus.substack.com/p/the-ai-2027-scenario-how-realistic",129
"Jupiter was formerly twice its current size, had a much stronger magnetic field","https://phys.org/news/2025-05-jupiter-current-size-stronger-magnetic.html",128
"I think it's time to give Nix a chance","https://maych.in/blog/its-time-to-give-nix-a-chance/",126
"ZEUS – A new two-petawatt laser facility at the University of Michigan","https://news.engin.umich.edu/2025/05/the-us-has-a-new-most-powerful-laser/",126
"Is TfL losing the battle against heat on the Victoria line?","https://www.swlondoner.co.uk/news/16052025-is-tfl-losing-the-battle-against-heat-on-the-victoria-line",124
"Failure Mechanisms in Democratic Regimes – An Army's Role","https://angrystaffofficer.com/2025/03/02/failure-mechanisms-in-democratic-regimes-an-armys-role/",124
"The metre originated in the French Revolution","https://www.abc.net.au/news/science/2025-05-20/metre-treaty-anniversary-metric-system-measurement-metrology/105302024",124
"ITXPlus: A ITX Sized Macintosh Plus Logicboard Reproduction","https://68kmla.org/bb/index.php?threads/itxplus-a-itx-sized-macintosh-plus-logicboard-reproduction.49715/",124
"The WinRAR approach","https://basicappleguy.com/basicappleblog/the-winrar-approach",122
"The curious tale of Bhutan's playable record postage stamps (2015)","https://thevinylfactory.com/features/the-curious-tale-of-bhutans-playable-record-postage-stamps/",122
"Harnessing the Universal Geometry of Embeddings","https://arxiv.org/abs/2505.12540",121
"Should I Block ICMP?","http://shouldiblockicmp.com/",121
"Show HN: HNRelevant – Add a "related" section to Hacker News","https://github.com/imdj/HNRelevant",120
"Adventures in Symbolic Algebra with Model Context Protocol","https://www.stephendiehl.com/posts/computer_algebra_mcp/",118
"Show HN: Juvio – UV Kernel for Jupyter","https://github.com/OKUA1/juvio",118
"Show HN: F2 – Cross-Platform CLI Batch Renaming Tool","https://github.com/ayoisaiah/f2",117
"Wrench Attacks: Physical attacks targeting cryptocurrency users (2024) [pdf]","https://drops.dagstuhl.de/storage/00lipics/lipics-vol316-aft2024/LIPIcs.AFT.2024.24/LIPIcs.AFT.2024.24.pdf",116
"GPU-Driven Clustered Forward Renderer","https://logdahl.net/p/gpu-driven",116
"Writing a Self-Mutating x86_64 C Program (2013)","https://ephemeral.cx/2013/12/writing-a-self-mutating-x86_64-c-program/",115
"1,145 pull requests per day","https://saile.it/1145-pull-requests-per-day/",114
"Claude Opus 4 turns to blackmail when engineers try to take it offline","https://techcrunch.com/2025/05/22/anthropics-new-ai-model-turns-to-blackmail-when-engineers-try-to-take-it-offline/",110
"What even is a small language model now?","https://jigsawstack.com/blog/what-even-is-a-small-language-model-now--ai",109
"KumoRFM: A Foundation Model for In-Context Learning on Relational Data","https://kumo.ai/company/news/kumo-relational-foundation-model/",109
"The truth about soft plastic recycling points at supermarkets","https://www.everydayplastic.org/softplastic",108
"Contacts let you see in the dark with your eyes closed","https://scitechdaily.com/from-sci-fi-to-superpower-these-contacts-let-you-see-in-the-dark-with-your-eyes-closed/",108
"'Turbocharged' Mitochondria Power Birds' Epic Migratory Journeys","https://www.quantamagazine.org/turbocharged-mitochondria-power-birds-epic-migratory-journeys-20250519/",108
"The double standard of webhook security and API security","https://www.speakeasy.com/blog/webhook-security",107
"WavePhoenix – open-source implementation of the Nintendo WaveBird protocol","https://github.com/loopj/wavephoenix",106
"Convolutions, Polynomials and Flipped Kernels","https://eli.thegreenplace.net/2025/convolutions-polynomials-and-flipped-kernels/",106
"Overview of the Ada Computer Language Competition (1979)","https://iment.com/maida/computer/redref/",105
"Mitochondria Are More Than Powerhouses–They're the Motherboard of the Cell","https://www.scientificamerican.com/article/why-mitochondria-are-more-like-a-motherboard-than-the-powerhouse-of-the-cell/",105
"FromSoft's singular mech game Chromehounds is back online","https://www.readonlymemo.com/interview-15-years-after-the-servers-shut-down-fromsofts-singular-mech-game-chromehounds-is-back-online/",103
"Show HN: Confidential computing for high-assurance RISC-V embedded systems","https://github.com/IBM/ACE-RISCV",103
"How Does Claude 4 Think? – Sholto Douglas and Trenton Bricken","https://www.dwarkesh.com/p/sholto-trenton-2",102
"UndoDB – The interactive time travel debugger for Linux C/C++ for debugging","https://undo.io/",102
"“Secret Mall Apartment,” a Protest for Place","https://modernagejournal.com/secret-mall-apartment-a-protest-for-place/251023/",101
"TeleMessage Explorer: a new open source research tool","https://micahflee.com/telemessage-explorer-a-new-open-source-research-tool/",100
"Nvidia pushes further into cloud with GPU marketplace","https://www.wsj.com/articles/nvidia-pushes-further-into-cloud-with-gpu-marketplace-4fba6bdd",100
"Satellites Spotting Depth","https://tech.marksblogg.com/depth-anything-v2-maxar-ai-detection.html",100
"The Logistics of Road War in the Wasteland","https://acoup.blog/2025/05/23/collections-the-logistics-of-road-war-in-the-wasteland/",98
"The Decline of Usability: Revisited (2023)","https://datagubbe.se/usab2/",95
"A Secret Trove of Rare Guitars Heads to the Met","https://www.newyorker.com/magazine/2025/05/26/a-secret-trove-of-rare-guitars-heads-to-the-met",95
"A Formal Proof of Complexity Bounds on Diophantine Equations","https://arxiv.org/abs/2505.16963",93
"The Difference Between Downloading and Streaming","https://danq.me/2025/05/26/downloading-vs-streaming/",92
"Mathpad: A mathematical keypad for students and professionals","https://github.com/Summa-Cogni/Mathpad",92
"It is time to stop teaching frequentism to non-statisticians (2012)","https://arxiv.org/abs/1201.2590",92
"Power Failure: The downfall of General Electric","https://www.gwintrob.com/power-failure-review/",91
"Creating Debian packages from upstream Git","https://optimizedbyotto.com/post/debian-packaging-from-git/",91
"Show HN: Zli – A Batteries-Included CLI Framework for Zig","https://github.com/xcaeser/zli",91
"The legacy of the iconic Nakagin capsule tower","https://www.designboom.com/architecture/moma-nakagin-capsule-tower-exhibition-many-lives-museum-modern-art-new-york-05-23-2025/",91
"Direct TLS can speed up your connections","https://marc-bowes.com/postgres-direct-tls.html",91
"Crypto investor charged with kidnapping and torturing","https://www.nytimes.com/2025/05/24/nyregion/crypto-investor-torture-italian-tourist.html",91
"Get PC BIOS back on UEFI only system","https://github.com/FlyGoat/csmwrap",90
"Show HN: A minimalist web timer for focus and time tracking","https://iamlockedin.com/",89
"Show HN: AI Baby Monitor – local Video-LLM that beeps when safety rules break","https://github.com/zeenolife/ai-baby-monitor",89
"Show HN: SuperUtilsPlus – A Modern Alternative to Lodash","https://github.com/dhaxor/super-utils-plus",89
"SteamOS now released officially for any device","https://store.steampowered.com/steamos",89
"Death of Michael Ledeen, maker of the phony case for the invasion of Iraq","https://www.spytalk.co/p/death-of-a-master-manipulator",88
"Silly job interview questions in Haskell","https://chrispenner.ca/posts/interview",87
"Highlights from the Claude 4 system prompt","https://simonwillison.net/2025/May/25/claude-4-system-prompt/",86
"An Almost Pointless Exercise in GPU Optimization","https://blog.speechmatics.com/pointless-gpu-optimization-exercise",85
"Alberta separatism push roils Canada","https://www.nytimes.com/2025/05/22/world/canada/alberta-separatism-referendum.html",85
"The Last Letter","https://aeon.co/essays/how-the-last-letters-of-the-condemned-can-teach-us-how-to-live",84
"Authors are accidentally leaving AI prompts in their novels","https://www.404media.co/authors-are-accidentally-leaving-ai-prompts-in-their-novels/",83
"Types of optical systems in a lens designer's toolbox (2020)","https://www.pencilofrays.com/lens-design-forms/",82
"Infinite Tool Use","https://snimu.github.io/2025/05/23/infinite-tool-use.html",81
"AI Hallucination Legal Cases Database","https://www.damiencharlotin.com/hallucinations/",81
"There was a time when the US government built homes for working-class Americans","https://theconversation.com/believe-it-or-not-there-was-a-time-when-the-us-government-built-beautiful-homes-for-working-class-americans-to-deal-with-a-housing-crisis-253512",81
"Whippet GC notes on Guile, heuristics, and heap growth","https://wingolog.org/archives/2025/05/22/whippet-lab-notebook-guile-heuristics-and-heap-growth",78
"Koog, a Kotlin-based framework to build and run Al agents in idiomatic Kotlin","https://github.com/JetBrains/koog",78
"Lune: Standalone Luau Runtime","https://github.com/lune-org/lune",78
"Stuff I Learned at Carta","https://lethain.com/stuff-learned-at-carta/",77
"Launch HN: WorkDone (YC X25) – AI Audit of Medical Charts","item?id=44063000",77
"Yes-rs: A fast, memory-safe rewrite of the classic Unix yes command","https://github.com/jedisct1/yes-rs",75
