title,link,score
"A Fifth of American Adults Can't Read","https://www.thefp.com/p/a-fifth-of-american-adults-cant-read-i-teach-them",17
"The Scam Network","https://www.nrk.no/dokumentar/xl/inside-the-scam-network-1.17399135",17
"Self-Hosted RSS with FreshRSS, Docker, and Tailscale","https://eric.mann.blog/containerized-rss/",17
"pdfCropMargins – auto-detect and cut PDF margins for small-screen reading","https://github.com/abarker/pdfCropMargins",16
"Genetic links with bipolar disorder identified","https://www.europesays.com/uk/73187/",16
"Charles M. Lieber joins Tsinghua University","https://www.chemistryworld.com/news/harvards-former-chemistry-chair-takes-new-position-at-chinese-university/4021444.article",16
"AWS Blog on Postgres Long Fork Anomaly (Response to Jepsen Report)","https://aws.amazon.com/blogs/database/understanding-transaction-visibility-in-postgresql-clusters-with-read-replicas/",16
"Mines: A simple mine puzzle game inspired by classic minesweeper","https://stefan-oltmann.de/mines/",15
"The Unofficial Ruby Usage Guide","https://caliban.org/ruby/rubyguide.shtml",15
"How much I have(n't) made angel investing","https://halletecco.substack.com/p/heres-how-much-ive-made-angel-investing",15
"Reading Zanzibar","https://macwright.com/2025/05/02/reading-zanzibar",15
"A Hyper-Catalan Series Solution to Polynomial Equations, and the Geode","https://www.tandfonline.com/doi/full/10.1080/00029890.2025.2460966#d1e523",14
"CORBA: Catching The Next Wave (1997)","https://web.archive.org/web/19981205064221fw_/http://developer.netscape.com/docs/wpapers/corba/index.html",14
"Vygotsky's Zone of Proximal Development","https://www.simplypsychology.org/zone-of-proximal-development.html",14
"The economic impact of Oman's rose season","https://www.omanobserver.om/article/1153780/magazine/the-correspondent-the-economic-impact-of-omans-rose-season",14
"Ghosts and Dolls","https://thelampmagazine.com/issues/issue-27/ghosts-and-dolls",14
"Twitch Blocked for Piracy as LaLiga and ISPs Prioritize Football over Everything","https://torrentfreak.com/end-game-twitch-servers-among-hundreds-blocked-for-piracy-by-spanish-isps-250504/",14
"Elon Musk wins vote to establish his city in Starbase, Texas","https://finance.yahoo.com/news/elon-musk-wins-vote-establish-045950268.html",14
"Making of Monkeys.zip","https://www.lukeschaefer.dev/posts/making-of-monkeys/",14
"The Joy of Aeroplane Mode Programming","https://blog.mattbearman.com/aeroplane-mode-code/",14
"QGIS is the mapping software you didn't know you needed (2023)","https://chollinger.com/blog/2023/01/qgis-is-the-mapping-software-you-didnt-know-you-needed/",13
"The secret recipe of powerful AI coding Agents","https://madhukarkumar.medium.com/the-secret-recipe-of-powerful-ai-coding-agents-b094f8216322",13
"Falling satellites put the atmosphere at risk","https://www.bloomberg.com/graphics/2025-space-orbit-satellites-pollution/",13
"Thirteen new MCP servers from Cloudflare you can use today","https://blog.cloudflare.com/thirteen-new-mcp-servers-from-cloudflare/",13
"How Complex Systems Fail","https://how.complexsystems.fail/",12
"ChatGPT as Economics Tutor: Capabilities and Limitations","https://EconPapers.repec.org/paper/briuobdis/25_2f786.htm",12
"Atari 2600 Smartwatch","https://atari.com/products/atari-2600-my-play-watch-smartwatch",12
"Stop Uncapped Cloud Billing","https://stopuncappedbilling.com",12
"Don't Look at Stock Markets. Look at the Ports","https://www.theatlantic.com/economy/archive/2025/05/trump-tariff-shipping-ports/682673/",12
"Distributed Continuous GPU Profiling","https://www.zymtrace.com/article/zero-friction-gpu-profiler",11
"FB told advertisers it can identify teens feeling 'insecure', 'worthless' (2017)","https://www.theguardian.com/technology/2017/may/01/facebook-advertising-data-insecure-teens",11
"Warren Buffett shocks shareholders by announcing his intention to retire","https://apnews.com/article/warren-buffett-berkshire-hathaway-shareholders-annual-meeting-a421061233f99859673fb131ce020d4d",11
"Ask HN: Best underrated way to get a job in tech during a hiring slowdown?","item?id=43882624",11
"Learn You Galois Fields for Great Good","https://xorvoid.com/galois_fields_for_great_good_00.html",11
"Physics of Language Models: Architecture Design and the Magic of Canon Layers","https://papers.ssrn.com/sol3/papers.cfm?abstract_id=5240330",10
"Feynman Trig Notation: Creating Custom Characters","https://tex.stackexchange.com/questions/274463/feynman-trig-notation-creating-custom-characters",10
"PowerToys – Windows system utilities to maximize productivity","https://github.com/microsoft/PowerToys",10
"Spain in the Dark Is Safer Than Elsewhere with Power","https://www.nytimes.com/2025/05/03/opinion/spain-portugal-blackout.html",10
"Fuzzy images are our first look at Amazon's super-secret satellites","https://arstechnica.com/space/2025/05/we-finally-know-a-little-more-about-amazons-super-secret-satellites/",10
"EU prohibited paying for plasma – shortage met by buying plasma from US","https://dynomight.substack.com/p/money",10
"Connet.dev – high performance reverse proxy to connect devices privately","https://connet.dev",10
"The Tragic Story Behind the Infamous '4 Children for Sale' Photograph (2023)","https://allthatsinteresting.com/4-children-for-sale",10
"Warren Buffett, 94, stepping down as Berkshire Hathaway CEO","https://www.bbc.com/news/articles/cqj4nev7p70o",10
"Prompt chaining reimagined with type inference","https://www.haskellforall.com/2025/05/prompt-chaining-reimagined-with-type_2.html",10
"New Atomic Clock Is So Precise It Won't Lose a Second for 140M Years","https://www.zmescience.com/science/news-science/this-new-atomic-clock-is-so-precise-it-wont-lose-a-second-for-140-million-years/",10
"What Netflix's patents reveal about the future of watching movies","https://stephenfollows.com/p/what-netflixs-patents-reveal",9
"Ensure public interface reliability: Tracking API compatibility for Android","https://www.revenuecat.com/blog/engineering/binary-compatability/",9
"Ghost in the machine? Legend of the 'haunted' N64 video game cartridge","https://www.bbc.com/future/article/20250501-the-haunted-video-game-that-traumatised-the-web",9
"Antarctica gains ice for first time in decades, reversing trend of mass loss","https://www.livenowfox.com/news/antarctica-ice-sheet-growth",9
"Writing your own C++ standard library, part 2","https://nibblestew.blogspot.com/2025/05/writing-your-own-c-standard-library.html",9
"RDS Reserved Instances: Where Did All the New Instance Types Go?","https://www.duckbillgroup.com/blog/rds-instance-types-excluded-from-ri/",9
"Adaptive Hashing","https://quotenil.com/adaptive-hashing.html",9
"Gravity is a clue that we live in a simulation","https://bgr.com/science/gravity-is-a-clue-that-we-live-in-a-simulation-according-to-this-physicist/",9
"Linuxphoneapps.org","https://linuxphoneapps.org/",9
"Chariot and Saucer","https://jewishreviewofbooks.com/american-jewry/18531/chariot-and-saucer/",9
"Bell's 1881 Metal detector","http://www.scitechantiques.com/belldiscovery/",8
"Show HN: Visualizing web server activity using gource","item?id=43885419",8
"A novel scientific theory: The Law of Adaptive Dissipative Organization","https://chatgpt.com/s/dr_6817001b49988191b1f0dbd01e69a1ab",8
"How to Leak to a Journalist","https://www.niemanlab.org/2025/04/how-to-leak-to-a-journalist/",8
"Be Careful of Your UDP Service: Preauth DoS on Windows Deployment Service","https://sites.google.com/site/zhiniangpeng/blogs/WDS-DoS",8
"Marathon streamer, online for three years, faces isolation and burnout","https://www.washingtonpost.com/technology/2025/05/04/longest-marathon-streamer-emilycc/",8
"OCaml Cross Compilation: An Experiment","https://www.chrisarmstrong.dev/posts/ocaml-cross-compilation-an-experiment",8
"RVPC Adds Basic Interpreter to €1 Open Source RISC-V Computer","https://linuxgizmos.com/rvpc-adds-basic-interpreter-to-e1-open-source-risc-v-computer/",8
"Building MapReduce (Based on Google Paper)","item?id=43882389",8
"Restoring oil wells back to nature with moss","https://uwaterloo.ca/news/restoring-oil-wells-back-nature-moss",8
"Making PyPI's test suite 81% faster","https://blog.trailofbits.com/2025/05/01/making-pypis-test-suite-81-faster/",8
"Planetary Realism","https://www.planetary.day/",8
"Visualising home sun exposure with Rhino","https://ostwilkens.se/blog/sun-coverage",7
"The Once and Future Genius","https://literaryreview.co.uk/the-once-future-genius",7
"NAC: The Amino Acid That Turns Psychiatry on Its Head (2018)","https://www.psychologytoday.com/ca/blog/heal-your-brain/201810/nac-the-amino-acid-turns-psychiatry-its-head",7
"Show HN: I built a tool to automate repetitive tasks by recording my screen","https://clickrepeat.com/",7
"Surprisingly simple method makes a low-cost, tuneable liquid lens","https://cosmosmagazine.com/science/physics/low-cost-tuneable-liquid-lens/",7
"The greatest soccer player never to play soccer","https://en.wikipedia.org/wiki/Carlos_Kaiser_(footballer)",7
"Netscape Communicator Datasheet (1997)","https://web.archive.org/web/19970709132943fw_/http://home.netscape.com/comprod/products/communicator/datasheet.html",7
"Show HN (YC S25): Well – MCP AI-Based Collection of Invoices","item?id=43871312",7
"Reverse-Engineering Cluely, the Invisible Cheating App","https://prathit.vercel.app/blog/reverse-engineering-cluely",7
"How Ukraine Is Replacing Human Soldiers with a Robot Army","https://www.forbes.com/sites/davidhambling/2025/04/18/how-ukraine-is-replacing-human-soldiers-with-a-robot-army/",7
"I learned Snobol and then wrote a toy Forth","https://www.ratfactor.com/snobol/",7
"Ancient DNA unearths a new race from a verdant North African interlude","https://www.razibkhan.com/p/lost-green-saharans-ancient-dna-unearths",6
"Perfect Random Floating-Point Numbers","https://specbranch.com/posts/fp-rand/",6
"The Hunt for Darcula","https://www.nrk.no/dokumentar/xl/the-hunt-for-darcula-1.17399157",6
"How the 'Shetland Bus' Helped Norway Resist Nazi Germany","https://www.bbc.com/news/articles/c87p55pg13po",6
"CMU TheAgentCompany: Benchmarking LLM Agents on Consequential Real World Tasks","https://arxiv.org/abs/2412.14161",6
"EnClose, open source iOS/macOS hybrid app development framework","https://github.com/fellowgeek/enClose",6
"What is storm-watching and where should you try it?","https://www.nationalgeographic.com/travel/article/what-is-storm-watching-how-to-do-it",6
"Show HN: I built a game where you guess which startup idea succeeded","https://www.startuporflop.com/",6
"Reaction to the Dec Spam of 1978","https://www.templetons.com/brad/spamreact.html",6
"You can now directly sync Postgres with Redis","https://github.com/redfly-ai-org/redfly.ai",6
"Go-away:Self-hosted abuse detection and rule enforcement for AI scraping bots","https://git.gammaspectra.live/git/go-away",6
"How to Measure an Apocalypse","https://jonn.substack.com/p/how-to-measure-an-apocalypse",6
"Castle Engine improvements: physics upgrade, sphere casting, layers filtering","https://castle-engine.io/wp/2025/05/01/april-improvements-physics-upgrade-sphere-casting-layers-filtering-easy-factory-ios-fixes-image-improvements-and-more/",6
"Step-by-step reasoning verifiers that think","https://arxiv.org/abs/2504.16828",6
"Searching for outliers (2022)","https://www.benkuhn.net/outliers/",6
"Show HN: A social media network where users share prompts instead of posts","https://2fjxieoiipm32.mocha.app/?_gl=1*5qx78k*_gcl_au*MTk3OTM1MDkwOC4xNzQ2Mzg2ODYzLjExOTgzODg5MTUuMTc0NjM4NjkyMS4xNzQ2Mzg2OTIx",5
"A cycle-accurate IBM PC emulator in your web browser","https://martypc.net/?mount=fd:0:Area%205150%20(Compo%20Version).img",5
"Show HN: A site that tracks how positively terms are discussed on Reddit","https://sentiment-index.github.io/index.html",5
"MingKwai prototype, the 'origin of Chinese computing,' finds a home at Stanford","https://news.stanford.edu/stories/2025/05/mingkwai-chinese-typewriter-prototype-stanford-libraries",5
"LaidOff","https://laid0ff.substack.com/",5
"Anatomy of a 'zombie' volcano: Investigating the cause of unrest inside Uturuncu","https://www.sciencedaily.com/releases/2025/04/250428220444.htm",5
"Show HN: GoVisual – lightweight, zero-config HTTP request visualizer for Go","https://github.com/doganarif/govisual",5
"Best Practices for User Authentication and Authorization in Web Applications","https://securityboulevard.com/2025/05/best-practices-for-user-authentication-and-authorization-in-web-applications-a-comprehensive-security-framework/",5
"Embedded Developers Should Care About the EU Cyber Resilience Act (CRA)","https://www.hackster.io/news/why-embedded-developers-should-care-about-the-cyber-resilience-act-cra-cac6ec7be78f",5
"Minecraft runs on 8MB of VRAM using a 20-year-old GPU","https://www.tomshardware.com/pc-components/gpus/minecraft-runs-on-8mb-of-vram-using-a-20-year-old-gpu",5
""An independent journalist" who won't remain nameless","https://www.thehandbasket.co/p/independent-journalism-legacy-media-credit",5
"Battle of the AI Code Assistants: Who Writes the Best Python Integration Code?","https://medium.com/@wjleon/battle-of-the-ai-code-assistants-who-writes-the-best-python-integration-code-f78e09a5554c",5
"The Scam Network","https://www.nrk.no/dokumentar/xl/inside-the-scam-network-1.17399135",5
"Volcanic Eruption in Deep Ocean Ridge Is Witnessed by Scientists for First Time","https://www.nytimes.com/2025/05/02/science/deep-ocean-volcanic-eruption-pacific.html",5
"Code Wars: Rust vs. C in the Battle for Billion-Device Safety","https://thenewstack.io/code-wars-rust-vs-c-in-the-battle-for-billion-device-safety/",5
"Presidio – Data Protection and De-Identification SDK (2019)","https://github.com/microsoft/presidio",5
"Rust Use Within the QEMU Emulator Shaping Up Well","https://www.phoronix.com/news/Rust-QEMU-Progress-Q2-2025",5
"I Owe It All to Community College (2015)","https://www.nytimes.com/2015/01/14/opinion/tom-hanks-on-his-two-years-at-chabot-college.html",5
"Before Our Attention Was a Commodity: Memories of a Pre-Web Internet","https://blog.sanfranciscan.org/2025/05/04/before-our-attention-was-a-commodity/",4
"Debugging a Logic Circuit in IDP-Z3","https://simonvandevelde.be/posts/Debugging_a_Logic_Circuit_in_IDP-Z3.html",4
"Cosmic Propaganda: The Soviet Space program in stamps","https://worldhistory.substack.com/p/cosmic-propaganda",4
"A structured coalescent model reveals deep ancestral structure shared by humans","https://www.nature.com/articles/s41588-025-02117-1",4
"Cognitive Benefits of Open-Skill Sports in Childhood: Evidence from ABCD Study","https://pubmed.ncbi.nlm.nih.gov/39876084/",4
"Co-dfns: High-performance, reliable, and parallel APL","https://github.com/Co-dfns/Co-dfns",4
"The worlds weirdest musical instrument","https://www.smh.com.au/culture/music/even-this-modern-maestro-won-t-touch-the-world-s-weirdest-instrument-20250417-p5lsms.html",4
"Fine-Tuning Qwen3","https://wandb.ai/byyoung3/Generative-AI/reports/How-to-fine-tune-and-evaluate-Qwen3-with-Unsloth---VmlldzoxMjU3OTI0Ng",4
"El Cono: The mysterious sacred 'pyramid' hidden deep in the Amazon rainforest","https://www.livescience.com/planet-earth/geology/el-cono-the-mysterious-sacred-pyramid-hidden-deep-in-the-amazon-rainforest",4
"Gold could come from some of the most violent stars in the universe","https://www.zmescience.com/space/astrophysics-space/your-gold-magnetar-eruption/",4
"VMOS – Virtual Android on Android","https://www.vmos.com/",4
"Backstory to the Survivorship Bias Plane","https://yuxi-liu-wired.github.io/logs/posts/2025-survivorship-bias/",4
"Brain interface allows speech decoding in ALS patient","https://medicalxpress.com/news/2025-05-brain-interface-speech-decoding-als.html",4
"The Whitworth Three Plates Method (2017)","https://ericweinhoffer.com/blog/2017/7/30/the-whitworth-three-plates-method",4
"Wget to Wipeout: Malicious Go Modules Fetch Destructive Payload","https://socket.dev/blog/wget-to-wipeout-malicious-go-modules-fetch-destructive-payload",4
"List of remote jobs updated daily","https://listofremotejobs.com/",4
"The Moleskine that works like a computer","https://www.moleskine.com/en-us/shop/moleskine-smart/",4
"Another look into PostgreSQL CTE materialization and non-idempotent subqueries","https://www.shayon.dev/post/2025/124/another-look-into-postgresql-cte-materialization-and-non-idempotent-subqueries/",4
"Your ViT Is Secretly an Image Segmentation Model","https://arxiv.org/abs/2503.19108",3
"When encryption works perfectly and still fails","https://digitalseams.com/blog/when-encryption-works-perfectly-and-still-fails",3
"The European Accessibility Act: what businesses and app developers need to know","https://abra.ai/blog/the-european-accessibility-act-what-businesses-and-app-developers-need-to-know",3
"Dating App 'Raw' Accidentally Rawdogs Users' Location Data, Personal Info","https://gizmodo.com/dating-app-raw-accidentally-rawdogs-users-location-data-personal-info-2000597766",3
"Digitization Complete for World-Renowned Franco Novacco Map Collection","https://www.newberry.org/news/digitization-complete-for-world-renowned-franco-novacco-map-collection",3
"How Kim Jong Il Kidnapped a Director, Made a Cult Hit Godzilla Knockoff (2015)","https://www.vanityfair.com/hollywood/2015/04/pulgasari-north-korea-cult-hit",3
"How 'Sinners' and Other Movies Multiply One Actor","https://www.nytimes.com/2025/04/25/movies/sinners-twins-visual-effects.html",3
"Flies in the evidence room: Inside Belgium's rotting Justice Palace","https://www.ft.com/content/0b72735a-b587-4dd3-a1ac-2805c89f5d2f",3
"xMEMS Ultrasonic Coolers for Power Hungry Transceivers","https://spectrum.ieee.org/data-center-cooling-xmems",3
"A 1903 Proposal to Preserve the Dead in Glass Cubes","https://hyperallergic.com/406959/preserving-the-dead-in-glass/",3
"KaiPod Learning (YC S21) Is Hiring VP of Engineering","https://www.ycombinator.com/companies/kaipod-learning/jobs/Bs3H9uB-vp-of-engineering",0
